Mercury_7024395,Several different sized filter-paper disks are soaked in a solution and placed into another solution where a reaction will take place that produces a gas. The gas bubbles collect on the filter paper and make the filter paper rise to the top of the solution. Which of these is a measurement that would not be made during this experiment?,the number of bubbles produced,Several different sized filter-paper disks are soaked in a solution and placed into another solution where a reaction will take place that produces a gas. The gas bubbles collect on the filter paper and make the filter paper rise to the top of the solution. The number of bubbles produced of these is a measurement that would not be made during this experiment.,several filter-paper disks --- are soaked in --> solution || several filter-paper disks --- are --> soaked || different sized filter-paper disks --- are --> soaked || different sized filter-paper disks --- are soaked in --> solution || disks --- are soaked in --> solution || disks --- are --> soaked || several sized disks --- are --> soaked || several sized disks --- are soaked in --> solution || sized disks --- are --> soaked || sized disks --- are soaked in --> solution || several different disks --- are soaked in --> solution || several different disks --- are --> soaked || filter-paper disks --- are --> soaked || filter-paper disks --- are soaked in --> solution || several sized filter-paper disks --- are soaked in --> solution || several sized filter-paper disks --- are --> soaked || different filter-paper disks --- are --> soaked || different filter-paper disks --- are soaked in --> solution || several different filter-paper disks --- are soaked in --> solution || several different filter-paper disks --- are --> soaked || several different sized disks --- are soaked in --> solution || several different sized disks --- are --> soaked || different disks --- are --> soaked || different disks --- are soaked in --> solution || several disks --- are soaked in --> solution || several disks --- are --> soaked || sized filter-paper disks --- are soaked in --> solution || sized filter-paper disks --- are --> soaked || several different sized filter-paper disks --- are --> soaked || several different sized filter-paper disks --- are soaked in --> solution || different sized disks --- are soaked in --> solution || different sized disks --- are --> soaked || gas bubbles --- make --> filter paper rise || gas bubbles --- collect on --> filter paper || gas bubbles --- make --> filter paper rise to top of solution || gas bubbles --- make --> filter paper rise to top ||,the distance the filter paper rises,Several different sized filter-paper disks are soaked in a solution and placed into another solution where a reaction will take place that produces a gas. The gas bubbles collect on the filter paper and make the filter paper rise to the top of the solution. The distance the filter paper rises of these is a measurement that would not be made during this experiment.,several filter-paper disks --- are soaked in --> solution || several filter-paper disks --- are --> soaked || different sized filter-paper disks --- are --> soaked || different sized filter-paper disks --- are soaked in --> solution || disks --- are soaked in --> solution || disks --- are --> soaked || several sized disks --- are --> soaked || several sized disks --- are soaked in --> solution || sized disks --- are --> soaked || sized disks --- are soaked in --> solution || several different disks --- are soaked in --> solution || several different disks --- are --> soaked || filter-paper disks --- are --> soaked || filter-paper disks --- are soaked in --> solution || several sized filter-paper disks --- are soaked in --> solution || several sized filter-paper disks --- are --> soaked || different filter-paper disks --- are --> soaked || different filter-paper disks --- are soaked in --> solution || several different filter-paper disks --- are soaked in --> solution || several different filter-paper disks --- are --> soaked || several different sized disks --- are soaked in --> solution || several different sized disks --- are --> soaked || different disks --- are --> soaked || different disks --- are soaked in --> solution || several disks --- are soaked in --> solution || several disks --- are --> soaked || sized filter-paper disks --- are soaked in --> solution || sized filter-paper disks --- are --> soaked || several different sized filter-paper disks --- are --> soaked || several different sized filter-paper disks --- are soaked in --> solution || different sized disks --- are soaked in --> solution || different sized disks --- are --> soaked || gas bubbles --- make --> filter paper rise || gas bubbles --- collect on --> filter paper || gas bubbles --- make --> filter paper rise to top of solution || gas bubbles --- make --> filter paper rise to top ||,the diameter of the filter-paper disks,Several different sized filter-paper disks are soaked in a solution and placed into another solution where a reaction will take place that produces a gas. The gas bubbles collect on the filter paper and make the filter paper rise to the top of the solution. The diameter of the filter-paper disks of these is a measurement that would not be made during this experiment.,several filter-paper disks --- are soaked in --> solution || several filter-paper disks --- are --> soaked || different sized filter-paper disks --- are --> soaked || different sized filter-paper disks --- are soaked in --> solution || disks --- are soaked in --> solution || disks --- are --> soaked || several sized disks --- are --> soaked || several sized disks --- are soaked in --> solution || sized disks --- are --> soaked || sized disks --- are soaked in --> solution || several different disks --- are soaked in --> solution || several different disks --- are --> soaked || filter-paper disks --- are --> soaked || filter-paper disks --- are soaked in --> solution || several sized filter-paper disks --- are soaked in --> solution || several sized filter-paper disks --- are --> soaked || different filter-paper disks --- are --> soaked || different filter-paper disks --- are soaked in --> solution || several different filter-paper disks --- are soaked in --> solution || several different filter-paper disks --- are --> soaked || several different sized disks --- are soaked in --> solution || several different sized disks --- are --> soaked || different disks --- are --> soaked || different disks --- are soaked in --> solution || several disks --- are soaked in --> solution || several disks --- are --> soaked || sized filter-paper disks --- are soaked in --> solution || sized filter-paper disks --- are --> soaked || several different sized filter-paper disks --- are --> soaked || several different sized filter-paper disks --- are soaked in --> solution || different sized disks --- are soaked in --> solution || different sized disks --- are --> soaked || gas bubbles --- make --> filter paper rise || gas bubbles --- collect on --> filter paper || gas bubbles --- make --> filter paper rise to top of solution || gas bubbles --- make --> filter paper rise to top ||,the time it takes for the filter paper to rise,Several different sized filter-paper disks are soaked in a solution and placed into another solution where a reaction will take place that produces a gas. The gas bubbles collect on the filter paper and make the filter paper rise to the top of the solution. The time it takes for the filter paper to rise of these is a measurement that would not be made during this experiment.,several filter-paper disks --- are soaked in --> solution || several filter-paper disks --- are --> soaked || different sized filter-paper disks --- are --> soaked || different sized filter-paper disks --- are soaked in --> solution || disks --- are soaked in --> solution || disks --- are --> soaked || several sized disks --- are --> soaked || several sized disks --- are soaked in --> solution || sized disks --- are --> soaked || sized disks --- are soaked in --> solution || several different disks --- are soaked in --> solution || several different disks --- are --> soaked || filter-paper disks --- are --> soaked || filter-paper disks --- are soaked in --> solution || several sized filter-paper disks --- are soaked in --> solution || several sized filter-paper disks --- are --> soaked || different filter-paper disks --- are --> soaked || different filter-paper disks --- are soaked in --> solution || several different filter-paper disks --- are soaked in --> solution || several different filter-paper disks --- are --> soaked || several different sized disks --- are soaked in --> solution || several different sized disks --- are --> soaked || different disks --- are --> soaked || different disks --- are soaked in --> solution || several disks --- are soaked in --> solution || several disks --- are --> soaked || sized filter-paper disks --- are soaked in --> solution || sized filter-paper disks --- are --> soaked || several different sized filter-paper disks --- are --> soaked || several different sized filter-paper disks --- are soaked in --> solution || different sized disks --- are soaked in --> solution || different sized disks --- are --> soaked || gas bubbles --- make --> filter paper rise || gas bubbles --- collect on --> filter paper || gas bubbles --- make --> filter paper rise to top of solution || gas bubbles --- make --> filter paper rise to top || filter paper --- rise of --> these || it --- takes --> filter paper rise of these || it --- takes --> filter paper rise ||,NA,NA,NA
NYSEDREGENTS_2012_8_28,Under which conditions would a sugar cube dissolve most quickly when placed in a liter of water at room temperature?,A whole sugar cube is added and the water is stirred.,Under a whole sugar cube is added and the water is stirred conditions would a sugar cube dissolve most quickly when placed in a liter of water at room temperature.,conditions --- placed in --> liter || conditions --- placed in --> liter of water || conditions --- placed at --> room temperature || water --- is --> stirred ||,A whole sugar cube is added and the water is not stirred.,Under a whole sugar cube is added and the water is not stirred conditions would a sugar cube dissolve most quickly when placed in a liter of water at room temperature.,,A crushed sugar cube is added and the water is stirred.,Under a crushed sugar cube is added and the water is stirred conditions would a sugar cube dissolve most quickly when placed in a liter of water at room temperature.,conditions --- placed in --> liter || conditions --- placed in --> liter of water || conditions --- placed at --> room temperature || water --- is --> stirred ||,A crushed sugar cube is added and the water is not stirred.,Under a crushed sugar cube is added and the water is not stirred conditions would a sugar cube dissolve most quickly when placed in a liter of water at room temperature.,,NA,NA,NA
Mercury_7090790,Which of these factors causes water to evaporate the fastest?,high temperatures,High temperatures of these factors causes water to evaporate the fastest.,temperatures --- causes --> water || water --- evaporate --> fastest || high temperatures --- causes --> water ||,high humidity,High humidity of these factors causes water to evaporate the fastest.,high humidity --- causes --> water || water --- evaporate --> fastest || humidity --- causes --> water ||,slow winds,Slow winds of these factors causes water to evaporate the fastest.,winds --- causes --> water || water --- evaporate --> fastest || slow winds --- causes --> water ||,slow runoff,Slow runoff of these factors causes water to evaporate the fastest.,runoff --- causes --> water || water --- evaporate --> fastest || slow runoff --- causes --> water ||,NA,NA,NA
TIMSS_2003_8_pg87,David makes a solution by dissolving 10 grams of salt in 100 ml of water. He wants a solution that is half as concentrated. What should he add to the original solution to obtain a solution that is about half as concentrated?,50 ml of water,David makes a solution by dissolving 10 grams of salt in 100 ml of water. He wants a solution that is half as concentrated. 50 ml of water should he add to the original solution to obtain a solution that is about half as concentrated.,david --- makes --> solution || david --- dissolving --> 10 grams of salt || david --- dissolving --> 10 grams ||,100 ml of water,David makes a solution by dissolving 10 grams of salt in 100 ml of water. He wants a solution that is half as concentrated. 100 ml of water should he add to the original solution to obtain a solution that is about half as concentrated.,david --- makes --> solution || david --- dissolving --> 10 grams of salt || david --- dissolving --> 10 grams ||,5 grams of salt,David makes a solution by dissolving 10 grams of salt in 100 ml of water. He wants a solution that is half as concentrated. 5 grams of salt should he add to the original solution to obtain a solution that is about half as concentrated.,david --- makes --> solution || david --- dissolving --> 10 grams of salt || david --- dissolving --> 10 grams ||,10 grams of salt,David makes a solution by dissolving 10 grams of salt in 100 ml of water. He wants a solution that is half as concentrated. 10 grams of salt should he add to the original solution to obtain a solution that is about half as concentrated.,david --- makes --> solution || david --- dissolving --> 10 grams of salt || david --- dissolving --> 10 grams ||,NA,NA,NA
Mercury_SC_407382,A duck and turtle are different types of animals. In which way are the duck and the turtle alike?,They both hibernate.,A duck and turtle are different types of animals. In they both hibernate way are the duck and the turtle alike.,duck --- are different types of --> animals || duck --- are types of --> animals || duck --- are --> types || duck --- are --> types of animals || duck --- are --> different types || duck --- are --> different types of animals || duck --- is in --> they || turtle --- are --> types || turtle --- are --> different types || turtle --- are different types of --> animals || turtle --- are types of --> animals || hibernate way --- are --> duck || hibernate way --- are duck in --> they || way --- are duck in --> they || way --- are --> duck ||,They both have feathers.,A duck and turtle are different types of animals. In they both have feathers way are the duck and the turtle alike.,duck --- are different types of --> animals || duck --- are types of --> animals || duck --- are --> types || duck --- are --> types of animals || duck --- are --> different types || duck --- are --> different types of animals || duck --- is in --> they || turtle --- are --> types || turtle --- are --> different types || turtle --- are different types of --> animals || turtle --- are types of --> animals || feathers way --- are duck in --> they || feathers way --- are --> duck ||,They both reproduce by laying eggs.,A duck and turtle are different types of animals. In they both reproduce by laying eggs way are the duck and the turtle alike.,duck --- are different types of --> animals || duck --- are types of --> animals || duck --- are --> types || duck --- are --> types of animals || duck --- are --> different types || duck --- are --> different types of animals || turtle --- are --> types || turtle --- are --> different types || turtle --- are different types of --> animals || turtle --- are types of --> animals || reproduce --- are --> duck ||,They both provide milk for their young.,A duck and turtle are different types of animals. In they both provide milk for their young way are the duck and the turtle alike.,duck --- are different types of --> animals || duck --- are types of --> animals || duck --- are --> types || duck --- are --> types of animals || duck --- are --> different types || duck --- are --> different types of animals || duck --- are for --> their young way || duck --- are for --> their way || turtle --- are --> types || turtle --- are --> different types || turtle --- are different types of --> animals || turtle --- are types of --> animals || turtle --- are for --> their young way || turtle --- are for --> their way ||,NA,NA,NA
MDSA_2010_4_20,Farmers grow different types of crops. Which of the following factors would most affect the type of crop a farmer grows?,depth of soil,Farmers grow different types of crops. Depth of soil factors would most affect the type of crop a farmer grows.,farmers --- grow --> types of crops || farmers --- grow --> different types of crops || farmers --- grow --> types || farmers --- grow --> different types ||,amount of rainfall,Farmers grow different types of crops. Amount of rainfall factors would most affect the type of crop a farmer grows.,farmers --- grow --> types of crops || farmers --- grow --> different types of crops || farmers --- grow --> types || farmers --- grow --> different types ||,the amount of land available,Farmers grow different types of crops. The amount of land available factors would most affect the type of crop a farmer grows.,farmers --- grow --> types of crops || farmers --- grow --> different types of crops || farmers --- grow --> types || farmers --- grow --> different types ||,the number of seeds available,Farmers grow different types of crops. The number of seeds available factors would most affect the type of crop a farmer grows.,farmers --- grow --> types of crops || farmers --- grow --> different types of crops || farmers --- grow --> types || farmers --- grow --> different types ||,NA,NA,NA
Mercury_SC_405019,"Alicia put hydrogen peroxide and yeast in a paper cup. The paper cup felt hot, and she concluded that a reaction occurred that gave off heat. What else could Alicia do to get a more accurate conclusion?",use an insulated cup rather than a paper cup,"Alicia put hydrogen peroxide and yeast in a paper cup. The paper cup felt hot, and she concluded that a reaction occurred that gave off heat. Use an insulated cup rather than a paper cup else could Alicia do to get a more accurate conclusion.",alicia --- put --> hydrogen peroxide || alicia --- put hydrogen peroxide in --> paper cup || alicia --- put yeast in --> paper cup || alicia --- put --> yeast || paper cup --- felt --> hot || that --- gave off --> heat ||,change the amount of hydrogen peroxide used,"Alicia put hydrogen peroxide and yeast in a paper cup. The paper cup felt hot, and she concluded that a reaction occurred that gave off heat. Change the amount of hydrogen peroxide used else could Alicia do to get a more accurate conclusion.",alicia --- put --> hydrogen peroxide || alicia --- put hydrogen peroxide in --> paper cup || alicia --- put yeast in --> paper cup || alicia --- put --> yeast || paper cup --- felt --> hot || that --- gave off --> heat ||,take a picture of the cup after the reaction took place,"Alicia put hydrogen peroxide and yeast in a paper cup. The paper cup felt hot, and she concluded that a reaction occurred that gave off heat. Take a picture of the cup after the reaction took place else could Alicia do to get a more accurate conclusion.",alicia --- put --> hydrogen peroxide || alicia --- put hydrogen peroxide in --> paper cup || alicia --- put yeast in --> paper cup || alicia --- put --> yeast || paper cup --- felt --> hot || that --- gave off --> heat || reaction --- took --> place || reaction --- took else --> place ||,use a thermometer to measure the change in temperature,"Alicia put hydrogen peroxide and yeast in a paper cup. The paper cup felt hot, and she concluded that a reaction occurred that gave off heat. Use a thermometer to measure the change in temperature else could Alicia do to get a more accurate conclusion.",alicia --- put --> hydrogen peroxide || alicia --- put hydrogen peroxide in --> paper cup || alicia --- put yeast in --> paper cup || alicia --- put --> yeast || paper cup --- felt --> hot || that --- gave off --> heat || change --- alicia --> do || change --- is in --> temperature ||,NA,NA,NA
Mercury_7123078,The planets in the solar system revolve around the Sun because the Sun is,made of hydrogen and helium.,The planets in the solar system revolve around the Sun because the Sun is made of hydrogen and helium.,planets --- is in --> solar system || sun --- is made of --> hydrogen || sun --- is --> made ||,older than other objects in the solar system.,The planets in the solar system revolve around the Sun because the Sun is older than other objects in the solar system.,other objects --- is in --> solar system || sun --- is older than --> objects in solar system || sun --- is --> older || sun --- is older than --> objects || sun --- is older than --> other objects in system || sun --- is older than --> other objects in solar system || sun --- is older than --> other objects || sun --- is older than --> objects in system || planets --- is in --> solar system ||,the source of most heat and light energy.,The planets in the solar system revolve around the Sun because the Sun is the source of most heat and light energy.,planets --- is in --> solar system ||,the strongest source of gravity in the solar system.,The planets in the solar system revolve around the Sun because the Sun is the strongest source of gravity in the solar system.,sun --- is --> strongest source || sun --- is source in --> solar system || sun --- is strongest source in --> solar system || sun --- is --> strongest source of gravity in system || sun --- is strongest source of --> gravity || sun --- is source of --> gravity || sun --- is source in --> system || sun --- is strongest source in --> system || sun --- is --> source || sun --- is --> strongest source of gravity in solar system || sun --- is --> source of gravity in solar system || sun --- is --> source of gravity in system || strongest source --- is in --> solar system || planets --- is in --> solar system ||,NA,NA,NA
Mercury_400084,An unbalanced equation for the reaction of methane gas (CH_{4}) with oxygen is shown below. CH_{4} + \Box O_{2} -> 2CO_{2} + 4H_{2}O How many molecules of oxygen gas (O_{2}) are needed to properly balance this equation?,1,An unbalanced equation for the reaction of methane gas (CH_{4}) with oxygen is shown below. CH_{4} + \Box O_{2} -> 2CO_{2} + 4H_{2}O 1 many molecules of oxygen gas (O_{2}) are needed to properly balance this equation.,equation --- is --> shown || equation --- is --> shown below || reaction --- is with --> oxygen || unbalanced equation --- is --> shown below || unbalanced equation --- is --> shown ||,2,An unbalanced equation for the reaction of methane gas (CH_{4}) with oxygen is shown below. CH_{4} + \Box O_{2} -> 2CO_{2} + 4H_{2}O 2 many molecules of oxygen gas (O_{2}) are needed to properly balance this equation.,equation --- is --> shown || equation --- is --> shown below || reaction --- is with --> oxygen || unbalanced equation --- is --> shown below || unbalanced equation --- is --> shown ||,3,An unbalanced equation for the reaction of methane gas (CH_{4}) with oxygen is shown below. CH_{4} + \Box O_{2} -> 2CO_{2} + 4H_{2}O 3 many molecules of oxygen gas (O_{2}) are needed to properly balance this equation.,equation --- is --> shown || equation --- is --> shown below || reaction --- is with --> oxygen || unbalanced equation --- is --> shown below || unbalanced equation --- is --> shown ||,4,An unbalanced equation for the reaction of methane gas (CH_{4}) with oxygen is shown below. CH_{4} + \Box O_{2} -> 2CO_{2} + 4H_{2}O 4 many molecules of oxygen gas (O_{2}) are needed to properly balance this equation.,equation --- is --> shown || equation --- is --> shown below || reaction --- is with --> oxygen || unbalanced equation --- is --> shown below || unbalanced equation --- is --> shown ||,NA,NA,NA
