Mercury_7234605,A student ran around a circular track. Which statement best describes the motion of the student while running?,The speed was constant.,A student ran around a circular track. The speed was constant statement best describes the motion of the student while running.,student --- ran around --> track || student --- ran around --> circular track || constant statement --- best describes --> motion of student || constant statement --- describes --> motion of student || constant statement --- best describes --> motion || constant statement --- describes --> motion || speed --- was --> statement || speed --- was --> constant statement || statement --- best describes --> motion || statement --- describes --> motion || statement --- best describes --> motion of student || statement --- describes --> motion of student ||,The velocity was constant.,A student ran around a circular track. The velocity was constant statement best describes the motion of the student while running.,student --- ran around --> track || student --- ran around --> circular track || constant statement --- best describes --> motion of student || constant statement --- describes --> motion of student || constant statement --- best describes --> motion || constant statement --- describes --> motion || statement --- best describes --> motion || statement --- describes --> motion || statement --- best describes --> motion of student || statement --- describes --> motion of student || velocity --- was --> constant statement || velocity --- was --> statement ||,The speed was always changing.,A student ran around a circular track. The speed was always changing statement best describes the motion of the student while running.,student --- ran around --> track || student --- ran around --> circular track || statement --- describes motion --> running || statement --- best describes motion --> running || statement --- best describes --> motion || statement --- describes --> motion || statement --- best describes --> motion of student || statement --- describes --> motion of student || statement --- motion of --> student ||,The velocity was always changing.,A student ran around a circular track. The velocity was always changing statement best describes the motion of the student while running.,student --- ran around --> track || student --- ran around --> circular track || statement --- describes motion --> running || statement --- best describes motion --> running || statement --- best describes --> motion || statement --- describes --> motion || statement --- best describes --> motion of student || statement --- describes --> motion of student || statement --- motion of --> student ||,NA,NA,NA
Mercury_SC_400839,The best container for storing an unknown liquid is a,plastic yogurt container.,The best container for storing an unknown liquid is a plastic yogurt container.,container --- is --> plastic ||,clearly labeled glass jar.,The best container for storing an unknown liquid is a clearly labeled glass jar.,container --- is --> labeled ||,paper orange juice container.,The best container for storing an unknown liquid is a paper orange juice container.,,green plastic soda bottle.,The best container for storing an unknown liquid is a green plastic soda bottle.,container --- is --> green ||,NA,NA,NA
Mercury_SC_402984,Which item can be used again in another science investigation?,latex gloves,Latex gloves item can be used again in another science investigation.,latex gloves item --- can --> can used || latex gloves item --- can --> can used again ||,a glass test tube,A glass test tube item can be used again in another science investigation.,glass test tube item --- can --> can used again || glass test tube item --- can --> can used ||,a mixture of water and sugar,A mixture of water and sugar item can be used again in another science investigation.,mixture --- can --> can used again || mixture --- can --> can used ||,a paper towel used to clean up,A paper towel used to clean up item can be used again in another science investigation.,paper towel --- can --> can used || paper towel --- can --> can used again ||,NA,NA,NA
NYSEDREGENTS_2012_4_29,Three identical seeds are planted and grown in identical pots of soil. All three pots receive equal amounts of sunlight. The plants are watered once each day. Plant A is given 10 milliliters (mL) of water. Plant B is given 20 mL of water. Plant C is given 30 mL of water. The height of each plant is measured and recorded after ten days. Which question could be answered by this experiment?,How much space does a plant need to grow?,Three identical seeds are planted and grown in identical pots of soil. All three pots receive equal amounts of sunlight. The plants are watered once each day. Plant A is given 10 milliliters (mL) of water. Plant B is given 20 mL of water. Plant C is given 30 mL of water. The height of each plant is measured and recorded after ten days. How much space does a plant need to grow? question could be answered by this experiment.,identical seeds --- grown in --> identical pots || identical seeds --- grown in --> identical pots of soil || identical seeds --- grown in --> pots || identical seeds --- grown in --> pots of soil || identical seeds --- are --> planted || three identical seeds --- grown in --> pots || three identical seeds --- are --> planted || three identical seeds --- grown in --> pots of soil || three identical seeds --- grown in --> identical pots || three identical seeds --- grown in --> identical pots of soil || three pots --- receive --> amounts || three pots --- receive --> equal amounts || three pots --- receive --> equal amounts of sunlight || three pots --- receive --> amounts of sunlight || plants --- are watered at_time --> once day || plants --- are watered at_time --> day || water --- of milliliters is --> ml || a --- is given --> ml || plant b --- is given --> 20 ml || plant b --- is given --> 20 ml of water || plant c --- is given --> 30 ml || plant c --- is given --> 30 ml of water || plant --- does need --> grow || question --- could --> could answered || question --- could --> could answered by experiment ||,How much soil does a plant need to grow?,Three identical seeds are planted and grown in identical pots of soil. All three pots receive equal amounts of sunlight. The plants are watered once each day. Plant A is given 10 milliliters (mL) of water. Plant B is given 20 mL of water. Plant C is given 30 mL of water. The height of each plant is measured and recorded after ten days. How much soil does a plant need to grow? question could be answered by this experiment.,identical seeds --- grown in --> identical pots || identical seeds --- grown in --> identical pots of soil || identical seeds --- grown in --> pots || identical seeds --- grown in --> pots of soil || identical seeds --- are --> planted || three identical seeds --- grown in --> pots || three identical seeds --- are --> planted || three identical seeds --- grown in --> pots of soil || three identical seeds --- grown in --> identical pots || three identical seeds --- grown in --> identical pots of soil || three pots --- receive --> amounts || three pots --- receive --> equal amounts || three pots --- receive --> equal amounts of sunlight || three pots --- receive --> amounts of sunlight || plants --- are watered at_time --> once day || plants --- are watered at_time --> day || water --- of milliliters is --> ml || a --- is given --> ml || plant b --- is given --> 20 ml || plant b --- is given --> 20 ml of water || plant c --- is given --> 30 ml || plant c --- is given --> 30 ml of water || plant --- does need --> grow || question --- could --> could answered || question --- could --> could answered by experiment ||,How much water will make a plant grow tallest?,Three identical seeds are planted and grown in identical pots of soil. All three pots receive equal amounts of sunlight. The plants are watered once each day. Plant A is given 10 milliliters (mL) of water. Plant B is given 20 mL of water. Plant C is given 30 mL of water. The height of each plant is measured and recorded after ten days. How much water will make a plant grow tallest? question could be answered by this experiment.,identical seeds --- grown in --> identical pots || identical seeds --- grown in --> identical pots of soil || identical seeds --- grown in --> pots || identical seeds --- grown in --> pots of soil || identical seeds --- are --> planted || three identical seeds --- grown in --> pots || three identical seeds --- are --> planted || three identical seeds --- grown in --> pots of soil || three identical seeds --- grown in --> identical pots || three identical seeds --- grown in --> identical pots of soil || three pots --- receive --> amounts || three pots --- receive --> equal amounts || three pots --- receive --> equal amounts of sunlight || three pots --- receive --> amounts of sunlight || plants --- are watered at_time --> once day || plants --- are watered at_time --> day || water --- of milliliters is --> ml || a --- is given --> ml || plant b --- is given --> 20 ml || plant b --- is given --> 20 ml of water || plant c --- is given --> 30 ml || plant c --- is given --> 30 ml of water || plant --- grow --> tallest || question --- could --> could answered || question --- could --> could answered by experiment ||,How much sunlight will make a plant grow tallest?,Three identical seeds are planted and grown in identical pots of soil. All three pots receive equal amounts of sunlight. The plants are watered once each day. Plant A is given 10 milliliters (mL) of water. Plant B is given 20 mL of water. Plant C is given 30 mL of water. The height of each plant is measured and recorded after ten days. How much sunlight will make a plant grow tallest? question could be answered by this experiment.,identical seeds --- grown in --> identical pots || identical seeds --- grown in --> identical pots of soil || identical seeds --- grown in --> pots || identical seeds --- grown in --> pots of soil || identical seeds --- are --> planted || three identical seeds --- grown in --> pots || three identical seeds --- are --> planted || three identical seeds --- grown in --> pots of soil || three identical seeds --- grown in --> identical pots || three identical seeds --- grown in --> identical pots of soil || three pots --- receive --> amounts || three pots --- receive --> equal amounts || three pots --- receive --> equal amounts of sunlight || three pots --- receive --> amounts of sunlight || plants --- are watered at_time --> once day || plants --- are watered at_time --> day || water --- of milliliters is --> ml || a --- is given --> ml || plant b --- is given --> 20 ml || plant b --- is given --> 20 ml of water || plant c --- is given --> 30 ml || plant c --- is given --> 30 ml of water || plant --- grow --> tallest || question --- could --> could answered || question --- could --> could answered by experiment ||,NA,NA,NA
VASoL_2009_3_22,Which of these tells something about how an apple looks?,It is soft.,It is soft of these tells something about how an apple looks.,it --- is soft of --> these || it --- is --> soft ||,It is blue.,It is blue of these tells something about how an apple looks.,it --- is blue of --> these || it --- is --> blue ||,It is square.,It is square of these tells something about how an apple looks.,square --- tells --> something || it --- is square of --> these || it --- is --> square ||,It is smooth.,It is smooth of these tells something about how an apple looks.,it --- is --> smooth || it --- is smooth of --> these ||,NA,NA,NA
Mercury_409349,"Two forms of boron are naturally occurring, boron-10 and boron-11. What difference exists between a boron atom with a 10 atomic mass units (amu) and a boron atom with 11 atomic mass units (amu)?",amount of neutrons,"Two forms of boron are naturally occurring, boron-10 and boron-11. Amount of neutrons difference exists between a boron atom with a 10 atomic mass units (amu) and a boron atom with 11 atomic mass units (amu).",boron atom --- is with --> 11 atomic mass units || boron atom --- is with --> 10 atomic mass units || amount --- exists between --> boron atom with 10 atomic mass units || amount --- exists between --> boron atom || amount --- exists between --> boron atom with 10 mass units ||,number of electrons,"Two forms of boron are naturally occurring, boron-10 and boron-11. Number of electrons difference exists between a boron atom with a 10 atomic mass units (amu) and a boron atom with 11 atomic mass units (amu).",number --- exists between --> boron atom with 10 mass units || number --- exists between --> boron atom with 10 atomic mass units || number --- exists between --> boron atom || boron atom --- is with --> 11 atomic mass units || boron atom --- is with --> 10 atomic mass units ||,size of protons and neutrons,"Two forms of boron are naturally occurring, boron-10 and boron-11. Size of protons and neutrons difference exists between a boron atom with a 10 atomic mass units (amu) and a boron atom with 11 atomic mass units (amu).",size --- exists between --> boron atom with 10 mass units || size --- exists between --> boron atom || size --- exists between --> boron atom with 10 atomic mass units || boron atom --- is with --> 11 atomic mass units || boron atom --- is with --> 10 atomic mass units ||,size of electrons and electron cloud,"Two forms of boron are naturally occurring, boron-10 and boron-11. Size of electrons and electron cloud difference exists between a boron atom with a 10 atomic mass units (amu) and a boron atom with 11 atomic mass units (amu).",,NA,NA,NA
Mercury_SC_407417,Which is caused by the tilt of Earth on its axis?,day and night,Day and night is caused by the tilt of Earth on its axis.,day --- is --> caused by tilt of earth on its axis || day --- is --> caused || day --- is --> caused by tilt on its axis || day --- is --> caused by tilt of earth || day --- is --> caused by tilt ||,stormy weather,Stormy weather is caused by the tilt of Earth on its axis.,weather --- is caused by --> tilt of earth on its axis || weather --- is --> caused || weather --- is caused by --> tilt || weather --- is caused by --> tilt on its axis || weather --- is caused by --> tilt of earth || stormy weather --- is caused by --> tilt of earth || stormy weather --- is --> caused || stormy weather --- is caused by --> tilt || stormy weather --- is caused by --> tilt on its axis || stormy weather --- is caused by --> tilt of earth on its axis ||,high and low tide,High and low tide is caused by the tilt of Earth on its axis.,high --- is --> caused by tilt of earth || high --- is --> caused by tilt of earth on its axis || high --- is --> caused || high --- is --> caused by tilt || high --- is --> caused by tilt on its axis ||,season changes,Season changes is caused by the tilt of Earth on its axis.,season changes --- is caused by --> tilt || season changes --- is caused by --> tilt of earth || season changes --- is --> caused || season changes --- is caused by --> tilt of earth on its axis || season changes --- is caused by --> tilt on its axis ||,NA,NA,NA
VASoL_2007_5_21,Which of the following animals is an invertebrate?,Squirrel,Squirrel animals is an invertebrate.,squirrel animals --- is --> invertebrate ||,Sea gull,Sea gull animals is an invertebrate.,sea gull animals --- is --> invertebrate ||,Cricket,Cricket animals is an invertebrate.,cricket animals --- is --> invertebrate ||,Lizard,Lizard animals is an invertebrate.,lizard animals --- is --> invertebrate ||,NA,NA,NA
MCAS_2012_8_23651,Which of the following could occur as a result of decreasing the heat energy of a gas?,condensation,Condensation could occur as a result of decreasing the heat energy of a gas.,,evaporation,Evaporation could occur as a result of decreasing the heat energy of a gas.,,radiation,Radiation could occur as a result of decreasing the heat energy of a gas.,,vaporization,Vaporization could occur as a result of decreasing the heat energy of a gas.,,NA,NA,NA
MCAS_2000_4_26,The Moon revolves around Earth. This causes,Earth to be warmer at night.,The Moon revolves around Earth. This causes earth to be warmer at night.,,Earth to rotate more rapidly.,The Moon revolves around Earth. This causes earth to rotate more rapidly.,,the Moon to shine more brightly than other objects in the sky.,The Moon revolves around Earth. This causes the moon to shine more brightly than other objects in the sky.,other objects --- is in --> sky ||,the Moon to appear as different shapes during the month.,The Moon revolves around Earth. This causes the moon to appear as different shapes during the month.,moon --- appear as --> shapes || moon --- appear during --> month || moon --- appear as --> different shapes ||,NA,NA,NA
Mercury_SC_410971,Cities control the amount of pollution that is allowed to come from cars. How does this most likely help people?,The air stays cleaner.,Cities control the amount of pollution that is allowed to come from cars. The air stays cleaner does this most likely help people.,air --- stays --> cleaner ||,Cars can travel at faster speeds.,Cities control the amount of pollution that is allowed to come from cars. Cars can travel at faster speeds does this most likely help people.,cars --- can travel at --> speeds || cars --- does --> likely help people || cars --- can travel at --> faster speeds || cars --- does --> most likely help people ||,The skills of the drivers improve.,Cities control the amount of pollution that is allowed to come from cars. The skills of the drivers improve does this most likely help people.,,It becomes safer to drive on the roads.,Cities control the amount of pollution that is allowed to come from cars. It becomes safer to drive on the roads does this most likely help people.,it --- becomes --> safer || it --- does --> likely help people || it --- does --> most likely help people ||,NA,NA,NA
Mercury_404841,Which of these will result in the least gravitational attraction?,two 2g objects 2 meters apart,Two 2g objects 2 meters apart of these will result in the least gravitational attraction.,2g objects --- will result in --> gravitational attraction || 2g objects --- apart of --> these || 2g objects --- will result in --> attraction || 2g objects --- apart --> 2 meters || 2g objects --- will result in --> least attraction || 2g objects --- will result in --> least gravitational attraction || two 2g objects --- will result in --> least gravitational attraction || two 2g objects --- will result in --> attraction || two 2g objects --- will result in --> least attraction || two 2g objects --- apart --> 2 meters || two 2g objects --- apart of --> these || two 2g objects --- will result in --> gravitational attraction || two 2g objects apart --- will result in --> least attraction || two 2g objects apart --- will result in --> attraction || two 2g objects apart --- will result in --> gravitational attraction || two 2g objects apart --- will result in --> least gravitational attraction || 2g objects apart --- will result in --> least attraction || 2g objects apart --- will result in --> least gravitational attraction || 2g objects apart --- will result in --> attraction || 2g objects apart --- will result in --> gravitational attraction ||,two 2g objects 4 meters apart,Two 2g objects 4 meters apart of these will result in the least gravitational attraction.,2g objects --- will result in --> gravitational attraction || 2g objects --- apart of --> these || 2g objects --- will result in --> attraction || 2g objects --- will result in --> least attraction || 2g objects --- apart --> 4 meters || 2g objects --- will result in --> least gravitational attraction || two 2g objects --- will result in --> least gravitational attraction || two 2g objects --- will result in --> attraction || two 2g objects --- apart --> 4 meters || two 2g objects --- will result in --> least attraction || two 2g objects --- apart of --> these || two 2g objects --- will result in --> gravitational attraction || two 2g objects apart --- will result in --> least attraction || two 2g objects apart --- will result in --> attraction || two 2g objects apart --- will result in --> gravitational attraction || two 2g objects apart --- will result in --> least gravitational attraction || 2g objects apart --- will result in --> least attraction || 2g objects apart --- will result in --> least gravitational attraction || 2g objects apart --- will result in --> attraction || 2g objects apart --- will result in --> gravitational attraction ||,two 1g objects 6 meters apart,Two 1g objects 6 meters apart of these will result in the least gravitational attraction.,two 1g objects --- apart of --> these || two 1g objects --- will result in --> gravitational attraction || two 1g objects --- will result in --> attraction || two 1g objects --- will result in --> least gravitational attraction || two 1g objects --- will result in --> least attraction || two 1g objects --- apart --> 6 meters || 1g objects apart --- will result in --> least attraction || 1g objects apart --- will result in --> gravitational attraction || 1g objects apart --- will result in --> attraction || 1g objects apart --- will result in --> least gravitational attraction || 1g objects --- apart --> 6 meters || 1g objects --- apart of --> these || 1g objects --- will result in --> attraction || 1g objects --- will result in --> least attraction || 1g objects --- will result in --> least gravitational attraction || 1g objects --- will result in --> gravitational attraction || two 1g objects apart --- will result in --> attraction || two 1g objects apart --- will result in --> gravitational attraction || two 1g objects apart --- will result in --> least attraction || two 1g objects apart --- will result in --> least gravitational attraction ||,two 1g objects 8 meters apart,Two 1g objects 8 meters apart of these will result in the least gravitational attraction.,two 1g objects --- apart of --> these || two 1g objects --- will result in --> gravitational attraction || two 1g objects --- will result in --> attraction || two 1g objects --- will result in --> least gravitational attraction || two 1g objects --- will result in --> least attraction || two 1g objects --- apart --> 8 meters || 1g objects apart --- will result in --> least attraction || 1g objects apart --- will result in --> gravitational attraction || 1g objects apart --- will result in --> attraction || 1g objects apart --- will result in --> least gravitational attraction || 1g objects --- apart of --> these || 1g objects --- will result in --> attraction || 1g objects --- will result in --> least attraction || 1g objects --- will result in --> least gravitational attraction || 1g objects --- will result in --> gravitational attraction || 1g objects --- apart --> 8 meters || two 1g objects apart --- will result in --> attraction || two 1g objects apart --- will result in --> gravitational attraction || two 1g objects apart --- will result in --> least attraction || two 1g objects apart --- will result in --> least gravitational attraction ||,NA,NA,NA
