LEAP__4_10225,You are getting up to go to school in Louisiana; a student on the other side of Earth is getting ready for bed. What is the reason for this?,Earth revolves around the Sun.,You are getting up to go to school in Louisiana; a student on the other side of Earth is getting ready for bed. Earth revolves around the Sun is the reason for this.,student --- is getting --> ready || student --- is getting for --> bed || you --- go in --> louisiana || you --- go to --> school || earth revolves --- is reason for --> this || earth revolves --- is --> reason ||,Earth rotates on its axis.,You are getting up to go to school in Louisiana; a student on the other side of Earth is getting ready for bed. Earth rotates on its axis is the reason for this.,student --- is getting --> ready || student --- is getting for --> bed || you --- go in --> louisiana || you --- go to --> school || earth rotates --- is --> reason || earth rotates --- is reason for --> this || earth --- rotates on --> its axis ||,The Sun rotates on its axis.,You are getting up to go to school in Louisiana; a student on the other side of Earth is getting ready for bed. The Sun rotates on its axis is the reason for this.,student --- is getting --> ready || student --- is getting for --> bed || you --- go in --> louisiana || you --- go to --> school || sun rotates --- is reason for --> this || sun rotates --- is --> reason || sun --- rotates on --> its axis ||,The Moon revolves around Earth.,You are getting up to go to school in Louisiana; a student on the other side of Earth is getting ready for bed. The Moon revolves around Earth is the reason for this.,student --- is getting --> ready || student --- is getting for --> bed || you --- go in --> louisiana || you --- go to --> school || moon revolves --- is --> reason || moon revolves --- is reason for --> this ||,NA,NA,NA
Mercury_SC_401661,"When building an electrical circuit, which safety precaution should be taken first?",use a new battery,"Use a new battery building an electrical circuit, which safety precaution should be taken first.",safety precaution --- should --> should taken || safety precaution --- should --> should taken first ||,wear rubber gloves,"Wear rubber gloves building an electrical circuit, which safety precaution should be taken first.",safety precaution --- should --> should taken || safety precaution --- should --> should taken first ||,clean the electrical wire,"Clean the electrical wire building an electrical circuit, which safety precaution should be taken first.",safety precaution --- should --> should taken || safety precaution --- should --> should taken first ||,read all directions,"Read all directions building an electrical circuit, which safety precaution should be taken first.",,NA,NA,NA
TIMSS_1995_8_Q15,Which is NOT an example of a chemical change?,Boiling water,Boiling water is NOT an example of a chemical change.,,Rusting iron,Rusting iron is NOT an example of a chemical change.,,Burning wood,Burning wood is NOT an example of a chemical change.,,Baking bread,Baking bread is NOT an example of a chemical change.,,NA,NA,NA
MCAS_1999_4_23,Why is it that the Moon can sometimes be seen during the day as well as at night?,The Moon reflects light from the Sun all the time.,The Moon reflects light from the Sun all the time is it that the Moon can sometimes be seen during the day as well as at night.,moon --- be --> sometimes seen during day at night || moon --- be seen during --> day || moon --- sometimes be seen during --> day || moon --- be --> seen during day at night || moon --- be seen at --> night || moon --- sometimes be seen at --> night || moon --- be --> seen || moon --- be --> sometimes seen || time --- is --> it ||,The Sun goes around Earth and the Moon every day.,The Sun goes around Earth and the Moon every day is it that the Moon can sometimes be seen during the day as well as at night.,sun --- goes at_time --> day || moon --- be --> sometimes seen during day at night || moon --- be seen during --> day || moon --- sometimes be seen during --> day || moon --- be --> seen during day at night || moon --- be seen at --> night || moon --- sometimes be seen at --> night || moon --- be --> seen || moon --- be --> sometimes seen || sun goes day --- is --> it ||,Earth reflects light from the Moon all the time.,Earth reflects light from the Moon all the time is it that the Moon can sometimes be seen during the day as well as at night.,earth --- reflects light at_time --> time || earth --- light from --> moon || moon --- be --> sometimes seen during day at night || moon --- be seen during --> day || moon --- sometimes be seen during --> day || moon --- be --> seen during day at night || moon --- be seen at --> night || moon --- sometimes be seen at --> night || moon --- be --> seen || moon --- be --> sometimes seen ||,The Moon goes around Earth every day.,The Moon goes around Earth every day is it that the Moon can sometimes be seen during the day as well as at night.,moon --- be --> sometimes seen during day at night || moon --- goes at_time --> day || moon --- be seen during --> day || moon --- sometimes be seen during --> day || moon --- be --> seen during day at night || moon --- be seen at --> night || moon --- sometimes be seen at --> night || moon --- be --> seen || moon --- be --> sometimes seen || moon goes day --- is --> it ||,NA,NA,NA
TIMSS_1995_8_J7,How are warm-blooded animals different from cold-blooded animals?,Warm-blooded animals have a higher metabolism in warm weather.,Warm-blooded animals have a higher metabolism in warm weather are warm-blooded animals different from cold-blooded animals.,warm-blooded animals --- metabolism in --> weather || warm-blooded animals --- higher metabolism in --> weather || warm-blooded animals --- have --> metabolism in warm weather || warm-blooded animals --- have --> metabolism || warm-blooded animals --- have --> higher metabolism in weather || warm-blooded animals --- metabolism in --> warm weather || warm-blooded animals --- higher metabolism in --> warm weather || warm-blooded animals --- have --> higher metabolism || warm-blooded animals --- have --> higher metabolism in warm weather || warm-blooded animals --- have --> metabolism in weather || animals --- have --> metabolism || animals --- have --> higher metabolism || animals --- have --> higher metabolism in weather || animals --- have --> metabolism in weather || animals --- metabolism in --> warm weather || animals --- higher metabolism in --> warm weather || animals --- have --> metabolism in warm weather || animals --- metabolism in --> weather || animals --- higher metabolism in --> weather || animals --- have --> higher metabolism in warm weather || higher metabolism --- is in --> warm weather ||,Warm-blooded animals are more aggressive in captivity.,Warm-blooded animals are more aggressive in captivity are warm-blooded animals different from cold-blooded animals.,animals --- different from --> animals || animals --- different from --> cold-blooded animals || animals --- are --> more aggressive || animals --- are --> aggressive || animals --- are aggressive in --> captivity || animals --- are more aggressive in --> captivity || warm-blooded animals --- are --> aggressive || warm-blooded animals --- different from --> cold-blooded animals || warm-blooded animals --- are aggressive in --> captivity || warm-blooded animals --- are more aggressive in --> captivity || warm-blooded animals --- different from --> animals || warm-blooded animals --- are --> more aggressive ||,Warm-blooded animals always have a higher blood temperature.,Warm-blooded animals always have a higher blood temperature are warm-blooded animals different from cold-blooded animals.,blood temperature --- are --> animals different from cold-blooded animals || blood temperature --- are --> warm-blooded animals different || blood temperature --- are --> animals different from animals || blood temperature --- are --> animals || blood temperature --- are --> warm-blooded animals || blood temperature --- are --> animals different || blood temperature --- are --> warm-blooded animals different from cold-blooded animals || blood temperature --- are --> warm-blooded animals different from animals || higher blood temperature --- are --> warm-blooded animals different from animals || higher blood temperature --- are --> animals || higher blood temperature --- are --> animals different || higher blood temperature --- are --> warm-blooded animals different || higher blood temperature --- are --> animals different from animals || higher blood temperature --- are --> animals different from cold-blooded animals || higher blood temperature --- are --> warm-blooded animals || higher blood temperature --- are --> warm-blooded animals different from cold-blooded animals ||,Warm-blooded animals normally maintain a fairly constant internal temperature at all air temperatures.,Warm-blooded animals normally maintain a fairly constant internal temperature at all air temperatures are warm-blooded animals different from cold-blooded animals.,,Warm-blooded animals are found only in warm climates.,Warm-blooded animals are found only in warm climates are warm-blooded animals different from cold-blooded animals.,animals --- are --> found || warm climates --- are --> warm-blooded animals || warm climates --- are --> animals different || warm climates --- are --> animals different from cold-blooded animals || warm climates --- are --> animals || warm climates --- are --> warm-blooded animals different from animals || warm climates --- are --> warm-blooded animals different || warm climates --- are --> animals different from animals || warm climates --- are --> warm-blooded animals different from cold-blooded animals || warm-blooded animals --- are --> found || climates --- are --> warm-blooded animals different || climates --- are --> animals different from animals || climates --- are --> animals different from cold-blooded animals || climates --- are --> warm-blooded animals different from cold-blooded animals || climates --- are --> animals || climates --- are --> animals different || climates --- are --> warm-blooded animals different from animals || climates --- are --> warm-blooded animals ||
Mercury_SC_LBS10018,All matter has two characteristics. These characteristics are that matter takes up space and matter has,mass.,All matter has two characteristics. These characteristics are that matter takes up space and matter has mass.,matter --- has --> two characteristics || matter --- takes up --> space || matter --- has --> mass ||,color.,All matter has two characteristics. These characteristics are that matter takes up space and matter has color.,matter --- has --> two characteristics || matter --- takes up --> space || matter --- has --> color ||,a definite weight.,All matter has two characteristics. These characteristics are that matter takes up space and matter has a definite weight.,matter --- has --> two characteristics || matter --- has --> definite weight || matter --- takes up --> space || matter --- has --> weight ||,a definite shape.,All matter has two characteristics. These characteristics are that matter takes up space and matter has a definite shape.,matter --- has --> two characteristics || matter --- takes up --> space || matter --- has --> shape || matter --- has --> definite shape ||,NA,NA,NA
Mercury_SC_406855,What is the best way to model the effect of wind on sand dunes?,Pour a bucket a sand through the air.,Pour a bucket a sand through the air is the best way to model the effect of wind on sand dunes.,sand --- model --> effect on sand dunes || sand --- model --> effect of wind || sand --- model --> effect || sand --- model --> effect of wind on sand dunes ||,Pour water over a pile of sand.,Pour water over a pile of sand is the best way to model the effect of wind on sand dunes.,,Filter sand through a screen into water.,Filter sand through a screen into water is the best way to model the effect of wind on sand dunes.,,Blow on a pile of sand through a straw.,Blow on a pile of sand through a straw is the best way to model the effect of wind on sand dunes.,,NA,NA,NA
Mercury_SC_415457,Which alternative energy resource is used most like coal?,geothermal energy,Geothermal energy alternative energy resource is used most like coal.,energy alternative energy resource --- is used like --> coal || energy alternative energy resource --- is used like --> most coal || geothermal energy alternative energy resource --- is used like --> most coal || geothermal energy alternative energy resource --- is used like --> coal ||,nuclear energy,Nuclear energy alternative energy resource is used most like coal.,energy alternative energy resource --- is used like --> coal || energy alternative energy resource --- is used like --> most coal || nuclear energy alternative energy resource --- is used like --> most coal || nuclear energy alternative energy resource --- is used like --> coal ||,hydropower,Hydropower alternative energy resource is used most like coal.,hydropower alternative energy resource --- is used like --> most coal || hydropower alternative energy resource --- is used like --> coal ||,biofuel energy,Biofuel energy alternative energy resource is used most like coal.,biofuel energy energy resource --- is used like --> most coal || biofuel energy energy resource --- is used like --> coal || biofuel energy alternative energy resource --- is used like --> most coal || biofuel energy alternative energy resource --- is used like --> coal ||,NA,NA,NA
NYSEDREGENTS_2015_4_25,The correct order of a plant's stages of growth and development is,young plant -> seed -> mature plant,The correct order of a plant's stages of growth and development is young plant -> seed -> mature plant,plant --- of --> stages of growth || plant 's stages --- order of is --> plant || plant 's stages --- correct order of is --> plant || plant 's stages --- order of is --> young plant || plant 's stages --- correct order of is --> young plant || order --- is --> young plant || order --- is --> plant || correct order --- is --> plant || correct order --- is --> young plant ||,seed -> mature plant -> young plant,The correct order of a plant's stages of growth and development is seed -> mature plant -> young plant,plant --- of --> stages of growth || order --- is --> seed || correct order --- is --> seed || plant 's stages --- order of is --> seed || plant 's stages --- correct order of is --> seed ||,seed -> young plant -> mature plant,The correct order of a plant's stages of growth and development is seed -> young plant -> mature plant,plant --- of --> stages of growth || order --- is --> seed || correct order --- is --> seed || plant 's stages --- order of is --> seed || plant 's stages --- correct order of is --> seed ||,mature plant -> young plant -> seed,The correct order of a plant's stages of growth and development is mature plant -> young plant -> seed,plant --- of --> stages of growth || plant 's stages --- order of is --> mature plant || plant 's stages --- correct order of is --> mature plant || plant 's stages --- order of is --> plant || plant 's stages --- correct order of is --> plant || order --- is --> mature plant || order --- is --> plant || correct order --- is --> mature plant || correct order --- is --> plant ||,NA,NA,NA
Mercury_7058135,"A student is investigating different types of trees. Two trees are found to have similar growth rates, temperature ranges, and sizes, but different leaves and flowers. The trees are most likely in",the same species.,"A student is investigating different types of trees. Two trees are found to have similar growth rates, temperature ranges, and sizes, but different leaves and flowers. The trees are most likely in the same species.",student --- is investigating --> different types || student --- is investigating --> different types of trees || student --- is investigating --> types || student --- is investigating --> types of trees || sizes --- have --> similar growth rates || sizes --- have --> growth rates || trees --- are --> likely || trees --- are most likely in --> same species || trees --- are likely in --> same species || trees --- are --> most likely || trees --- are likely in --> species || trees --- are most likely in --> species ||,the same genus.,"A student is investigating different types of trees. Two trees are found to have similar growth rates, temperature ranges, and sizes, but different leaves and flowers. The trees are most likely in the same genus.",student --- is investigating --> different types || student --- is investigating --> different types of trees || student --- is investigating --> types || student --- is investigating --> types of trees || sizes --- have --> similar growth rates || sizes --- have --> growth rates || trees --- are --> likely || trees --- are --> most likely || trees --- are most likely in --> genus || trees --- are likely in --> genus || trees --- are likely in --> same genus || trees --- are most likely in --> same genus ||,a different kingdom.,"A student is investigating different types of trees. Two trees are found to have similar growth rates, temperature ranges, and sizes, but different leaves and flowers. The trees are most likely in a different kingdom.",student --- is investigating --> different types || student --- is investigating --> different types of trees || student --- is investigating --> types || student --- is investigating --> types of trees || sizes --- have --> similar growth rates || sizes --- have --> growth rates || trees --- are --> likely || trees --- are most likely in --> kingdom || trees --- are likely in --> kingdom || trees --- are --> most likely || trees --- are most likely in --> different kingdom || trees --- are likely in --> different kingdom ||,a different phylum.,"A student is investigating different types of trees. Two trees are found to have similar growth rates, temperature ranges, and sizes, but different leaves and flowers. The trees are most likely in a different phylum.",student --- is investigating --> different types || student --- is investigating --> different types of trees || student --- is investigating --> types || student --- is investigating --> types of trees || sizes --- have --> similar growth rates || sizes --- have --> growth rates || trees --- are --> likely || trees --- are --> most likely || trees --- are likely in --> phylum || trees --- are most likely in --> phylum || trees --- are most likely in --> different phylum || trees --- are likely in --> different phylum ||,NA,NA,NA
MDSA_2008_4_19,"In October, the constellations Gemini and Orion appear in the sky after midnight. In January, Orion appears at sunset. At which time will Gemini most likely appear in January?",at noon,"In October, the constellations Gemini and Orion appear in the sky after midnight. In January, Orion appears at sunset. At at noon time will Gemini most likely appear in January.",constellations --- appear after --> midnight || constellations --- appear in --> sky || constellations --- appear in --> october || orion --- appears at --> sunset || orion --- appears in --> january ||,at sunset,"In October, the constellations Gemini and Orion appear in the sky after midnight. In January, Orion appears at sunset. At at sunset time will Gemini most likely appear in January.",constellations --- appear after --> midnight || constellations --- appear in --> sky || constellations --- appear in --> october || orion --- appears at --> sunset || orion --- appears in --> january ||,after midnight,"In October, the constellations Gemini and Orion appear in the sky after midnight. In January, Orion appears at sunset. At after midnight time will Gemini most likely appear in January.",constellations --- appear after --> midnight || constellations --- appear in --> sky || constellations --- appear in --> october || orion --- appears at --> sunset || orion --- appears in --> january ||,before sunrise,"In October, the constellations Gemini and Orion appear in the sky after midnight. In January, Orion appears at sunset. At before sunrise time will Gemini most likely appear in January.",constellations --- appear after --> midnight || constellations --- appear in --> sky || constellations --- appear in --> october || orion --- appears at --> sunset || orion --- appears in --> january ||,NA,NA,NA
AKDE&ED_2008_8_45,Which combination of processes from the water cycle is most likely to cause flooding?,"low runoff, low evaporation, high transpiration","Low runoff, low evaporation, high transpiration combination of processes from the water cycle is most likely to cause flooding.",runoff --- is --> likely || runoff --- is --> most likely || runoff --- cause --> flooding || low runoff --- is --> most likely || low runoff --- is --> likely || low runoff --- cause --> flooding ||,"high runoff, low evaporation, low precipitation","High runoff, low evaporation, low precipitation combination of processes from the water cycle is most likely to cause flooding.",runoff --- is --> likely || runoff --- is --> most likely || runoff --- cause --> flooding || high runoff --- cause --> flooding || high runoff --- is --> likely || high runoff --- is --> most likely ||,"low runoff, high infiltration, high condensation","Low runoff, high infiltration, high condensation combination of processes from the water cycle is most likely to cause flooding.",runoff --- is --> likely || runoff --- is --> most likely || runoff --- cause --> flooding || low runoff --- is --> most likely || low runoff --- is --> likely || low runoff --- cause --> flooding ||,"high runoff, low infiltration, high precipitation","High runoff, low infiltration, high precipitation combination of processes from the water cycle is most likely to cause flooding.",runoff --- is --> likely || runoff --- is --> most likely || runoff --- cause --> flooding || high runoff --- cause --> flooding || high runoff --- is --> likely || high runoff --- is --> most likely ||,NA,NA,NA
Mercury_7131758,"Michael has to write a paper on the formation of red blood cells. In addition to the circulatory system, what other body system should he research to find information about the formation of red blood cells?",skeletal system,"Michael has to write a paper on the formation of red blood cells. In addition to the circulatory system, skeletal system other body system should he research to find information about the formation of red blood cells.",michael --- write --> paper on formation of red blood cells || michael --- write --> paper || michael --- write --> paper on formation || michael --- write --> paper on formation of blood cells || he --- should research in addition to --> system || he --- find --> information || he --- find --> information about formation of red blood cells || he --- find --> information about formation || he --- find --> information about formation of blood cells || he --- should research in addition to --> circulatory system ||,immune system,"Michael has to write a paper on the formation of red blood cells. In addition to the circulatory system, immune system other body system should he research to find information about the formation of red blood cells.",michael --- write --> paper on formation of red blood cells || michael --- write --> paper || michael --- write --> paper on formation || michael --- write --> paper on formation of blood cells || he --- should research in addition to --> system || he --- find --> information || he --- find --> information about formation of red blood cells || he --- find --> information about formation || he --- find --> information about formation of blood cells || he --- should research in addition to --> circulatory system ||,endocrine system,"Michael has to write a paper on the formation of red blood cells. In addition to the circulatory system, endocrine system other body system should he research to find information about the formation of red blood cells.",michael --- write --> paper on formation of red blood cells || michael --- write --> paper || michael --- write --> paper on formation || michael --- write --> paper on formation of blood cells || he --- should research in addition to --> system || he --- find --> information || he --- find --> information about formation of red blood cells || he --- find --> information about formation || he --- find --> information about formation of blood cells || he --- should research in addition to --> circulatory system ||,reproductive system,"Michael has to write a paper on the formation of red blood cells. In addition to the circulatory system, reproductive system other body system should he research to find information about the formation of red blood cells.",michael --- write --> paper on formation of red blood cells || michael --- write --> paper || michael --- write --> paper on formation || michael --- write --> paper on formation of blood cells || he --- should research in addition to --> system || he --- find --> information || he --- find --> information about formation of red blood cells || he --- find --> information about formation || he --- find --> information about formation of blood cells || he --- should research in addition to --> circulatory system ||,NA,NA,NA
