MSA_2013_5_11,A container of liquid water was placed outside during the day when the temperature was 3°C. At night the outside temperature dropped to -2°C. This temperature change most likely caused the water to,condense,A container of liquid water was placed outside during the day when the temperature was 3°C. At night the outside temperature dropped to -2°C. This temperature change most likely caused the water to condense,container --- was --> placed || container --- was --> placed outside || temperature change --- likely caused --> water || temperature change --- caused --> water || temperature change --- most likely caused --> water || temperature --- was --> 3 ° c. || temperature --- dropped during --> day || temperature --- was --> when 3 ° c. || temperature --- dropped to --> -2 ° c. || temperature --- was --> when 3 ° c. at night || temperature --- was --> 3 ° c. at night || outside temperature --- dropped to --> -2 ° c. || outside temperature --- dropped during --> day ||,evaporate,A container of liquid water was placed outside during the day when the temperature was 3°C. At night the outside temperature dropped to -2°C. This temperature change most likely caused the water to evaporate,container --- was --> placed || container --- was --> placed outside || temperature change --- likely caused --> water || temperature change --- caused --> water || temperature change --- most likely caused --> water || temperature --- was --> 3 ° c. || temperature --- dropped during --> day || temperature --- was --> when 3 ° c. || temperature --- dropped to --> -2 ° c. || temperature --- was --> when 3 ° c. at night || temperature --- was --> 3 ° c. at night || outside temperature --- dropped to --> -2 ° c. || outside temperature --- dropped during --> day ||,remain a liquid,A container of liquid water was placed outside during the day when the temperature was 3°C. At night the outside temperature dropped to -2°C. This temperature change most likely caused the water to remain a liquid,container --- was --> placed || container --- was --> placed outside || temperature change --- likely caused --> water || temperature change --- caused --> water || temperature change --- most likely caused --> water || water --- remain --> liquid || temperature --- was --> 3 ° c. || temperature --- dropped during --> day || temperature --- was --> when 3 ° c. || temperature --- dropped to --> -2 ° c. || temperature --- was --> when 3 ° c. at night || temperature --- was --> 3 ° c. at night || outside temperature --- dropped to --> -2 ° c. || outside temperature --- dropped during --> day ||,become a solid,A container of liquid water was placed outside during the day when the temperature was 3°C. At night the outside temperature dropped to -2°C. This temperature change most likely caused the water to become a solid,container --- was --> placed || container --- was --> placed outside || temperature change --- likely caused --> water || temperature change --- caused --> water || temperature change --- most likely caused --> water || water --- become --> solid || temperature --- was --> 3 ° c. || temperature --- dropped during --> day || temperature --- was --> when 3 ° c. || temperature --- dropped to --> -2 ° c. || temperature --- was --> when 3 ° c. at night || temperature --- was --> 3 ° c. at night || outside temperature --- dropped to --> -2 ° c. || outside temperature --- dropped during --> day ||,NA,NA,NA
Mercury_SC_408706,Students studied the revolution of Earth around the Sun. During which month will Florida have the most sunlight energy available?,March,Students studied the revolution of Earth around the Sun. During march month will Florida have the most sunlight energy available.,students --- studied --> revolution of earth around sun || students --- studied --> revolution around sun || students --- studied --> revolution of earth || students --- studied --> revolution ||,June,Students studied the revolution of Earth around the Sun. During june month will Florida have the most sunlight energy available.,students --- studied --> revolution of earth around sun || students --- studied --> revolution around sun || students --- studied --> revolution of earth || students --- studied --> revolution ||,September,Students studied the revolution of Earth around the Sun. During september month will Florida have the most sunlight energy available.,students --- studied --> revolution of earth around sun || students --- studied --> revolution around sun || students --- studied --> revolution of earth || students --- studied --> revolution ||,December,Students studied the revolution of Earth around the Sun. During december month will Florida have the most sunlight energy available.,students --- studied --> revolution of earth around sun || students --- studied --> revolution around sun || students --- studied --> revolution of earth || students --- studied --> revolution ||,NA,NA,NA
Mercury_7213325,The main disadvantage of using solar energy to generate electricity is that solar panels,produce greenhouse gases.,The main disadvantage of using solar energy to generate electricity is that solar panels produce greenhouse gases.,panels --- produce --> greenhouse gases || solar panels --- produce --> greenhouse gases ||,produce water pollution.,The main disadvantage of using solar energy to generate electricity is that solar panels produce water pollution.,solar panels --- produce --> water pollution || panels --- produce --> water pollution ||,are expensive to operate.,The main disadvantage of using solar energy to generate electricity is that solar panels are expensive to operate.,panels --- are --> expensive || solar panels --- are --> expensive ||,are expensive to purchase.,The main disadvantage of using solar energy to generate electricity is that solar panels are expensive to purchase.,panels --- are --> expensive || solar panels --- are --> expensive ||,NA,NA,NA
Mercury_SC_LBS10932,"A scientist lost the cap to an ammonia bottle, so she moved the ammonia into a clean container with a lid. What else should she do to be safe?",Recycle the old ammonia bottle.,"A scientist lost the cap to an ammonia bottle, so she moved the ammonia into a clean container with a lid. Recycle the old ammonia bottle else should she do to be safe.",scientist --- lost --> cap || scientist --- lost cap --> she moved into clean container with lid || scientist --- lost cap --> she moved into container with lid || scientist --- lost cap --> she moved || scientist --- lost cap to --> ammonia bottle || scientist --- lost cap --> she moved into clean container || scientist --- lost cap --> she moved into container || she --- moved into --> container || she --- moved ammonia into --> container || she --- moved into --> container with lid || she --- moved ammonia into --> container with lid || she --- moved into --> clean container || she --- moved ammonia into --> clean container || she --- moved --> ammonia || she --- moved into --> clean container with lid || she --- moved ammonia into --> clean container with lid || clean container --- is with --> lid ||,Label the new container clearly.,"A scientist lost the cap to an ammonia bottle, so she moved the ammonia into a clean container with a lid. Label the new container clearly else should she do to be safe.",scientist --- lost --> cap || scientist --- lost cap --> she moved into clean container with lid || scientist --- lost cap --> she moved into container with lid || scientist --- lost cap --> she moved || scientist --- lost cap to --> ammonia bottle || scientist --- lost cap --> she moved into clean container || scientist --- lost cap --> she moved into container || she --- moved into --> container || she --- moved ammonia into --> container || she --- moved into --> container with lid || she --- moved ammonia into --> container with lid || she --- moved into --> clean container || she --- moved ammonia into --> clean container || she --- moved --> ammonia || she --- moved into --> clean container with lid || she --- moved ammonia into --> clean container with lid || she --- should do --> safe || container --- should do --> safe || clean container --- is with --> lid || new container --- should do --> safe ||,Heat the new container to seal the lid.,"A scientist lost the cap to an ammonia bottle, so she moved the ammonia into a clean container with a lid. Heat the new container to seal the lid else should she do to be safe.",scientist --- lost --> cap || scientist --- lost cap --> she moved into clean container with lid || scientist --- lost cap --> she moved into container with lid || scientist --- lost cap --> she moved || scientist --- lost cap to --> ammonia bottle || scientist --- lost cap --> she moved into clean container || scientist --- lost cap --> she moved into container || she --- moved into --> container || she --- moved ammonia into --> container || she --- moved into --> container with lid || she --- moved ammonia into --> container with lid || she --- moved into --> clean container || she --- moved ammonia into --> clean container || she --- moved --> ammonia || she --- moved into --> clean container with lid || she --- moved ammonia into --> clean container with lid || she --- should do --> safe || clean container --- is with --> lid ||,Store the new container in the refrigerator.,"A scientist lost the cap to an ammonia bottle, so she moved the ammonia into a clean container with a lid. Store the new container in the refrigerator else should she do to be safe.",scientist --- lost --> cap || scientist --- lost cap --> she moved into clean container with lid || scientist --- lost cap --> she moved into container with lid || scientist --- lost cap --> she moved || scientist --- lost cap to --> ammonia bottle || scientist --- lost cap --> she moved into clean container || scientist --- lost cap --> she moved into container || she --- moved into --> container || she --- moved ammonia into --> container || she --- moved into --> container with lid || she --- moved ammonia into --> container with lid || she --- moved into --> clean container || she --- moved ammonia into --> clean container || she --- moved --> ammonia || she --- moved into --> clean container with lid || she --- moved ammonia into --> clean container with lid || she --- should do --> safe || clean container --- is with --> lid || store --- is in --> refrigerator else ||,NA,NA,NA
Mercury_192220,"During photosynthesis, plants convert sunlight into what substance to be used for energy?",oxygen,"During photosynthesis, plants convert sunlight into oxygen substance to be used for energy.",plants --- be used for --> energy || plants --- convert sunlight --> used || plants --- be --> used || plants --- convert --> sunlight || plants --- convert sunlight --> used for energy || plants --- convert sunlight into --> oxygen substance || plants --- convert sunlight during --> photosynthesis ||,carbon dioxide,"During photosynthesis, plants convert sunlight into carbon dioxide substance to be used for energy.",plants --- be used for --> energy || plants --- convert sunlight --> used || plants --- be --> used || plants --- convert --> sunlight || plants --- convert sunlight into --> carbon dioxide substance || plants --- convert sunlight --> used for energy || plants --- convert sunlight during --> photosynthesis ||,iron sulfide,"During photosynthesis, plants convert sunlight into iron sulfide substance to be used for energy.",plants --- be used for --> energy || plants --- convert sunlight --> used || plants --- be --> used || plants --- convert --> sunlight || plants --- convert sunlight --> used for energy || plants --- convert sunlight into --> iron sulfide substance || plants --- convert sunlight during --> photosynthesis ||,glucose,"During photosynthesis, plants convert sunlight into glucose substance to be used for energy.",plants --- be used for --> energy || plants --- convert sunlight --> used || plants --- be --> used || plants --- convert sunlight into --> glucose substance || plants --- convert --> sunlight || plants --- convert sunlight --> used for energy || plants --- convert sunlight during --> photosynthesis ||,NA,NA,NA
Mercury_SC_407247,Some frog species will bury themselves in mud if the environment becomes very dry. The frogs enter into a type of hibernation. Which would be the most likely signal for the frogs to emerge from the mud?,a decrease in daylight hours,Some frog species will bury themselves in mud if the environment becomes very dry. The frogs enter into a type of hibernation. A decrease in daylight hours would be the most likely signal for the frogs to emerge from the mud.,frog species --- will bury --> themselves || environment --- becomes --> dry || environment --- becomes --> very dry || decrease --- is in --> daylight hours || decrease --- would --> would most likely signal || decrease --- would --> would likely signal || frogs --- emerge from --> mud ||,an increase in air temperature,Some frog species will bury themselves in mud if the environment becomes very dry. The frogs enter into a type of hibernation. An increase in air temperature would be the most likely signal for the frogs to emerge from the mud.,frog species --- will bury --> themselves || environment --- becomes --> dry || environment --- becomes --> very dry || increase --- would --> would likely signal || increase --- would --> would most likely signal || increase --- is in --> air temperature || frogs --- emerge from --> mud ||,an increase in precipitation,Some frog species will bury themselves in mud if the environment becomes very dry. The frogs enter into a type of hibernation. An increase in precipitation would be the most likely signal for the frogs to emerge from the mud.,frog species --- will bury --> themselves || environment --- becomes --> dry || environment --- becomes --> very dry || increase --- is in --> precipitation || increase --- be --> would most likely signal || increase --- be --> would likely signal || frogs --- emerge from --> mud ||,a decrease in air pressure,Some frog species will bury themselves in mud if the environment becomes very dry. The frogs enter into a type of hibernation. A decrease in air pressure would be the most likely signal for the frogs to emerge from the mud.,frog species --- will bury --> themselves || environment --- becomes --> dry || environment --- becomes --> very dry || decrease --- is in --> air pressure || decrease --- would --> would most likely signal || decrease --- would --> would likely signal || frogs --- emerge from --> mud ||,NA,NA,NA
Mercury_7024798,Which characteristic is least likely to be affected by an individual's environment?,height,Height characteristic is least likely to be affected by an individual's environment.,height characteristic --- be --> affected || height characteristic --- is --> likely || height characteristic --- is --> least likely || height characteristic --- be affected by --> individual 's environment || individual --- by --> environment ||,weight,Weight characteristic is least likely to be affected by an individual's environment.,weight characteristic --- be affected by --> individual 's environment || weight characteristic --- is --> least likely || weight characteristic --- be --> affected || weight characteristic --- is --> likely || individual --- by --> environment ||,skin color,Skin color characteristic is least likely to be affected by an individual's environment.,skin color characteristic --- be --> affected || skin color characteristic --- is --> likely || skin color characteristic --- be affected by --> individual 's environment || skin color characteristic --- is --> least likely || individual --- by --> environment ||,eye color,Eye color characteristic is least likely to be affected by an individual's environment.,eye color characteristic --- be affected by --> individual 's environment || eye color characteristic --- is --> likely || eye color characteristic --- is --> least likely || eye color characteristic --- be --> affected || individual --- by --> environment ||,NA,NA,NA
Mercury_7180810,A teacher is conducting an investigation by using special equipment to hold a magnesium (Mg) ribbon over the flame of a Bunsen burner. Which observation indicates a chemical reaction took place?,The temperature of the magnesium ribbon increased.,A teacher is conducting an investigation by using special equipment to hold a magnesium (Mg) ribbon over the flame of a Bunsen burner. The temperature of the magnesium ribbon increased observation indicates a chemical reaction took place.,teacher --- using --> equipment || teacher --- using --> special equipment || teacher --- is conducting --> investigation || reaction --- took --> place || chemical reaction --- took --> place ||,The shape of the magnesium ribbon changed.,A teacher is conducting an investigation by using special equipment to hold a magnesium (Mg) ribbon over the flame of a Bunsen burner. The shape of the magnesium ribbon changed observation indicates a chemical reaction took place.,teacher --- using --> equipment || teacher --- using --> special equipment || teacher --- is conducting --> investigation || reaction --- took --> place || chemical reaction --- took --> place ||,The burning magnesium produced light.,A teacher is conducting an investigation by using special equipment to hold a magnesium (Mg) ribbon over the flame of a Bunsen burner. The burning magnesium produced light observation indicates a chemical reaction took place.,teacher --- using --> equipment || teacher --- using --> special equipment || teacher --- is conducting --> investigation || reaction --- took --> place || chemical reaction --- took --> place ||,The magnesium appeared to evaporate.,A teacher is conducting an investigation by using special equipment to hold a magnesium (Mg) ribbon over the flame of a Bunsen burner. The magnesium appeared to evaporate observation indicates a chemical reaction took place.,teacher --- using --> equipment || teacher --- using --> special equipment || teacher --- is conducting --> investigation || magnesium --- evaporate --> observation || reaction --- took --> place || chemical reaction --- took --> place ||,NA,NA,NA
Mercury_412780,Propane (C_{3}H_{8}) is a gas at room temperature. Which statement best describes the physical characteristics of a sample of propane at room temperature?,It has a definite volume and takes the shape of its container.,Propane (C_{3}H_{8}) is a gas at room temperature. It has a definite volume and takes the shape of its container statement best describes the physical characteristics of a sample of propane at room temperature.,describes --- physical characteristics of --> sample || describes --- characteristics of --> sample || describes --- physical characteristics of --> sample of propane || describes --- characteristics of --> sample of propane || describes --- physical characteristics at --> room temperature || describes --- characteristics at --> room temperature || takes --- shape of --> its container statement best || takes --- shape of --> its container statement || it --- takes --> shape of its container statement best || it --- has --> volume || it --- takes --> shape || it --- has --> definite volume || it --- takes --> shape of its container statement ||,It has an indefinite volume and takes the shape of its container.,Propane (C_{3}H_{8}) is a gas at room temperature. It has an indefinite volume and takes the shape of its container statement best describes the physical characteristics of a sample of propane at room temperature.,describes --- physical characteristics of --> sample || describes --- characteristics of --> sample || describes --- physical characteristics of --> sample of propane || describes --- characteristics of --> sample of propane || describes --- physical characteristics at --> room temperature || describes --- characteristics at --> room temperature || takes --- shape of --> its container statement best || takes --- shape of --> its container statement || it --- has --> indefinite volume || it --- takes --> shape of its container statement best || it --- has --> volume || it --- takes --> shape || it --- takes --> shape of its container statement ||,"It has a definite volume, and its shape is independent of its container.","Propane (C_{3}H_{8}) is a gas at room temperature. It has a definite volume, and its shape is independent of its container statement best describes the physical characteristics of a sample of propane at room temperature.",its shape --- is --> independent || it --- has --> definite volume || it --- has --> volume ||,"It has an indefinite volume, and its shape is independent of its container.","Propane (C_{3}H_{8}) is a gas at room temperature. It has an indefinite volume, and its shape is independent of its container statement best describes the physical characteristics of a sample of propane at room temperature.",it --- has --> indefinite volume || it --- has --> volume || its shape --- is --> independent ||,NA,NA,NA
LEAP_2011_8_10434,"Dennis believes that Earth's crust is evenly thick everywhere around the globe. Charlie says that Dennis is wrong, but he does not know any facts to help him win the argument. Which fact would help Charlie?",Earth is somewhat flattened at the Poles due to its rotation.,"Dennis believes that Earth's crust is evenly thick everywhere around the globe. Charlie says that Dennis is wrong, but he does not know any facts to help him win the argument. Earth is somewhat flattened at the Poles due to its rotation fact would help Charlie.",earth --- has --> crust || earth --- is flattened at --> poles || earth --- is somewhat flattened at --> poles || earth --- is --> flattened || earth --- is --> somewhat flattened || him --- win --> argument || flattened --- would help --> charlie ||,"The continents are thick rock masses, unlike the ocean floors.","Dennis believes that Earth's crust is evenly thick everywhere around the globe. Charlie says that Dennis is wrong, but he does not know any facts to help him win the argument. The continents are thick rock masses, unlike the ocean floors fact would help Charlie.",earth --- has --> crust || him --- win --> argument || continents --- are --> thick rock masses || continents --- are --> rock masses || fact --- would help --> charlie ||,Earth has a solid spherical inner core that is mostly iron.,"Dennis believes that Earth's crust is evenly thick everywhere around the globe. Charlie says that Dennis is wrong, but he does not know any facts to help him win the argument. Earth has a solid spherical inner core that is mostly iron fact would help Charlie.",earth --- has --> crust || him --- win --> argument ||,Earth's plates are constantly moving at a very slow rate.,"Dennis believes that Earth's crust is evenly thick everywhere around the globe. Charlie says that Dennis is wrong, but he does not know any facts to help him win the argument. Earth's plates are constantly moving at a very slow rate fact would help Charlie.",earth --- has --> crust || earth --- has --> plates || him --- win --> argument || earth 's plates --- are constantly moving at --> slow rate fact || earth 's plates --- are moving at --> slow rate fact || earth 's plates --- are constantly moving at --> very slow rate fact || earth 's plates --- are moving at --> very slow rate fact || earth 's plates --- are constantly moving at --> rate fact || earth 's plates --- are moving at --> rate fact || earth 's plates are moving --- would help --> charlie ||,NA,NA,NA
Mercury_7200340,Rowing a boat forward requires a force that will overcome friction from water and wind. Which factor most helps overcome the forces working against the boat?,the length of the boat,Rowing a boat forward requires a force that will overcome friction from water and wind. The length of the boat factor most helps overcome the forces working against the boat.,,the height of sides of the boat,Rowing a boat forward requires a force that will overcome friction from water and wind. The height of sides of the boat factor most helps overcome the forces working against the boat.,,the weight of the rowers in the boat,Rowing a boat forward requires a force that will overcome friction from water and wind. The weight of the rowers in the boat factor most helps overcome the forces working against the boat.,weight --- is in --> boat factor ||,the number of people rowing in the boat,Rowing a boat forward requires a force that will overcome friction from water and wind. The number of people rowing in the boat factor most helps overcome the forces working against the boat.,rowing --- is in --> boat factor ||,NA,NA,NA
