Mercury_7056525,The movement of crustal plates is best described as a,trend toward increased crust movement over time.,The movement of crustal plates is best described as a trend toward increased crust movement over time.,movement --- is described as --> trend toward crust movement over time || movement --- is best described as --> trend toward crust movement over time || movement --- is described as --> trend toward increased crust movement over time || movement --- is best described as --> trend toward increased crust movement over time || movement --- is described as --> trend toward crust movement || movement --- is best described as --> trend toward crust movement || movement --- is described as --> trend || movement --- is best described as --> trend || movement --- is described as --> trend toward increased crust movement || movement --- is best described as --> trend toward increased crust movement || movement --- is --> best described || movement --- is --> described ||,series of events that happens quickly.,The movement of crustal plates is best described as a series of events that happens quickly.,movement --- is --> best described || movement --- is --> described ||,continuing long-term process.,The movement of crustal plates is best described as a continuing long-term process.,movement --- is described as --> continuing process || movement --- is best described as --> continuing process || movement --- is described as --> long-term process || movement --- is best described as --> long-term process || movement --- is described as --> continuing long-term process || movement --- is best described as --> continuing long-term process || movement --- is described as --> process || movement --- is best described as --> process || movement --- is --> best described || movement --- is --> described ||,process that has a predictable pattern.,The movement of crustal plates is best described as a process that has a predictable pattern.,movement --- is --> best described || movement --- is --> described ||,NA,NA,NA
Mercury_7085278,Some regions produce large amounts of geothermal energy. This energy production indicates that the crust in these regions,has large oil reserves.,Some regions produce large amounts of geothermal energy. This energy production indicates that the crust in these regions has large oil reserves.,regions --- produce --> large amounts of geothermal energy || regions --- produce --> amounts of energy || regions --- produce --> large amounts of energy || regions --- produce --> large amounts || regions --- produce --> amounts || regions --- produce --> amounts of geothermal energy || oil reserves --- crust in --> regions || crust --- has --> large oil reserves || crust --- is in --> regions || crust --- has --> oil reserves || large oil reserves --- crust in --> regions ||,reaches deep into Earth.,Some regions produce large amounts of geothermal energy. This energy production indicates that the crust in these regions reaches deep into earth.,regions --- produce --> large amounts of geothermal energy || regions --- produce --> amounts of energy || regions --- produce --> large amounts of energy || regions --- produce --> large amounts || regions --- produce --> amounts || regions --- produce --> amounts of geothermal energy || crust --- reaches into --> earth || crust --- reaches deep into --> earth || crust --- is in --> regions ||,is rich in precious metals.,Some regions produce large amounts of geothermal energy. This energy production indicates that the crust in these regions is rich in precious metals.,regions --- produce --> large amounts of geothermal energy || regions --- produce --> amounts of energy || regions --- produce --> large amounts of energy || regions --- produce --> large amounts || regions --- produce --> amounts || regions --- produce --> amounts of geothermal energy || crust --- is --> rich || crust --- is in --> regions || crust --- is rich in --> precious metals || crust --- is rich in --> metals ||,is heated by nearby magma.,Some regions produce large amounts of geothermal energy. This energy production indicates that the crust in these regions is heated by nearby magma.,regions --- produce --> large amounts of geothermal energy || regions --- produce --> amounts of energy || regions --- produce --> large amounts of energy || regions --- produce --> large amounts || regions --- produce --> amounts || regions --- produce --> amounts of geothermal energy || crust --- is --> heated || crust --- is heated by --> magma || crust --- is heated by --> nearby magma || crust --- is in --> regions ||,NA,NA,NA
AKDE&ED_2008_4_35,When and where would the number of daylight hours each day be greatest?,during the winter near the equator,During the winter near the equator and where would the number of daylight hours each day be greatest.,number --- be --> would day greatest || number --- be --> where would day greatest ||,during the summer near the equator,During the summer near the equator and where would the number of daylight hours each day be greatest.,number --- be --> would day greatest || number --- be --> where would day greatest ||,during the winter near the North Pole,During the winter near the North Pole and where would the number of daylight hours each day be greatest.,number --- be --> would day greatest || number --- be --> where would day greatest ||,during the summer near the North Pole,During the summer near the North Pole and where would the number of daylight hours each day be greatest.,number --- be --> would day greatest || number --- be --> where would day greatest ||,NA,NA,NA
MCAS_1999_8_16,Betsy wants to find out if the rainfall in her town contains pollutants. The best way for Betsy to gather this information would be to collect,one sample on one rainy day.,Betsy wants to find out if the rainfall in her town contains pollutants. The best way for Betsy to gather this information would be to collect one sample on one rainy day.,rainfall --- is in --> her town || rainfall --- contains --> pollutants || pollutants --- rainfall in --> her town ||,one sample a day on several rainy days.,Betsy wants to find out if the rainfall in her town contains pollutants. The best way for Betsy to gather this information would be to collect one sample a day on several rainy days.,rainfall --- is in --> her town || rainfall --- contains --> pollutants || pollutants --- rainfall in --> her town ||,several separate samples on one rainy day.,Betsy wants to find out if the rainfall in her town contains pollutants. The best way for Betsy to gather this information would be to collect several separate samples on one rainy day.,rainfall --- is in --> her town || rainfall --- contains --> pollutants || pollutants --- rainfall in --> her town ||,several separate samples on several rainy days.,Betsy wants to find out if the rainfall in her town contains pollutants. The best way for Betsy to gather this information would be to collect several separate samples on several rainy days.,rainfall --- is in --> her town || rainfall --- contains --> pollutants || pollutants --- rainfall in --> her town ||,NA,NA,NA
Mercury_SC_400063,Water evaporation on the surface of Earth most likely causes the formation of,glaciers.,Water evaporation on the surface of Earth most likely causes the formation of glaciers.,water evaporation --- causes --> formation of glaciers || water evaporation --- likely causes --> formation of glaciers || water evaporation --- most likely causes --> formation of glaciers || water evaporation --- causes --> formation || water evaporation --- likely causes --> formation || water evaporation --- most likely causes --> formation ||,mountains.,Water evaporation on the surface of Earth most likely causes the formation of mountains.,water evaporation --- causes --> formation of mountains || water evaporation --- likely causes --> formation of mountains || water evaporation --- most likely causes --> formation of mountains || water evaporation --- causes --> formation || water evaporation --- likely causes --> formation || water evaporation --- most likely causes --> formation ||,natural gas.,Water evaporation on the surface of Earth most likely causes the formation of natural gas.,water evaporation --- causes --> formation of natural gas || water evaporation --- likely causes --> formation of natural gas || water evaporation --- most likely causes --> formation of natural gas || water evaporation --- causes --> formation || water evaporation --- likely causes --> formation || water evaporation --- most likely causes --> formation || water evaporation --- causes --> formation of gas || water evaporation --- likely causes --> formation of gas || water evaporation --- most likely causes --> formation of gas ||,limestone.,Water evaporation on the surface of Earth most likely causes the formation of limestone.,water evaporation --- causes --> formation || water evaporation --- likely causes --> formation || water evaporation --- most likely causes --> formation || water evaporation --- causes --> formation of limestone || water evaporation --- likely causes --> formation of limestone || water evaporation --- most likely causes --> formation of limestone ||,NA,NA,NA
Mercury_SC_401666,Which question will best help a student determine the composition of an unknown substance?,Is the sample warm or cold?,Is the sample warm or cold? question will best help a student determine the composition of an unknown substance.,sample --- is --> warm || student --- composition of --> substance || student --- determine --> composition || student --- composition of --> unknown substance || student --- determine --> composition of unknown substance || student --- determine --> composition of substance ||,How valuable is the sample?,How valuable is the sample? question will best help a student determine the composition of an unknown substance.,student --- composition of --> substance || student --- determine --> composition || student --- composition of --> unknown substance || student --- determine --> composition of unknown substance || student --- determine --> composition of substance ||,Has the sample ever been melted?,Has the sample ever been melted? question will best help a student determine the composition of an unknown substance.,sample --- has --> has ever melted || sample --- has --> has melted || student --- composition of --> substance || student --- determine --> composition || student --- composition of --> unknown substance || student --- determine --> composition of unknown substance || student --- determine --> composition of substance ||,Does the sample conduct electricity?,Does the sample conduct electricity? question will best help a student determine the composition of an unknown substance.,student --- composition of --> substance || student --- determine --> composition || student --- composition of --> unknown substance || student --- determine --> composition of unknown substance || student --- determine --> composition of substance ||,NA,NA,NA
TIMSS_2011_8_pg31,A car tire runs over a can and crushes it completely. Which statement is true for the atoms of the structure of the can?,The atoms are broken.,A car tire runs over a can and crushes it completely. The atoms are broken statement is true for the atoms of the structure of the can.,car tire --- crushes --> it || car tire --- crushes completely --> it || car tire --- runs over --> can || statement --- is true for --> atoms of structure of can || statement --- is true for --> atoms of structure || statement --- is true for --> atoms || statement --- is --> true || atoms --- are --> broken ||,The atoms are flattened.,A car tire runs over a can and crushes it completely. The atoms are flattened statement is true for the atoms of the structure of the can.,car tire --- crushes --> it || car tire --- crushes completely --> it || car tire --- runs over --> can || statement --- is true for --> atoms of structure of can || statement --- is true for --> atoms of structure || statement --- is true for --> atoms || statement --- is --> true || atoms --- are --> flattened ||,The atoms remain the same.,A car tire runs over a can and crushes it completely. The atoms remain the same statement is true for the atoms of the structure of the can.,car tire --- crushes --> it || car tire --- crushes completely --> it || car tire --- runs over --> can || statement --- is true for --> atoms of structure of can || statement --- is true for --> atoms of structure || statement --- is true for --> atoms || statement --- is --> true || same statement --- is true for --> atoms || same statement --- is --> true || same statement --- is true for --> atoms of structure || same statement --- is true for --> atoms of structure of can ||,The atoms are changed into different atoms.,A car tire runs over a can and crushes it completely. The atoms are changed into different atoms statement is true for the atoms of the structure of the can.,car tire --- crushes --> it || car tire --- crushes completely --> it || car tire --- runs over --> can || atoms --- are --> changed || atoms --- are changed into --> atoms statement || atoms --- are changed into --> different atoms statement || changed --- is true for --> atoms || changed --- is true for --> atoms of structure of can || changed --- is --> true || changed --- is true for --> atoms of structure ||,NA,NA,NA
Mercury_412673,Which of the following properties of ethanol is a chemical property?,colorless,Colorless properties of ethanol is a chemical property.,properties --- is --> chemical property || ethanol --- colorless properties of is --> chemical property || ethanol --- properties of is --> chemical property || colorless properties --- is --> chemical property ||,flammable,Flammable properties of ethanol is a chemical property.,properties --- is --> chemical property || flammable properties --- is --> chemical property || ethanol --- flammable properties of is --> chemical property || ethanol --- properties of is --> chemical property ||,boils at 78°C,Boils at 78°C properties of ethanol is a chemical property.,,density of 0.79 g/cm^3,Density of 0.79 g/cm^3 properties of ethanol is a chemical property.,g/cm ^ 3 properties --- density of is --> chemical property || density --- is --> chemical property || 0.79 g/cm ^ 3 properties --- density of is --> chemical property ||,NA,NA,NA
Mercury_7130655,"Until recently, only a small part of the human DNA was known to have a specific function. The rest of the DNA was thought to be unimportant. New evidence now suggests that all DNA is needed in certain gene functions. Which statement best describes the significance of this new evidence?",It will make the study of DNA much simpler.,"Until recently, only a small part of the human DNA was known to have a specific function. The rest of the DNA was thought to be unimportant. New evidence now suggests that all DNA is needed in certain gene functions. It will make the study of DNA much simpler statement best describes the significance of this new evidence.",part --- was --> known || part --- was known until --> recently || part --- have --> specific function || part --- have --> function || small part --- was known until --> recently || small part --- was --> known || small part --- have --> specific function || small part --- have --> function || rest --- was --> thought || rest --- was thought --> unimportant || dna --- is --> needed || dna --- is needed in --> gene functions || dna --- is needed in --> certain gene functions || significance --- study of --> dna simpler statement || significance --- study of --> dna statement || significance --- study of --> dna much statement || significance --- study of --> dna much simpler statement || study --- best describes --> significance of new evidence || study --- describes --> significance of new evidence || study --- best describes --> significance || study --- describes --> significance || study --- best describes --> significance of evidence || study --- describes --> significance of evidence ||,It proves that DNA is less important than originally thought.,"Until recently, only a small part of the human DNA was known to have a specific function. The rest of the DNA was thought to be unimportant. New evidence now suggests that all DNA is needed in certain gene functions. It proves that DNA is less important than originally thought statement best describes the significance of this new evidence.",part --- was --> known || part --- was known until --> recently || part --- have --> specific function || part --- have --> function || small part --- was known until --> recently || small part --- was --> known || small part --- have --> specific function || small part --- have --> function || rest --- was --> thought || rest --- was thought --> unimportant || dna --- is --> needed || dna --- is needed in --> gene functions || dna --- is needed in --> certain gene functions || dna --- is important than --> thought statement || dna --- is less important than --> thought statement || dna --- is --> less important || dna --- is important than --> thought statement best || dna --- is less important than --> thought statement best || dna --- is important than --> statement best || dna --- is less important than --> statement best || dna --- is important than --> originally thought statement best || dna --- is less important than --> originally thought statement best || dna --- is important than --> statement || dna --- is less important than --> statement || dna --- is important than --> originally thought statement || dna --- is less important than --> originally thought statement || dna --- is --> important || it proves --- describes --> significance || it proves --- describes --> significance of new evidence || it proves --- describes --> significance of evidence ||,It provides evidence that scientific results should not be challenged.,"Until recently, only a small part of the human DNA was known to have a specific function. The rest of the DNA was thought to be unimportant. New evidence now suggests that all DNA is needed in certain gene functions. It provides evidence that scientific results should not be challenged statement best describes the significance of this new evidence.",part --- was --> known || part --- was known until --> recently || part --- have --> specific function || part --- have --> function || small part --- was known until --> recently || small part --- was --> known || small part --- have --> specific function || small part --- have --> function || rest --- was --> thought || rest --- was thought --> unimportant || dna --- is --> needed || dna --- is needed in --> gene functions || dna --- is needed in --> certain gene functions ||,It demonstrates that scientific knowledge is subject to change.,"Until recently, only a small part of the human DNA was known to have a specific function. The rest of the DNA was thought to be unimportant. New evidence now suggests that all DNA is needed in certain gene functions. It demonstrates that scientific knowledge is subject to change statement best describes the significance of this new evidence.",part --- was --> known || part --- was known until --> recently || part --- have --> specific function || part --- have --> function || small part --- was known until --> recently || small part --- was --> known || small part --- have --> specific function || small part --- have --> function || rest --- was --> thought || rest --- was thought --> unimportant || dna --- is --> needed || dna --- is needed in --> gene functions || dna --- is needed in --> certain gene functions || statement --- best describes --> significance || statement --- describes --> significance || statement --- significance of --> evidence || statement --- best describes --> significance of evidence || statement --- describes --> significance of evidence || statement --- significance of --> new evidence || statement --- best describes --> significance of new evidence || statement --- describes --> significance of new evidence || scientific knowledge --- is --> subject || knowledge --- is --> subject ||,NA,NA,NA
MCAS_2004_5_7,"Which of the following lists Earth, Jupiter,the Moon, and the Sun in order from largest to smallest?","Jupiter, Earth, Sun, Moon","Jupiter, Earth, Sun, Moon lists Earth, Jupiter,the Moon, and the Sun in order from largest to smallest.",sun --- is in --> order from largest to smallest ||,"Sun, Jupiter, Earth, Moon","Sun, Jupiter, Earth, Moon lists Earth, Jupiter,the Moon, and the Sun in order from largest to smallest.",sun --- is in --> order from largest to smallest ||,"Sun, Jupiter, Moon, Earth","Sun, Jupiter, Moon, Earth lists Earth, Jupiter,the Moon, and the Sun in order from largest to smallest.",sun --- is in --> order from largest to smallest ||,"Jupiter, Sun, Earth, Moon","Jupiter, Sun, Earth, Moon lists Earth, Jupiter,the Moon, and the Sun in order from largest to smallest.",sun --- is in --> order from largest to smallest ||,NA,NA,NA
Mercury_7187373,Some non-native plants can adapt to their environments more quickly than some native plants or crops can. Which adaptation would most likely decrease a plant's ability to survive?,having a large number of seeds,Some non-native plants can adapt to their environments more quickly than some native plants or crops can. Having a large number of seeds adaptation would most likely decrease a plant's ability to survive.,plants --- can adapt to --> their environments || plants --- can adapt more quickly to --> their environments || plants --- can adapt quickly to --> their environments || non-native plants --- can adapt to --> their environments || non-native plants --- can adapt more quickly to --> their environments || non-native plants --- can adapt quickly to --> their environments || having --- large number of --> seeds adaptation || having --- number of --> seeds adaptation || plant --- has --> ability survive ||,having a resistance to herbicides,Some non-native plants can adapt to their environments more quickly than some native plants or crops can. Having a resistance to herbicides adaptation would most likely decrease a plant's ability to survive.,plants --- can adapt to --> their environments || plants --- can adapt more quickly to --> their environments || plants --- can adapt quickly to --> their environments || non-native plants --- can adapt to --> their environments || non-native plants --- can adapt more quickly to --> their environments || non-native plants --- can adapt quickly to --> their environments || having --- resistance to --> herbicides adaptation || plant --- has --> ability survive ||,having roots that develop rapidly,Some non-native plants can adapt to their environments more quickly than some native plants or crops can. Having roots that develop rapidly adaptation would most likely decrease a plant's ability to survive.,plants --- can adapt to --> their environments || plants --- can adapt more quickly to --> their environments || plants --- can adapt quickly to --> their environments || non-native plants --- can adapt to --> their environments || non-native plants --- can adapt more quickly to --> their environments || non-native plants --- can adapt quickly to --> their environments || plant --- has --> ability survive ||,having leaves that form at a slow rate,Some non-native plants can adapt to their environments more quickly than some native plants or crops can. Having leaves that form at a slow rate adaptation would most likely decrease a plant's ability to survive.,plants --- can adapt to --> their environments || plants --- can adapt more quickly to --> their environments || plants --- can adapt quickly to --> their environments || non-native plants --- can adapt to --> their environments || non-native plants --- can adapt more quickly to --> their environments || non-native plants --- can adapt quickly to --> their environments || form --- most likely decrease --> plant 's ability survive || form --- likely decrease --> plant 's ability survive || plant --- has --> ability survive ||,NA,NA,NA
Mercury_SC_401361,What do the tinted lenses of sunglasses do to the UV rays of the Sun?,absorb,Absorb do the tinted lenses of sunglasses do to the UV rays of the Sun.,lenses --- do do to --> uv rays || lenses --- do do to --> uv rays of sun || tinted lenses --- do do to --> uv rays || tinted lenses --- do do to --> uv rays of sun ||,deflect,Deflect do the tinted lenses of sunglasses do to the UV rays of the Sun.,tinted lenses --- do to --> uv rays || tinted lenses --- do to --> uv rays of sun || lenses --- do to --> uv rays of sun || lenses --- do to --> uv rays ||,reflect,Reflect do the tinted lenses of sunglasses do to the UV rays of the Sun.,tinted lenses --- do to --> uv rays || tinted lenses --- do to --> uv rays of sun || lenses --- do to --> uv rays of sun || lenses --- do to --> uv rays ||,refract,Refract do the tinted lenses of sunglasses do to the UV rays of the Sun.,tinted lenses --- do to --> uv rays || tinted lenses --- do to --> uv rays of sun || lenses --- do to --> uv rays of sun || lenses --- do to --> uv rays ||,NA,NA,NA
