Mercury_7128555,"In a certain field, plants with blue flowers are pollinated by bees, while plants with white flowers are pollinated by moths. If the population of bees decreases, which will most likely occur?",The population of blue flowers will increase over time.,"In a certain field, plants with blue flowers are pollinated by bees, while plants with white flowers are pollinated by moths. If the population of bees decreases, the population of blue flowers will increase over time will most likely occur.",plants --- are pollinated by --> moths || plants --- are pollinated in --> certain field || plants --- are pollinated --> pollinated by moths || plants --- are pollinated by --> bees || plants --- are --> pollinated || plants --- are pollinated --> pollinated || plants --- are pollinated in --> field || plants --- are --> in certain field pollinated by bees || plants --- is with --> white flowers || plants --- are --> in field pollinated by bees || plants --- is with --> blue flowers || population --- will increase --> population decreases || population --- will increase --> population of bees decreases || population --- will increase over --> time ||,The population of white flowers will increase over time.,"In a certain field, plants with blue flowers are pollinated by bees, while plants with white flowers are pollinated by moths. If the population of bees decreases, the population of white flowers will increase over time will most likely occur.",plants --- are pollinated by --> moths || plants --- are pollinated in --> certain field || plants --- are pollinated --> pollinated by moths || plants --- are pollinated by --> bees || plants --- are --> pollinated || plants --- are pollinated --> pollinated || plants --- are pollinated in --> field || plants --- are --> in certain field pollinated by bees || plants --- is with --> white flowers || plants --- are --> in field pollinated by bees || plants --- is with --> blue flowers || population --- will increase --> population decreases || population --- will increase --> population of bees decreases || population --- will increase over --> time ||,The moths will start pollinating the blue flowers.,"In a certain field, plants with blue flowers are pollinated by bees, while plants with white flowers are pollinated by moths. If the population of bees decreases, the moths will start pollinating the blue flowers will most likely occur.",plants --- are pollinated by --> moths || plants --- are pollinated in --> certain field || plants --- are pollinated --> pollinated by moths || plants --- are pollinated by --> bees || plants --- are --> pollinated || plants --- are pollinated --> pollinated || plants --- are pollinated in --> field || plants --- are --> in certain field pollinated by bees || plants --- is with --> white flowers || plants --- are --> in field pollinated by bees || plants --- is with --> blue flowers || moths --- will start --> population decreases || moths --- pollinating --> flowers || moths --- pollinating --> blue flowers || moths --- will start --> population of bees decreases ||,The bees will start pollinating the white flowers.,"In a certain field, plants with blue flowers are pollinated by bees, while plants with white flowers are pollinated by moths. If the population of bees decreases, the bees will start pollinating the white flowers will most likely occur.",plants --- are pollinated by --> moths || plants --- are pollinated in --> certain field || plants --- are pollinated --> pollinated by moths || plants --- are pollinated by --> bees || plants --- are --> pollinated || plants --- are pollinated --> pollinated || plants --- are pollinated in --> field || plants --- are --> in certain field pollinated by bees || plants --- is with --> white flowers || plants --- are --> in field pollinated by bees || plants --- is with --> blue flowers || bees --- will start --> population decreases || bees --- will start --> population of bees decreases || bees --- pollinating --> white flowers || bees --- pollinating --> flowers ||,NA,NA,NA
Mercury_407517,"A certain atom has 20 electrons, 21 neutrons, and 20 protons. What is the atomic mass of the atom?",20,"A certain atom has 20 electrons, 21 neutrons, and 20 protons. 20 is the atomic mass of the atom.",atom --- has --> 21 neutrons || atom --- has --> 20 electrons || atom --- has --> 20 protons || certain atom --- has --> 20 electrons || certain atom --- has --> 21 neutrons || certain atom --- has --> 20 protons || 20 --- is --> atomic mass || 20 --- is --> mass || 20 --- is atomic mass of --> atom || 20 --- is mass of --> atom ||,21,"A certain atom has 20 electrons, 21 neutrons, and 20 protons. 21 is the atomic mass of the atom.",atom --- has --> 21 neutrons || atom --- has --> 20 electrons || atom --- has --> 20 protons || certain atom --- has --> 20 electrons || certain atom --- has --> 21 neutrons || certain atom --- has --> 20 protons || 21 --- is atomic mass of --> atom || 21 --- is mass of --> atom || 21 --- is --> atomic mass || 21 --- is --> mass ||,41,"A certain atom has 20 electrons, 21 neutrons, and 20 protons. 41 is the atomic mass of the atom.",atom --- has --> 21 neutrons || atom --- has --> 20 electrons || atom --- has --> 20 protons || certain atom --- has --> 20 electrons || certain atom --- has --> 21 neutrons || certain atom --- has --> 20 protons || 41 --- is --> atomic mass || 41 --- is --> mass || 41 --- is atomic mass of --> atom || 41 --- is mass of --> atom ||,61,"A certain atom has 20 electrons, 21 neutrons, and 20 protons. 61 is the atomic mass of the atom.",atom --- has --> 21 neutrons || atom --- has --> 20 electrons || atom --- has --> 20 protons || certain atom --- has --> 20 electrons || certain atom --- has --> 21 neutrons || certain atom --- has --> 20 protons || 61 --- is --> atomic mass || 61 --- is atomic mass of --> atom || 61 --- is mass of --> atom || 61 --- is --> mass ||,NA,NA,NA
Mercury_405950,All organisms process nutrients. Which sentence best describes how plants and animals process nutrients similarly?,Energy from sunlight produces nutrients.,All organisms process nutrients. Energy from sunlight produces nutrients sentence best describes how plants and animals process nutrients similarly.,plants --- process --> nutrients || plants --- process similarly --> nutrients || animals --- process --> nutrients || animals --- process similarly --> nutrients ||,Nutrients increase the strength of cell walls.,All organisms process nutrients. Nutrients increase the strength of cell walls sentence best describes how plants and animals process nutrients similarly.,plants --- process --> nutrients || plants --- process similarly --> nutrients || nutrients --- increase --> strength of cell walls sentence best || nutrients --- increase --> strength || nutrients --- strength of --> cell walls sentence best || nutrients --- strength of --> cell walls sentence || nutrients --- increase --> strength of cell walls sentence || animals --- process --> nutrients || animals --- process similarly --> nutrients ||,Cells break down nutrients into usable forms.,All organisms process nutrients. Cells break down nutrients into usable forms sentence best describes how plants and animals process nutrients similarly.,plants --- process --> nutrients || plants --- process similarly --> nutrients || animals --- process --> nutrients || animals --- process similarly --> nutrients || cells --- describes into --> forms sentence || cells --- best describes into --> forms sentence || cells --- describes into --> usable forms sentence || cells --- best describes into --> usable forms sentence || cells --- break down --> nutrients ||,Nutrients are broken down by the digestive system.,All organisms process nutrients. Nutrients are broken down by the digestive system sentence best describes how plants and animals process nutrients similarly.,nutrients --- are broken down by --> system sentence best describes || nutrients --- are broken down by --> digestive system sentence || nutrients --- are broken down by --> digestive system sentence describes || nutrients --- are broken down by --> system sentence || nutrients --- are broken down by --> system sentence describes || nutrients --- are broken down by --> digestive system sentence best describes || plants --- process --> nutrients || plants --- process similarly --> nutrients || animals --- process --> nutrients || animals --- process similarly --> nutrients ||,NA,NA,NA
MCAS_2004_9_5,The voltage is held constant in an electric circuit. What will happen to the current in this circuit if the resistance is doubled?,The current will be tripled.,The voltage is held constant in an electric circuit. The current will be tripled will happen to the current in this circuit if the resistance is doubled.,voltage --- is held in --> electric circuit || voltage --- is held in --> circuit || voltage --- is --> held || voltage --- is held --> constant || current --- will --> will tripled || resistance --- is --> doubled ||,The current will be doubled.,The voltage is held constant in an electric circuit. The current will be doubled will happen to the current in this circuit if the resistance is doubled.,voltage --- is held in --> electric circuit || voltage --- is held in --> circuit || voltage --- is --> held || voltage --- is held --> constant || current --- will --> will doubled || resistance --- is --> doubled ||,The current will be cut in half.,The voltage is held constant in an electric circuit. The current will be cut in half will happen to the current in this circuit if the resistance is doubled.,voltage --- is held in --> electric circuit || voltage --- is held in --> circuit || voltage --- is --> held || voltage --- is held --> constant || current --- will --> will cut || current --- will --> will cut in half || resistance --- is --> doubled ||,The current will stay the same.,The voltage is held constant in an electric circuit. The current will stay the same will happen to the current in this circuit if the resistance is doubled.,voltage --- is held in --> electric circuit || voltage --- is held in --> circuit || voltage --- is --> held || voltage --- is held --> constant || same --- happen to --> current in circuit || same --- happen to --> current || same --- happen --> doubled || resistance --- is --> doubled ||,NA,NA,NA
NCEOGA_2013_8_28,"If a body of water has high turbidity levels, what can most likely be concluded?",It has a low pH.,"If a body of water has high turbidity levels, it has a low ph can most likely be concluded.",ph --- be --> likely concluded || ph --- be --> most likely concluded || ph --- be --> concluded || low ph --- be --> most likely concluded || low ph --- be --> concluded || low ph --- be --> likely concluded || body --- has --> high turbidity levels || body --- has --> turbidity levels || high turbidity levels --- body of --> water || turbidity levels --- body of --> water ||,It is unsafe to drink.,"If a body of water has high turbidity levels, it is unsafe to drink can most likely be concluded.",body --- has --> high turbidity levels || body --- has --> turbidity levels || high turbidity levels --- body of --> water || turbidity levels --- body of --> water || it --- is --> unsafe ||,It is too hot to drink.,"If a body of water has high turbidity levels, it is too hot to drink can most likely be concluded.",body --- has --> high turbidity levels || body --- has --> turbidity levels || high turbidity levels --- body of --> water || turbidity levels --- body of --> water || it --- is --> too hot || it --- is --> hot ||,It contains a lot of chemicals.,"If a body of water has high turbidity levels, it contains a lot of chemicals can most likely be concluded.",body --- has --> high turbidity levels || body --- has --> turbidity levels || high turbidity levels --- body of --> water || turbidity levels --- body of --> water || chemicals --- be --> most likely concluded || chemicals --- be --> concluded || chemicals --- be --> likely concluded ||,NA,NA,NA
Mercury_SC_406451,A school replaced all of their light bulbs with a new type of light bulb. The new light bulbs use less energy. How will the new light bulbs most likely help the environment?,The amount of light pollution will decrease.,A school replaced all of their light bulbs with a new type of light bulb. The new light bulbs use less energy. The amount of light pollution will decrease will the new light bulbs most likely help the environment.,school --- replaced --> all light bulbs || school --- replaced --> all their light bulbs || school --- replaced --> all of light bulbs || school --- replaced --> all of their light bulbs || new light bulbs --- use --> less energy || new light bulbs --- use --> energy || new light bulbs --- most likely help --> environment || new light bulbs --- likely help --> environment || light bulbs --- use --> energy || light bulbs --- use --> less energy || light bulbs --- most likely help --> environment || light bulbs --- likely help --> environment ||,The air conditioner at the school will run less often.,A school replaced all of their light bulbs with a new type of light bulb. The new light bulbs use less energy. The air conditioner at the school will run less often will the new light bulbs most likely help the environment.,school --- replaced --> all light bulbs || school --- replaced --> all their light bulbs || school --- replaced --> all of light bulbs || school --- replaced --> all of their light bulbs || new light bulbs --- use --> less energy || new light bulbs --- use --> energy || new light bulbs --- most likely help --> environment || new light bulbs --- likely help --> environment || light bulbs --- use --> energy || light bulbs --- use --> less energy || light bulbs --- most likely help --> environment || light bulbs --- likely help --> environment ||,Fewer natural resources will be used to make electricity.,A school replaced all of their light bulbs with a new type of light bulb. The new light bulbs use less energy. Fewer natural resources will be used to make electricity will the new light bulbs most likely help the environment.,school --- replaced --> all light bulbs || school --- replaced --> all their light bulbs || school --- replaced --> all of light bulbs || school --- replaced --> all of their light bulbs || new light bulbs --- use --> less energy || new light bulbs --- use --> energy || new light bulbs --- will most likely help --> environment || new light bulbs --- will likely help --> environment || light bulbs --- use --> energy || light bulbs --- use --> less energy || light bulbs --- will most likely help --> environment || light bulbs --- will likely help --> environment || natural resources --- make --> electricity || natural resources --- will --> will used || fewer resources --- make --> electricity || fewer resources --- will --> will used || resources --- will --> will used || resources --- make --> electricity || fewer natural resources --- will --> will used || fewer natural resources --- make --> electricity ||,Money will be saved on the electricity bill for the school.,A school replaced all of their light bulbs with a new type of light bulb. The new light bulbs use less energy. Money will be saved on the electricity bill for the school will the new light bulbs most likely help the environment.,school --- replaced --> all light bulbs || school --- replaced --> all their light bulbs || school --- replaced --> all of light bulbs || school --- replaced --> all of their light bulbs || new light bulbs --- use --> less energy || new light bulbs --- use --> energy || new light bulbs --- most likely help --> environment || new light bulbs --- likely help --> environment || light bulbs --- use --> energy || light bulbs --- use --> less energy || light bulbs --- most likely help --> environment || light bulbs --- likely help --> environment || money --- will --> will saved on electricity bill || money --- will --> will saved on electricity bill for school || money --- will --> will saved ||,NA,NA,NA
Mercury_7109323,"For years, many astronomers thought that our solar system formed from a slowly condensing cloud of dust and gas. New evidence indicates that our solar system may have formed when short-lived, massive stars in a nebula exploded. What is most likely going to result from the new evidence?",The old hypothesis will become obsolete.,"For years, many astronomers thought that our solar system formed from a slowly condensing cloud of dust and gas. New evidence indicates that our solar system may have formed when short-lived, massive stars in a nebula exploded. The old hypothesis will become obsolete is most likely going to result from the new evidence.",astronomers --- thought for --> years || many astronomers --- thought for --> years || short-lived massive stars --- is in --> nebula || hypothesis --- will become --> obsolete || old hypothesis --- will become --> obsolete ||,The new hypothesis will be rejected due to conflict.,"For years, many astronomers thought that our solar system formed from a slowly condensing cloud of dust and gas. New evidence indicates that our solar system may have formed when short-lived, massive stars in a nebula exploded. The new hypothesis will be rejected due to conflict is most likely going to result from the new evidence.",astronomers --- thought for --> years || many astronomers --- thought for --> years || short-lived massive stars --- is in --> nebula || due --- is --> most likely || due --- is --> likely || due --- going --> result || due --- going --> result from evidence || due --- going --> result from new evidence || new hypothesis --- will --> will rejected || hypothesis --- will --> will rejected ||,The evidence for the old hypothesis will be disregarded.,"For years, many astronomers thought that our solar system formed from a slowly condensing cloud of dust and gas. New evidence indicates that our solar system may have formed when short-lived, massive stars in a nebula exploded. The evidence for the old hypothesis will be disregarded is most likely going to result from the new evidence.",astronomers --- thought for --> years || many astronomers --- thought for --> years || short-lived massive stars --- is in --> nebula || will disregarded --- going --> result || will disregarded --- going --> result from new evidence || will disregarded --- is --> most likely || will disregarded --- going --> result from evidence || will disregarded --- is --> likely || evidence --- will --> will disregarded ||,The evidence will be verified before the old hypothesis is revised.,"For years, many astronomers thought that our solar system formed from a slowly condensing cloud of dust and gas. New evidence indicates that our solar system may have formed when short-lived, massive stars in a nebula exploded. The evidence will be verified before the old hypothesis is revised is most likely going to result from the new evidence.",astronomers --- thought for --> years || many astronomers --- thought for --> years || short-lived massive stars --- is in --> nebula || old hypothesis --- is --> revised || will verified --- is --> likely || will verified --- going --> result from evidence || will verified --- going --> result from new evidence || will verified --- going --> result || will verified --- is --> most likely || evidence --- will --> will verified || hypothesis --- is --> revised ||,NA,NA,NA
Mercury_404132,Which of the following is a correctly written chemical equation that demonstrates the conservation of mass?,Mg + HCl -> H_{2} + MgCl_{2},Mg + HCl -> H_{2} + MgCl_{2} is a correctly written chemical equation that demonstrates the conservation of mass.,chemical equation --- demonstrates --> conservation of mass || chemical equation --- demonstrates --> conservation || chemical equation --- conservation of --> mass || equation --- demonstrates --> conservation || equation --- conservation of --> mass || equation --- demonstrates --> conservation of mass || written equation --- demonstrates --> conservation || written equation --- demonstrates --> conservation of mass || written equation --- conservation of --> mass || written chemical equation --- demonstrates --> conservation of mass || written chemical equation --- demonstrates --> conservation || written chemical equation --- conservation of --> mass || > --- is --> chemical || > --- is --> written ||,H_{2}O + CO_{2} -> H_{2}CO_{3},H_{2}O + CO_{2} -> H_{2}CO_{3} is a correctly written chemical equation that demonstrates the conservation of mass.,co _ 2 written equation --- demonstrates --> conservation || co _ 2 written equation --- demonstrates --> conservation of mass || co _ 2 written equation --- conservation of --> mass || co _ 2 equation --- demonstrates --> conservation of mass || co _ 2 equation --- demonstrates --> conservation || co _ 2 equation --- conservation of --> mass || co _ 2 written chemical equation --- conservation of --> mass || co _ 2 written chemical equation --- demonstrates --> conservation of mass || co _ 2 written chemical equation --- demonstrates --> conservation || co _ 2 chemical equation --- demonstrates --> conservation of mass || co _ 2 chemical equation --- conservation of --> mass || co _ 2 chemical equation --- demonstrates --> conservation || > --- is --> chemical || > --- is --> written ||,KClO_{3} -> KCl + O_{2},KClO_{3} -> KCl + O_{2} is a correctly written chemical equation that demonstrates the conservation of mass.,_ --- is --> chemical || _ --- is --> written || > --- is --> written || > --- is --> chemical ||,H_{2} + O_{2} -> H_{2}O,H_{2} + O_{2} -> H_{2}O is a correctly written chemical equation that demonstrates the conservation of mass.,chemical equation --- demonstrates --> conservation of mass || chemical equation --- demonstrates --> conservation || chemical equation --- conservation of --> mass || written chemical equation --- demonstrates --> conservation of mass || written chemical equation --- demonstrates --> conservation || written chemical equation --- conservation of --> mass || equation --- conservation of --> mass || equation --- demonstrates --> conservation || equation --- demonstrates --> conservation of mass || o --- is --> chemical || o --- is --> written || written equation --- conservation of --> mass || written equation --- demonstrates --> conservation || written equation --- demonstrates --> conservation of mass ||,NA,NA,NA
Mercury_7210210,Using solar panels to convert solar energy into electricity may help slow the depletion of which resource?,sunlight,Using solar panels to convert solar energy into electricity may help slow the depletion of sunlight resource.,,water,Using solar panels to convert solar energy into electricity may help slow the depletion of water resource.,,coal,Using solar panels to convert solar energy into electricity may help slow the depletion of coal resource.,,copper,Using solar panels to convert solar energy into electricity may help slow the depletion of copper resource.,,NA,NA,NA
Mercury_SC_408042,Jefferson's class was studying sunflowers. They learned that sunflowers are able to make their own food. Which parts of a sunflower collect most of the sunlight needed to make food?,flowers,Jefferson's class was studying sunflowers. They learned that sunflowers are able to make their own food. Flowers parts of a sunflower collect most of the sunlight needed to make food.,jefferson 's class --- was studying --> sunflowers || sunflowers --- make --> their food || sunflowers --- make --> their own food || sunflowers --- are --> able || jefferson --- has --> class || flowers parts --- collect --> most || flowers parts --- collect --> most of sunlight || flowers parts --- collect --> most of sunlight needed ||,leaves,Jefferson's class was studying sunflowers. They learned that sunflowers are able to make their own food. Leaves parts of a sunflower collect most of the sunlight needed to make food.,jefferson 's class --- was studying --> sunflowers || sunflowers --- make --> their food || sunflowers --- make --> their own food || sunflowers --- are --> able || jefferson --- has --> class || parts --- collect --> most || parts --- collect --> most of sunlight needed || parts --- collect --> most of sunlight || most --- parts of --> sunflower ||,seeds,Jefferson's class was studying sunflowers. They learned that sunflowers are able to make their own food. Seeds parts of a sunflower collect most of the sunlight needed to make food.,jefferson 's class --- was studying --> sunflowers || sunflowers --- make --> their food || sunflowers --- make --> their own food || sunflowers --- are --> able || jefferson --- has --> class || seeds parts --- collect --> most of sunlight needed || seeds parts --- collect --> most of sunlight || seeds parts --- collect --> most ||,roots,Jefferson's class was studying sunflowers. They learned that sunflowers are able to make their own food. Roots parts of a sunflower collect most of the sunlight needed to make food.,jefferson 's class --- was studying --> sunflowers || sunflowers --- make --> their food || sunflowers --- make --> their own food || sunflowers --- are --> able || jefferson --- has --> class || roots parts --- collect --> most of sunlight needed || roots parts --- collect --> most of sunlight || roots parts --- collect --> most ||,NA,NA,NA
