Mercury_415268,How are organisms classified as Eukarya different from organisms classified as Archaea and Bacteria?,They are all multicellular.,They are all multicellular are organisms classified as Eukarya different from organisms classified as Archaea and Bacteria.,,They all reproduce sexually.,They all reproduce sexually are organisms classified as Eukarya different from organisms classified as Archaea and Bacteria.,organisms --- classified as --> eukarya || organisms --- classified as --> eukarya different || organisms --- classified as --> eukarya different from organisms classified || organisms --- classified as --> eukarya different from organisms classified as archaea || organisms --- classified as --> eukarya different from organisms ||,They all produce their own food.,They all produce their own food are organisms classified as Eukarya different from organisms classified as Archaea and Bacteria.,their own food --- are --> organisms classified as eukarya || their own food --- are --> organisms || their own food --- are --> organisms classified || their own food --- are --> organisms classified as eukarya different from organisms || their own food --- are --> organisms classified as eukarya different || their own food --- are --> organisms classified as eukarya different from organisms classified as archaea || their own food --- are --> organisms classified as eukarya different from organisms classified || their food --- are --> organisms classified as eukarya different from organisms classified as archaea || their food --- are --> organisms classified || their food --- are --> organisms classified as eukarya different from organisms classified || their food --- are --> organisms classified as eukarya different from organisms || their food --- are --> organisms || their food --- are --> organisms classified as eukarya different || their food --- are --> organisms classified as eukarya ||,They all have membrane-bound nuclei.,They all have membrane-bound nuclei are organisms classified as Eukarya different from organisms classified as Archaea and Bacteria.,membrane-bound nuclei --- are --> organisms classified as eukarya different from organisms classified || membrane-bound nuclei --- are --> organisms classified as eukarya different from organisms classified as archaea || membrane-bound nuclei --- are --> organisms classified as eukarya different || membrane-bound nuclei --- are --> organisms classified || membrane-bound nuclei --- are --> organisms classified as eukarya || membrane-bound nuclei --- are --> organisms classified as eukarya different from organisms || membrane-bound nuclei --- are --> organisms || nuclei --- are --> organisms classified as eukarya different from organisms classified || nuclei --- are --> organisms || nuclei --- are --> organisms classified || nuclei --- are --> organisms classified as eukarya || nuclei --- are --> organisms classified as eukarya different || nuclei --- are --> organisms classified as eukarya different from organisms || nuclei --- are --> organisms classified as eukarya different from organisms classified as archaea ||,NA,NA,NA
Mercury_7017710,Sound waves and ocean waves are similar in that both,are longitudinal waves.,Sound waves and ocean waves are similar in that both are longitudinal waves.,ocean waves --- are --> similar || both --- are waves in --> that || both --- are longitudinal waves in --> that || both --- are --> longitudinal waves || both --- are --> waves || longitudinal waves --- is in --> that || waves --- are --> similar || sound waves --- are --> similar ||,have the same frequency.,Sound waves and ocean waves are similar in that both have the same frequency.,both --- have --> same frequency || both --- have --> frequency || both --- have frequency in --> that || ocean waves --- are --> similar || waves --- are --> similar || sound waves --- are --> similar ||,carry energy from one place to another.,Sound waves and ocean waves are similar in that both carry energy from one place to another.,ocean waves --- are --> similar || ocean waves --- are similar in --> that || waves --- are --> similar in that || waves --- are --> similar || waves --- are similar in --> that || sound waves --- are --> similar in that || sound waves --- are --> similar || sound waves --- are similar in --> that ||,carry a medium from one place to another.,Sound waves and ocean waves are similar in that both carry a medium from one place to another.,ocean waves --- are --> similar || ocean waves --- are similar in --> that || waves --- are --> similar in that || waves --- are --> similar || waves --- are similar in --> that || sound waves --- are --> similar in that || sound waves --- are --> similar || sound waves --- are similar in --> that ||,NA,NA,NA
Mercury_7210123,A student uses a bar graph to display the amount of rainfall per week over a 3-month period. Which other method of presentation is appropriate for the data?,a table,A student uses a bar graph to display the amount of rainfall per week over a 3-month period. A table other method of presentation is appropriate for the data.,student --- uses --> bar graph || student --- display amount over --> 3-month period || student --- display amount over --> period || student --- display amount per --> week || student --- display --> amount || student --- display --> amount of rainfall || method --- is --> appropriate || method --- is appropriate for --> data || other method --- is appropriate for --> data || other method --- is --> appropriate ||,a pie chart,A student uses a bar graph to display the amount of rainfall per week over a 3-month period. A pie chart other method of presentation is appropriate for the data.,student --- uses --> bar graph || student --- display amount over --> 3-month period || student --- display amount over --> period || student --- display amount per --> week || student --- display --> amount || student --- display --> amount of rainfall || method --- is --> appropriate || method --- is appropriate for --> data || other method --- is appropriate for --> data || other method --- is --> appropriate ||,a photograph,A student uses a bar graph to display the amount of rainfall per week over a 3-month period. A photograph other method of presentation is appropriate for the data.,student --- uses --> bar graph || student --- display amount over --> 3-month period || student --- display amount over --> period || student --- display amount per --> week || student --- display --> amount || student --- display --> amount of rainfall || photograph other method --- is --> appropriate || photograph other method --- is appropriate for --> data || photograph method --- is --> appropriate || photograph method --- is appropriate for --> data ||,a written paragraph,A student uses a bar graph to display the amount of rainfall per week over a 3-month period. A written paragraph other method of presentation is appropriate for the data.,student --- uses --> bar graph || student --- display amount over --> 3-month period || student --- display amount over --> period || student --- display amount per --> week || student --- display --> amount || student --- display --> amount of rainfall || other method --- is appropriate for --> data || other method --- is --> appropriate || method --- is --> appropriate || method --- is appropriate for --> data ||,NA,NA,NA
MCAS_2009_5_6519,Naomi has a pet dog. Which of the following characteristics did the dog most likely inherit from its parents?,its weight,Naomi has a pet dog. Its weight characteristics did the dog most likely inherit from its parents.,naomi --- has --> pet dog || its weight characteristics --- did --> dog ||,its favorite food,Naomi has a pet dog. Its favorite food characteristics did the dog most likely inherit from its parents.,naomi --- has --> pet dog || its favorite food characteristics --- did --> dog || its food characteristics --- did --> dog ||,the color of its fur,Naomi has a pet dog. The color of its fur characteristics did the dog most likely inherit from its parents.,naomi --- has --> pet dog || dog --- inherit from --> its parents || dog --- most likely inherit from --> its parents || dog --- likely inherit from --> its parents ||,the place where it lives,Naomi has a pet dog. The place where it lives characteristics did the dog most likely inherit from its parents.,naomi --- has --> pet dog || dog --- inherit from --> its parents || dog --- most likely inherit from --> its parents || dog --- likely inherit from --> its parents || it --- lives --> characteristics ||,NA,NA,NA
Mercury_401502,"Incandescent light bulb filaments are best preserved by filling the bulb with a low density, non-reactive gas. From which group of elements on the periodic table is this gas most likely selected?",1 (1A),"Incandescent light bulb filaments are best preserved by filling the bulb with a low density, non-reactive gas. From 1 (1a) group of elements on the periodic table is this gas most likely selected.",incandescent light bulb filaments --- filling --> bulb || incandescent light bulb filaments --- are --> preserved || incandescent light bulb filaments --- filling bulb with --> low density || incandescent light bulb filaments --- are --> best preserved || incandescent light bulb filaments --- filling bulb with --> gas || incandescent light bulb filaments --- filling bulb with --> density || incandescent light bulb filaments --- filling bulb with --> non-reactive gas || light bulb filaments --- are --> best preserved || light bulb filaments --- filling --> bulb || light bulb filaments --- filling bulb with --> density || light bulb filaments --- filling bulb with --> non-reactive gas || light bulb filaments --- filling bulb with --> low density || light bulb filaments --- filling bulb with --> gas || light bulb filaments --- are --> preserved || 1a group --- is --> gas selected || 1a group --- is gas from --> 1 || 1a group --- is --> from 1 gas selected || 1a group --- is --> gas likely selected || 1a group --- is --> gas || 1a group --- is --> gas most likely selected || 1a group --- is --> from 1 gas likely selected || 1a group --- is --> from 1 gas most likely selected || elements --- group of is --> gas likely selected || elements --- group of is --> gas || elements --- group of is --> from 1 gas || elements --- group of is --> from 1 gas likely selected || elements --- group of is --> gas selected || elements --- group of is --> from 1 gas selected || elements --- group of is --> from 1 gas most likely selected || elements --- group of is --> gas most likely selected ||,2 (2A),"Incandescent light bulb filaments are best preserved by filling the bulb with a low density, non-reactive gas. From 2 (2a) group of elements on the periodic table is this gas most likely selected.",incandescent light bulb filaments --- filling --> bulb || incandescent light bulb filaments --- are --> preserved || incandescent light bulb filaments --- filling bulb with --> low density || incandescent light bulb filaments --- are --> best preserved || incandescent light bulb filaments --- filling bulb with --> gas || incandescent light bulb filaments --- filling bulb with --> density || incandescent light bulb filaments --- filling bulb with --> non-reactive gas || light bulb filaments --- are --> best preserved || light bulb filaments --- filling --> bulb || light bulb filaments --- filling bulb with --> density || light bulb filaments --- filling bulb with --> non-reactive gas || light bulb filaments --- filling bulb with --> low density || light bulb filaments --- filling bulb with --> gas || light bulb filaments --- are --> preserved || elements --- group of is --> gas likely selected || elements --- group of is --> gas || elements --- group of is --> from 2 gas || elements --- group of is --> from 2 gas most likely selected || elements --- group of is --> gas selected || elements --- group of is --> from 2 gas likely selected || elements --- group of is --> from 2 gas selected || elements --- group of is --> gas most likely selected || 2a group --- is --> gas selected || 2a group --- is --> from 2 gas likely selected || 2a group --- is --> gas most likely selected || 2a group --- is --> from 2 gas selected || 2a group --- is --> from 2 gas most likely selected || 2a group --- is --> gas || 2a group --- is gas from --> 2 || 2a group --- is --> gas likely selected ||,17 (7A),"Incandescent light bulb filaments are best preserved by filling the bulb with a low density, non-reactive gas. From 17 (7a) group of elements on the periodic table is this gas most likely selected.",incandescent light bulb filaments --- filling --> bulb || incandescent light bulb filaments --- are --> preserved || incandescent light bulb filaments --- filling bulb with --> low density || incandescent light bulb filaments --- are --> best preserved || incandescent light bulb filaments --- filling bulb with --> gas || incandescent light bulb filaments --- filling bulb with --> density || incandescent light bulb filaments --- filling bulb with --> non-reactive gas || light bulb filaments --- are --> best preserved || light bulb filaments --- filling --> bulb || light bulb filaments --- filling bulb with --> density || light bulb filaments --- filling bulb with --> non-reactive gas || light bulb filaments --- filling bulb with --> low density || light bulb filaments --- filling bulb with --> gas || light bulb filaments --- are --> preserved || elements --- group of is --> from 17 gas || elements --- group of is --> gas || 7a group --- is --> gas || 7a group --- is gas from --> 17 ||,18 (8A),"Incandescent light bulb filaments are best preserved by filling the bulb with a low density, non-reactive gas. From 18 (8a) group of elements on the periodic table is this gas most likely selected.",incandescent light bulb filaments --- filling --> bulb || incandescent light bulb filaments --- are --> preserved || incandescent light bulb filaments --- filling bulb with --> low density || incandescent light bulb filaments --- are --> best preserved || incandescent light bulb filaments --- filling bulb with --> gas || incandescent light bulb filaments --- filling bulb with --> density || incandescent light bulb filaments --- filling bulb with --> non-reactive gas || light bulb filaments --- are --> best preserved || light bulb filaments --- filling --> bulb || light bulb filaments --- filling bulb with --> density || light bulb filaments --- filling bulb with --> non-reactive gas || light bulb filaments --- filling bulb with --> low density || light bulb filaments --- filling bulb with --> gas || light bulb filaments --- are --> preserved || elements --- group of is --> gas || elements --- group of is --> from 18 gas || 8a group --- is gas from --> 18 || 8a group --- is --> gas ||,NA,NA,NA
Mercury_7109498,Sequoia trees in the Sierra Nevada in California are tall giants. Some of them are more than 3000 years old. Which statement best illustrates how forest brush fires have benefited these trees?,They set up a secondary succession event.,Sequoia trees in the Sierra Nevada in California are tall giants. Some of them are more than 3000 years old. They set up a secondary succession event statement best illustrates how forest brush fires have benefited these trees.,sequoia trees --- is in --> sierra nevada || sequoia trees --- are --> giants || sequoia trees --- are --> tall giants || sierra nevada --- is in --> california || forest brush fires --- benefited --> trees ||,They eliminate some competition for nutrients.,Sequoia trees in the Sierra Nevada in California are tall giants. Some of them are more than 3000 years old. They eliminate some competition for nutrients statement best illustrates how forest brush fires have benefited these trees.,sequoia trees --- is in --> sierra nevada || sequoia trees --- are --> giants || sequoia trees --- are --> tall giants || sierra nevada --- is in --> california || forest brush fires --- benefited --> trees ||,They allow larger trees to act as pioneer species.,Sequoia trees in the Sierra Nevada in California are tall giants. Some of them are more than 3000 years old. They allow larger trees to act as pioneer species statement best illustrates how forest brush fires have benefited these trees.,sequoia trees --- is in --> sierra nevada || sequoia trees --- are --> giants || sequoia trees --- are --> tall giants || sierra nevada --- is in --> california || they --- allow --> larger trees || they --- allow --> act || they --- allow --> trees || forest brush fires --- benefited --> trees ||,"They stimulate growth in smaller, shade-tolerant trees.","Sequoia trees in the Sierra Nevada in California are tall giants. Some of them are more than 3000 years old. They stimulate growth in smaller, shade-tolerant trees statement best illustrates how forest brush fires have benefited these trees.",sequoia trees --- is in --> sierra nevada || sequoia trees --- are --> giants || sequoia trees --- are --> tall giants || sierra nevada --- is in --> california || growth --- is in --> smaller shade-tolerant trees statement || forest brush fires --- benefited --> trees ||,NA,NA,NA
VASoL_2008_5_10,Which of these objects is opaque?,A brick wall,A brick wall of these objects is opaque.,brick wall --- is --> opaque ||,Eyeglass lenses,Eyeglass lenses of these objects is opaque.,eyeglass lenses --- is --> opaque ||,Liquid water,Liquid water of these objects is opaque.,water --- is --> opaque || liquid water --- is --> opaque ||,Stained glass windows,Stained glass windows of these objects is opaque.,stained glass windows --- is --> opaque || glass windows --- is --> opaque ||,NA,NA,NA
MCAS_2006_9_4,"There are two types of modern whales: toothed whales and baleen whales. Baleen whales filter plankton from the water using baleen, plates made of fibrous proteins that grow from the roof of their mouths. The embryos of baleen whales have teeth in their upper jaws. As the embryos develop, the teeth are replaced with baleen. Which of the following conclusions is best supported by this information?",Primitive whales had teeth as adults.,"There are two types of modern whales: toothed whales and baleen whales. Baleen whales filter plankton from the water using baleen, plates made of fibrous proteins that grow from the roof of their mouths. The embryos of baleen whales have teeth in their upper jaws. As the embryos develop, the teeth are replaced with baleen. Primitive whales had teeth as adults conclusions is best supported by this information.",water --- from plankton is --> plates made of fibrous proteins || whales filter plankton --- using --> baleen || baleen whales filter plankton --- using --> baleen || embryos --- have teeth in --> their jaws || embryos --- have --> teeth || embryos --- have teeth in --> their upper jaws || teeth --- are replaced with --> baleen || teeth --- are --> replaced || teeth --- are replaced --> embryos develop || whales --- had teeth --> best supported || whales --- had teeth --> supported || whales --- had teeth --> best supported by information || whales --- had --> teeth || whales --- had teeth --> supported by information || adults conclusions --- is --> best supported || adults conclusions --- is supported by --> information || adults conclusions --- is best supported by --> information || adults conclusions --- is --> supported || primitive whales --- had teeth --> supported by information || primitive whales --- had teeth --> best supported || primitive whales --- had teeth --> best supported by information || primitive whales --- had --> teeth || primitive whales --- had teeth --> supported ||,Toothed whales descended from baleen whales.,"There are two types of modern whales: toothed whales and baleen whales. Baleen whales filter plankton from the water using baleen, plates made of fibrous proteins that grow from the roof of their mouths. The embryos of baleen whales have teeth in their upper jaws. As the embryos develop, the teeth are replaced with baleen. Toothed whales descended from baleen whales conclusions is best supported by this information.",water --- from plankton is --> plates made of fibrous proteins || whales filter plankton --- using --> baleen || baleen whales filter plankton --- using --> baleen || embryos --- have teeth in --> their jaws || embryos --- have --> teeth || embryos --- have teeth in --> their upper jaws || teeth --- are replaced with --> baleen || teeth --- are --> replaced || teeth --- are replaced --> embryos develop || toothed whales descended --- is supported by --> information || toothed whales descended --- is best supported by --> information || toothed whales descended --- is --> best supported || toothed whales descended --- is --> supported || whales descended --- is --> best supported || whales descended --- is supported by --> information || whales descended --- is best supported by --> information || whales descended --- is --> supported || toothed whales --- descended from --> whales conclusions || toothed whales --- descended from --> baleen whales conclusions || whales --- descended from --> baleen whales conclusions || whales --- descended from --> whales conclusions ||,Baleen whales are evolving into toothed whales.,"There are two types of modern whales: toothed whales and baleen whales. Baleen whales filter plankton from the water using baleen, plates made of fibrous proteins that grow from the roof of their mouths. The embryos of baleen whales have teeth in their upper jaws. As the embryos develop, the teeth are replaced with baleen. Baleen whales are evolving into toothed whales conclusions is best supported by this information.",water --- from plankton is --> plates made of fibrous proteins || whales filter plankton --- using --> baleen || baleen whales filter plankton --- using --> baleen || embryos --- have teeth in --> their jaws || embryos --- have --> teeth || embryos --- have teeth in --> their upper jaws || teeth --- are replaced with --> baleen || teeth --- are --> replaced || teeth --- are replaced --> embryos develop || baleen whales are evolving --- is supported by --> information || baleen whales are evolving --- is best supported by --> information || baleen whales are evolving --- is --> supported || baleen whales are evolving --- is --> best supported || whales are evolving --- is --> best supported || whales are evolving --- is supported by --> information || whales are evolving --- is best supported by --> information || whales are evolving --- is --> supported ||,Descendants of modern baleen whales will have both teeth and baleen as adults.,"There are two types of modern whales: toothed whales and baleen whales. Baleen whales filter plankton from the water using baleen, plates made of fibrous proteins that grow from the roof of their mouths. The embryos of baleen whales have teeth in their upper jaws. As the embryos develop, the teeth are replaced with baleen. Descendants of modern baleen whales will have both teeth and baleen as adults conclusions is best supported by this information.",water --- from plankton is --> plates made of fibrous proteins || whales filter plankton --- using --> baleen || baleen whales filter plankton --- using --> baleen || embryos --- have teeth in --> their jaws || embryos --- have --> teeth || embryos --- have teeth in --> their upper jaws || teeth --- are replaced with --> baleen || teeth --- are --> replaced || teeth --- are replaced --> embryos develop || descendants --- will have teeth --> supported by information || descendants --- will have baleen --> supported by information || descendants --- will have teeth --> supported || descendants --- will have baleen --> supported || descendants --- will have --> teeth || descendants --- will have teeth --> best supported || descendants --- will have baleen --> best supported || descendants --- will have teeth --> best supported by information || descendants --- will have baleen --> best supported by information || descendants --- will have --> baleen || adults conclusions --- is --> best supported || adults conclusions --- is supported by --> information || adults conclusions --- is best supported by --> information || adults conclusions --- is --> supported ||,NA,NA,NA
Mercury_402341,"In what order are the Sun, Moon, and Earth during a total lunar eclipse?",Earth-Moon-Sun,"In earth-moon-sun order are the Sun, Moon, and Earth during a total lunar eclipse.",earth --- are in --> earth-moon-sun order || earth --- are in --> order || sun --- are in --> earth-moon-sun order || sun --- are in --> order || moon --- are in --> order || moon --- are in --> earth-moon-sun order ||,Earth-Sun-Moon,"In earth-sun-moon order are the Sun, Moon, and Earth during a total lunar eclipse.",moon --- are in --> earth-sun-moon order || moon --- are in --> order || earth --- are in --> order || earth --- are in --> earth-sun-moon order || sun --- are in --> order || sun --- are in --> earth-sun-moon order ||,Moon-Sun-Earth,"In moon-sun-earth order are the Sun, Moon, and Earth during a total lunar eclipse.",sun --- are in --> moon-sun-earth order || sun --- are in --> order || earth --- are in --> moon-sun-earth order || earth --- are in --> order || moon --- are in --> order || moon --- are in --> moon-sun-earth order ||,Moon-Earth-Sun,"In moon-earth-sun order are the Sun, Moon, and Earth during a total lunar eclipse.",moon --- are in --> moon-earth-sun order || moon --- are in --> order || earth --- are in --> order || earth --- are in --> moon-earth-sun order || sun --- are in --> order || sun --- are in --> moon-earth-sun order ||,NA,NA,NA
