Mercury_7198468,"Wolves, which are top predators, were eliminated from Yellowstone National Park in the 1930s. In 1995, wolves were reintroduced into Yellowstone. During the period in which wolves were absent from Yellowstone, which most likely occurred?",an increase in competition for food resources among small prey,"Wolves, which are top predators, were eliminated from Yellowstone National Park in the 1930s. In 1995, wolves were reintroduced into Yellowstone. During the period in an increase in competition for food resources among small prey wolves were absent from Yellowstone, which most likely occurred.",wolves --- were --> in 1995 reintroduced into yellowstone || wolves --- were reintroduced into --> yellowstone || wolves --- were reintroduced in --> 1995 || wolves --- were --> reintroduced || period --- is in --> increase || increase --- is in --> competition for food resources among small prey wolves || absent --- were during --> period in increase in competition for food resources among prey wolves || absent --- were during --> period || absent --- were during --> period in increase in competition || absent --- were during --> period in increase in competition for food resources among small prey wolves || absent --- were during --> period in increase in competition for food resources || absent --- were during --> period in increase ||,a greater opportunity for primary producers to flourish,"Wolves, which are top predators, were eliminated from Yellowstone National Park in the 1930s. In 1995, wolves were reintroduced into Yellowstone. During the period in a greater opportunity for primary producers to flourish wolves were absent from Yellowstone, which most likely occurred.",wolves --- were --> in 1995 reintroduced into yellowstone || wolves --- were reintroduced into --> yellowstone || wolves --- were reintroduced in --> 1995 || wolves --- were --> reintroduced || absent --- were during --> period in opportunity producers flourish || absent --- were during --> period || absent --- were during --> period in opportunity primary producers flourish || absent --- were during --> period in greater opportunity producers flourish || absent --- were during --> period in greater opportunity primary producers flourish || period --- is in --> greater opportunity primary producers flourish ||,an increase in the population of tertiary consumers,"Wolves, which are top predators, were eliminated from Yellowstone National Park in the 1930s. In 1995, wolves were reintroduced into Yellowstone. During the period in an increase in the population of tertiary consumers wolves were absent from Yellowstone, which most likely occurred.",wolves --- were --> in 1995 reintroduced into yellowstone || wolves --- were reintroduced into --> yellowstone || wolves --- were reintroduced in --> 1995 || wolves --- were --> reintroduced || increase --- is in --> population of tertiary consumers wolves || absent --- were during --> period in increase in population of tertiary consumers wolves || absent --- were during --> period || absent --- were during --> period in increase in population || absent --- were during --> period in increase || absent --- were during --> period in increase in population of consumers wolves || period --- is in --> increase ||,a greater balance of predator-prey relationships,"Wolves, which are top predators, were eliminated from Yellowstone National Park in the 1930s. In 1995, wolves were reintroduced into Yellowstone. During the period in a greater balance of predator-prey relationships wolves were absent from Yellowstone, which most likely occurred.",wolves --- were --> in 1995 reintroduced into yellowstone || wolves --- were reintroduced into --> yellowstone || wolves --- were reintroduced in --> 1995 || wolves --- were --> reintroduced || period --- is in --> greater balance of predator-prey relationships wolves || absent --- were during --> period in balance of relationships wolves || absent --- were during --> period in greater balance of predator-prey relationships wolves || absent --- were during --> period in balance of predator-prey relationships wolves || absent --- were during --> period || absent --- were during --> period in greater balance || absent --- were during --> period in balance || absent --- were during --> period in greater balance of relationships wolves ||,NA,NA,NA
MEA_2014_5_11,Balsam fir trees in Maine have similar needle length. Why do the trees have similar needle length?,because of the amount of sunlight they receive,Balsam fir trees in Maine have similar needle length. Because of the amount of sunlight they receive do the trees have similar needle length.,balsam fir trees --- have --> needle length || balsam fir trees --- is in --> maine || balsam fir trees --- have --> similar needle length || trees --- have --> needle length || trees --- have --> similar needle length || they --- receive because of --> amount of sunlight || they --- receive because of --> amount ||,because of their closeness to the ocean,Balsam fir trees in Maine have similar needle length. Because of their closeness to the ocean do the trees have similar needle length.,balsam fir trees --- have --> needle length || balsam fir trees --- is in --> maine || balsam fir trees --- have --> similar needle length || trees --- do have --> similar needle length || trees --- do have needle length because of --> their closeness to ocean || trees --- do have needle length because of --> their closeness || trees --- do have --> needle length ||,because of the inherited information inside the seeds,Balsam fir trees in Maine have similar needle length. Because of the inherited information inside the seeds do the trees have similar needle length.,balsam fir trees --- have --> needle length || balsam fir trees --- is in --> maine || balsam fir trees --- have --> similar needle length || trees --- do have needle length because of --> information inside seeds || trees --- do have --> similar needle length || trees --- do have needle length because of --> inherited information inside seeds || trees --- do have needle length because of --> inherited information || trees --- do have needle length because of --> information || trees --- do have --> needle length ||,because of the type of insects that eat the needles,Balsam fir trees in Maine have similar needle length. Because of the type of insects that eat the needles do the trees have similar needle length.,balsam fir trees --- have --> needle length || balsam fir trees --- is in --> maine || balsam fir trees --- have --> similar needle length || trees --- do have --> similar needle length || trees --- do have --> needle length ||,NA,NA,NA
Mercury_410602,An airplane travels at a constant speed of 800 kilometers per hour (km/h). Approximately how long will it take the airplane to travel 200 kilometers?,15 minutes,An airplane travels at a constant speed of 800 kilometers per hour (km/h). Approximately 15 minutes long will it take the airplane to travel 200 kilometers.,airplane --- travels at --> speed of 800 kilometers per hour || airplane --- travels at --> constant speed of 800 kilometers per hour || airplane --- travels at --> speed || airplane --- travels at --> constant speed of 800 kilometers || airplane --- travels at --> constant speed || airplane --- travels at --> speed of 800 kilometers || minutes --- will take --> airplane || minutes --- long will take --> airplane || it --- travel --> 200 kilometers ||,25 minutes,An airplane travels at a constant speed of 800 kilometers per hour (km/h). Approximately 25 minutes long will it take the airplane to travel 200 kilometers.,airplane --- travels at --> speed of 800 kilometers per hour || airplane --- travels at --> constant speed of 800 kilometers per hour || airplane --- travels at --> speed || airplane --- travels at --> constant speed of 800 kilometers || airplane --- travels at --> constant speed || airplane --- travels at --> speed of 800 kilometers || minutes --- will take --> airplane || minutes --- long will take --> airplane || it --- travel --> 200 kilometers ||,2 hours,An airplane travels at a constant speed of 800 kilometers per hour (km/h). Approximately 2 hours long will it take the airplane to travel 200 kilometers.,airplane --- travels at --> speed of 800 kilometers per hour || airplane --- travels at --> constant speed of 800 kilometers per hour || airplane --- travels at --> speed || airplane --- travels at --> constant speed of 800 kilometers || airplane --- travels at --> constant speed || airplane --- travels at --> speed of 800 kilometers || hours --- will take --> airplane || hours --- long will take --> airplane || it --- travel --> 200 kilometers ||,4 hours,An airplane travels at a constant speed of 800 kilometers per hour (km/h). Approximately 4 hours long will it take the airplane to travel 200 kilometers.,airplane --- travels at --> speed of 800 kilometers per hour || airplane --- travels at --> constant speed of 800 kilometers per hour || airplane --- travels at --> speed || airplane --- travels at --> constant speed of 800 kilometers || airplane --- travels at --> constant speed || airplane --- travels at --> speed of 800 kilometers || hours --- will take --> airplane || hours --- long will take --> airplane || it --- travel --> 200 kilometers ||,NA,NA,NA
Mercury_7108868,"Certain lakes in the northeastern part of the United States have had decreases in pH levels, causing the deaths of many fish. What is the most likely reason for this change in pH levels?",nuclear power plants,"Certain lakes in the northeastern part of the United States have had decreases in pH levels, causing the deaths of many fish. Nuclear power plants is the most likely reason for this change in pH levels.",certain lakes --- causing --> deaths of fish || certain lakes --- have had --> decreases || certain lakes --- causing --> deaths of many fish || certain lakes --- have had --> decreases in ph levels || certain lakes --- is in --> northeastern part of united states || decreases --- is in --> ph levels || lakes --- causing --> deaths of fish || lakes --- have had --> decreases in ph levels || lakes --- causing --> deaths of many fish || lakes --- have had --> decreases || change --- is in --> ph levels || nuclear power plants --- is likely reason for --> change || nuclear power plants --- is most likely reason for --> change || nuclear power plants --- is --> likely reason || nuclear power plants --- is likely reason for --> change in ph levels || nuclear power plants --- is most likely reason for --> change in ph levels || nuclear power plants --- is --> most likely reason || power plants --- is --> likely reason || power plants --- is likely reason for --> change in ph levels || power plants --- is most likely reason for --> change in ph levels || power plants --- is likely reason for --> change || power plants --- is most likely reason for --> change || power plants --- is --> most likely reason ||,hydroelectric power plants,"Certain lakes in the northeastern part of the United States have had decreases in pH levels, causing the deaths of many fish. Hydroelectric power plants is the most likely reason for this change in pH levels.",certain lakes --- causing --> deaths of fish || certain lakes --- have had --> decreases || certain lakes --- causing --> deaths of many fish || certain lakes --- have had --> decreases in ph levels || certain lakes --- is in --> northeastern part of united states || decreases --- is in --> ph levels || lakes --- causing --> deaths of fish || lakes --- have had --> decreases in ph levels || lakes --- causing --> deaths of many fish || lakes --- have had --> decreases || change --- is in --> ph levels || hydroelectric power plants --- is --> likely reason || hydroelectric power plants --- is --> most likely reason || hydroelectric power plants --- is likely reason for --> change in ph levels || hydroelectric power plants --- is most likely reason for --> change in ph levels || hydroelectric power plants --- is likely reason for --> change || hydroelectric power plants --- is most likely reason for --> change || power plants --- is --> likely reason || power plants --- is likely reason for --> change in ph levels || power plants --- is most likely reason for --> change in ph levels || power plants --- is likely reason for --> change || power plants --- is most likely reason for --> change || power plants --- is --> most likely reason ||,coal-burning factories,"Certain lakes in the northeastern part of the United States have had decreases in pH levels, causing the deaths of many fish. Coal-burning factories is the most likely reason for this change in pH levels.",certain lakes --- causing --> deaths of fish || certain lakes --- have had --> decreases || certain lakes --- causing --> deaths of many fish || certain lakes --- have had --> decreases in ph levels || certain lakes --- is in --> northeastern part of united states || decreases --- is in --> ph levels || lakes --- causing --> deaths of fish || lakes --- have had --> decreases in ph levels || lakes --- causing --> deaths of many fish || lakes --- have had --> decreases || change --- is in --> ph levels || factories --- is likely reason for --> change || factories --- is most likely reason for --> change || factories --- is --> likely reason || factories --- is likely reason for --> change in ph levels || factories --- is most likely reason for --> change in ph levels || factories --- is --> most likely reason || coal-burning factories --- is --> likely reason || coal-burning factories --- is likely reason for --> change in ph levels || coal-burning factories --- is most likely reason for --> change in ph levels || coal-burning factories --- is likely reason for --> change || coal-burning factories --- is most likely reason for --> change || coal-burning factories --- is --> most likely reason ||,noncommercial farms,"Certain lakes in the northeastern part of the United States have had decreases in pH levels, causing the deaths of many fish. Noncommercial farms is the most likely reason for this change in pH levels.",certain lakes --- causing --> deaths of fish || certain lakes --- have had --> decreases || certain lakes --- causing --> deaths of many fish || certain lakes --- have had --> decreases in ph levels || certain lakes --- is in --> northeastern part of united states || decreases --- is in --> ph levels || lakes --- causing --> deaths of fish || lakes --- have had --> decreases in ph levels || lakes --- causing --> deaths of many fish || lakes --- have had --> decreases || change --- is in --> ph levels || noncommercial farms --- is --> likely reason || noncommercial farms --- is likely reason for --> change || noncommercial farms --- is most likely reason for --> change || noncommercial farms --- is likely reason for --> change in ph levels || noncommercial farms --- is most likely reason for --> change in ph levels || noncommercial farms --- is --> most likely reason || farms --- is --> most likely reason || farms --- is likely reason for --> change || farms --- is most likely reason for --> change || farms --- is --> likely reason || farms --- is likely reason for --> change in ph levels || farms --- is most likely reason for --> change in ph levels ||,NA,NA,NA
Mercury_7033828,Energy companies often produce electricity from a variety of sources. Using which resource would improve air quality the most?,oil,Energy companies often produce electricity from a variety of sources. Using oil resource would improve air quality the most.,energy companies --- often produce --> electricity || energy companies --- produce --> electricity || air quality --- using --> oil resource ||,gas,Energy companies often produce electricity from a variety of sources. Using gas resource would improve air quality the most.,energy companies --- often produce --> electricity || energy companies --- produce --> electricity || air quality --- using --> gas resource ||,coal,Energy companies often produce electricity from a variety of sources. Using coal resource would improve air quality the most.,energy companies --- often produce --> electricity || energy companies --- produce --> electricity || air quality --- using --> coal resource ||,wind,Energy companies often produce electricity from a variety of sources. Using wind resource would improve air quality the most.,energy companies --- often produce --> electricity || energy companies --- produce --> electricity || air quality --- using --> wind resource ||,NA,NA,NA
TIMSS_2007_4_pg19,Some people have straight hair and some have curly hair. What decides whether a person will be born with curly hair or straight hair?,the type of hair their parents have,Some people have straight hair and some have curly hair. The type of hair their parents have decides whether a person will be born with curly hair or straight hair.,people --- have --> straight hair || people --- have --> hair || some --- have --> curly hair || some --- have --> hair || person --- be --> born || person --- be born with --> hair || person --- be born with --> curly hair ||,the type of hair their brothers and sisters have,Some people have straight hair and some have curly hair. The type of hair their brothers and sisters have decides whether a person will be born with curly hair or straight hair.,people --- have --> straight hair || people --- have --> hair || some --- have --> curly hair || some --- have --> hair || person --- be --> born || person --- be born with --> hair || person --- be born with --> curly hair ||,their hair color,Some people have straight hair and some have curly hair. Their hair color decides whether a person will be born with curly hair or straight hair.,people --- have --> straight hair || people --- have --> hair || some --- have --> curly hair || some --- have --> hair || person --- be --> born || person --- be born with --> hair || person --- be born with --> curly hair ||,their skin color,Some people have straight hair and some have curly hair. Their skin color decides whether a person will be born with curly hair or straight hair.,people --- have --> straight hair || people --- have --> hair || some --- have --> curly hair || some --- have --> hair || person --- be --> born || person --- be born with --> hair || person --- be born with --> curly hair ||,NA,NA,NA
Mercury_400828,"If an ion has three more electrons than protons, it has a",mass of +3.,"If an ion has three more electrons than protons, it has a mass of +3.",it --- has --> mass || it --- has --> mass of +3 || ion --- has --> three more electrons than protons || ion --- has --> three electrons than protons ||,mass of -3.,"If an ion has three more electrons than protons, it has a mass of -3.",it --- has --> mass || it --- has --> mass of -3 || ion --- has --> three more electrons than protons || ion --- has --> three electrons than protons ||,charge of +3.,"If an ion has three more electrons than protons, it has a charge of +3.",it --- has --> charge || it --- has --> charge of +3 || ion --- has --> three more electrons than protons || ion --- has --> three electrons than protons ||,charge of -3.,"If an ion has three more electrons than protons, it has a charge of -3.",it --- has --> charge || it --- has --> charge of -3 || ion --- has --> three more electrons than protons || ion --- has --> three electrons than protons ||,NA,NA,NA
VASoL_2008_3_16,Which of these is MOST likely a behavior of tame animals that is different from wild animals?,Moving to a warmer climate in winter,Moving to a warmer climate in winter of these is MOST likely a behavior of tame animals that is different from wild animals.,moving --- is --> behavior || moving --- is --> likely behavior || moving --- is --> most likely behavior || warmer climate --- is in --> winter of these ||,Eating out of the hands of humans,Eating out of the hands of humans of these is MOST likely a behavior of tame animals that is different from wild animals.,eating --- is --> most likely behavior || eating --- is --> behavior || eating --- is --> likely behavior ||,Hunting for their own food,Hunting for their own food of these is MOST likely a behavior of tame animals that is different from wild animals.,hunting --- is --> behavior || hunting --- is --> likely behavior || hunting --- is --> most likely behavior ||,Staying away from people,Staying away from people of these is MOST likely a behavior of tame animals that is different from wild animals.,staying --- is --> behavior || staying --- is --> most likely behavior || staying --- is --> likely behavior ||,NA,NA,NA
LEAP__5_10315,What happens when the temperature of water changes from 10° Celsius to -10° Celsius?,The water changes from a solid into a gas.,The water changes from a solid into a gas happens when the temperature of water changes from 10° Celsius to -10° Celsius.,,The water changes from a liquid into a gas.,The water changes from a liquid into a gas happens when the temperature of water changes from 10° Celsius to -10° Celsius.,,The water changes from a liquid into a solid.,The water changes from a liquid into a solid happens when the temperature of water changes from 10° Celsius to -10° Celsius.,,The water changes from a solid into a liquid.,The water changes from a solid into a liquid happens when the temperature of water changes from 10° Celsius to -10° Celsius.,,NA,NA,NA
Mercury_SC_415471,What advantage do some plants have over animals in a drought?,Plants can use underground water.,Plants can use underground water advantage do some plants have over animals in a drought.,plants --- do have over --> animals || plants --- can use --> water advantage || plants --- can use --> underground water advantage || plants --- do have in --> drought ||,Plants can live without water.,Plants can live without water advantage do some plants have over animals in a drought.,plants --- do have over --> animals || plants --- can live without --> water advantage || plants --- do have in --> drought ||,Plants release oxygen.,Plants release oxygen advantage do some plants have over animals in a drought.,plants --- do have over --> animals || plants --- release --> oxygen advantage || plants --- do have in --> drought ||,Plants cannot move.,Plants cannot move advantage do some plants have over animals in a drought.,,NA,NA,NA
Mercury_7247065,Which of these is not an adverse result from a tornado?,Fallen trees create a risk of fire.,Fallen trees create a risk of fire of these is not an adverse result from a tornado.,trees --- risk of --> fire of these || trees --- create --> risk of fire of these || trees --- create --> risk || trees --- risk of --> fire || trees --- create --> risk of fire || fallen trees --- risk of --> fire || fallen trees --- risk of --> fire of these || fallen trees --- create --> risk of fire of these || fallen trees --- create --> risk || fallen trees --- create --> risk of fire ||,Animal habitats undergo significant loss.,Animal habitats undergo significant loss of these is not an adverse result from a tornado.,animal habitats --- undergo --> loss || animal habitats --- loss of --> these || animal habitats --- significant loss of --> these || animal habitats --- undergo --> significant loss of these || animal habitats --- undergo --> loss of these || animal habitats --- undergo --> significant loss ||,A storm surge wipes out sea turtle nests.,A storm surge wipes out sea turtle nests of these is not an adverse result from a tornado.,storm surge --- wipes out --> sea turtle nests || storm surge --- wipes out --> sea turtle nests of these ||,Debris creates additional habitats for mosquitoes.,Debris creates additional habitats for mosquitoes of these is not an adverse result from a tornado.,habitats --- is --> adverse ||,NA,NA,NA
