Mercury_7163818,"When a speeding meteor enters Earth's atmosphere, it slows down and becomes very hot due to friction. Which factor most influences the amount of friction that a meteor encounters when it enters the atmosphere?",the weather,"When a speeding meteor enters Earth's atmosphere, it slows down and becomes very hot due to friction. The weather factor most influences the amount of friction that a meteor encounters when it enters the atmosphere.",speeding meteor --- enters --> earth 's atmosphere || it --- becomes --> very hot || it --- becomes --> very hot due || it --- becomes --> hot due to friction || it --- becomes --> hot || it --- becomes --> very hot due to friction || it --- becomes --> hot due || earth --- has --> atmosphere || weather factor --- most influences --> amount of friction || weather factor --- influences --> amount of friction || weather factor --- most influences --> amount || weather factor --- influences --> amount ||,magnetism,"When a speeding meteor enters Earth's atmosphere, it slows down and becomes very hot due to friction. Magnetism factor most influences the amount of friction that a meteor encounters when it enters the atmosphere.",speeding meteor --- enters --> earth 's atmosphere || it --- becomes --> very hot || it --- becomes --> very hot due || it --- becomes --> hot due to friction || it --- becomes --> hot || it --- becomes --> very hot due to friction || it --- becomes --> hot due || earth --- has --> atmosphere || magnetism factor --- most influences --> amount || magnetism factor --- influences --> amount || magnetism factor --- most influences --> amount of friction || magnetism factor --- influences --> amount of friction ||,solar energy,"When a speeding meteor enters Earth's atmosphere, it slows down and becomes very hot due to friction. Solar energy factor most influences the amount of friction that a meteor encounters when it enters the atmosphere.",speeding meteor --- enters --> earth 's atmosphere || it --- becomes --> very hot || it --- becomes --> very hot due || it --- becomes --> hot due to friction || it --- becomes --> hot || it --- becomes --> very hot due to friction || it --- becomes --> hot due || earth --- has --> atmosphere || energy factor --- most influences --> amount || energy factor --- influences --> amount || energy factor --- most influences --> amount of friction || energy factor --- influences --> amount of friction || solar energy factor --- most influences --> amount || solar energy factor --- influences --> amount || solar energy factor --- most influences --> amount of friction || solar energy factor --- influences --> amount of friction ||,air density,"When a speeding meteor enters Earth's atmosphere, it slows down and becomes very hot due to friction. Air density factor most influences the amount of friction that a meteor encounters when it enters the atmosphere.",speeding meteor --- enters --> earth 's atmosphere || it --- becomes --> very hot || it --- becomes --> very hot due || it --- becomes --> hot due to friction || it --- becomes --> hot || it --- becomes --> very hot due to friction || it --- becomes --> hot due || earth --- has --> atmosphere || air density factor --- most influences --> amount of friction || air density factor --- influences --> amount of friction || air density factor --- most influences --> amount || air density factor --- influences --> amount ||,NA,NA,NA
Mercury_402502,"According to the periodic table, argon is found in what column?",1 (1A),"According to the periodic table, argon is found in 1 (1a) column.",argon --- is found according to --> table || argon --- is found according to --> periodic table || argon --- is found in --> 1 1a column || argon --- is --> found ||,2 (2A),"According to the periodic table, argon is found in 2 (2a) column.",argon --- is found according to --> table || argon --- is found in --> 2 2a column || argon --- is found according to --> periodic table || argon --- is --> found ||,16 (6A),"According to the periodic table, argon is found in 16 (6a) column.",argon --- is found in --> 16 6a column || argon --- is found according to --> table || argon --- is found according to --> periodic table || argon --- is --> found ||,18 (8A),"According to the periodic table, argon is found in 18 (8a) column.",argon --- is found according to --> table || argon --- is found in --> 18 8a column || argon --- is found according to --> periodic table || argon --- is --> found ||,NA,NA,NA
Mercury_7130778,Organisms interact in the flow of energy in an ecosystem. Carnivores and omnivores are classified as consumers. Which two organisms are also classified as consumers?,bacteria and fungi,Organisms interact in the flow of energy in an ecosystem. Carnivores and omnivores are classified as consumers. Bacteria and fungi two organisms are also classified as consumers.,organisms --- interact in --> ecosystem || organisms --- interact in --> flow || organisms --- interact in --> flow of energy || omnivores --- are --> classified || omnivores --- are --> classified as consumers ||,fungi and scavengers,Organisms interact in the flow of energy in an ecosystem. Carnivores and omnivores are classified as consumers. Fungi and scavengers two organisms are also classified as consumers.,organisms --- interact in --> ecosystem || organisms --- interact in --> flow || organisms --- interact in --> flow of energy || omnivores --- are --> classified || omnivores --- are --> classified as consumers ||,parasites and herbivores,Organisms interact in the flow of energy in an ecosystem. Carnivores and omnivores are classified as consumers. Parasites and herbivores two organisms are also classified as consumers.,organisms --- interact in --> ecosystem || organisms --- interact in --> flow || organisms --- interact in --> flow of energy || omnivores --- are --> classified || omnivores --- are --> classified as consumers ||,decomposers and herbivores,Organisms interact in the flow of energy in an ecosystem. Carnivores and omnivores are classified as consumers. Decomposers and herbivores two organisms are also classified as consumers.,organisms --- interact in --> ecosystem || organisms --- interact in --> flow || organisms --- interact in --> flow of energy || omnivores --- are --> classified || omnivores --- are --> classified as consumers ||,NA,NA,NA
MEA_2010_8_18,Which statement best explains why wood is considered a renewable energy resource and coal is not?,Wood is easier to find than coal.,Wood is easier to find than coal statement best explains why wood is considered a renewable energy resource and coal is not.,wood --- is easier than --> coal statement best explains || wood --- is easier than --> coal statement explains || wood --- is easier than --> coal statement || wood --- is --> why considered || wood --- is --> considered || wood --- is --> easier ||,Wood has less carbon per unit mass than coal.,Wood has less carbon per unit mass than coal statement best explains why wood is considered a renewable energy resource and coal is not.,wood --- has --> carbon per unit mass than coal statement || wood --- has --> carbon than coal statement explains || wood --- has --> less carbon per unit mass than coal statement explains || wood --- has --> less carbon per unit mass || wood --- is --> why considered || wood --- is --> considered || wood --- has --> less carbon than coal statement best explains || wood --- has --> less carbon than coal statement || wood --- has --> carbon per unit mass || wood --- has --> carbon than coal statement best explains || wood --- has --> carbon than coal statement || wood --- has --> less carbon per unit mass than coal statement || wood --- has --> carbon per unit mass than coal statement explains || wood --- has --> carbon per unit mass than coal statement best explains || wood --- has --> carbon || wood --- has --> less carbon || wood --- has --> less carbon than coal statement explains || wood --- has --> less carbon per unit mass than coal statement best explains ||,Wood grows more quickly than coal forms.,Wood grows more quickly than coal forms statement best explains why wood is considered a renewable energy resource and coal is not.,,Wood has less stored energy per unit mass than coal.,Wood has less stored energy per unit mass than coal statement best explains why wood is considered a renewable energy resource and coal is not.,wood --- is --> why considered || wood --- is --> considered ||,NA,NA,NA
Mercury_7211033,Which of these is a product of photosynthesis and a requirement for cellular respiration?,carbon dioxide,Carbon dioxide of these is a product of photosynthesis and a requirement for cellular respiration.,carbon dioxide --- is product of --> photosynthesis || carbon dioxide --- is --> product ||,glucose,Glucose of these is a product of photosynthesis and a requirement for cellular respiration.,glucose --- is product of --> photosynthesis || glucose --- is --> product ||,water,Water of these is a product of photosynthesis and a requirement for cellular respiration.,water --- is --> product || water --- is product of --> photosynthesis ||,sunlight,Sunlight of these is a product of photosynthesis and a requirement for cellular respiration.,sunlight --- is --> product || sunlight --- is product of --> photosynthesis ||,NA,NA,NA
NYSEDREGENTS_2008_8_17,What advantage does a species that reproduces sexually have over a species that reproduces asexually?,There is greater variation among the offspring.,There is greater variation among the offspring advantage does a species that reproduces sexually have over a species that reproduces asexually.,,The offspring are identical to the parents.,The offspring are identical to the parents advantage does a species that reproduces sexually have over a species that reproduces asexually.,offspring --- are --> identical || offspring --- are identical to --> parents advantage ||,Only one parent is necessary for reproduction.,Only one parent is necessary for reproduction advantage does a species that reproduces sexually have over a species that reproduces asexually.,parent --- is necessary for --> reproduction advantage || parent --- is --> necessary || one parent --- is --> necessary || one parent --- is necessary for --> reproduction advantage ||,No sex cells are needed for reproduction.,No sex cells are needed for reproduction advantage does a species that reproduces sexually have over a species that reproduces asexually.,,NA,NA,NA
NAEP_2005_8_S11+1,Household appliances convert electricity into one or more different forms of energy. An electric fan can best be described as converting electricity into,heat energy only,Household appliances convert electricity into one or more different forms of energy. An electric fan can best be described as converting electricity into heat energy only,household appliances --- convert --> electricity || fan --- can --> can best described || fan --- converting electricity only into --> heat energy || fan --- converting electricity into --> heat energy || fan --- converting only --> electricity || fan --- converting --> electricity || fan --- can --> can described || electric fan --- converting only --> electricity || electric fan --- converting --> electricity || electric fan --- can --> can best described || electric fan --- converting electricity only into --> heat energy || electric fan --- converting electricity into --> heat energy || electric fan --- can --> can described ||,heat energy and sound energy only,Household appliances convert electricity into one or more different forms of energy. An electric fan can best be described as converting electricity into heat energy and sound energy only,household appliances --- convert --> electricity || fan --- can --> can best described || fan --- can --> can best described only || fan --- converting --> electricity || fan --- converting electricity into --> heat energy || fan --- can --> can described || fan --- can --> can described only || electric fan --- converting --> electricity || electric fan --- can --> can best described || electric fan --- converting electricity into --> heat energy || electric fan --- can --> can described only || electric fan --- can --> can described || electric fan --- can --> can best described only ||,"heat energy, sound energy, and mechanical energy only","Household appliances convert electricity into one or more different forms of energy. An electric fan can best be described as converting electricity into heat energy, sound energy, and mechanical energy only",household appliances --- convert --> electricity || fan --- can --> can best described || fan --- can --> can best described only || fan --- converting --> electricity || fan --- converting electricity into --> heat energy || fan --- can --> can described || fan --- can --> can described only || electric fan --- converting --> electricity || electric fan --- can --> can best described || electric fan --- converting electricity into --> heat energy || electric fan --- can --> can described only || electric fan --- can --> can described || electric fan --- can --> can best described only ||,"heat energy, sound energy, mechanical energy, and chemical energy","Household appliances convert electricity into one or more different forms of energy. An electric fan can best be described as converting electricity into heat energy, sound energy, mechanical energy, and chemical energy",household appliances --- convert --> electricity || fan --- can --> can best described || fan --- converting --> electricity || fan --- converting electricity into --> heat energy || fan --- can --> can described || electric fan --- converting electricity into --> heat energy || electric fan --- converting --> electricity || electric fan --- can --> can best described || electric fan --- can --> can described ||,NA,NA,NA
Mercury_412774,"A student is using a straw to blow bubbles into a calcium hydroxide solution. The carbon dioxide in the student's breath is reacting with the water to form an acid, which begins to neutralize the basic solution. Which of the following best describes the initial change in pH of the solution?",increase in pH toward a pH of 7,"A student is using a straw to blow bubbles into a calcium hydroxide solution. The carbon dioxide in the student's breath is reacting with the water to form an acid, which begins to neutralize the basic solution. Increase in pH toward a pH of 7 best describes the initial change in pH of the solution.",,increase in pH away from a pH of 7,"A student is using a straw to blow bubbles into a calcium hydroxide solution. The carbon dioxide in the student's breath is reacting with the water to form an acid, which begins to neutralize the basic solution. Increase in pH away from a pH of 7 best describes the initial change in pH of the solution.",student --- in --> breath || carbon dioxide --- is in --> student 's breath || carbon dioxide --- is reacting with --> water || increase --- describes --> initial change in ph || increase --- describes --> initial change in ph of solution || increase --- is in --> ph || increase --- describes --> change in ph of solution || increase --- describes --> change || increase --- describes --> change in ph || increase --- describes --> initial change || initial change --- is in --> ph of solution ||,decrease in pH toward a pH of 7,"A student is using a straw to blow bubbles into a calcium hydroxide solution. The carbon dioxide in the student's breath is reacting with the water to form an acid, which begins to neutralize the basic solution. Decrease in pH toward a pH of 7 best describes the initial change in pH of the solution.",student --- in --> breath || carbon dioxide --- is in --> student 's breath || carbon dioxide --- is reacting with --> water || decrease --- describes --> initial change in ph || decrease --- describes --> change in ph of solution || decrease --- is in --> ph || decrease --- describes --> initial change in ph of solution || decrease --- describes --> change in ph || decrease --- describes --> initial change || decrease --- describes --> change || initial change --- is in --> ph of solution ||,decrease in pH away from a pH of 7,"A student is using a straw to blow bubbles into a calcium hydroxide solution. The carbon dioxide in the student's breath is reacting with the water to form an acid, which begins to neutralize the basic solution. Decrease in pH away from a pH of 7 best describes the initial change in pH of the solution.",student --- in --> breath || carbon dioxide --- is in --> student 's breath || carbon dioxide --- is reacting with --> water || decrease --- describes --> initial change in ph || decrease --- describes --> change in ph of solution || decrease --- is in --> ph || decrease --- describes --> initial change in ph of solution || decrease --- describes --> change in ph || decrease --- describes --> initial change || decrease --- describes --> change || initial change --- is in --> ph of solution ||,NA,NA,NA
MEA_2013_5_12,A student dissolves 20 g of table salt in a glass of water. Which statement explains what happens to the weight of the table salt after it dissolves?,The weight decreases because the pieces of table salt are much smaller.,A student dissolves 20 g of table salt in a glass of water. The weight decreases because the pieces of table salt are much smaller statement explains what happens to the weight of the table salt after it dissolves.,student --- dissolves --> 20 g || student --- dissolves --> 20 g of table salt || explains --- pieces of --> table salt ||,The weight increases because the table salt is spread throughout the water.,A student dissolves 20 g of table salt in a glass of water. The weight increases because the table salt is spread throughout the water statement explains what happens to the weight of the table salt after it dissolves.,student --- dissolves --> 20 g || student --- dissolves --> 20 g of table salt || table salt --- is --> spread || table salt --- is spread throughout --> water statement || table salt --- is spread throughout --> water statement explains || weight --- increases --> spread || weight --- increases --> spread throughout water statement explains || weight --- increases --> spread throughout water statement ||,The weight stays the same because the amount of table salt does not change.,A student dissolves 20 g of table salt in a glass of water. The weight stays the same because the amount of table salt does not change statement explains what happens to the weight of the table salt after it dissolves.,student --- dissolves --> 20 g || student --- dissolves --> 20 g of table salt ||,The weight is zero because the table salt has become a liquid.,A student dissolves 20 g of table salt in a glass of water. The weight is zero because the table salt has become a liquid statement explains what happens to the weight of the table salt after it dissolves.,student --- dissolves --> 20 g || student --- dissolves --> 20 g of table salt || weight --- is zero --> table salt has become ||,NA,NA,NA
Mercury_7098473,Which example best illustrates an action-at-a-distance force?,lifting a box,Lifting a box example best illustrates an action-at-a-distance force.,box example --- best illustrates --> action-at-a-distance force || box example --- illustrates --> action-at-a-distance force || box example --- best illustrates --> force || box example --- illustrates --> force ||,an apple falling,An apple falling example best illustrates an action-at-a-distance force.,example --- best illustrates --> action-at-a-distance force || example --- illustrates --> action-at-a-distance force || example --- best illustrates --> force || example --- illustrates --> force || falling example --- best illustrates --> force || falling example --- illustrates --> force || falling example --- best illustrates --> action-at-a-distance force || falling example --- illustrates --> action-at-a-distance force ||,pulling a nail out of wood,Pulling a nail out of wood example best illustrates an action-at-a-distance force.,force --- pulling --> nail || action-at-a-distance force --- pulling --> nail ||,a car moving along a flat surface,A car moving along a flat surface example best illustrates an action-at-a-distance force.,,NA,NA,NA
