AIMS_2009_4_4,Television provides some benefits. What is one way that television has helped people?,Television manufacturing uses many toxic chemicals.,Television provides some benefits. Television manufacturing uses many toxic chemicals is one way that television has helped people.,television --- provides --> benefits || television manufacturing --- uses --> toxic chemicals || television manufacturing --- uses --> many toxic chemicals ||,The ads on television show many popular toys that kids want.,Television provides some benefits. The ads on television show many popular toys that kids want is one way that television has helped people.,television --- provides --> benefits || television --- helped --> people ||,Television provides information about current weather conditions.,Television provides some benefits. Television provides information about current weather conditions is one way that television has helped people.,television --- provides --> benefits || television --- provides --> information about weather conditions || television --- information about --> current weather conditions || television --- provides --> information || television --- information about --> weather conditions || television --- provides --> information about current weather conditions ||,The electricity used to run televisions is one use of natural resources.,Television provides some benefits. The electricity used to run televisions is one use of natural resources is one way that television has helped people.,television --- provides --> benefits || electricity --- is --> one use || electricity --- is --> one use of resources || electricity --- is --> one use of natural resources || one use --- is --> one way ||,NA,NA,NA
NCEOGA_2013_8_18,What do transitional fossils best support?,the Theory of Biological Evolution,The Theory of Biological Evolution do transitional fossils best support.,theory --- do best --> fossils || theory --- do --> fossils || theory --- do best --> transitional fossils || theory --- do --> transitional fossils ||,the Law of Superposition,The Law of Superposition do transitional fossils best support.,law --- do --> fossils || law --- do --> transitional fossils ||,the Theory of Geological Evolution,The Theory of Geological Evolution do transitional fossils best support.,theory --- do best --> fossils || theory --- do --> fossils || theory --- do best --> transitional fossils || theory --- do --> transitional fossils ||,the Theory of Continental Drift,The Theory of Continental Drift do transitional fossils best support.,theory --- do best --> fossils || theory --- do --> fossils || theory --- do best --> transitional fossils || theory --- do --> transitional fossils ||,NA,NA,NA
Mercury_400884,"Based on its position in the Periodic Table of the Elements, how many valence electrons does phosphorus (atomic number 15) have?",3,"Based on its position in the Periodic Table of the Elements, 3 many valence electrons does phosphorus (atomic number 15) have.",many valence electrons --- does based on --> its position in table || many valence electrons --- does based on --> its position in table of elements || many valence electrons --- does based on --> its position in periodic table of elements || many valence electrons --- does based on --> its position || many valence electrons --- does based on --> its position in periodic table || 3 many valence electrons --- does based on --> its position in periodic table of elements || 3 many valence electrons --- does based on --> its position in table || 3 many valence electrons --- does based on --> its position || 3 many valence electrons --- does based on --> its position in table of elements || 3 many valence electrons --- does based on --> its position in periodic table || its position --- is in --> periodic table of elements ||,5,"Based on its position in the Periodic Table of the Elements, 5 many valence electrons does phosphorus (atomic number 15) have.",many valence electrons --- does based on --> its position in table || many valence electrons --- does based on --> its position in table of elements || many valence electrons --- does based on --> its position in periodic table of elements || many valence electrons --- does based on --> its position || many valence electrons --- does based on --> its position in periodic table || 5 many valence electrons --- does based on --> its position in table of elements || 5 many valence electrons --- does based on --> its position || 5 many valence electrons --- does based on --> its position in table || 5 many valence electrons --- does based on --> its position in periodic table || 5 many valence electrons --- does based on --> its position in periodic table of elements || its position --- is in --> periodic table of elements ||,8,"Based on its position in the Periodic Table of the Elements, 8 many valence electrons does phosphorus (atomic number 15) have.",many valence electrons --- does based on --> its position in table || many valence electrons --- does based on --> its position in table of elements || many valence electrons --- does based on --> its position in periodic table of elements || many valence electrons --- does based on --> its position || many valence electrons --- does based on --> its position in periodic table || its position --- is in --> periodic table of elements || 8 many valence electrons --- does based on --> its position in table || 8 many valence electrons --- does based on --> its position in table of elements || 8 many valence electrons --- does based on --> its position in periodic table || 8 many valence electrons --- does based on --> its position || 8 many valence electrons --- does based on --> its position in periodic table of elements ||,15,"Based on its position in the Periodic Table of the Elements, 15 many valence electrons does phosphorus (atomic number 15) have.",many valence electrons --- does based on --> its position in table || many valence electrons --- does based on --> its position in table of elements || many valence electrons --- does based on --> its position in periodic table of elements || many valence electrons --- does based on --> its position || many valence electrons --- does based on --> its position in periodic table || its position --- is in --> periodic table of elements || 15 many valence electrons --- does based on --> its position in periodic table || 15 many valence electrons --- does based on --> its position in periodic table of elements || 15 many valence electrons --- does based on --> its position in table of elements || 15 many valence electrons --- does based on --> its position || 15 many valence electrons --- does based on --> its position in table ||,NA,NA,NA
Mercury_7219678,Desalination removes salt from water. Removing salt from water can be risky because the process is expensive and slow. Sometimes the technology does not work. A beach community's surface and ground water was decreasing. The community decided to construct a large-scale plant to remove salt from the bay water. The plan to construct a salt-removing plant was accepted because the community,needed increased resources.,Desalination removes salt from water. Removing salt from water can be risky because the process is expensive and slow. Sometimes the technology does not work. A beach community's surface and ground water was decreasing. The community decided to construct a large-scale plant to remove salt from the bay water. The plan to construct a salt-removing plant was accepted because the community needed increased resources.,desalination --- removes --> salt || desalination --- removes salt from --> water || process --- is --> expensive || beach community --- has --> surface || community --- construct --> plant || community --- construct --> large-scale plant || community --- needed --> increased resources || community --- needed --> resources ||,had access to advanced technology.,Desalination removes salt from water. Removing salt from water can be risky because the process is expensive and slow. Sometimes the technology does not work. A beach community's surface and ground water was decreasing. The community decided to construct a large-scale plant to remove salt from the bay water. The plan to construct a salt-removing plant was accepted because the community had access to advanced technology.,desalination --- removes --> salt || desalination --- removes salt from --> water || process --- is --> expensive || beach community --- has --> surface || community --- construct --> plant || community --- construct --> large-scale plant || community --- access to --> advanced technology || community --- had --> access to advanced technology || community --- had --> access to technology || community --- had --> access || community --- access to --> technology ||,had unlimited financial resources.,Desalination removes salt from water. Removing salt from water can be risky because the process is expensive and slow. Sometimes the technology does not work. A beach community's surface and ground water was decreasing. The community decided to construct a large-scale plant to remove salt from the bay water. The plan to construct a salt-removing plant was accepted because the community had unlimited financial resources.,desalination --- removes --> salt || desalination --- removes salt from --> water || process --- is --> expensive || beach community --- has --> surface || community --- construct --> plant || community --- construct --> large-scale plant || community --- had --> unlimited resources || community --- had --> unlimited financial resources || community --- had --> resources || community --- had --> financial resources ||,needed to ease social pressures.,Desalination removes salt from water. Removing salt from water can be risky because the process is expensive and slow. Sometimes the technology does not work. A beach community's surface and ground water was decreasing. The community decided to construct a large-scale plant to remove salt from the bay water. The plan to construct a salt-removing plant was accepted because the community needed to ease social pressures.,fossils --- is in --> rock layers || rock layers --- pattern of --> fossils || rock layers --- same pattern of --> fossils || rock layers --- showed --> pattern || rock layers --- pattern of --> older fossils || rock layers --- same pattern of --> older fossils || rock layers --- showed --> same pattern of fossils || rock layers --- showed --> same pattern of older fossils || rock layers --- showed --> pattern of older fossils || rock layers --- showed --> pattern of fossils || rock layers --- showed --> same pattern || discovery --- is example of --> fossil evidence || discovery --- is example of --> new evidence || discovery --- is example of --> evidence || discovery --- is --> example || discovery --- is example of --> new fossil evidence ||,NA,NA,NA
ACTAAP_2010_5_7,"Heat was applied to a substance. First the substance expanded, and then it melted. Which state of matter did the substance start off as?",Gas,"Heat was applied to a substance. First the substance expanded, and then it melted. Gas state of matter did the substance start off as.",heat --- was --> applied || heat --- was applied to --> substance ||,Solid,"Heat was applied to a substance. First the substance expanded, and then it melted. Solid state of matter did the substance start off as.",heat --- was --> applied || heat --- was applied to --> substance ||,Liquid,"Heat was applied to a substance. First the substance expanded, and then it melted. Liquid state of matter did the substance start off as.",heat --- was --> applied || heat --- was applied to --> substance ||,Plasma,"Heat was applied to a substance. First the substance expanded, and then it melted. Plasma state of matter did the substance start off as.",heat --- was --> applied || heat --- was applied to --> substance ||,NA,NA,NA
ACTAAP_2012_7_9,"The elements carbon, hydrogen, and oxygen are parts of many different compounds. Which explains why these three elements can make so many different compounds?","They can be solids, liquids, or gases.","The elements carbon, hydrogen, and oxygen are parts of many different compounds. They can be solids, liquids, or gases explains why these three elements can make so many different compounds.",elements --- are parts of --> many different compounds || elements --- can make --> many different compounds || elements --- are parts of --> different compounds || elements --- can make --> different compounds || elements --- can make --> so many different compounds || three elements --- can make --> many different compounds || three elements --- can make --> so many different compounds || three elements --- can make --> different compounds || they --- be --> can solids ||,They come in different sizes and shapes.,"The elements carbon, hydrogen, and oxygen are parts of many different compounds. They come in different sizes and shapes explains why these three elements can make so many different compounds.",elements --- are parts of --> many different compounds || elements --- can make --> many different compounds || elements --- are parts of --> different compounds || elements --- can make --> different compounds || elements --- can make --> so many different compounds || three elements --- can make --> many different compounds || three elements --- can make --> so many different compounds || three elements --- can make --> different compounds || they --- come in --> sizes || they --- come in --> different sizes ||,They combine in different numbers and ratios.,"The elements carbon, hydrogen, and oxygen are parts of many different compounds. They combine in different numbers and ratios explains why these three elements can make so many different compounds.",elements --- are parts of --> many different compounds || elements --- can make --> many different compounds || elements --- are parts of --> different compounds || elements --- can make --> different compounds || elements --- can make --> so many different compounds || three elements --- can make --> many different compounds || three elements --- can make --> so many different compounds || three elements --- can make --> different compounds || they --- combine in --> numbers || they --- combine in --> different numbers ||,"They can be a proton, a neutron, or an electron.","The elements carbon, hydrogen, and oxygen are parts of many different compounds. They can be a proton, a neutron, or an electron explains why these three elements can make so many different compounds.",elements --- are parts of --> many different compounds || elements --- can make --> many different compounds || elements --- are parts of --> different compounds || elements --- can make --> different compounds || elements --- can make --> so many different compounds || three elements --- can make --> many different compounds || three elements --- can make --> so many different compounds || three elements --- can make --> different compounds || they --- be --> can proton ||,NA,NA,NA
MCAS_2005_8_6,"Fossilized coral reefs, fish, and other warm water marine creatures have been found in mountainous regions of New England. Which of the following best explains how this could have occurred?",The climate and geology of this area have changed over time.,"Fossilized coral reefs, fish, and other warm water marine creatures have been found in mountainous regions of New England. The climate and geology of this area have changed over time best explains how this could have occurred.",fossilized coral reefs --- have --> have found in regions of england || fossilized coral reefs --- have --> have found in regions || fossilized coral reefs --- have --> have found in mountainous regions || fossilized coral reefs --- have --> have found in regions of new england || fossilized coral reefs --- have --> have found in mountainous regions of england || fossilized coral reefs --- have --> have found || fossilized coral reefs --- have --> have found in mountainous regions of new england || coral reefs --- have --> have found in regions || coral reefs --- have --> have found in mountainous regions of new england || coral reefs --- have --> have found in regions of new england || coral reefs --- have --> have found in mountainous regions of england || coral reefs --- have --> have found in regions of england || coral reefs --- have --> have found in mountainous regions || coral reefs --- have --> have found || best --- explains over --> time ||,These creatures were better adapted to cold climates at one time.,"Fossilized coral reefs, fish, and other warm water marine creatures have been found in mountainous regions of New England. These creatures were better adapted to cold climates at one time best explains how this could have occurred.",fossilized coral reefs --- have --> have found in regions of england || fossilized coral reefs --- have --> have found in regions || fossilized coral reefs --- have --> have found in mountainous regions || fossilized coral reefs --- have --> have found in regions of new england || fossilized coral reefs --- have --> have found in mountainous regions of england || fossilized coral reefs --- have --> have found || fossilized coral reefs --- have --> have found in mountainous regions of new england || coral reefs --- have --> have found in regions || coral reefs --- have --> have found in mountainous regions of new england || coral reefs --- have --> have found in regions of new england || coral reefs --- have --> have found in mountainous regions of england || coral reefs --- have --> have found in regions of england || coral reefs --- have --> have found in mountainous regions || coral reefs --- have --> have found || creatures --- were adapted to --> cold climates || creatures --- were better adapted to --> cold climates || creatures --- were --> adapted || creatures --- were --> better adapted || creatures --- were adapted to --> climates || creatures --- were better adapted to --> climates || best --- explains at --> one time ||,The process of fossilization greatly changed the original material.,"Fossilized coral reefs, fish, and other warm water marine creatures have been found in mountainous regions of New England. The process of fossilization greatly changed the original material best explains how this could have occurred.",fossilized coral reefs --- have --> have found in regions of england || fossilized coral reefs --- have --> have found in regions || fossilized coral reefs --- have --> have found in mountainous regions || fossilized coral reefs --- have --> have found in regions of new england || fossilized coral reefs --- have --> have found in mountainous regions of england || fossilized coral reefs --- have --> have found || fossilized coral reefs --- have --> have found in mountainous regions of new england || coral reefs --- have --> have found in regions || coral reefs --- have --> have found in mountainous regions of new england || coral reefs --- have --> have found in regions of new england || coral reefs --- have --> have found in mountainous regions of england || coral reefs --- have --> have found in regions of england || coral reefs --- have --> have found in mountainous regions || coral reefs --- have --> have found ||,Scavengers carried the remains of these creatures to higher regions.,"Fossilized coral reefs, fish, and other warm water marine creatures have been found in mountainous regions of New England. Scavengers carried the remains of these creatures to higher regions best explains how this could have occurred.",fossilized coral reefs --- have --> have found in regions of england || fossilized coral reefs --- have --> have found in regions || fossilized coral reefs --- have --> have found in mountainous regions || fossilized coral reefs --- have --> have found in regions of new england || fossilized coral reefs --- have --> have found in mountainous regions of england || fossilized coral reefs --- have --> have found || fossilized coral reefs --- have --> have found in mountainous regions of new england || coral reefs --- have --> have found in regions || coral reefs --- have --> have found in mountainous regions of new england || coral reefs --- have --> have found in regions of new england || coral reefs --- have --> have found in mountainous regions of england || coral reefs --- have --> have found in regions of england || coral reefs --- have --> have found in mountainous regions || coral reefs --- have --> have found || scavengers --- carried remains to --> higher regions || scavengers --- carried remains to --> regions best explains || scavengers --- carried remains to --> higher regions best explains || scavengers --- carried remains to --> regions || scavengers --- carried remains to --> higher regions explains || scavengers --- carried --> remains of creatures || scavengers --- carried remains to --> regions explains || scavengers --- carried --> remains ||,NA,NA,NA
Mercury_SC_401162,What unit of measurement would be used to describe the melting point of a substance?,liters,Liters unit of measurement would be used to describe the melting point of a substance.,liters unit --- describe --> melting point || liters unit --- would --> would used || liters unit --- describe --> melting point of substance ||,grams,Grams unit of measurement would be used to describe the melting point of a substance.,grams unit --- describe --> melting point of substance || grams unit --- describe --> melting point || grams unit --- would --> would used ||,degrees,Degrees unit of measurement would be used to describe the melting point of a substance.,degrees unit --- describe --> melting point of substance || degrees unit --- would --> would used || degrees unit --- describe --> melting point ||,centimeters,Centimeters unit of measurement would be used to describe the melting point of a substance.,centimeters unit --- would --> would used || centimeters unit --- describe --> melting point of substance || centimeters unit --- describe --> melting point ||,NA,NA,NA
Mercury_SC_407710,Brianna thinks larger pumpkin seeds will sprout faster than smaller pumpkin seeds. She investigates by planting four seeds of each size in the same container. What term is used to describe what Brianna thinks will happen?,a trial,Brianna thinks larger pumpkin seeds will sprout faster than smaller pumpkin seeds. She investigates by planting four seeds of each size in the same container. A trial term is used to describe what Brianna thinks will happen.,she --- planting --> four seeds of size || trial term --- is --> used || trial term --- is used --> describe ||,a result,Brianna thinks larger pumpkin seeds will sprout faster than smaller pumpkin seeds. She investigates by planting four seeds of each size in the same container. A result term is used to describe what Brianna thinks will happen.,she --- planting --> four seeds of size || result term --- is --> used || result term --- is used --> describe ||,a variable,Brianna thinks larger pumpkin seeds will sprout faster than smaller pumpkin seeds. She investigates by planting four seeds of each size in the same container. A variable term is used to describe what Brianna thinks will happen.,she --- planting --> four seeds of size || term --- is --> used || term --- is used --> describe || variable term --- is used --> describe || variable term --- is --> used ||,a hypothesis,Brianna thinks larger pumpkin seeds will sprout faster than smaller pumpkin seeds. She investigates by planting four seeds of each size in the same container. A hypothesis term is used to describe what Brianna thinks will happen.,she --- planting --> four seeds of size || hypothesis term --- is --> used || hypothesis term --- is used --> describe ||,NA,NA,NA
VASoL_2009_3_23,A metal rod is struck and starts to vibrate. Which of these could happen next?,The metal rod becomes a liquid.,A metal rod is struck and starts to vibrate. The metal rod becomes a liquid of these could happen next.,metal rod --- starts --> vibrate || metal rod --- is --> struck ||,The metal rod becomes heavier.,A metal rod is struck and starts to vibrate. The metal rod becomes heavier of these could happen next.,metal rod --- starts --> vibrate || metal rod --- is --> struck || metal rod --- becomes --> heavier || metal rod --- becomes --> heavier of these ||,The metal rod attracts other metals.,A metal rod is struck and starts to vibrate. The metal rod attracts other metals of these could happen next.,metal rod --- starts --> vibrate || metal rod --- is --> struck || metal rod --- attracts --> other metals || metal rod --- attracts --> metals || metal rod --- attracts --> metals of these || metal rod --- attracts --> other metals of these ||,The metal rod produces sound.,A metal rod is struck and starts to vibrate. The metal rod produces sound of these could happen next.,metal rod --- starts --> vibrate || metal rod --- is --> struck || metal rod --- produces --> sound of these || metal rod --- produces --> sound ||,NA,NA,NA
