MDSA_2011_5_3,"A student filled three beakers, each with 50 milliliters of liquid water. The student cooled Beaker 1 to form ice. The student heated Beaker 2 to form water vapor (gas). Beaker 3 remained at room temperature. What process takes place when liquid water changes to a vapor (gas)?",condensation,"A student filled three beakers, each with 50 milliliters of liquid water. The student cooled Beaker 1 to form ice. The student heated Beaker 2 to form water vapor (gas). Beaker 3 remained at room temperature. Condensation process takes place when liquid water changes to a vapor (gas).",three beakers --- each with --> 50 milliliters of liquid water || student --- filled --> each || student --- filled --> each with 50 milliliters of liquid water || student --- filled --> each with 50 milliliters of water || student --- filled --> three beakers || student --- filled --> each with 50 milliliters || student --- cooled --> beaker 1 || student --- form --> ice || beaker 3 --- remained at --> room temperature || beaker --- remained at --> room temperature || condensation process --- takes --> place ||,evaporation,"A student filled three beakers, each with 50 milliliters of liquid water. The student cooled Beaker 1 to form ice. The student heated Beaker 2 to form water vapor (gas). Beaker 3 remained at room temperature. Evaporation process takes place when liquid water changes to a vapor (gas).",three beakers --- each with --> 50 milliliters of liquid water || student --- filled --> each || student --- filled --> each with 50 milliliters of liquid water || student --- filled --> each with 50 milliliters of water || student --- filled --> three beakers || student --- filled --> each with 50 milliliters || student --- cooled --> beaker 1 || student --- form --> ice || beaker 3 --- remained at --> room temperature || beaker --- remained at --> room temperature || evaporation process --- takes --> place ||,freezing,"A student filled three beakers, each with 50 milliliters of liquid water. The student cooled Beaker 1 to form ice. The student heated Beaker 2 to form water vapor (gas). Beaker 3 remained at room temperature. Freezing process takes place when liquid water changes to a vapor (gas).",three beakers --- each with --> 50 milliliters of liquid water || student --- filled --> each || student --- filled --> each with 50 milliliters of liquid water || student --- filled --> each with 50 milliliters of water || student --- filled --> three beakers || student --- filled --> each with 50 milliliters || student --- cooled --> beaker 1 || student --- form --> ice || beaker 3 --- remained at --> room temperature || beaker --- remained at --> room temperature || freezing process --- takes --> place ||,melting,"A student filled three beakers, each with 50 milliliters of liquid water. The student cooled Beaker 1 to form ice. The student heated Beaker 2 to form water vapor (gas). Beaker 3 remained at room temperature. Melting process takes place when liquid water changes to a vapor (gas).",three beakers --- each with --> 50 milliliters of liquid water || student --- filled --> each || student --- filled --> each with 50 milliliters of liquid water || student --- filled --> each with 50 milliliters of water || student --- filled --> three beakers || student --- filled --> each with 50 milliliters || student --- cooled --> beaker 1 || student --- form --> ice || beaker 3 --- remained at --> room temperature || beaker --- remained at --> room temperature || melting process --- takes --> place || process --- takes --> place ||,NA,NA,NA
MDSA_2009_5_39,"A Green Community Many cities in the United States are developing ""green communities."" A green community is intended to reduce the use of energy and consists of houses, apartments, and nearby businesses. Grocery stores, restaurants, and movie theaters are all within walking distance of the homes in the community. People travel shorter distances to their schools and jobs. Many of the buildings in a green community are made of renewable and recycled materials. Solar energy keeps the buildings at a comfortable temperature. Natural landscape features, such as trees and plants, are carefully located to provide shade and to control temperatures. Community gardens allow residents to grow food and flowers. People in green communities are using a nonrenewable resource when they",heat their homes with wood,"A Green Community Many cities in the United States are developing ""green communities."" A green community is intended to reduce the use of energy and consists of houses, apartments, and nearby businesses. Grocery stores, restaurants, and movie theaters are all within walking distance of the homes in the community. People travel shorter distances to their schools and jobs. Many of the buildings in a green community are made of renewable and recycled materials. Solar energy keeps the buildings at a comfortable temperature. Natural landscape features, such as trees and plants, are carefully located to provide shade and to control temperatures. Community gardens allow residents to grow food and flowers. People in green communities are using a nonrenewable resource heat their homes with wood they",communities --- many cities in --> united states || communities --- cities in --> united states || green communities --- many cities in --> united states || green communities --- cities in --> united states || many cities --- is in --> united states || green community --- reduce --> use of energy || green community --- reduce --> use || green community --- is --> intended || green community --- consists of --> houses || community --- consists of --> houses || community --- reduce --> use || community --- is --> intended || community --- reduce --> use of energy || all --- walking --> distance || all --- walking --> distance of homes || all --- walking --> distance of homes in community || are --- all --> walking || homes --- is in --> community || people --- travel --> shorter distances || people --- travel --> distances || people --- travel distances to --> their schools || people --- are using --> resource heat || people --- is in --> green communities || people --- are using --> nonrenewable resource heat || buildings --- is in --> green community || solar energy --- keeps --> buildings || solar energy --- keeps buildings at --> temperature || solar energy --- keeps buildings at --> comfortable temperature || energy --- keeps --> buildings || energy --- keeps buildings at --> temperature || energy --- keeps buildings at --> comfortable temperature || natural landscape features --- are --> located || natural landscape features --- are --> carefully located || shade --- control --> temperatures || landscape features --- are --> carefully located || landscape features --- are --> located || residents --- grow --> food || residents --- grow --> flowers || community gardens --- allow --> residents || community gardens --- allow --> grow || their homes --- is with --> wood ||,wash vegetables before cooking,"A Green Community Many cities in the United States are developing ""green communities."" A green community is intended to reduce the use of energy and consists of houses, apartments, and nearby businesses. Grocery stores, restaurants, and movie theaters are all within walking distance of the homes in the community. People travel shorter distances to their schools and jobs. Many of the buildings in a green community are made of renewable and recycled materials. Solar energy keeps the buildings at a comfortable temperature. Natural landscape features, such as trees and plants, are carefully located to provide shade and to control temperatures. Community gardens allow residents to grow food and flowers. People in green communities are using a nonrenewable resource wash vegetables before cooking they",communities --- many cities in --> united states || communities --- cities in --> united states || green communities --- many cities in --> united states || green communities --- cities in --> united states || many cities --- is in --> united states || green community --- reduce --> use of energy || green community --- reduce --> use || green community --- is --> intended || green community --- consists of --> houses || community --- consists of --> houses || community --- reduce --> use || community --- is --> intended || community --- reduce --> use of energy || all --- walking --> distance || all --- walking --> distance of homes || all --- walking --> distance of homes in community || are --- all --> walking || homes --- is in --> community || people --- travel --> shorter distances || people --- travel --> distances || people --- travel distances to --> their schools || people --- are using --> nonrenewable resource wash vegetables || people --- are using --> resource wash vegetables || people --- is in --> green communities || buildings --- is in --> green community || solar energy --- keeps --> buildings || solar energy --- keeps buildings at --> temperature || solar energy --- keeps buildings at --> comfortable temperature || energy --- keeps --> buildings || energy --- keeps buildings at --> temperature || energy --- keeps buildings at --> comfortable temperature || natural landscape features --- are --> located || natural landscape features --- are --> carefully located || shade --- control --> temperatures || landscape features --- are --> carefully located || landscape features --- are --> located || residents --- grow --> food || residents --- grow --> flowers || community gardens --- allow --> residents || community gardens --- allow --> grow ||,drive gasoline-powered automobiles,"A Green Community Many cities in the United States are developing ""green communities."" A green community is intended to reduce the use of energy and consists of houses, apartments, and nearby businesses. Grocery stores, restaurants, and movie theaters are all within walking distance of the homes in the community. People travel shorter distances to their schools and jobs. Many of the buildings in a green community are made of renewable and recycled materials. Solar energy keeps the buildings at a comfortable temperature. Natural landscape features, such as trees and plants, are carefully located to provide shade and to control temperatures. Community gardens allow residents to grow food and flowers. People in green communities are using a nonrenewable resource drive gasoline-powered automobiles they",communities --- many cities in --> united states || communities --- cities in --> united states || green communities --- many cities in --> united states || green communities --- cities in --> united states || many cities --- is in --> united states || green community --- reduce --> use of energy || green community --- reduce --> use || green community --- is --> intended || green community --- consists of --> houses || community --- consists of --> houses || community --- reduce --> use || community --- is --> intended || community --- reduce --> use of energy || all --- walking --> distance || all --- walking --> distance of homes || all --- walking --> distance of homes in community || are --- all --> walking || homes --- is in --> community || people --- travel --> shorter distances || people --- travel --> distances || people --- travel distances to --> their schools || people --- are using --> resource drive gasoline-powered automobiles || people --- are using --> resource drive automobiles || people --- are using --> nonrenewable resource drive gasoline-powered automobiles || people --- is in --> green communities || people --- are using --> nonrenewable resource drive automobiles || buildings --- is in --> green community || solar energy --- keeps --> buildings || solar energy --- keeps buildings at --> temperature || solar energy --- keeps buildings at --> comfortable temperature || energy --- keeps --> buildings || energy --- keeps buildings at --> temperature || energy --- keeps buildings at --> comfortable temperature || natural landscape features --- are --> located || natural landscape features --- are --> carefully located || shade --- control --> temperatures || landscape features --- are --> carefully located || landscape features --- are --> located || residents --- grow --> food || residents --- grow --> flowers || community gardens --- allow --> residents || community gardens --- allow --> grow ||,grow flowers in the community garden,"A Green Community Many cities in the United States are developing ""green communities."" A green community is intended to reduce the use of energy and consists of houses, apartments, and nearby businesses. Grocery stores, restaurants, and movie theaters are all within walking distance of the homes in the community. People travel shorter distances to their schools and jobs. Many of the buildings in a green community are made of renewable and recycled materials. Solar energy keeps the buildings at a comfortable temperature. Natural landscape features, such as trees and plants, are carefully located to provide shade and to control temperatures. Community gardens allow residents to grow food and flowers. People in green communities are using a nonrenewable resource grow flowers in the community garden they",communities --- many cities in --> united states || communities --- cities in --> united states || green communities --- many cities in --> united states || green communities --- cities in --> united states || many cities --- is in --> united states || green community --- reduce --> use of energy || green community --- reduce --> use || green community --- is --> intended || green community --- consists of --> houses || community --- consists of --> houses || community --- reduce --> use || community --- is --> intended || community --- reduce --> use of energy || all --- walking --> distance || all --- walking --> distance of homes || all --- walking --> distance of homes in community || are --- all --> walking || homes --- is in --> community || people --- travel --> shorter distances || people --- travel --> distances || people --- travel distances to --> their schools || people --- is in --> green communities || buildings --- is in --> green community || solar energy --- keeps --> buildings || solar energy --- keeps buildings at --> temperature || solar energy --- keeps buildings at --> comfortable temperature || energy --- keeps --> buildings || energy --- keeps buildings at --> temperature || energy --- keeps buildings at --> comfortable temperature || natural landscape features --- are --> located || natural landscape features --- are --> carefully located || shade --- control --> temperatures || landscape features --- are --> carefully located || landscape features --- are --> located || residents --- grow --> food || residents --- grow --> flowers || community gardens --- allow --> residents || community gardens --- allow --> grow || resource --- grow --> flowers || resource --- grow in --> community garden || resource --- grow flowers in --> community garden || nonrenewable resource --- grow in --> community garden || nonrenewable resource --- grow flowers in --> community garden || nonrenewable resource --- grow --> flowers ||,NA,NA,NA
Mercury_187198,"When ice begins to melt at 0°C, water molecules",begin to lose some of their atomic mass.,"Begin to lose some of their atomic mass ice begins to melt at 0°C, water molecules",begin --- begins --> melt at 0 ° c || begin --- melt at --> 0 ° c || begin --- melt at --> water molecules || begin --- begins --> melt ||,break apart into individual water atoms.,"Break apart into individual water atoms ice begins to melt at 0°C, water molecules",break --- begins --> melt || break --- begins --> melt at 0 ° c || break --- melt at --> 0 ° c || break --- melt at --> water molecules ||,move more freely in relation to each other.,"Move more freely in relation to each other ice begins to melt at 0°C, water molecules",,release heat to the surrounding atmosphere.,"Release heat to the surrounding atmosphere ice begins to melt at 0°C, water molecules",release heat --- melt at --> water molecules || release heat --- melt at --> 0 ° c || release heat --- begins --> melt || release heat --- begins --> melt at 0 ° c ||,NA,NA,NA
MCAS_2000_4_36,Which is NOT a pathway for transportation?,radio tower,Radio tower is NOT a pathway for transportation.,begin --- begins --> melt at 0 ° c || begin --- melt at --> 0 ° c || begin --- melt at --> water molecules || begin --- begins --> melt ||,road,Road is NOT a pathway for transportation.,,runway,Runway is NOT a pathway for transportation.,,pipeline,Pipeline is NOT a pathway for transportation.,,NA,NA,NA
Mercury_184100,Which of these is the best example of physical weathering?,insects eating a dead tree,Insects eating a dead tree of these is the best example of physical weathering.,insects --- is --> example || insects --- is --> best example || insects --- is best example of --> weathering || insects --- is example of --> weathering || insects --- eating --> dead tree || insects --- is best example of --> physical weathering || insects --- is example of --> physical weathering || insects --- eating --> tree || insects --- eating --> dead tree of these || insects --- eating --> tree of these || eating --- tree of --> these || eating --- dead tree of --> these ||,a bulldozer pushing soil,A bulldozer pushing soil of these is the best example of physical weathering.,bulldozer --- is best example of --> physical weathering || bulldozer --- is example of --> physical weathering || bulldozer --- is --> example || bulldozer --- pushing --> soil of these || bulldozer --- pushing --> soil || bulldozer --- is best example of --> weathering || bulldozer --- is example of --> weathering || bulldozer --- is --> best example || pushing --- soil of --> these ||,ice fracturing a stone,Ice fracturing a stone of these is the best example of physical weathering.,ice fracturing --- is --> example || ice fracturing --- is best example of --> weathering || ice fracturing --- is example of --> weathering || ice fracturing --- is best example of --> physical weathering || ice fracturing --- is example of --> physical weathering || ice fracturing --- is --> best example ||,acid rain dissolving limestone,Acid rain dissolving limestone of these is the best example of physical weathering.,acid rain --- is best example of --> weathering || acid rain --- is example of --> weathering || acid rain --- is --> example || acid rain --- is --> best example || acid rain --- dissolving limestone of --> these || acid rain --- limestone of --> these || acid rain --- is best example of --> physical weathering || acid rain --- is example of --> physical weathering || rain --- is best example of --> weathering || rain --- is example of --> weathering || rain --- dissolving limestone of --> these || rain --- limestone of --> these || rain --- is --> best example || rain --- is best example of --> physical weathering || rain --- is example of --> physical weathering || rain --- is --> example ||,NA,NA,NA
Mercury_LBS10814,Lithospheric plates have moved to form land formations on the Earth's surface. Which land formation occurs as a result of the plates folding upon one another?,an earthquake,Lithospheric plates have moved to form land formations on the Earth's surface. An earthquake land formation occurs as a result of the plates folding upon one another.,lithospheric plates --- form --> land formations on earth 's surface || lithospheric plates --- form --> land formations || plates --- form --> land formations on earth 's surface || plates --- form --> land formations || earth --- on --> surface || earthquake land formation --- occurs as --> result || earthquake land formation --- occurs as --> result of plates folding upon one another || earthquake land formation --- occurs as --> result of plates folding || earthquake land formation --- occurs as --> result of plates ||,a mountain range,Lithospheric plates have moved to form land formations on the Earth's surface. A mountain range land formation occurs as a result of the plates folding upon one another.,lithospheric plates --- form --> land formations on earth 's surface || lithospheric plates --- form --> land formations || plates --- form --> land formations on earth 's surface || plates --- form --> land formations || earth --- on --> surface || mountain range land formation --- occurs as --> result of plates || mountain range land formation --- occurs as --> result of plates folding || mountain range land formation --- occurs as --> result of plates folding upon one another || mountain range land formation --- occurs as --> result ||,a river,Lithospheric plates have moved to form land formations on the Earth's surface. A river land formation occurs as a result of the plates folding upon one another.,lithospheric plates --- form --> land formations on earth 's surface || lithospheric plates --- form --> land formations || plates --- form --> land formations on earth 's surface || plates --- form --> land formations || earth --- on --> surface || river land formation --- occurs as --> result of plates || river land formation --- occurs as --> result of plates folding upon one another || river land formation --- occurs as --> result of plates folding || river land formation --- occurs as --> result ||,a volcano,Lithospheric plates have moved to form land formations on the Earth's surface. A volcano land formation occurs as a result of the plates folding upon one another.,lithospheric plates --- form --> land formations on earth 's surface || lithospheric plates --- form --> land formations || plates --- form --> land formations on earth 's surface || plates --- form --> land formations || earth --- on --> surface || volcano land formation --- occurs as --> result of plates || volcano land formation --- occurs as --> result || volcano land formation --- occurs as --> result of plates folding upon one another || volcano land formation --- occurs as --> result of plates folding ||,NA,NA,NA
Mercury_SC_408384,Which best describes both a mixture and a solution?,A solid dissolves in a liquid.,A solid dissolves in a liquid best describes both a mixture and a solution.,,Two different substances combine.,Two different substances combine best describes both a mixture and a solution.,,A material with new properties forms.,A material with new properties forms best describes both a mixture and a solution.,material --- is with --> new properties ||,The combined substances cannot be separated.,The combined substances cannot be separated best describes both a mixture and a solution.,,NA,NA,NA
