Mercury_7268240,Which of these is a function of all cells?,to produce oxygen through photosynthesis,To produce oxygen through photosynthesis of these is a function of all cells.,,to combine with other cells to form tissues,To combine with other cells to form tissues of these is a function of all cells.,combine --- is function of --> cells ||,to subdivide to form cells for sexual reproduction,To subdivide to form cells for sexual reproduction of these is a function of all cells.,subdivide --- is function of --> cells ||,to transfer genetic information from one generation to the next,To transfer genetic information from one generation to the next of these is a function of all cells.,,NA,NA,NA
Mercury_7228358,"In biology class, a student places a tissue specimen on a glass microscope slide. The student drops the slide, and the slide shatters. What procedure should the student follow first?",attempt to collect the specimen from the slide pieces,"In biology class, a student places a tissue specimen on a glass microscope slide. The student drops the slide, and the slide shatters. Attempt to collect the specimen from the slide pieces procedure should the student follow first.",student --- places tissue specimen in --> biology class || student --- places tissue specimen on --> glass microscope slide || student --- places --> tissue specimen || student --- drops --> slide || attempt --- collect --> specimen || attempt --- collect specimen from --> slide pieces procedure ||,pick up the larger pieces of the slide,"In biology class, a student places a tissue specimen on a glass microscope slide. The student drops the slide, and the slide shatters. Pick up the larger pieces of the slide procedure should the student follow first.",student --- places tissue specimen in --> biology class || student --- places tissue specimen on --> glass microscope slide || student --- places --> tissue specimen || student --- drops --> slide ||,use a broom to sweep up all glass on the floor,"In biology class, a student places a tissue specimen on a glass microscope slide. The student drops the slide, and the slide shatters. Use a broom to sweep up all glass on the floor procedure should the student follow first.",student --- places tissue specimen in --> biology class || student --- places tissue specimen on --> glass microscope slide || student --- places --> tissue specimen || student --- drops --> slide ||,inform the teacher of the accident,"In biology class, a student places a tissue specimen on a glass microscope slide. The student drops the slide, and the slide shatters. Inform the teacher of the accident procedure should the student follow first.",student --- places tissue specimen in --> biology class || student --- places tissue specimen on --> glass microscope slide || student --- places --> tissue specimen || student --- drops --> slide ||,NA,NA,NA
MCAS_2004_5_33,Few flowers are able to grow on the northern arctic tundra. Those that do grow there have very short stems. How is this an adaptation to help them survive in the arctic climate?,It protects them from freezing.,Few flowers are able to grow on the northern arctic tundra. Those that do grow there have very short stems. It protects them from freezing is this an adaptation to help them survive in the arctic climate.,few flowers --- are --> able || few flowers --- grow on --> arctic tundra || few flowers --- grow on --> northern tundra || few flowers --- grow on --> northern arctic tundra || few flowers --- grow on --> tundra || flowers --- grow on --> arctic tundra || flowers --- grow on --> northern tundra || flowers --- are --> able || flowers --- grow on --> northern arctic tundra || flowers --- grow on --> tundra || them --- survive in --> climate || them --- survive in --> arctic climate || it --- protects --> them ||,It prevents them from being eaten by consumers.,Few flowers are able to grow on the northern arctic tundra. Those that do grow there have very short stems. It prevents them from being eaten by consumers is this an adaptation to help them survive in the arctic climate.,few flowers --- are --> able || few flowers --- grow on --> arctic tundra || few flowers --- grow on --> northern tundra || few flowers --- grow on --> northern arctic tundra || few flowers --- grow on --> tundra || flowers --- grow on --> arctic tundra || flowers --- grow on --> northern tundra || flowers --- are --> able || flowers --- grow on --> northern arctic tundra || flowers --- grow on --> tundra || them --- survive in --> climate || them --- survive in --> arctic climate || it --- prevents --> them || it --- being --> eaten || it --- being eaten by --> consumers ||,It protects them from breaking in strong winds.,Few flowers are able to grow on the northern arctic tundra. Those that do grow there have very short stems. It protects them from breaking in strong winds is this an adaptation to help them survive in the arctic climate.,few flowers --- are --> able || few flowers --- grow on --> arctic tundra || few flowers --- grow on --> northern tundra || few flowers --- grow on --> northern arctic tundra || few flowers --- grow on --> tundra || flowers --- grow on --> arctic tundra || flowers --- grow on --> northern tundra || flowers --- are --> able || flowers --- grow on --> northern arctic tundra || flowers --- grow on --> tundra || them --- survive in --> climate || them --- survive in --> arctic climate || it --- breaking in --> winds || it --- protects --> them || it --- breaking in --> strong winds ||,It makes it very hard for them to be pulled from the ground.,Few flowers are able to grow on the northern arctic tundra. Those that do grow there have very short stems. It makes it very hard for them to be pulled from the ground is this an adaptation to help them survive in the arctic climate.,few flowers --- are --> able || few flowers --- grow on --> arctic tundra || few flowers --- grow on --> northern tundra || few flowers --- grow on --> northern arctic tundra || few flowers --- grow on --> tundra || flowers --- grow on --> arctic tundra || flowers --- grow on --> northern tundra || flowers --- are --> able || flowers --- grow on --> northern arctic tundra || flowers --- grow on --> tundra || them --- survive in --> climate || them --- be --> very hard pulled || them --- survive in --> arctic climate || them --- be --> pulled from ground || them --- be --> hard pulled || them --- be --> very hard pulled from ground || them --- be --> hard pulled from ground || them --- be --> pulled || it --- makes --> hard pulled || it --- makes --> pulled || it --- makes --> very hard pulled from ground || it --- makes --> hard pulled from ground || it --- makes --> very hard pulled || it --- makes --> pulled from ground || it makes --- is adaptation --> help ||,NA,NA,NA
Mercury_7008855,Which statement concerning metals is correct?,Metals are soluble.,Metals are soluble statement concerning metals is correct.,metals --- are --> soluble statement || metals --- are --> statement || metals --- concerning --> metals || soluble statement --- concerning --> metals || soluble statement --- is --> correct || statement --- concerning --> metals || statement --- is --> correct ||,Metals conduct electricity.,Metals conduct electricity statement concerning metals is correct.,metals --- conduct --> electricity statement || electricity statement --- concerning --> metals ||,Metals form a rigid structure.,Metals form a rigid structure statement concerning metals is correct.,rigid structure statement --- concerning --> metals || metals --- form --> rigid structure statement || metals --- form --> structure statement || structure statement --- concerning --> metals ||,Metals have a low melting point.,Metals have a low melting point statement concerning metals is correct.,melting point statement --- concerning --> metals || metals --- have --> melting point statement || metals --- have --> low melting point statement || low melting point statement --- concerning --> metals ||,NA,NA,NA
Mercury_7057085,What information best helps a meteorologist predict the possibility of tornadoes developing in a certain area?,current wind conditions,Current wind conditions information best helps a meteorologist predict the possibility of tornadoes developing in a certain area.,meteorologist --- predict --> possibility of tornadoes developing || meteorologist --- possibility of --> tornadoes || meteorologist --- predict --> possibility || meteorologist --- predict --> possibility of tornadoes developing in certain area || meteorologist --- predict --> possibility of tornadoes developing in area || meteorologist --- possibility of --> tornadoes developing in area || meteorologist --- possibility of --> tornadoes developing || meteorologist --- predict --> possibility of tornadoes || meteorologist --- possibility of --> tornadoes developing in certain area ||,type of clouds in the sky,Type of clouds in the sky information best helps a meteorologist predict the possibility of tornadoes developing in a certain area.,type --- helps in --> sky information || type --- best helps in --> sky information || meteorologist --- predict --> possibility of tornadoes developing || meteorologist --- possibility of --> tornadoes || meteorologist --- predict --> possibility of tornadoes developing in certain area || meteorologist --- predict --> possibility || meteorologist --- predict --> possibility of tornadoes developing in area || meteorologist --- possibility of --> tornadoes developing || meteorologist --- possibility of --> tornadoes developing in area || meteorologist --- predict --> possibility of tornadoes || meteorologist --- possibility of --> tornadoes developing in certain area ||,percent humidity in the air,Percent humidity in the air information best helps a meteorologist predict the possibility of tornadoes developing in a certain area.,meteorologist --- predict --> possibility of tornadoes developing || meteorologist --- possibility of --> tornadoes || meteorologist --- predict --> possibility of tornadoes developing in certain area || meteorologist --- predict --> possibility || meteorologist --- predict --> possibility of tornadoes developing in area || meteorologist --- possibility of --> tornadoes developing || meteorologist --- possibility of --> tornadoes developing in area || meteorologist --- predict --> possibility of tornadoes || meteorologist --- possibility of --> tornadoes developing in certain area || percent humidity --- helps in --> air information || percent humidity --- best helps in --> air information ||,amount of rainfall,Amount of rainfall information best helps a meteorologist predict the possibility of tornadoes developing in a certain area.,meteorologist --- predict --> possibility of tornadoes developing || meteorologist --- possibility of --> tornadoes || meteorologist --- predict --> possibility || meteorologist --- predict --> possibility of tornadoes developing in certain area || meteorologist --- predict --> possibility of tornadoes developing in area || meteorologist --- possibility of --> tornadoes developing in area || meteorologist --- possibility of --> tornadoes developing || meteorologist --- predict --> possibility of tornadoes || meteorologist --- possibility of --> tornadoes developing in certain area ||,NA,NA,NA
Mercury_7171728,The weight of an object changes at different locations on Earth. Which is a measurement of weight?,20 mL,The weight of an object changes at different locations on Earth. 20 mL is a measurement of weight.,20 ml --- is measurement of --> weight || 20 ml --- is --> measurement || ml --- is --> measurement || ml --- is measurement of --> weight ||,16 N,The weight of an object changes at different locations on Earth. 16 N is a measurement of weight.,n --- is measurement of --> weight || n --- is --> measurement || 16 n --- is measurement of --> weight || 16 n --- is --> measurement ||,45 m,The weight of an object changes at different locations on Earth. 45 m is a measurement of weight.,45 m --- is --> measurement || 45 m --- is measurement of --> weight || m --- is --> measurement || m --- is measurement of --> weight ||,90째C,The weight of an object changes at different locations on Earth. 90째C is a measurement of weight.,90 째 c --- is --> measurement || 90 째 c --- is measurement of --> weight || c --- is measurement of --> weight || c --- is --> measurement ||,NA,NA,NA
NAEP_2005_4_S14+3,"Pat has two kinds of plant food,""""Quickgrow"""" and """"Supergrow."""" What would be the best way for Pat to find out which plant food helps a particular type of houseplant grow the most?","Put some Quickgrow on a plant in the living room, put some Supergrow on a plant of the same type in the bedroom, and see which one grows the most.","Pat has two kinds of plant food,""""Quickgrow"""" and """"Supergrow."""" put some quickgrow on a plant in the living room, put some supergrow on a plant of the same type in the bedroom, and see which one grows the most would be the best way for Pat to find out which plant food helps a particular type of houseplant grow the most.",pat --- has --> supergrow || pat --- has --> two kinds || pat --- has --> quickgrow || pat --- has --> two kinds of plant food || quickgrow --- put --> supergrow || quickgrow --- put supergrow on --> plant of same type || quickgrow --- put supergrow in --> bedroom || quickgrow --- put supergrow on --> plant of type || quickgrow --- put supergrow on --> plant || particular type --- grow --> most || most --- particular type of --> houseplant || most --- type of --> houseplant || type --- grow --> most || plant --- is in --> living room ||,"Find out how much each kind of plant food costs, because the more expensive kind is probably better for growing plants.","Pat has two kinds of plant food,""""Quickgrow"""" and """"Supergrow."""" find out how much each kind of plant food costs, because the more expensive kind is probably better for growing plants would be the best way for Pat to find out which plant food helps a particular type of houseplant grow the most.",pat --- has --> supergrow || pat --- has --> two kinds || pat --- has --> quickgrow || pat --- has --> two kinds of plant food || particular type --- grow --> most || most --- particular type of --> houseplant || most --- type of --> houseplant || type --- grow --> most ||,"Put some Quickgrow on a few plants, put the same amount of Supergrow on a few other plants of the same type, put all the plants in the same place, and see which group of plants grows the most.","Pat has two kinds of plant food,""""Quickgrow"""" and """"Supergrow."""" put some quickgrow on a few plants, put the same amount of supergrow on a few other plants of the same type, put all the plants in the same place, and see which group of plants grows the most would be the best way for Pat to find out which plant food helps a particular type of houseplant grow the most.",pat --- has --> supergrow || pat --- has --> two kinds || pat --- has --> quickgrow || pat --- has --> two kinds of plant food || quickgrow --- put --> amount of supergrow || quickgrow --- put --> amount || quickgrow --- put --> same amount || quickgrow --- put amount on --> plants of type || quickgrow --- put plants in --> same place || quickgrow --- put amount on --> other plants of same type || quickgrow --- put amount on --> plants of same type || quickgrow --- put amount on --> few plants || quickgrow --- put --> same amount of supergrow || quickgrow --- put amount on --> few other plants || quickgrow --- put amount on --> few plants of type || quickgrow --- put amount on --> few other plants of type || quickgrow --- put --> plants || quickgrow --- put amount on --> plants || quickgrow --- put amount on --> few plants of same type || quickgrow --- put amount on --> few other plants of same type || quickgrow --- put plants in --> place || quickgrow --- put amount on --> other plants || quickgrow --- put amount on --> other plants of type || most --- particular type of --> houseplant || most --- type of --> houseplant || particular type --- grow --> most || type --- grow --> most ||,"Look at the advertisements for Quickgrow, look at the advertisements for Supergrow, and see which one says it helps plants grow the most.","Pat has two kinds of plant food,""""Quickgrow"""" and """"Supergrow."""" look at the advertisements for quickgrow, look at the advertisements for supergrow, and see which one says it helps plants grow the most would be the best way for Pat to find out which plant food helps a particular type of houseplant grow the most.",pat --- has --> supergrow || pat --- has --> two kinds || pat --- has --> quickgrow || pat --- has --> two kinds of plant food ||,NA,NA,NA
