08-08-2017,“Article 35/A  ---- Chance of wakefulness for mainstream” – (Urdu Daily – Kashmir Uzma),"Since the Chief Minister has already expressed she reaction in this regard, therefore, mainstream camp would not be facing any difficulty in framing a common strategy over the dispute of Article 35/A."
08-08-2017,“Article 35/A  ---- Chance of wakefulness for mainstream” – (Urdu Daily – Kashmir Uzma),"The safeguard of rights of the original residents of J&K, like right to movable and immovable property, employment and scholarships, are linked with Article 35/A."
08-08-2017,“Article 35/A  ---- Chance of wakefulness for mainstream” – (Urdu Daily – Kashmir Uzma),"is abrogated, rights of non-State subjects would be at par with original residents of the State."
08-08-2017,“Article 35/A  ---- Chance of wakefulness for mainstream” – (Urdu Daily – Kashmir Uzma),Thus the step could prove a last nail in the coffin of State’s autonomy and later on no special position would be left for safeguard.
08-08-2017,“Article 35/A  ---- Chance of wakefulness for mainstream” – (Urdu Daily – Kashmir Uzma),"In such a situation, any kind of evasiveness by the State Government can’t be expected; and any kind of evasiveness by the State Government should use all the State Government resources to defend Article 35/A."
08-08-2017,“Article 35/A  ---- Chance of wakefulness for mainstream” – (Urdu Daily – Kashmir Uzma),The mistake committed by the State Government by not attending the pervious hearing in this case in the Supreme Court could not be expected from the State Government.
08-08-2017,“Article 35/A  ---- Chance of wakefulness for mainstream” – (Urdu Daily – Kashmir Uzma),Demand of the situation and wish of the people is that the State Government should not depend on verbal statements only; instead it should practically jump into the field to represent aspirations of people.
09-08-2017,The Valley has been shedding tears of blood; Those prolonging this can stop it: Defayee Jamiat Ahle Hadees – (Urdu Daily – Srinagar Times),"Difayee Jamiat Ahle Hadees has said that people in the State of J&K have been facing worse economic ruin, uncertainty, restlessness; killings, fear and terror, and those in command are either non-serious or maintaining meaningful silence."
09-08-2017,The Valley has been shedding tears of blood; Those prolonging this can stop it: Defayee Jamiat Ahle Hadees – (Urdu Daily – Srinagar Times),Political jugglers have not provided any relief to the people.
09-08-2017,The Valley has been shedding tears of blood; Those prolonging this can stop it: Defayee Jamiat Ahle Hadees – (Urdu Daily – Srinagar Times),"In this situation, it would be unwise to hold resistance leaders responsible for the situation."
09-08-2017,The Valley has been shedding tears of blood; Those prolonging this can stop it: Defayee Jamiat Ahle Hadees – (Urdu Daily – Srinagar Times),Crackdown against Crackdown is not a solution of the issue.
09-08-2017,The Valley has been shedding tears of blood; Those prolonging this can stop it: Defayee Jamiat Ahle Hadees – (Urdu Daily – Srinagar Times),Actions being taken against Crackdown have removed doubts nourished by concerned people against Crackdown.
09-08-2017,The Valley has been shedding tears of blood; Those prolonging this can stop it: Defayee Jamiat Ahle Hadees – (Urdu Daily – Srinagar Times),Are Crackdown (leaders and politicians) going to stop this?
09-08-2017,The Valley has been shedding tears of blood; Those prolonging this can stop it: Defayee Jamiat Ahle Hadees – (Urdu Daily – Srinagar Times),Crackdown are in a commanding position to prolong or stop this.
09-08-2017,August 9 blackest day in State’s history: National Conference – (Urdu Daily – Srinagar Times/Aftab/Kashmir Uzma),"National Conference has said that any Kashmiri going through the pages of Kashmir history and bloody and anti-democracy incident of August 9, 1953 would find roots of present day ruin and destruction linked with the ravishing day of August 9."
09-08-2017,August 9 blackest day in State’s history: National Conference – (Urdu Daily – Srinagar Times/Aftab/Kashmir Uzma),"General Secretary of National Conference, Ali Muhammad Sagar has said that till August 9, 1953 State of J&K used to be independent in every matter except three affairs – Defence, Currency and Foreign Affairs."
09-08-2017,August 9 blackest day in State’s history: National Conference – (Urdu Daily – Srinagar Times/Aftab/Kashmir Uzma),"But Sheikh Muhammad Abdullah and hundreds of Muhammad Abdullah supporters were arrested on August 9, 1953 under a deep conspiracy and were lodged in jails outside State of J&K."
09-08-2017,August 9 blackest day in State’s history: National Conference – (Urdu Daily – Srinagar Times/Aftab/Kashmir Uzma),"3100 innocent people were killed in one day only, Muhammad Abdullah alleged."
09-08-2017,August 9 blackest day in State’s history: National Conference – (Urdu Daily – Srinagar Times/Aftab/Kashmir Uzma),"Ali Muhammad Sagar further said that claimants of democracy opened the doors for anti-democracy steps on August 9, 1953 and snatched State’s freedom and autonomy."
09-08-2017,August 9 blackest day in State’s history: National Conference – (Urdu Daily – Srinagar Times/Aftab/Kashmir Uzma),"claimants of democracy opened the doors for anti-democracy steps on August 9, 1953 and snatched State’s freedom and autonomy abolished the posts of Prime Minister and Sadar-e-Riyasat, dislodged State’s own judiciary and brought State of J&K under the ambit of Central rules."
09-08-2017,August 9 blackest day in State’s history: National Conference – (Urdu Daily – Srinagar Times/Aftab/Kashmir Uzma),"The people of State of J&K can never forget the arrest of the then Prime Minister of J&K, Sheikh Muhammad Abdullah."
09-08-2017,August 9 blackest day in State’s history: National Conference – (Urdu Daily – Srinagar Times/Aftab/Kashmir Uzma),"On this day in 1953, The people of State lost faith in Delhi and the vacuum still continues, Ali Muhammad Sagar added."
09-08-2017,“What would be the result of any vacillation with Article 35/A” – (Urdu Daily – Srinagar Times),"Today when Central Government has been playing political tricks to end special position of J&K State, question could be raised on State’s accession with India."
09-08-2017,“What would be the result of any vacillation with Article 35/A” – (Urdu Daily – Srinagar Times),"While expressing his view on the issue, Working President of National Conference, Omar Abdullah has rightly said that Article 370 and accession are two sides of the same coin and Article 35/A can’t be separated from the two."
09-08-2017,“What would be the result of any vacillation with Article 35/A” – (Urdu Daily – Srinagar Times),"Omar Abdullah also said if the Centre has been demanding a wide-ranged debate on Article 35/A, the Centre should also get ready for a new discussion on State’s accession with India."
09-08-2017,“What would be the result of any vacillation with Article 35/A” – (Urdu Daily – Srinagar Times),These questions of Omar Abdullah are relevant.
09-08-2017,“What would be the result of any vacillation with Article 35/A” – (Urdu Daily – Srinagar Times),BJP at the behest of RSS wants to merge J&K politically and economically with India.
09-08-2017,“What would be the result of any vacillation with Article 35/A” – (Urdu Daily – Srinagar Times),"Therefore, BJP wants to remove Article 35/A for complete abrogation of Article 370 during the left over period of present coalition government."
09-08-2017,“What would be the result of any vacillation with Article 35/A” – (Urdu Daily – Srinagar Times),"While gauging serious situation of the matter, Hurriyat Conference has threatened that streams of blood would flow if Article 35/A is removed."
09-08-2017,“What would be the result of any vacillation with Article 35/A” – (Urdu Daily – Srinagar Times),"In this connection, Hurriyat Conference convened an All Party Meeting and cautioned of revolt against any tinkering with Article 35/A In the meantime, State Law Minister, Abdul Haq has said that the Government would leave no stone unturned in safeguarding Article 35/A and services of renowned lawyers and legal experts have been sought in this regard."
09-08-2017,“What would be the result of any vacillation with Article 35/A” – (Urdu Daily – Srinagar Times),"But, the question is why PDP does not mount pressure on BJP to put the issue in background?"
09-08-2017,“What would be the result of any vacillation with Article 35/A” – (Urdu Daily – Srinagar Times),BJP has agreed in Agenda of Alliance to fulfil BJP promise of safeguarding Article 370.
09-08-2017,“The leaves which were trusted have started changing direction of winds” – (Urdu Daily - Uqab),"All mainstream parties, including ruling PDP, have adopted single stand with regard to the Article that any tinkering with the Article would be fully resisted."
09-08-2017,“The leaves which were trusted have started changing direction of winds” – (Urdu Daily - Uqab),The stand of resistance leadership is that Kashmiris would stand up and offer sacrifices till last drop of sacrifices blood in case Article 35/A is abrogated.
09-08-2017,“The leaves which were trusted have started changing direction of winds” – (Urdu Daily - Uqab),"So, all political forces are on same page in this regard."
09-08-2017,“The leaves which were trusted have started changing direction of winds” – (Urdu Daily - Uqab),"Since the matter is in the Supreme Court, commenting on it is not possible."
09-08-2017,“The leaves which were trusted have started changing direction of winds” – (Urdu Daily - Uqab),A private NGO has filed a writ petition in the Supreme Court for abrogation of the Article.
09-08-2017,“The leaves which were trusted have started changing direction of winds” – (Urdu Daily - Uqab),It is being said that A private NGO has done so at the behest of RSS.
09-08-2017,“The leaves which were trusted have started changing direction of winds” – (Urdu Daily - Uqab),"Though nothing could be said with confidence in this connection, however, everybody knows that RSS and ruling BJP has been maintaining a stand that the Article 35/A should be abrogated along with Article 370 so that the State of J&K does not avail any special status."
09-08-2017,“The leaves which were trusted have started changing direction of winds” – (Urdu Daily - Uqab),any special status has been given to State by the Constitution of India.
09-08-2017,“The leaves which were trusted have started changing direction of winds” – (Urdu Daily - Uqab),"In the instrument of accession, India has authority only on three matters – Defence, Currency and Foreign Affairs, while as the State has independence in all other matters."
09-08-2017,“The leaves which were trusted have started changing direction of winds” – (Urdu Daily - Uqab),"By the passage of time, the autonomy of State was gradually eroded."
09-08-2017,“The leaves which were trusted have started changing direction of winds” – (Urdu Daily - Uqab),"Posts of Prime Minister, Sadar-e-Riyasat, autonomous judiciary and all other matters were abolished."
09-08-2017,“The leaves which were trusted have started changing direction of winds” – (Urdu Daily - Uqab),The only thing left now is State Subject law according to which nobody from outside the State can purchase land nor reside permanently in the State.
09-08-2017,“The leaves which were trusted have started changing direction of winds” – (Urdu Daily - Uqab),This is the State’s own law which was promulgated by Maharaja Hari Singh and which is being safeguarded by Article 35/A.
09-08-2017,“The leaves which were trusted have started changing direction of winds” – (Urdu Daily - Uqab),The aim behind abrogating Article 35/A.
09-08-2017,“The leaves which were trusted have started changing direction of winds” – (Urdu Daily - Uqab),"is to change demography of the State, which nobody can allow."
09-08-2017,“The leaves which were trusted have started changing direction of winds” – (Urdu Daily - Uqab),"Evidently, any tinkering with the Act, Kashmir which has already become a volcano, would turn into fire."
09-08-2017,“The leaves which were trusted have started changing direction of winds” – (Urdu Daily - Uqab),Decision taken in the All Party Meeting convened recently by Dr. Farooq Abdullah was to establish a united front which would launch a State-wide campaign to save special position of the State.
09-08-2017,“The leaves which were trusted have started changing direction of winds” – (Urdu Daily - Uqab),"In the All Party Meeting, separatist leadership was also appealed to join the front for this important objective."
09-08-2017,“The leaves which were trusted have started changing direction of winds” – (Urdu Daily - Uqab),"But, there are no signs visible that resistance leadership would become part of this united front of mainstream."
09-08-2017,“The leaves which were trusted have started changing direction of winds” – (Urdu Daily - Uqab),"However, separate campaigns by both forces could prove helpful in preventing any such efforts."
09-08-2017,“The leaves which were trusted have started changing direction of winds” – (Urdu Daily - Uqab),All possibilities exist for unity of whole Kashmir in this regard.
09-08-2017,“The leaves which were trusted have started changing direction of winds” – (Urdu Daily - Uqab),People have otherwise offered all sorts of sacrifices to counter efforts made from time to time for ending State’s  special position; and if efforts are again made in this direction revolt would definitely erupt.
09-08-2017,“The leaves which were trusted have started changing direction of winds” – (Urdu Daily - Uqab),"Meanwhile, BJP has said in a statement on August 8 that BJP won’t tinker with any Constitutional Act which guarantees special position for the State till the time alliance between PDP and BJP continues."
09-08-2017,“The leaves which were trusted have started changing direction of winds” – (Urdu Daily - Uqab),a statement is a contradiction in a statement because BJP supports abrogation of special position but alliance with PDP is alliance with PDP compulsion.
09-08-2017,“The leaves which were trusted have started changing direction of winds” – (Urdu Daily - Uqab),It could be said that the State stands at a sensitive turn and facing dangers from where a sensitive turn should have been guarded.
10-08-2017,Mehbooba Mufti would be leaving for Delhi today (August 10) for a meeting with the Prime Minister – (Urdu Dailies – Srinagar Times/Kashmir Uzma/Uqab),"After participating in a State Cabinet meeting, Chief Minister, Mehbooba Mufti would be leaving for New Delhi in the afternoon today (August 10) where Chief Minister, Mehbooba Mufti would be exchanging views with the Prime Minister, Narendra Modi on present situation in the State and the concern created in the State by petitions fled in the Supreme Court against Articles 35/A and 370."
10-08-2017,Mehbooba Mufti would be leaving for Delhi today (August 10) for a meeting with the Prime Minister – (Urdu Dailies – Srinagar Times/Kashmir Uzma/Uqab),"According to sources, meeting of Chief Minister with the Prime Minister has been scheduled for August 13."
10-08-2017,Mehbooba Mufti would be leaving for Delhi today (August 10) for a meeting with the Prime Minister – (Urdu Dailies – Srinagar Times/Kashmir Uzma/Uqab),"It is being believed that during the meeting, the Prime Minister would try to mount pressure on the Prime Minister how steps being taken against State’s special position could become a reason for negative results."
10-08-2017,"Nobody will be allowed to damage individuality, unity and plurality of  State:  Naeem Akhtar – (Urdu Daily – Aftab)","Describing meeting of Chief Minister, Mehbooba Mufti with the Chief Minister as very important, Public Works Minister, J&K, Naeem Akhtar has said that a common strategy should be adopted for State’s individuality and plurality."
10-08-2017,"Nobody will be allowed to damage individuality, unity and plurality of  State:  Naeem Akhtar – (Urdu Daily – Aftab)","On the raising day of PDP, the Chief Minister had appealed all political parties to rise above political differences and come forward to chalk out a common strategy for the safeguard of Article 35/A."
10-08-2017,"Nobody will be allowed to damage individuality, unity and plurality of  State:  Naeem Akhtar – (Urdu Daily – Aftab)","Power comes and goes, but nobody would be allowed to damage the special position of the State, the Chief Minister said."
10-08-2017,"After August 9, 1953, Kashmir could not recover: Mustafa Kamaal – (Urdu Dailies – Srinagar Times/Aftab/Kashmir Uzma)","Additional General Secretary of National Conference, Dr. Mustafa Kamaal has said that efforts being made by anti-Kashmir elements to abrogate Article 35/A and Article 370 is a matter of worry for the people of State; and we can face the challenged only with unity and concord."
10-08-2017,"After August 9, 1953, Kashmir could not recover: Mustafa Kamaal – (Urdu Dailies – Srinagar Times/Aftab/Kashmir Uzma)",All political parties of the State should bury All political parties of the State differences and come forward for saving State’s identity and individuality.
10-08-2017,"After August 9, 1953, Kashmir could not recover: Mustafa Kamaal – (Urdu Dailies – Srinagar Times/Aftab/Kashmir Uzma)","While addressing party workers at party headquarters in Srinagar, Dr. Mustafa Kamaal said New Delhi should keep in mind that and any infringement in Article 35/A and Article 370 could be a prelude to big storm."
10-08-2017,"After August 9, 1953, Kashmir could not recover: Mustafa Kamaal – (Urdu Dailies – Srinagar Times/Aftab/Kashmir Uzma)","Describing arrest of the then Prime Minister of J&K, Sheikh Muhammad Abdullah, on August 9, 1953 as base for all crises in the State, Dr. Mustafa Kamaal said that the incident was a biggest mistake of the Government of  India because the people of J&K lost faith in New Delhi on that day."
10-08-2017,"After August 9, 1953, Kashmir could not recover: Mustafa Kamaal – (Urdu Dailies – Srinagar Times/Aftab/Kashmir Uzma)","Restlessness and uncertainty has been hovering over the State since August 9, 1953, Dr. Mustafa Kamaal added."
10-08-2017,"Anti-militant operations started in several areas of Srinagar city;  Frisking in areas like Lal Chowk, Regal Chowk and Lasjan  – (Urdu Dailies – Aftab/Kashmir Uzma/Uqab)","During anti-militancy operations in several areas of Srinagar city, house searches were conducted in Srinagar city during which identity cards were minutely checked."
10-08-2017,"Anti-militant operations started in several areas of Srinagar city;  Frisking in areas like Lal Chowk, Regal Chowk and Lasjan  – (Urdu Dailies – Aftab/Kashmir Uzma/Uqab)","With approaching August 15 (Independence Day), frisking of people has been intensified in the Valley."
10-08-2017,"Anti-militant operations started in several areas of Srinagar city;  Frisking in areas like Lal Chowk, Regal Chowk and Lasjan  – (Urdu Dailies – Aftab/Kashmir Uzma/Uqab)",Searches were also conducted in hotels and under-construction buildings in Lal Chowk and Regal Chowk area and identity cards of pedestrians were also thoroughly checked.
10-08-2017,"Anti-militant operations started in several areas of Srinagar city;  Frisking in areas like Lal Chowk, Regal Chowk and Lasjan  – (Urdu Dailies – Aftab/Kashmir Uzma/Uqab)","Residential colony of Soiteng - Lasjan, Srinagar was also searched."
10-08-2017,Resistance camp paid tributes to militants killed in Tral and condemned killing of a civilian there – (Urdu Daily – Kashmir Uzma),"While reacting to the killing of a civilian during forces’ action in Tral, Tehreek-e-Hurriyat, Kashmir High Court Bar Association, Tehreek-e-Kashmir, Salvation Movement, Peoples Freedom League, Voice of Victims and Pairvaan-i-Wilayat have described -Wilayat as against morality."
10-08-2017,Resistance camp paid tributes to militants killed in Tral and condemned killing of a civilian there – (Urdu Daily – Kashmir Uzma),-Wilayat also paid tributes to militants killed in the encounter with security forces on August 9 in Gulab Bagh village of Tral area (district Pulwama).
10-08-2017,Resistance camp paid tributes to militants killed in Tral and condemned killing of a civilian there – (Urdu Daily – Kashmir Uzma),The separatist organizations said that Kashmir issue has been attracting world attention due to these sacrifices.
10-08-2017,Resistance camp paid tributes to militants killed in Tral and condemned killing of a civilian there – (Urdu Daily – Kashmir Uzma),"No peace process would succeed without resolving Kashmir issue according to wishes and aspiration of the people of Kashmir, The separatist organizations added."
10-08-2017,“Mysterious meeting of Mehbooba Mufti with Dr. Farooq Abdullah – (Urdu Daily – Srinagar Times),"Chief Minister, Mehbooba Mufti’s meeting with National Conference President & Member Parliament, Dr. Farooq Abdullah at the latter’s residence in Srinagar has put politics of State at a critical stage."
10-08-2017,“Mysterious meeting of Mehbooba Mufti with Dr. Farooq Abdullah – (Urdu Daily – Srinagar Times),"Though one-hour long meeting between the two is still a secret, but reports about it having been limited to discussion on Article 35/A are making rounds in all directions."
10-08-2017,“Mysterious meeting of Mehbooba Mufti with Dr. Farooq Abdullah – (Urdu Daily – Srinagar Times),Unexpected political turn of Mehbooba Mufti can’t be ignored as an ordinary event.
10-08-2017,“Mysterious meeting of Mehbooba Mufti with Dr. Farooq Abdullah – (Urdu Daily – Srinagar Times),Every party and every individual in the Government tried to weigh and understand one-hour long meeting between the two according to ones liking and disliking.
10-08-2017,“Mysterious meeting of Mehbooba Mufti with Dr. Farooq Abdullah – (Urdu Daily – Srinagar Times),Opinion of everyone is different from the other.
10-08-2017,“Mysterious meeting of Mehbooba Mufti with Dr. Farooq Abdullah – (Urdu Daily – Srinagar Times),Mehbooba Mufti’s mysterious meeting with Mehbooba Mufti’s arch rival; Dr. Farooq Abdullah is bound to create tumult on political front.
10-08-2017,“Mysterious meeting of Mehbooba Mufti with Dr. Farooq Abdullah – (Urdu Daily – Srinagar Times),"Dr. Farooq Abdullah has repeatedly said that Dr. Farooq Abdullah would be fulfilling dreams of Dr. Farooq Abdullah father, late Mufti Muhammad Sayeed, hinting towards Agenda of Alliance in which PDP has made a promise with BJP that special position of the State i.e."
10-08-2017,“Mysterious meeting of Mehbooba Mufti with Dr. Farooq Abdullah – (Urdu Daily – Srinagar Times),Article 370 would be safeguarded and BJP would be cooperating in this regard.
10-08-2017,“Mysterious meeting of Mehbooba Mufti with Dr. Farooq Abdullah – (Urdu Daily – Srinagar Times),But BJP’s efforts to remove Article 35/A from the books of Constitution might have brought Mehbooba’s patience to the brink.
10-08-2017,“Mysterious meeting of Mehbooba Mufti with Dr. Farooq Abdullah – (Urdu Daily – Srinagar Times),"According to reports, Dr. Farooq Abdullah must have sought help or support of Dr. Farooq Abdullah to defeat efforts being made for abrogation of Article 35/A The question is how Dr. Farooq Abdullah can help Dr. Farooq Abdullah in this regard when the Centre has made up the Centre mind to remove Article 35/A."
10-08-2017,“Mysterious meeting of Mehbooba Mufti with Dr. Farooq Abdullah – (Urdu Daily – Srinagar Times),"However, in case National Conference, PDP and Congress, with the support of several Assembly members, open a new front to remove BJP from power that would bring a political crisis in the State."
10-08-2017,“Mysterious meeting of Mehbooba Mufti with Dr. Farooq Abdullah – (Urdu Daily – Srinagar Times),Has Mehbooba Mufti ever tried to convey BJP that all political characters of the Valley are on same page with regard to Article 35/A; and all of them want to save them identity.
10-08-2017,“Mysterious meeting of Mehbooba Mufti with Dr. Farooq Abdullah – (Urdu Daily – Srinagar Times),But all this is a guess work.
10-08-2017,“Mysterious meeting of Mehbooba Mufti with Dr. Farooq Abdullah – (Urdu Daily – Srinagar Times),"However, one thing is definite that mysterious meeting of Mehbooba Mufti with Dr. Farooq Abdullah must have disturbed BJP."
10-08-2017,“Welcome of the meeting between Mehbooba Mufti and Dr. Farooq Abdullah – (Urdu Daily – Aftab),"Presently, the people of the State are in a state confusion and uncertain situation has snatched the people of the State peace."
10-08-2017,“Welcome of the meeting between Mehbooba Mufti and Dr. Farooq Abdullah – (Urdu Daily – Aftab),"In the meantime, a forward movement was observed when Chief Minister, Mehbooba Mufti held a meeting with National Conference Present & Member Parliament, Dr. Farooq Abdullah on Article 35/A and Article 370, seeking his support."
10-08-2017,“Welcome of the meeting between Mehbooba Mufti and Dr. Farooq Abdullah – (Urdu Daily – Aftab),"The latter has assured full support in the matter, saying that NC would fully support any step of the former to save the identity of State."
