01-08-2018,"Difayee Jamiat Ahle Hadees concluded organisational/Tableeg visit of Kulgam; Several youth associated with Tehreek Ahle Hadees joined Difayee Jamiat Ahle Hadees in Beerwah, Budgam - (Urdu Daily - Srinagar Times) ","A high level delegation of Difayee Jamiat Ahle Hadees, headed by District President, Kulgam, visited Tehsil Manzgam, Tehsil Devsar and Tehsil Damhal in Kulgam district where the delegation members exchanged views with Tehsil office-bearers on organizational matters and laid stress on strengthening the organization."
01-08-2018,"Difayee Jamiat Ahle Hadees concluded organisational/Tableeg visit of Kulgam; Several youth associated with Tehreek Ahle Hadees joined Difayee Jamiat Ahle Hadees in Beerwah, Budgam - (Urdu Daily - Srinagar Times) ","Later, an invitational ijtemah was organized at Mandhol, Tehsil Devsar, which was presided over by District President, Bashir Ahmed Malik."
01-08-2018,"Difayee Jamiat Ahle Hadees concluded organisational/Tableeg visit of Kulgam; Several youth associated with Tehreek Ahle Hadees joined Difayee Jamiat Ahle Hadees in Beerwah, Budgam - (Urdu Daily - Srinagar Times) ","Addressing an invitational ijtemah, District President threw light on organisational matters and said that one or two days’ District ijtemah would be organized soon for which members should make preparations."
01-08-2018,"Difayee Jamiat Ahle Hadees concluded organisational/Tableeg visit of Kulgam; Several youth associated with Tehreek Ahle Hadees joined Difayee Jamiat Ahle Hadees in Beerwah, Budgam - (Urdu Daily - Srinagar Times) ","Meanwhile, another ijtemah of Difayee Jamiat Ahle Hadees was organised at Takiya Lalpora by Tehsil Beerwah (district Budgam) which was presided over by Tehsil President Beerwah, Mushtaq Ahmed."
01-08-2018,"Difayee Jamiat Ahle Hadees concluded organisational/Tableeg visit of Kulgam; Several youth associated with Tehreek Ahle Hadees joined Difayee Jamiat Ahle Hadees in Beerwah, Budgam - (Urdu Daily - Srinagar Times) ","On the occasion, several orators and youths associated with Jamiat Ahle Hadees, Barbarshah, Srinagar have joined Difayee Jamiat Ahle Hadees."
01-08-2018,Behind curtain efforts for government formation; Muzaffar Hussain Beig could be Chief Minister  - (Urdu Dailies - Aftab/Chattan),"Amid efforts being made behind the curtain for government formation in the State, it has been revealed that the dispersed associates would be again taking over the seat of power in coming days."
01-08-2018,Behind curtain efforts for government formation; Muzaffar Hussain Beig could be Chief Minister  - (Urdu Dailies - Aftab/Chattan),"it was also learnt that Chief Ministers’ chair would be given to senior leader of PDP and Member Parliament, Muzaffar Hussain Beig."
01-08-2018,Behind curtain efforts for government formation; Muzaffar Hussain Beig could be Chief Minister  - (Urdu Dailies - Aftab/Chattan),Speculations and behind curtain efforts for government formation were strengthened when party insiders revealed that former coalition partners are once again making efforts to embrace each other and a big change at political level is expected in coming days.
01-08-2018,Behind curtain efforts for government formation; Muzaffar Hussain Beig could be Chief Minister  - (Urdu Dailies - Aftab/Chattan),"According to sources, BJP has fully agreed on Muzaffar Hussain Beig for Chief Minister’s post; and hustle bustle in this regard would be seen in the beginning of September."
01-08-2018,Raid by NIA in the house of Asiya Indrabi condemned - (Urdu Daily - Kashmir Uzma),"Chairman of J&K Liberation Front, Muhammad Yasin Malik has condemned raid by NIA in the house Asiya Indrabi, who is presently lodged in Mandwali jail along with Fehmeeda Sofi and Nahida Nasreen."
01-08-2018,Raid by NIA in the house of Asiya Indrabi condemned - (Urdu Daily - Kashmir Uzma),Indian rulers should keep in mind that such steps won’t browbeat Kashmiris and these steps will also face defeat.
01-08-2018,Now nobody is going to believe Mehbooba Mufti: Shameema Firdous - (Urdu Daily - Kashmir Uzma),"Addressing one-day women’s convention at Faqir Gujri, President of National Conference Women’s Wing, Shameema Firdous has said that Kashmiris have seen nothing except destruction since the day when PDP forged alliance with BJP."
01-08-2018,Now nobody is going to believe Mehbooba Mufti: Shameema Firdous - (Urdu Daily - Kashmir Uzma),"Earlier, PDP did not see anything wrong in BJP, but when Mehbooba Mufti was removed from power Mehbooba Mufti felt the alliance with BJP as a cup of poison and bed of thorns."
01-08-2018,Now nobody is going to believe Mehbooba Mufti: Shameema Firdous - (Urdu Daily - Kashmir Uzma),Now nobody is going to believe in Mehbooba’s deceits and cheating.
01-08-2018,Now nobody is going to believe Mehbooba Mufti: Shameema Firdous - (Urdu Daily - Kashmir Uzma),"Today Mehbooba Mufti has been speaking about Article 35/A, Article 370, while as Mehbooba Mufti imposed Central laws like GST, SARFESI Act and Food Bill in the State."
01-08-2018,Now nobody is going to believe Mehbooba Mufti: Shameema Firdous - (Urdu Daily - Kashmir Uzma),"Mehbooba Mufti has also hollowed Article 370 and paved way for abrogation of Article 35/A, Shameema added."
01-08-2018,People should remain cautious about conspiracies against Article 35/A: J&K Bachao Tehreek - (Urdu Daily - Tameel-i-Irshad),"‘Jammu and Kashmir Bachao Tehreek’ held a meeting of Bachao Tehreek Working Committee in Srinagar which was presided over by Bachao Tehreek President, Abdul Gani Vakil."
01-08-2018,People should remain cautious about conspiracies against Article 35/A: J&K Bachao Tehreek - (Urdu Daily - Tameel-i-Irshad),"Apprehensions about abrogation of Article 370 and Article 35/A were discussed in a meeting of its Working Committee in Srinagar which was presided over by its President, Abdul Gani Vakil."
01-08-2018,People should remain cautious about conspiracies against Article 35/A: J&K Bachao Tehreek - (Urdu Daily - Tameel-i-Irshad),"It was felt that Central Government is hell bent to abrogate these Articles, which won’t be in the interest of country; instead relations of J&K with it could be in danger."
01-08-2018,People should remain cautious about conspiracies against Article 35/A: J&K Bachao Tehreek - (Urdu Daily - Tameel-i-Irshad),"it was said in a meeting of its Working Committee in Srinagar which was presided over by its President, Abdul Gani Vakil that J&K is linked with country because of Article 370 and if efforts are made to abrogate Article 370 and Article 35/A, relation of State with country will end."
01-08-2018,People should remain cautious about conspiracies against Article 35/A: J&K Bachao Tehreek - (Urdu Daily - Tameel-i-Irshad),"All political, social and trade leaders were appealed to unite against forces which are making efforts to harm the special position of State."
01-08-2018,“Hearing on Article 35/A in the Supreme Court” - (Urdu Daily - Aftab),"The people of Kashmir have unanimously decided to defend this Article in any case, because this Article is neither against any religion nor any region, but existence of all three regions lies in existence of all three regions."
01-08-2018,“Hearing on Article 35/A in the Supreme Court” - (Urdu Daily - Aftab),"Resistance leadership, traders, shopkeepers, transporters and labourers are presently in a state of restlessness and tension."
01-08-2018,“Hearing on Article 35/A in the Supreme Court” - (Urdu Daily - Aftab),Nobody knows what is going to happen when this Article this Article comes up for hearing in the Supreme Court on August 6.
01-08-2018,“Hearing on Article 35/A in the Supreme Court” - (Urdu Daily - Aftab),"Twenty Seven organisations have decided to start agitation in case decision on this Article this Article comes against expectations of Kashmiri people, which could create law and order problem."
01-08-2018,“Hearing on Article 35/A in the Supreme Court” - (Urdu Daily - Aftab),Twenty Seven organisations have also announced to support shutdown call given by resistance leadership.
01-08-2018,“Hearing on Article 35/A in the Supreme Court” - (Urdu Daily - Aftab),"In the meantime, Civil Society, in a communiqué, has invited attention of the Governor, J&K in this regard, saying that if decision of the Supreme Court comes against expectations of Kashmiri people situation could worsen in the Valley."
01-08-2018,“Hearing on Article 35/A in the Supreme Court” - (Urdu Daily - Aftab),Civil Society has also appealed the Governor to use the Governor influence for postponement of hearing on this Article in the Supreme Court.
01-08-2018,“Hearing on Article 35/A in the Supreme Court” - (Urdu Daily - Aftab),"Political analysts are of the view that before dangers to be faced by State of J&K and the country after annulment of these Articles, it needs to be seen why these Articles were implemented in the State."
01-08-2018,“Hearing on Article 35/A in the Supreme Court” - (Urdu Daily - Aftab),these Articles also said that Kashmir would not have been a part of India if these Articles had not been implemented; and these Articles have been playing important role in keeping the State linked with India.
01-08-2018,“Hearing on Article 35/A in the Supreme Court” - (Urdu Daily - Aftab),Now this Article 35/A will come up for hearing on August 6 before a 5-member Bench of the Supreme Court.
01-08-2018,“Where is the strategy” - (Urdu Daily - Uqab),Atmosphere of anxiety and suspense prevails in the Valley on Article 35/A.
01-08-2018,“Where is the strategy” - (Urdu Daily - Uqab),Everybody is restless about the decision on petitions filed in the Supreme Court against Article 35/A.
01-08-2018,“Where is the strategy” - (Urdu Daily - Uqab),Resistance leadership has given two-day hartal call and Bar Association has constituted a delegation for legal struggle.
01-08-2018,“Where is the strategy” - (Urdu Daily - Uqab),Alliance of traders and industrial units has also announced readiness for struggle and any kind of sacrifice to defend Article 35/A.
01-08-2018,“Where is the strategy” - (Urdu Daily - Uqab),"All these apprehensions are being expressed only because BJP is ruling at the Centre, working on BJP agenda to repeal Article 35/A."
01-08-2018,“Where is the strategy” - (Urdu Daily - Uqab),The question is that people of all sections in the Valley are ready to defend Article 35/A.
01-08-2018,“Where is the strategy” - (Urdu Daily - Uqab),The thinking of resistance leadership is also same on this issue.
01-08-2018,“Where is the strategy” - (Urdu Daily - Uqab),But nobody has any effective and solid strategy for this issue.
01-08-2018,“Where is the strategy” - (Urdu Daily - Uqab),It is a big question.
01-08-2018,“Where is the strategy” - (Urdu Daily - Uqab),Intentions to come on roads and give sacrifices on any issue is not enough; but a credible strategy is more important.
01-08-2018,“Where is the strategy” - (Urdu Daily - Uqab),"In his recent statement, former Union Minister and Congress leader, Saif-ud-Din Soz has hinted towards this, suggesting that mainstream parties can constitute a delegation under the leadership of sitting MP, Dr. Farooq Abdullah and inform the Prime Minister about sentiments and concern of State’s people on the issue and consequences of any tinkering with Article 35/A."
01-08-2018,“Where is the strategy” - (Urdu Daily - Uqab),"Discipline is needed more on national issues, and if there is no discipline no struggle or sacrifices could fetch results."
01-08-2018,“Where is the strategy” - (Urdu Daily - Uqab),Entire nation is united for the safeguard of Article 35/A and no one is ready to compromise on the safeguard of Article 35/A.
01-08-2018,“Where is the strategy” - (Urdu Daily - Uqab),"Therefore, if leaders, whether from mainstream or resistance camp, exhibit wisdom and farsightedness at this crucial juncture, leaders, whether from mainstream or resistance camp, exhibit wisdom and farsightedness at this crucial juncture role will be appreciated in coming times."
01-08-2018,“Where is the strategy” - (Urdu Daily - Uqab),Mutual rivalries should not become an obstacle so that people could achieve success in this hard test.
01-08-2018,“Where is the strategy” - (Urdu Daily - Uqab),"Consultation, if needed, should be held, because indiscipline disturbs the situation which becomes reason for the failure of movements."
01-08-2018,“Where is the strategy” - (Urdu Daily - Uqab),"Therefore, it is the foremost duty of leaders to make efforts for unity for achieving at least the single objective."
01-08-2018,“Where is the strategy” - (Urdu Daily - Uqab),It is necessary; and efforts in this direction should be started right now.
01-08-2018,“Where is the strategy” - (Urdu Daily - Uqab),It is hoped that people from all sections of thought would try to cooperate with each other.
02-08-2018,Several Hindu extremist organisations want to change Kashmir into a battle field: J&K Civil Society - (Urdu Daily - Srinagar Times),"A meeting of ‘Jammu and Kashmir Civil Society’ was held in Srinagar under the presidentship of Muhammad Altaf Jadoora (President) in which, besides others, all District and Tehsil Presidents participated."
02-08-2018,Several Hindu extremist organisations want to change Kashmir into a battle field: J&K Civil Society - (Urdu Daily - Srinagar Times),Discussion was held on Article 35/A and Article 370 in the meeting.
02-08-2018,Several Hindu extremist organisations want to change Kashmir into a battle field: J&K Civil Society - (Urdu Daily - Srinagar Times),Discussion was alleged in the meeting that some extremist organisations of India want to change Kashmir into a battle ground to take political advantage in India.
02-08-2018,Several Hindu extremist organisations want to change Kashmir into a battle field: J&K Civil Society - (Urdu Daily - Srinagar Times),Relation of Kashmir with India depends on Article 370 and Article 35/A and Article 35/A existed in the State before independence.
02-08-2018,Several Hindu extremist organisations want to change Kashmir into a battle field: J&K Civil Society - (Urdu Daily - Srinagar Times),the meeting decided to fight tooth and nail the efforts of any change in these Articles.
02-08-2018,Several Hindu extremist organisations want to change Kashmir into a battle field: J&K Civil Society - (Urdu Daily - Srinagar Times),"In this connection, a team was constituted under the leadership of Advocate Altaf Gandarbali which would be taking steps for legal action in the Supreme Court against this conspiracy."
02-08-2018,Several Hindu extremist organisations want to change Kashmir into a battle field: J&K Civil Society - (Urdu Daily - Srinagar Times),"In case efforts are made to tinker with these Articles, Central offices in Kashmir won’t be allowed to function, for which Government of India would be responsible."
02-08-2018,Article 35/A should not be touched: Tramboo and Rathore - (Urdu Daily - Srinagar Times),"In a joint statement, Patron of J&K Liberation Front (R), Barrister Abdul Majid Tramboo and Advocate Ayub Rathore have condemned intentions of India against Article 35/A, saying that people of the State would fight against any change or amendment in this Article."
02-08-2018,Article 35/A should not be touched: Tramboo and Rathore - (Urdu Daily - Srinagar Times),"India Government or this Article judiciary has no authority to abrogate or amend this Article, India Government or its judiciary said."
02-08-2018,Article 35/A should not be touched: Tramboo and Rathore - (Urdu Daily - Srinagar Times),"While appealing people from all sections of society to remain cautious in this regard, people from all sections of society supported the protest call given by resistance circles and said that people have given sacrifices for safeguard of this Act and people won’t hesitate in giving sacrifices of men and material for achieving right to self-determination."
02-08-2018,“Article 35/A and Jammu & Kashmir” - (Urdu Daily - Srinagar Times),"With the approaching date of August 6, anxiety has been increasing among political and public circles."
02-08-2018,“Article 35/A and Jammu & Kashmir” - (Urdu Daily - Srinagar Times),"On this day, the Supreme Court is probably going to give the Supreme Court verdict on the writ petition in which repeal of Article 35/A has been demanded."
02-08-2018,“Article 35/A and Jammu & Kashmir” - (Urdu Daily - Srinagar Times),"Resistance leadership has been expressing the Supreme Court anger on this issue and warning governments that in case efforts are made to abrogate Article 370 in the garb of removing of Article 35/A, people would come on roads to protest against the Supreme Court."
02-08-2018,“Article 35/A and Jammu & Kashmir” - (Urdu Daily - Srinagar Times),"Meanwhile, traders have raised traders voice in favour of Article 35/A and members of Civil Society have also come in the field."
02-08-2018,“Article 35/A and Jammu & Kashmir” - (Urdu Daily - Srinagar Times),Efforts of BJP in this matter are meaningful.
02-08-2018,“Article 35/A and Jammu & Kashmir” - (Urdu Daily - Srinagar Times),Opposition has alleged that BJP is behind taking this matter to the Supreme Court.
02-08-2018,“Article 35/A and Jammu & Kashmir” - (Urdu Daily - Srinagar Times),Congress has said that no power on earth has authority to repeal Article 35/A.
02-08-2018,“Article 35/A and Jammu & Kashmir” - (Urdu Daily - Srinagar Times),"According to Hurriyat, it is the matter of life and death for Kashmiris and Kashmiris won’t tolerate abrogation of this law."
02-08-2018,“Article 35/A and Jammu & Kashmir” - (Urdu Daily - Srinagar Times),"Dr. Farooq Abdullah and other leaders of National Conference have cautioned that if efforts to abrogate Article 35/A and Article 370 are allowed to succeed, link of J&K with India will automatically break."
02-08-2018,“Article 35/A and Jammu & Kashmir” - (Urdu Daily - Srinagar Times),"Whether the Centre pays any heed on suggestions of Dr. Farooq and opposition will be known within few days, but the important job done by BJP was that BJP has put ‘Agenda of Alliance’ held with PDP on back burner to take forward PDP own agenda."
02-08-2018,“Issue of State’s identity” - (Urdu Daily - Tameel-i-Irshad),this Article is very important for the identity and integrity of J&K State.
02-08-2018,“Issue of State’s identity” - (Urdu Daily - Tameel-i-Irshad),Guarantees for this Article also exist in the Constitution of India.
02-08-2018,“Issue of State’s identity” - (Urdu Daily - Tameel-i-Irshad),"But now efforts are being made to remove this Article, for which the issue has been taken to the Supreme Court."
02-08-2018,“Issue of State’s identity” - (Urdu Daily - Tameel-i-Irshad),"While expressing apprehensions about hearing in the case scheduled for August 6, a wave of anxiety has gripped political galleries and public circles."
02-08-2018,“Issue of State’s identity” - (Urdu Daily - Tameel-i-Irshad),"Despite different political ideologies, people are unanimous with regard to apprehensions about Article 35/A."
02-08-2018,“Issue of State’s identity” - (Urdu Daily - Tameel-i-Irshad),Resistance leadership and mainstream leaders have also become active and are unanimous to ensure protection of this Article.
02-08-2018,“Issue of State’s identity” - (Urdu Daily - Tameel-i-Irshad),"It is worth mention that people of State appear active to protect the identity of State, because it is a matter of people of State life and death."
02-08-2018,“Issue of State’s identity” - (Urdu Daily - Tameel-i-Irshad),"If this Article is tinkered with, the people of State would be losing privileges and rights which won’t be less than a tragedy."
02-08-2018,“Issue of State’s identity” - (Urdu Daily - Tameel-i-Irshad),Mainstream parties of the State are also annoyed in this regard; and Mainstream parties of the State are ready to give any sacrifice for the safeguard of Article 35/A.
02-08-2018,“Issue of State’s identity” - (Urdu Daily - Tameel-i-Irshad),"Keeping this situation and sentiments in view, the Central Government will have to intervene to protect this Article, because any serious situation proves crisis at country level."
02-08-2018,“Issue of State’s identity” - (Urdu Daily - Tameel-i-Irshad),"Therefore, instead of taking negative steps, the Central Government should take steps for resolving basic issues so that atmosphere of peace could be established in the region."
02-08-2018,“Imran Khan and Narendra Modi could being a new era” - (Urdu Daily - Aftab) ,"According to reports, Imran Khan would be taking oath of office as Prime Minister of Pakistan on August 11."
02-08-2018,“Imran Khan and Narendra Modi could being a new era” - (Urdu Daily - Aftab) ,"Traditionally, renowned personalities of the world are being invited on such occasions and there is possibility that Prime Minister of India, Narendra Modi would also be invited in this function."
02-08-2018,“Imran Khan and Narendra Modi could being a new era” - (Urdu Daily - Aftab) ,"During telephonic talk with Imran Khan, Prime Minister of Pakistan has congratulated the former and expressed wish for a strong Pakistan."
02-08-2018,“Imran Khan and Narendra Modi could being a new era” - (Urdu Daily - Aftab) ,Contact between the Prime Minister of India and Imran Khan has been welcomed at diplomatic level.
02-08-2018,“Imran Khan and Narendra Modi could being a new era” - (Urdu Daily - Aftab) ,"If Indo-Pak leaders wish sincerely, solution for all disputed issued could be found out, for which table for dialogue has to be put in place."
02-08-2018,“Imran Khan and Narendra Modi could being a new era” - (Urdu Daily - Aftab) ,"So, if both leaders wish India and Pakistan can become friends, all disputed issues, including Kashmir issue, would be resolved amicably."
02-08-2018,“Mob violence:  From road to Studio” -  by Dr. Syed Fazil Hussain Parvez -(Urdu Daily - Kashmir Uzma),"Despite condemnation statements, with a caution of law, by every political leader, including the Prime Minister and religious leaders, lynching or mob violence has been continuing unabatedly."
02-08-2018,“Mob violence:  From road to Studio” -  by Dr. Syed Fazil Hussain Parvez -(Urdu Daily - Kashmir Uzma),"every political leader, including the Prime Minister and religious leaders, lynching or mob violence has not remained limited to roads or villages only; instead every political leader, including the Prime Minister and religious leaders, lynching or mob violence has become common in every sphere of life."
02-08-2018,“Mob violence:  From road to Studio” -  by Dr. Syed Fazil Hussain Parvez -(Urdu Daily - Kashmir Uzma),Quarrels in TV shows are not new.
02-08-2018,“Mob violence:  From road to Studio” -  by Dr. Syed Fazil Hussain Parvez -(Urdu Daily - Kashmir Uzma),But lynching of Muslims has also reached to TV studios.
02-08-2018,“Mob violence:  From road to Studio” -  by Dr. Syed Fazil Hussain Parvez -(Urdu Daily - Kashmir Uzma),Our job is to remain alert and make every effort to take elements involved in mob violence to justice.
02-08-2018,“Mob violence:  From road to Studio” -  by Dr. Syed Fazil Hussain Parvez -(Urdu Daily - Kashmir Uzma),Our should strengthen Our contacts with Hindu brethren of county and inform Hindu brethren of county about politics behind this poisonous game of fascists.
02-08-2018,“Mob violence:  From road to Studio” -  by Dr. Syed Fazil Hussain Parvez -(Urdu Daily - Kashmir Uzma),Our need to understand that fascist politicians have failed in resolving real issues of the country.
02-08-2018,“Mob violence:  From road to Studio” -  by Dr. Syed Fazil Hussain Parvez -(Urdu Daily - Kashmir Uzma),"Therefore, fascist politicians want to sow the seeds of mob violence which could become destructive for the nation, only to hide fascist politicians non-performance and weaknesses, so that such inhuman actions and violence-based politics could be justified and these leaders could be saved from evaluation in view of next elections."
03-08-2018,Checking of vehicles/motorcycles and frisking of passengers starts in view of Independence Day - (Urdu Dailies - Srinagar Times/Aftab/Uqab),"To ensure peaceful celebrations on the occasion of Independence Day, J&K Police and CRPF have started checking of vehicles/motorcycles and searches of passengers in Srinagar city to avert any plan of militants."
03-08-2018,Checking of vehicles/motorcycles and frisking of passengers starts in view of Independence Day - (Urdu Dailies - Srinagar Times/Aftab/Uqab),Naka points have been established at different places in the city where searches are being conducted by force personnel.
03-08-2018,Article 35/A will be protected in any case for special position of the State: KUTA - (Urdu Daily - Srinagar Times),"Kashmir University Teachers Association (KUTA) has said that Article 35/A, Article 370 and Section ‘6’ would be safeguarded in any case, urging the Central Government to evade affecting special position of Jammu and Kashmir."
03-08-2018,Article 35/A will be protected in any case for special position of the State: KUTA - (Urdu Daily - Srinagar Times),"In a statement, Spokesman of KUTA has said that efforts being made to repeal Article 35/A are intolerable."
03-08-2018,Article 35/A will be protected in any case for special position of the State: KUTA - (Urdu Daily - Srinagar Times),These rights existed in the State of Jammu and Kashmir Kashmir before freedom and These rights abrogation will fetch serious consequences.
