23-01-2018,“Why the properties of civilians targeted?” -  (Urdu Daily – Kashmir Uzma),"According to news, security forces burnt down a motorcycle, damaged 36 residence and 10 private vehicles."
23-01-2018,“Why the properties of civilians targeted?” -  (Urdu Daily – Kashmir Uzma),"Picture shows that forces damaged the materials insides the houses, besides destroying the necessary things."
23-01-2018,“Why the properties of civilians targeted?” -  (Urdu Daily – Kashmir Uzma),Such type of actions cannot be declared as legal.
23-01-2018,“Why the properties of civilians targeted?” -  (Urdu Daily – Kashmir Uzma),There is no doubt that forces can take actions and conduct search operations in militant hiding places but it is not right to target militant hiding places families and relatives in the name of search operations.
23-01-2018,“Why the properties of civilians targeted?” -  (Urdu Daily – Kashmir Uzma),Politicians and societies have expressed annoyance on such actions.
23-01-2018,“Why the properties of civilians targeted?” -  (Urdu Daily – Kashmir Uzma),On the matter of Redwani discussion were made in State Assembly.
23-01-2018,“Why the properties of civilians targeted?” -  (Urdu Daily – Kashmir Uzma),"However, Government always give assurance to take actions on the matter of Redwani discussion after investigation, but always ignored."
23-01-2018,“Why the properties of civilians targeted?” -  (Urdu Daily – Kashmir Uzma),Why this happens always?
23-01-2018,“Why the properties of civilians targeted?” -  (Urdu Daily – Kashmir Uzma),"State Government, which is a representative of people, should examine the matter of Redwani discussion and take actions."
23-01-2018,“Why the properties of civilians targeted?” -  (Urdu Daily – Kashmir Uzma),"Administration always give assurance that action would be taken against the culprits, but no action has been taken so far."
23-01-2018,“Why the properties of civilians targeted?” -  (Urdu Daily – Kashmir Uzma),"According to constitution and law, Government is responsible for the security of properties and life of common people, therefore State Government should examine the situation and effective measures should be taken."
23-01-2018,“Why the properties of civilians targeted?” -  (Urdu Daily – Kashmir Uzma),"Otherwise, the situation and effective measures would be worsened."
23-01-2018,“Why the properties of civilians targeted?” -  (Urdu Daily – Kashmir Uzma),Government should examine the affected persons of Redwani and compensate the affected persons of Redwani.
23-01-2018,“Why the properties of civilians targeted?” -  (Urdu Daily – Kashmir Uzma),"Further, Government should do the affected persons of Redwani duty to stop such actions of security forces in future."
23-01-2018,"“In the name of General Bipan Rawat, from Altaf Bukhari: I have to say something – by Zafar Iqbal Minhas-(Urdu Daily – Uqab)",Harsh statements by right wing extremist leaders in connection with Kashmir have become daily norms.
23-01-2018,"“In the name of General Bipan Rawat, from Altaf Bukhari: I have to say something – by Zafar Iqbal Minhas-(Urdu Daily – Uqab)","Whenever these people who do not know about the history of Kashmir issue, open these people who do not know about the history of Kashmir issue mouth to say some thing about Kashmir then these people who do not know about the history of Kashmir issue never say good words about Kashmir."
23-01-2018,"“In the name of General Bipan Rawat, from Altaf Bukhari: I have to say something – by Zafar Iqbal Minhas-(Urdu Daily – Uqab)","Now Army Chief, General Bipan Rawat has given a statement about Kashmir which supports the views of Rashtriya Swyam Sangh, a Right Wing Hindu Party."
23-01-2018,"“In the name of General Bipan Rawat, from Altaf Bukhari: I have to say something – by Zafar Iqbal Minhas-(Urdu Daily – Uqab)","On Army day, January 10, General Bipan Rawat while addressing a press conference has forced to use an untraditional and out of box strategy to get rid of Muslim extremism and thought of ending enmity of India with Kashmir."
23-01-2018,"“In the name of General Bipan Rawat, from Altaf Bukhari: I have to say something – by Zafar Iqbal Minhas-(Urdu Daily – Uqab)",He also held government schools responsible for teaching extremism and anti-India emotions besides mosques and Madrasas.
23-01-2018,"“In the name of General Bipan Rawat, from Altaf Bukhari: I have to say something – by Zafar Iqbal Minhas-(Urdu Daily – Uqab)","According to General Rawat, Government schools are spreading extremism among the students by which students become extremists."
23-01-2018,"“In the name of General Bipan Rawat, from Altaf Bukhari: I have to say something – by Zafar Iqbal Minhas-(Urdu Daily – Uqab)",We should keep an eye on the government schools to control the government schools.
23-01-2018,"“In the name of General Bipan Rawat, from Altaf Bukhari: I have to say something – by Zafar Iqbal Minhas-(Urdu Daily – Uqab)","He said to the reporters that if you have been gone to government schools in Kashmir then you would come to know that teachers taught students about two maps, one of India and another of Jammu and Kashmir."
23-01-2018,"“In the name of General Bipan Rawat, from Altaf Bukhari: I have to say something – by Zafar Iqbal Minhas-(Urdu Daily – Uqab)",Students thinks that Students are part of the country but have a different identify.
23-01-2018,"“In the name of General Bipan Rawat, from Altaf Bukhari: I have to say something – by Zafar Iqbal Minhas-(Urdu Daily – Uqab)",This is the reason that such students became stone pelters while the students of Burn Hall School and DPS do not participate in such actions because teachers do not teach teachers about two maps.
23-01-2018,"“In the name of General Bipan Rawat, from Altaf Bukhari: I have to say something – by Zafar Iqbal Minhas-(Urdu Daily – Uqab)","In the meantime, Syed Altaf Bukhari, Education Minister expressed grief over the statement and opined that General Rawat should mind General Rawat own business."
23-01-2018,"“In the name of General Bipan Rawat, from Altaf Bukhari: I have to say something – by Zafar Iqbal Minhas-(Urdu Daily – Uqab)","Bukhari who was giving answers to reporters said that being an Army Chief, we honour General Rawat but I don’t think that he is skilled in education who can tell we what should we do and not do in we domain."
23-01-2018,"“In the name of General Bipan Rawat, from Altaf Bukhari: I have to say something – by Zafar Iqbal Minhas-(Urdu Daily – Uqab)",It would be better for he to mind he own business.
23-01-2018,"“In the name of General Bipan Rawat, from Altaf Bukhari: I have to say something – by Zafar Iqbal Minhas-(Urdu Daily – Uqab)","he must know that in every state of the country two maps are taught in schools, one of the state and another of the country."
23-01-2018,"“In the name of General Bipan Rawat, from Altaf Bukhari: I have to say something – by Zafar Iqbal Minhas-(Urdu Daily – Uqab)",But here we have own constitution and flag.
23-01-2018,"“In the name of General Bipan Rawat, from Altaf Bukhari: I have to say something – by Zafar Iqbal Minhas-(Urdu Daily – Uqab)",The syllabus of education is written in the state list.
23-01-2018,"“In the name of General Bipan Rawat, from Altaf Bukhari: I have to say something – by Zafar Iqbal Minhas-(Urdu Daily – Uqab)","Being an Education Minister, I know better what I have to do."
23-01-2018,"“In the name of General Bipan Rawat, from Altaf Bukhari: I have to say something – by Zafar Iqbal Minhas-(Urdu Daily – Uqab)",If any direction comes then any direction can be from Sate Chief Minister.
23-01-2018,"“In the name of General Bipan Rawat, from Altaf Bukhari: I have to say something – by Zafar Iqbal Minhas-(Urdu Daily – Uqab)",Sate Chief Minister also rejected the statement that extremism are taught in government schools and students are victims of extremism.
24-01-2018,Efforts are being made to restrain Kashmiris from struggle: Suwat-ul-Haq J&K expressed concern over the arrests– (Urdu Dailies –Srinagar Times/Tameel-i-Irshad/Kashmir Uzma),"Denouncing the search operations being conducted under CASO after 17 years against unarmed Kashmiris in different corners of the Valley, fresh wave of terror unleashed by security forces ahead of January 26, crackdowns and arrests, spokesperson of Suwat-ul-Haq has said that efforts are being made to restrain Kashmiris from Kashmiris right struggle."
24-01-2018,Efforts are being made to restrain Kashmiris from struggle: Suwat-ul-Haq J&K expressed concern over the arrests– (Urdu Dailies –Srinagar Times/Tameel-i-Irshad/Kashmir Uzma),"Suwat-ul-Haq interpreted the curfews, restrictions and bans as a divisive policy of pushing back the State in respect of education, economy and development."
24-01-2018,Zaffar Akbar Bhat appealed joint resistance leadership to unite on one platform – (Urdu Dailies – Aftab/Tameel-i-Irshad),"Zafar Akbar Bhat, chairman Salvation Movement has appealed joint leadership to unite on one platform for the benefit of resistance movement, emotion, feelings and wishes of Kashmiris."
24-01-2018,Zaffar Akbar Bhat appealed joint resistance leadership to unite on one platform – (Urdu Dailies – Aftab/Tameel-i-Irshad),"When on one hand oppression and tyranny of government is ready to discourage the Kashmiris, establishment of second faction within the resistance leadership is harmful for the movement and Kashmir issue."
24-01-2018,Zaffar Akbar Bhat appealed joint resistance leadership to unite on one platform – (Urdu Dailies – Aftab/Tameel-i-Irshad),"He said that there are already two factions in the resistance leadership, if third faction is established then third faction could affect the continuing struggle and Kashmir issue."
24-01-2018,Zaffar Akbar Bhat appealed joint resistance leadership to unite on one platform – (Urdu Dailies – Aftab/Tameel-i-Irshad),It is inevitable to establish a joint platform.
24-01-2018,“Open arms and open doors” -  (Urdu Daily – Srinagar Times),"In an interview of a private TV channel Prime Minister Narendra Modi while highlighting the policies and projects of Central Government reiterated the statements given on Independence Day (15 August) last year about Kashmir issue in which he had said, “neither abuse nor bullets, Kashmir issue could be solved by embracing Kashmiris”."
24-01-2018,“Open arms and open doors” -  (Urdu Daily – Srinagar Times),This statement has become a cause of discussion among the political circles.
24-01-2018,“Open arms and open doors” -  (Urdu Daily – Srinagar Times),"In Kashmir Valley, most political leaders welcomed This statement and Hurriyat leaders said that if Narendra Modi wants to solve Kashmir issue by embracing Kashmiris then we welcome Kashmir issue."
24-01-2018,“Open arms and open doors” -  (Urdu Daily – Srinagar Times),"In the fresh interview, Narendra Modi reiterated This statement, but Narendra Modi said that Narendra Modi door is open within the limitation of Indian constitution."
24-01-2018,“Open arms and open doors” -  (Urdu Daily – Srinagar Times),Narendra Modi explained that according to constitution every citizen have right to ask question to Prime Minister.
24-01-2018,“Open arms and open doors” -  (Urdu Daily – Srinagar Times),"Several people welcomed the decision, but some people rejected Narendra Modi statements by declaring the decision as traditional and habitual ways of a politician."
24-01-2018,“Open arms and open doors” -  (Urdu Daily – Srinagar Times),"But in a special programme when Home Minister Rajnath Singh declare Dineshwar Sharma as government representative to solve Kashmir issue, according to steps of Prime Minister, then everyone felt that Centre has really taken a good initiative for dialogue process."
24-01-2018,“Open arms and open doors” -  (Urdu Daily – Srinagar Times),"After this announcement Dineshwar Sharma, visited Jammu and Kashmir 4 times, but the reality is that no solution was come up from his visit."
24-01-2018,“Open arms and open doors” -  (Urdu Daily – Srinagar Times),"Despite visiting Kashmir four times, Dineshwar Sharma could not established a meeting with any Hurriyat leader."
24-01-2018,“Open arms and open doors” -  (Urdu Daily – Srinagar Times),"However, Hurriyat has not rejected Hurriyat Hurriyat and people know about a meeting with any Hurriyat leader."
24-01-2018,“Open arms and open doors” -  (Urdu Daily – Srinagar Times),It is clear that if the representative would not meet Hurriyat leaders then Kashmir issue could not be solved.
24-01-2018,“Open arms and open doors” -  (Urdu Daily – Srinagar Times),"Kashmir issue is an international issue, so besides Hurriyat leaders, participation of Pakistan is also important."
24-01-2018,“Open arms and open doors” -  (Urdu Daily – Srinagar Times),"Now Narendra Modi is making announcement that Narendra Modi doors are open for everyone, but neither Hurriyat is willing to talk within the limitation of constitution nor other separatist leaders, then on which way Narendra Modi will embrace the Kashmiris."
24-01-2018,“Open arms and open doors” -  (Urdu Daily – Srinagar Times),The meaning of embrace is quite wide.
24-01-2018,“Open arms and open doors” -  (Urdu Daily – Srinagar Times),Feeling of the Kashmiris needs to be understood.
24-01-2018,“Open arms and open doors” -  (Urdu Daily – Srinagar Times),It is not possible to solve Kashmir issue by two parties.
24-01-2018,“Open arms and open doors” -  (Urdu Daily – Srinagar Times),Kashmir issue has three parties and two parties should come on one platform and should show flexibilities in three parties viewpoints.
24-01-2018,“Open arms and open doors” -  (Urdu Daily – Srinagar Times),"The statement of Narendra Modi, that Narendra Modi arms and doors were open for anyone is good, but Kashmir issue needs to be supported by a courageous decision."
24-01-2018,“Hajj Subsidy: Hornet’s nest– by Hafiz Namani -(Urdu Daily – Uqab),In India everyday one issue related to Muslims become a topic for discussion.
24-01-2018,“Hajj Subsidy: Hornet’s nest– by Hafiz Namani -(Urdu Daily – Uqab),Now discussion of Hajj Subsidy is on every channel and social media.
24-01-2018,“Hajj Subsidy: Hornet’s nest– by Hafiz Namani -(Urdu Daily – Uqab),When going for Hajj was stopped by ship then aeroplane was the only way to go for Hajj.
24-01-2018,“Hajj Subsidy: Hornet’s nest– by Hafiz Namani -(Urdu Daily – Uqab),There was much difference between the fare of ship and aeroplane which can be imagined by an example that when the last group of Hajj returned by ship then the fare was Rs.
24-01-2018,“Hajj Subsidy: Hornet’s nest– by Hafiz Namani -(Urdu Daily – Uqab),Every Hajji told that when Every Hajji reached Mumbai Every Hajji used to stay in the inn of Sabu Siddiq free of cost.
24-01-2018,“Hajj Subsidy: Hornet’s nest– by Hafiz Namani -(Urdu Daily – Uqab),When Hajj was started through aeroplane then Central Hajj Committee and State Hajj Committee were established.
24-01-2018,“Hajj Subsidy: Hornet’s nest– by Hafiz Namani -(Urdu Daily – Uqab),Hajj house were constructed in states and Rs.
24-01-2018,“Hajj Subsidy: Hornet’s nest– by Hafiz Namani -(Urdu Daily – Uqab),300/- was been taken as a rent.
24-01-2018,“Hajj Subsidy: Hornet’s nest– by Hafiz Namani -(Urdu Daily – Uqab),Besides this whole money were collected from the Hajjis before a month and deposited in Banks.
24-01-2018,“Hajj Subsidy: Hornet’s nest– by Hafiz Namani -(Urdu Daily – Uqab),The interest of this whole money is more than 30 crore.
24-01-2018,“Hajj Subsidy: Hornet’s nest– by Hafiz Namani -(Urdu Daily – Uqab),"Hajj organisers and common Muslims appealed for ending the Hajj subsidy, as the money given by government is not free from interest."
24-01-2018,“Hajj Subsidy: Hornet’s nest– by Hafiz Namani -(Urdu Daily – Uqab),Hajj committees mix the rupees of Hajj taken from the Hajjis with the interests of government.
24-01-2018,“Hajj Subsidy: Hornet’s nest– by Hafiz Namani -(Urdu Daily – Uqab),Agreements were also made that the Hajjis were not bound to go by Air India.
24-01-2018,“Hajj Subsidy: Hornet’s nest– by Hafiz Namani -(Urdu Daily – Uqab),One Muslim judge Aftab Alam told Supreme Court that if One Muslim judge end the Hajj subsidy within 10 years then the Hajj subsidy will complete in 2022.
24-01-2018,“Hajj Subsidy: Hornet’s nest– by Hafiz Namani -(Urdu Daily – Uqab),But Prime Minister ended they end the hajj subsidy within 10 years then it will complete in 2022 in 2018.
24-01-2018,“Hajj Subsidy: Hornet’s nest– by Hafiz Namani -(Urdu Daily – Uqab),"There should a be a provision to examine through tender of airlines that how many the Hajjis are going to perform Hajj, on which date how many Hajjis are going and returning, how many things how many Hajjis would bring after performing Hajj and how many fare would be taken from how many Hajjis."
24-01-2018,“Hajj Subsidy: Hornet’s nest– by Hafiz Namani -(Urdu Daily – Uqab),"Uwaisi urged Prime Minister that the money, which was given to Kumbh Mela or for programmes of Shri Shri Ji at Delhi, should be taken back and also the money given to the people going to different Yatras should be stopped."
24-01-2018,“Hajj Subsidy: Hornet’s nest– by Hafiz Namani -(Urdu Daily – Uqab),But we are not challenging.
24-01-2018,“Hajj Subsidy: Hornet’s nest– by Hafiz Namani -(Urdu Daily – Uqab),"government is claiming that 700 crore which could be saved from Hajj subsidy would be spent on Muslims girl’s education, but government is also shouting slogans of “Beti Bachao, beti Padhao” then is it not that Muslim girl are included."
24-01-2018,“Hajj Subsidy: Hornet’s nest– by Hafiz Namani -(Urdu Daily – Uqab),"If government really wants to spend the money saved for Muslim girl’s education, then the money saved for Muslim girl’s education could be divided among the Muslims girl’s institution of the country."
24-01-2018,“Hajj Subsidy: Hornet’s nest– by Hafiz Namani -(Urdu Daily – Uqab),"If ’s institution of the country is given every year, then Muslims should be told to open new schools and educate the girl students."
24-01-2018,“Hajj Subsidy: Hornet’s nest– by Hafiz Namani -(Urdu Daily – Uqab),"But if the money saved for Muslim girl’s education is given to Ministry of Minority this money is given to Ministry of Minority will give to the officer concerned and expenditure would be made on papers, but on ground level, the Muslims girl will get benefit and Muslim girls would be seen as indebted to government, like subsidy."
25-01-2018,Raid at the residence of Ghulam Nabi is condemnable– (Urdu Daily –Tameel-i-Irshad),"Blaming security forces for conducting raids and harassing residents of Ghulam Nabi War, Chairman Tehreek-e-Istiqamat at Bahipora Kupwara, in a statement, the party has said that such tactics would not affect Tehreek-e-Azadi and the voice could not be suppressed by arrests and unleashing terror."
25-01-2018,Raid at the residence of Ghulam Nabi is condemnable– (Urdu Daily –Tameel-i-Irshad),the party further added that the party are ready to sacrifice to resolve the Kashmir Issue and no one will be allowed to bargain with the sacrifice of youths.
25-01-2018,Action of fresh arrests frustration of government: Resistance Camp – (Urdu Daily –Kashmir Uzma) ,"Declaring the actions of fresh arrests, frisking and search operation being conducted by security forces ahead of January 26 as frustration of Government, resistance camp including Muslim league, Dukhtaran-e-Millat, National Front, Tehreek-Mazahamat, Mahaz-e-Azadi, Peoples League, Peoples Freedom League, Muslim Conference, International Forum for Justice, Young Men’s  league and Tehreek Istiqamat have said that whether it is 15 August or 26 January security forces convert Kashmir into a silent graveyards."
25-01-2018,Action of fresh arrests frustration of government: Resistance Camp – (Urdu Daily –Kashmir Uzma) ,"In a statement, Muslim league said that whole Valley has been changed into a force cantonment ahead of January 26."
25-01-2018,Action of fresh arrests frustration of government: Resistance Camp – (Urdu Daily –Kashmir Uzma) ,"League spokesperson, interpreted this action as frustration of Government."
25-01-2018,Action of fresh arrests frustration of government: Resistance Camp – (Urdu Daily –Kashmir Uzma) ,"Chief of Dukhtaran-e-Millat, Asia Andrabi appealed people to celebrate 26 January as ‘black day’ and hoist black flags on people homes."
25-01-2018,Peoples Political Front expressed grief over the killings of innocent people – (Urdu Dailies –Aftab/Kashmir Uzma) ,"In a press statement, spokesperson of Peoples Political Front has said that Peoples Political Front chairman, Mohd Mussadiq Adil has expressed grief over the killing of innocent people in the border firing between India and Pakistan."
25-01-2018,Peoples Political Front expressed grief over the killings of innocent people – (Urdu Dailies –Aftab/Kashmir Uzma) ,"its chairman, Mohd Mussadiq Adil also criticised the continued excesses being made by security forces in the Valley."
25-01-2018,“United Nation and Kashmir issue” -  (Urdu Daily – Srinagar Times),Secretary General of United Nation through Secretary General of United Nation through his spokesperson spokesperson sent Secretary General of United Nation through his spokesperson message to every corner of the world that UN has anxiety over the daily killings on Indo-Pak border.
25-01-2018,“United Nation and Kashmir issue” -  (Urdu Daily – Srinagar Times),Secretary General of United Nation through his spokesperson said that after border tensions the firing and shelling from both sides worsened the situation.
25-01-2018,“United Nation and Kashmir issue” -  (Urdu Daily – Srinagar Times),If efforts were not made to stop such exchanging of fire on borders then efforts were not made to stop such exchanging of fire on borders will become a cause of danger to peace in the world.
25-01-2018,“United Nation and Kashmir issue” -  (Urdu Daily – Srinagar Times),Secretary General of United Nation through his spokesperson said that UN is keeping a close watch on borders.
25-01-2018,“United Nation and Kashmir issue” -  (Urdu Daily – Srinagar Times),UN is keeping a close watch on the borders are assessing the situation and measures have been taken for both countries to adopt patience.
25-01-2018,“United Nation and Kashmir issue” -  (Urdu Daily – Srinagar Times),"Secretary General of United Nation through his spokesperson acknowledged that Indian Government never accept the intervention of third country in connection with Kashmir issue, but despite this Secretary General of United Nation through his spokesperson expressed Secretary General of United Nation through his spokesperson willingness that India and Pakistan should talk to solve Kashmir issue along with other issues."
25-01-2018,“United Nation and Kashmir issue” -  (Urdu Daily – Srinagar Times),Secretary General of United Nation through his spokesperson said that war would worsen the situation.
25-01-2018,“United Nation and Kashmir issue” -  (Urdu Daily – Srinagar Times),Secretary General of United Nation through his spokesperson said that UN is ready to play a role of mediator and only waiting for green flags from PakistanPakistan.
25-01-2018,“United Nation and Kashmir issue” -  (Urdu Daily – Srinagar Times),"As far as Kashmir is concerned, it is an old and complex issue."
25-01-2018,“United Nation and Kashmir issue” -  (Urdu Daily – Srinagar Times),Kashmir issue brings the world to a place where a spark can invite third world war.
25-01-2018,“United Nation and Kashmir issue” -  (Urdu Daily – Srinagar Times),When UN was established then Kashmir issue become important and critical on Kashmir issue agenda.
25-01-2018,“United Nation and Kashmir issue” -  (Urdu Daily – Srinagar Times),Representative of India and Pakistan Pakistan used to attack each other on Kashmir issue and alleged each other for capturing Kashmir.
25-01-2018,“United Nation and Kashmir issue” -  (Urdu Daily – Srinagar Times),If United Nation tried to become a mediator between Representative of India and Pakistan then United Nation tried to become a mediator between them is good thing.
25-01-2018,“United Nation and Kashmir issue” -  (Urdu Daily – Srinagar Times),But if we read the old histories then United Nation has played an unpleasant role in Kashmir issue.
25-01-2018,“United Nation and Kashmir issue” -  (Urdu Daily – Srinagar Times),"Who do not know, that from 1947 several agreements were made on Kashmir but no action were taken on Representative of India and Pakistan as this organisation surrendered this organisation in front of super powers and atomic power dictators and kept Kashmir issue alive."
25-01-2018,“United Nation and Kashmir issue” -  (Urdu Daily – Srinagar Times),"But if United Nation wants to save the sub-continent from atom bombs, if the border firing/shelling between India ad Pakistan is danger for peace of the world and dialogue is necessary then UN never needs to go far away."
25-01-2018,“United Nation and Kashmir issue” -  (Urdu Daily – Srinagar Times),The agreements made on Kashmir issue are safe with UN.
25-01-2018,“United Nation and Kashmir issue” -  (Urdu Daily – Srinagar Times),It takes no time in taking out The agreements made on Kashmir issue and taking actions on actions.
