05-08-2018,“Pleasing forward movement” - (Urdu Daily - Uqab),"a meeting on Article 35/A was presided over by the former President of Jammu Bar Association, A. V. Gupta."
05-08-2018,“Pleasing forward movement” - (Urdu Daily - Uqab),"In Gupta presidential address, Gupta said that if Article 35/A and Article 370 are revoked, accession with India would automatically come to end."
05-08-2018,“Pleasing forward movement” - (Urdu Daily - Uqab),"A large number of lawyers coming in support of Article 35/A Article 35/A proves that extremist and anti-Kashmir groups do not represent Jammu, but extremist and anti-Kashmir groups have been deliberately giving vent to anti-Kashmir sentiments only to achieve anti-Kashmir sentiments political aims."
05-08-2018,“Pleasing forward movement” - (Urdu Daily - Uqab),The fact is that people of Jammu know well that Article 35/A is in the interest of Jammu more than Kashmir.
05-08-2018,“Pleasing forward movement” - (Urdu Daily - Uqab),"This way, positive thinking has opened up This way wings in Jammu which were suppressed, so far, and which had created wedge between Jammu and Kashmir."
05-08-2018,“Pleasing forward movement” - (Urdu Daily - Uqab),Even voices had started rising that there is nothing common between the two provinces and Even voices should be separated.
05-08-2018,“Pleasing forward movement” - (Urdu Daily - Uqab),"But, the lawyers have given new strength to State’s unity and ended the atmosphere of hate between Jammu and Kashmir."
06-08-2018,“National Conference has always been supporter of unity and individuality of the State: Dr. Kamaal - (Urdu Dailies - Srinagar Times/Aftab),"Condemning the statements of staunch Jana Sangh and communal leaders and terming these an unacceptable, National Conference Additional General Secretary, Dr. Mustafa Kamaal has said that the worrying issue is that Kavindra Gupta has been issuing statements which can put the State on fire."
06-08-2018,“National Conference has always been supporter of unity and individuality of the State: Dr. Kamaal - (Urdu Dailies - Srinagar Times/Aftab),"People of the State know that Kavindra Gupta and Dr. Nirmal Singh are staunch communal Jana Sangh leaders who, laced with arms, used to participate in Jana Sangh rallies in the past."
06-08-2018,“National Conference has always been supporter of unity and individuality of the State: Dr. Kamaal - (Urdu Dailies - Srinagar Times/Aftab),Dr. Mustafa Kamaal cautioned the leaders who want to remove Article 370 and Article 35-A to desist from issuing statements which can harm special position of the State and conditional accession of late Maharaja Hari Singh.
06-08-2018,“Igniting lava in Kashmir will become destructive for the subcontinent - Mahaz-e-Azadi - (Urdu Daily - Tameel-i-Irshad),"Patron of Jammu and Kashmir Mahaz-e-Azadi, Azam Inqilabi; President, Syed Atlaf Indrabi and other Shoora members have expressed grief and sorrow over efforts of rulers to involve Kashmiri people in newer apprehensions and vacillations on daily basis so as to mislead Patron of Jammu and Kashmir Mahaz-e-Azadi, Azam Inqilabi; President, Syed Atlaf Indrabi and other Shoora members from real target and aim."
06-08-2018,“Igniting lava in Kashmir will become destructive for the subcontinent - Mahaz-e-Azadi - (Urdu Daily - Tameel-i-Irshad),"In a statement, Spokesman of Mahaz-e-Azadi, Yousuf Gilkar has said that Indian rulers would be tearing Indian rulers Constitution and laws into pieces by removing or annulling any section of it."
06-08-2018,“Igniting lava in Kashmir will become destructive for the subcontinent - Mahaz-e-Azadi - (Urdu Daily - Tameel-i-Irshad),Indian rulers should have full knowledge of ground realities of Kashmir that Kashmiris have moved ahead of death and fear.
06-08-2018,“Igniting lava in Kashmir will become destructive for the subcontinent - Mahaz-e-Azadi - (Urdu Daily - Tameel-i-Irshad),Removing Article 35/A will ignite lava in Kashmir which will engulf whole subcontinent.
06-08-2018,“Igniting lava in Kashmir will become destructive for the subcontinent - Mahaz-e-Azadi - (Urdu Daily - Tameel-i-Irshad),"Indian rulers should know that Kashmiri people can’t be browbeaten by using force, Kashmiri people can’t be browbeaten by using force said."
06-08-2018,“Article 35/A: Question of life and death” - by Ali Asrar - (Urdu Daily - Kashmir Uzma),Efforts are being made since long to make the last pillar of identity for Jammu and Kashmir State - Article 35/A - controversial.
06-08-2018,“Article 35/A: Question of life and death” - by Ali Asrar - (Urdu Daily - Kashmir Uzma),"But, with BJP coming to power at the Centre and BJP coalition with PDP in J&K State, preparations are going on to implement the plan of burying down this last sign of State’s individuality."
06-08-2018,“Article 35/A: Question of life and death” - by Ali Asrar - (Urdu Daily - Kashmir Uzma),"This issue is coming up for hearing in the Supreme Court on August 6, which has put the State and the Supreme Court people into perplexity."
06-08-2018,“Article 35/A: Question of life and death” - by Ali Asrar - (Urdu Daily - Kashmir Uzma),The reality with regard to the Supreme Court defence is that Central Government has withdrawn the Supreme Court hands from fulfilling the Supreme Court constitutional responsibility.
06-08-2018,“Article 35/A: Question of life and death” - by Ali Asrar - (Urdu Daily - Kashmir Uzma),"As there is no elected government in the State at present, well known leaders of people are not ready to join hands on this issue of life and death."
06-08-2018,“Article 35/A: Question of life and death” - by Ali Asrar - (Urdu Daily - Kashmir Uzma),Several people believe that there is no steam in the petition filed in the Supreme Court for freezing the rights enjoyed by the State.
06-08-2018,“Article 35/A: Question of life and death” - by Ali Asrar - (Urdu Daily - Kashmir Uzma),"Earlier, the Supreme Court has dismissed such petitions more than once without hearing."
06-08-2018,“Article 35/A: Question of life and death” - by Ali Asrar - (Urdu Daily - Kashmir Uzma),"This time, Advocate General of India has not attended the Court, which indicates that Government of India has distanced Government of India from the responsibility of defending this Article."
06-08-2018,“Article 35/A: Question of life and death” - by Ali Asrar - (Urdu Daily - Kashmir Uzma),"But, Government of India has more responsibility than the Centre."
06-08-2018,“Article 35/A: Question of life and death” - by Ali Asrar - (Urdu Daily - Kashmir Uzma),The Constitution of Jammu and Kashmir is as strong that any action against Article 370 and Article 35/A can be challenged in any the Supreme Court.
07-08-2018,Resolve and unity of State people in defence of Article 35/A a message for the world: Ali Sagar - (Urdu Dailies - Srinagar Times/Aftab/Kashmir Uzma),"While exchanging views with party leaders and office bearers, General Secretary of National Conference, Ali Muhammad Sagar has said that unity and cooperation exhibited by the people of all three regions of the State in defence of Article 35/A should be an eye opener for New Delhi."
07-08-2018,Resolve and unity of State people in defence of Article 35/A a message for the world: Ali Sagar - (Urdu Dailies - Srinagar Times/Aftab/Kashmir Uzma),"The Centre should immediately file an affidavit in the Supreme Court through the Supreme Court Attorney General for dismissal of this case, Ali Muhammad Sagar added."
07-08-2018,Resolve and unity of State people in defence of Article 35/A a message for the world: Ali Sagar - (Urdu Dailies - Srinagar Times/Aftab/Kashmir Uzma),"Determination and enthusiasm shown the people of State should be an eye opened for the world also, Ali Muhammad Sagar said."
07-08-2018,Resolve and unity of State people in defence of Article 35/A a message for the world: Ali Sagar - (Urdu Dailies - Srinagar Times/Aftab/Kashmir Uzma),"Ali Muhammad Sagar further said, “Our links with India are based on Article 370, Delhi Agreement and 1952 position."
07-08-2018,Resolve and unity of State people in defence of Article 35/A a message for the world: Ali Sagar - (Urdu Dailies - Srinagar Times/Aftab/Kashmir Uzma),Our hope that this link can be strengthened only when internal autonomy of State is restored and conspiracies against State’s special position are brought to end for ever”.
07-08-2018,Protest sit-in by resistance groups in Muzaffarabad - (Urdu Daily - Kashmir Uzma),Protest rallies were taken out in Muzaffarabad (PoK) in favour of Article 35/A.
07-08-2018,Protest sit-in by resistance groups in Muzaffarabad - (Urdu Daily - Kashmir Uzma),These protests were organized by International Forum for Justice and Pasban-e-Hurriyat in Press Club.
07-08-2018,Protest sit-in by resistance groups in Muzaffarabad - (Urdu Daily - Kashmir Uzma),"On the occasion, Central President of Peoples Party, Choudhary Lateef Akba; Vice-Chairman of International Forum for Justice, Mushtaq-ul-Islam; Chairman of Pasban-e-Hurriyat, Aziz Ahmed Gazali; President of Central Bar, Muzaffarabad and others addressed the convention."
07-08-2018,Protest sit-in by resistance groups in Muzaffarabad - (Urdu Daily - Kashmir Uzma),"The Speakers said that according to UN resolutions, Jammu and Kashmir is a disputed State."
07-08-2018,Protest sit-in by resistance groups in Muzaffarabad - (Urdu Daily - Kashmir Uzma),Conspiracies being hatched against Article 35/A convey a message to the entire State that promises made with the entire State people will be never fulfilled.
07-08-2018,Protest sit-in by resistance groups in Muzaffarabad - (Urdu Daily - Kashmir Uzma),The Speakers also said that unarmed youth of Kashmir have been making a history by offering sacrifices of unarmed youth of Kashmir lives.
07-08-2018,One-day convention of BJP at Nowgam - Shahabad - (Urdu Daily - Kashmir Uzma),"In view of Panchayat elections, BJP held a one-day convention at Nowgam - Shahabad, Dooru (District Anantnag)."
07-08-2018,One-day convention of BJP at Nowgam - Shahabad - (Urdu Daily - Kashmir Uzma),"Addressing a one-day convention at Nowgam - Shahabad, Dooru (District Anantnag), District President of BJP, Muhammad Rafiq Wani urged party workers to make preparations for Panchayat elections."
07-08-2018,One-day convention of BJP at Nowgam - Shahabad - (Urdu Daily - Kashmir Uzma),"Prime Minister, Narendra Modi is making efforts for equitable development of all three regions of the State, Narendra Modi said."
07-08-2018,One-day convention of BJP at Nowgam - Shahabad - (Urdu Daily - Kashmir Uzma),Narendra Modi laid stress on party workers to take the agenda of BJP to every household.
07-08-2018,Mufti Nasir-ul-Islam thanked people for observing hartal on Article 35/A and appealed for hartal once more on August 27 - (Urdu Daily - Tameel-e-Irshad),"Deputy Mufti Azam, Nasir-ul-Islam has thanked people of Valley for observing two days hartal against conspiracies being hatched against Article 35/A, saying that the people of J&K State, especially Kashmiris, won’t allow any conspiracy against Kashmir to succeed as was expressed by people by observing two-day hartal on August 5 and 6."
07-08-2018,Mufti Nasir-ul-Islam thanked people for observing hartal on Article 35/A and appealed for hartal once more on August 27 - (Urdu Daily - Tameel-e-Irshad),"Islam said that the Supreme Court of India has deferred hearing on Article 37/A till August 27, and Islam appealed to the people of Valley to observe shutdown once more on August 27."
07-08-2018,“Issue of Article 35-A” -  (Urdu Daily - Aftab) ,The hearing on petition filed against article 35-A in the Supreme Court has been deferred and the next hearing has been fixed on August 27.
07-08-2018,“Issue of Article 35-A” -  (Urdu Daily - Aftab) ,It is not the issue of deferring hearing; It should be eliminated completely because the law implemented by Maharaja in 1927 was validated by the Constituent Assembly in 1954.
07-08-2018,“Issue of Article 35-A” -  (Urdu Daily - Aftab) ,"According to law experts, the Supreme Court has no role in the Supreme Court and the Ordinance can be removed by President at the time when the State Assembly passes a resolution in this regard."
07-08-2018,“Issue of Article 35-A” -  (Urdu Daily - Aftab) ,"On August 6, a bench of the Supreme Court comprising of three judges has deferred The hearing on petition filed against article 35-A in the Supreme Court."
07-08-2018,“Issue of Article 35-A” -  (Urdu Daily - Aftab) ,A propaganda campaign is being run against Kashmir and A propaganda campaign people out side the State.
07-08-2018,“Issue of Article 35-A” -  (Urdu Daily - Aftab) ,Tourists who use to visit this place for sight seeing have declared the situation in Kashmir as peaceful.
07-08-2018,“Issue of Article 35-A” -  (Urdu Daily - Aftab) ,Tourists who use to visit this place for sight seeing say that propagandas shown on TV outside the State is based on falsehood and deceit.
07-08-2018,“Issue of Article 35-A” -  (Urdu Daily - Aftab) ,While the reality is that Kashmiris are hospitable and good people.
07-08-2018,“Issue of Article 35-A” -  (Urdu Daily - Aftab) ,"The Indian people who have been demanding abrogation of Article 35-A from Kashmir, need to learn about Mizoram, Meghalya, Manipur, Nagaland, Assam, Sikkim and Andhra Pradesh, as the same Article is in vogue these States,  as well."
07-08-2018,“Issue of Article 35-A” -  (Urdu Daily - Aftab) ,"It is important that instead of deferring hearing, the writ petition filed in the Supreme Court for abrogation of Article 35-A should be dismissed."
07-08-2018,“Issue of Article 35-A” -  (Urdu Daily - Aftab) ,Efforts are being made to create disturbance in Kashmir which won’t fetch positive results.
07-08-2018,“Issue of Article 35-A” -  (Urdu Daily - Aftab) ,Kashmiri people irrespective of religion and region have united on this matter which could be guessed from the strike on August 5 and 6.
07-08-2018,“Issue of Article 35-A” -  (Urdu Daily - Aftab) ,"On these days, there was not only strike in Kashmir, but people of Ladakh, Chenab region and Jammu, except some Mohallas, observed strike and took out peaceful rallies in support of the same Article."
07-08-2018,“Article 35/A - Immediate danger averted”  - (Urdu Daily - Chattan),Hearing on Article 35/A in the Supreme Court has been deferred for two weeks due to non-availability of one member of 3-Judge Bench.
07-08-2018,“Article 35/A - Immediate danger averted”  - (Urdu Daily - Chattan),Next day of hearing has been fixed for August 27.
07-08-2018,“Article 35/A - Immediate danger averted”  - (Urdu Daily - Chattan),Strong reaction is being found in Kashmir on the petitions filed against Article 35/A.
07-08-2018,“Article 35/A - Immediate danger averted”  - (Urdu Daily - Chattan),Several people call Article 35/A as a matter of life and death.
07-08-2018,“Article 35/A - Immediate danger averted”  - (Urdu Daily - Chattan),"Though immediate danger to Article 35/A has been averted, yet it is a mistake to think that opposite party has been scared."
07-08-2018,“Article 35/A - Immediate danger averted”  - (Urdu Daily - Chattan),"At present, all political circles, except BJP, have supported Kashmiris."
07-08-2018,“Article 35/A - Immediate danger averted”  - (Urdu Daily - Chattan),all political circles have been alleging that BJP wants to gain sympathy of voters in next elections.
07-08-2018,“Article 35/A - Immediate danger averted”  - (Urdu Daily - Chattan),"But, BJP is in no dilemma, BJP clear stand is to end special position of Kashmir."
07-08-2018,“Article 35/A - Immediate danger averted”  - (Urdu Daily - Chattan),"In past, Congress has played basic role in such efforts."
07-08-2018,“Article 35/A - Immediate danger averted”  - (Urdu Daily - Chattan),"After Kashmir Accord, the role played by Congress in widening ambit of Delhi in J&K State had disappointed Sheikh Muhammad Abdullah."
07-08-2018,“Article 35/A - Immediate danger averted”  - (Urdu Daily - Chattan),"Local politicians have played a role of more loyal than king in this matter, due to which special position of Kashmir has been damaged."
07-08-2018,“Article 35/A - Immediate danger averted”  - (Urdu Daily - Chattan),BJP wants to complete the left over deficiency for which BJP has sought help of the Supreme Court.
07-08-2018,“Article 35/A - Immediate danger averted”  - (Urdu Daily - Chattan),The courage and sensibility shown by the State Governor is encouraging.
07-08-2018,“Article 35/A - Immediate danger averted”  - (Urdu Daily - Chattan),It was perhaps not possible for any local politician at this position to play such a defensive role.
07-08-2018,“Article 35/A - Immediate danger averted”  - (Urdu Daily - Chattan),"Unfortunately, instead of adopting legal means, the State leadership wants to resolve this issue by provoking sentiments of people and resorting to tumult and shutdowns."
07-08-2018,“Article 35/A - Immediate danger averted”  - (Urdu Daily - Chattan),"At the behest of trader’s fraternity, Hurriyat circles gave a 2-day shutdown call which succeeded beyond expectations."
07-08-2018,“Article 35/A - Immediate danger averted”  - (Urdu Daily - Chattan),This was for the first time in Kashmir history that all groups appeared on same page.
07-08-2018,“Article 35/A - Immediate danger averted”  - (Urdu Daily - Chattan),Efforts should have been made to strengthen thus unity after taking advantage of the situation.
07-08-2018,“Article 35/A - Immediate danger averted”  - (Urdu Daily - Chattan),It that is done it would be easy to fight and win litigation in the Supreme Court.
07-08-2018,“Article 35/A - Immediate danger averted”  - (Urdu Daily - Chattan),But this is not acceptable to any one.
07-08-2018,“Article 35/A - Immediate danger averted”  - (Urdu Daily - Chattan),"If Hurriyat circles failed in forging unity, defeat in the Supreme Court is certain."
07-08-2018,“Battle to remove Article 35/A” -  by Hamid Saalik - (Urdu Daily - Chattan),"Amid the protest wave in several areas of J&K State, the Supreme Court has deferred hearing on petitions filed against Article 35/A till August 27 - when ongoing Amarnath Yatra would have concluded a day earlier."
07-08-2018,“Battle to remove Article 35/A” -  by Hamid Saalik - (Urdu Daily - Chattan),"Therefore, a new process of guess work has started with regard to next date of hearing."
07-08-2018,“Battle to remove Article 35/A” -  by Hamid Saalik - (Urdu Daily - Chattan),It is worth mention that no heed has been paid on the request of State Government for deferring hearing till December.
07-08-2018,“Battle to remove Article 35/A” -  by Hamid Saalik - (Urdu Daily - Chattan),This was perhaps done to make people understand that protest by Kashmiris is not going to influence the action of the Supreme Court.
07-08-2018,“Battle to remove Article 35/A” -  by Hamid Saalik - (Urdu Daily - Chattan),Kashmiri people have opened a front against danger to Article 35/A.
07-08-2018,“Battle to remove Article 35/A” -  by Hamid Saalik - (Urdu Daily - Chattan),"For the first time concerned political and business circles, besides other sections of society, appeared on same page with no differentiation between political and separatist camps."
07-08-2018,“Battle to remove Article 35/A” -  by Hamid Saalik - (Urdu Daily - Chattan),The important question is that amid political crisis why no shame is being felt in divesting Kashmiris from special powers enjoyed by Kashmiris.
07-08-2018,“Battle to remove Article 35/A” -  by Hamid Saalik - (Urdu Daily - Chattan),Kashmiris have rightly expressed resistance which should convey a message to Delhi that Kashmiris are not ready to lose Kashmiris identity and bargain Kashmiris autonomy while remaining in Indian Union.
07-08-2018,“Battle to remove Article 35/A” -  by Hamid Saalik - (Urdu Daily - Chattan),"Though ground situation does not allow to dream about greater merger through Court, yet new dates for hearing are being fixed which infer that the issue is being kept alive permanently to create confusion among Kashmiris."
07-08-2018,“Battle to remove Article 35/A” -  by Hamid Saalik - (Urdu Daily - Chattan),"Court has deferred hearing of the case, but the challenge to seek dismissal of petitions filed against Article 35/A still remains."
07-08-2018,“Old Kashmir issue in new Pakistan” - by Imran Khushhal Raja - (Urdu Daily - Uqab),"While followers of Pakistan Tehreek-e-Insaf Party are celebrating victory of Pakistan Tehreek-e-Insaf Party in recently conclude elections, followers of Pakistan Tehreek-e-Insaf Party also firmly believe that a ‘new Pakistan’ will be established now."
07-08-2018,“Old Kashmir issue in new Pakistan” - by Imran Khushhal Raja - (Urdu Daily - Uqab),"Several writers, analysts and impartial intellectuals have also started believing this possibility."
07-08-2018,“Old Kashmir issue in new Pakistan” - by Imran Khushhal Raja - (Urdu Daily - Uqab),"After listing to victory speech of Imran Khan, some of listing to victory speech of Imran Khan have even said that Imran Khan can resolve decades’ old Kashmir issue."
07-08-2018,“Old Kashmir issue in new Pakistan” - by Imran Khushhal Raja - (Urdu Daily - Uqab),Most Kashmiris have also started building narratives on Kashmiris.
07-08-2018,“Old Kashmir issue in new Pakistan” - by Imran Khushhal Raja - (Urdu Daily - Uqab),"Therefore, it is necessary to understand why Imran Khan has talked about improving relations with India; and is it really possible for Imran Khan to resolve Kashmir issue?"
07-08-2018,“Old Kashmir issue in new Pakistan” - by Imran Khushhal Raja - (Urdu Daily - Uqab),"Instead of popularising the narrative of Kashmiris that a messiah has emerged in Pakistan who can resolve their issue overnight, their should be made to understand that the biggest hurdle in non-resolution of Kashmir issue is their non-representation."
07-08-2018,“Old Kashmir issue in new Pakistan” - by Imran Khushhal Raja - (Urdu Daily - Uqab),"In absence of Kashmiris, dialogue between India and Pakistan can not succeed."
07-08-2018,“Old Kashmir issue in new Pakistan” - by Imran Khushhal Raja - (Urdu Daily - Uqab),"So, the foremost need is to ensure representation of Kashmiris in every effort for the resolution of Kashmir issue; and representation of Kashmiris shall have the support of all parts of Kashmir."
07-08-2018,“Old Kashmir issue in new Pakistan” - by Imran Khushhal Raja - (Urdu Daily - Uqab),"The proposed way out for this is that a representative institutions should be established in Azad Kashmir (PoK) based on public vote at Union Council level, Tehsil/District level and at the level of Kashmir."
07-08-2018,“Old Kashmir issue in new Pakistan” - by Imran Khushhal Raja - (Urdu Daily - Uqab),Similar institutions should also be established in Jammu and Kashmir and Gilgit-Baltistan.
07-08-2018,“Old Kashmir issue in new Pakistan” - by Imran Khushhal Raja - (Urdu Daily - Uqab),"Later, a national institution should be established by joining all the three institutions which can hold talks with India and Pakistan and participate in any dialogue between the two countries."
07-08-2018,“Old Kashmir issue in new Pakistan” - by Imran Khushhal Raja - (Urdu Daily - Uqab),"Till the time such institutions are established, all routes of contact should be opened for business and movement of people."
07-08-2018,“Old Kashmir issue in new Pakistan” - by Imran Khushhal Raja - (Urdu Daily - Uqab),Pakistan should give full legal and civil authority to local governments in Kashmir and Gilgit-Baltistan and India should do the same in Jammu and Kashmir.
07-08-2018,“Old Kashmir issue in new Pakistan” - by Imran Khushhal Raja - (Urdu Daily - Uqab),"Resolution of any issue can’t be acceptable to 100% population, but solution of Kashmir issue should be acceptable to at least those whose life and death is linked with whose life and death."
08-08-2018,Barrister Abdul Majid Tramboo rejected conspiracy against Article 35-A;  Called pro-India people opportunist - (Urdu Daily - Aftab),"While rejecting conspiracies against Article 35/A, Patron of J&K Liberation Front (R), Barrister Abdul Majid Tramboo, Advocate Ayub Rathore and Wajahat Qureshi have said that while the Supreme Court has deferred hearing on this Article, but sword is hanging on people of Jammu and Kashmir."
08-08-2018,Barrister Abdul Majid Tramboo rejected conspiracy against Article 35-A;  Called pro-India people opportunist - (Urdu Daily - Aftab),"In a statement, Barrister Abdul Majid Tramboo, Advocate Ayub Rathore and Wajahat appealed people to continue protests against alleged efforts to abrogate this Article."
08-08-2018,Barrister Abdul Majid Tramboo rejected conspiracy against Article 35-A;  Called pro-India people opportunist - (Urdu Daily - Aftab),"People of Kashmir have never accepted Constitution of India, but Indian authorities consider this Article as a hurdle and People of Kashmir are hell bent to end or amend this Article, for which local pro-India parties have been cooperating with People of Kashmir, People of Kashmir said."
08-08-2018,Barrister Abdul Majid Tramboo rejected conspiracy against Article 35-A;  Called pro-India people opportunist - (Urdu Daily - Aftab),"People of Kashmir called recent statements of NC Working President, Omar Abdullah and MLA (Ind) Engineer Rashid as opportunism."
