01-06-2017,Statement of General Rawat is an open warning: Jamiat/Freedom League (Urdu Dailies –Kashmir Uzma/Aftab),"Reacting over the recent statement of Army Chief, Jamiat Ahl-e-Hadees, People’s Freedom League and many other organisations have strongly condemned and requited Freedom League with an open warning."
01-06-2017,Statement of General Rawat is an open warning: Jamiat/Freedom League (Urdu Dailies –Kashmir Uzma/Aftab),Jamiat Ahl-e-Hadees Jammu and Kashmir has said that the recent statement of Army Chief gives new hints and Freedom League indicated that plans to bully Kashmiris are in the offing.
01-06-2017,With reference to Kashmir issue BJP leadership is divided : Javed Mir- (Urdu Dailies- Kashmir Uzma/Tameel-i-Irshad Srinagar Times),"Levelling allegations against Chief of Indian Army and present BJP Government, Javed Ahmad Mir, Chairman Liberation Front/H said that the Indian political leaders show disparity towards anti-Kashmiri activities and Kashmir issue."
01-06-2017,With reference to Kashmir issue BJP leadership is divided : Javed Mir- (Urdu Dailies- Kashmir Uzma/Tameel-i-Irshad Srinagar Times),"/H also said that with reference to Kashmir issue BJP leadership seems to be completely divided, which is clear from the statements of Indian Home Minister Rajnath Singh and Information Minister Venkaiah Naidu."
01-06-2017,PSA slapped again on three house-arrested persons of Baramulla: Use of draconian laws again and again is gross  human rights violation: Tehreek-e-Hurriyat— (Urdu Daily: Uqab),"While condemning the PSA slapped again on three house-arrested persons of Baramulla, Tehreek-e- Hurriyat said that the repeated use of draconian laws is a gross human rights violation."
01-06-2017,PSA slapped again on three house-arrested persons of Baramulla: Use of draconian laws again and again is gross  human rights violation: Tehreek-e-Hurriyat— (Urdu Daily: Uqab),"Tehreek-e-Hurriyat  Jammu and Kashmir in a statement to KNS said that  the PSA PSA has been slapped on Tanveer Ahmad War (physically handicapped), Bashir Ahmad Salah and Asif Gul all residents of Baramulla and all residents of Baramulla have been sent to Koth Balwal Jail Jammu."
01-06-2017,“Talks on Kashmir by Central Ministers”- (Urdu Daily – Srinagar Times),"Defence Minister is silent over the Kashmir issue till date, but Defence Minister feels pressure on International level to solve the Kashmir issue."
01-06-2017,“Talks on Kashmir by Central Ministers”- (Urdu Daily – Srinagar Times),Messages also receiving from America to pay attention to Kashmir issue.
01-06-2017,“Talks on Kashmir by Central Ministers”- (Urdu Daily – Srinagar Times),"However, Defence Minister was sure that President Trump would support India on Kashmir issue."
01-06-2017,“Talks on Kashmir by Central Ministers”- (Urdu Daily – Srinagar Times),There is only Kashmir issue in the minds of Cabinet Ministers.
01-06-2017,“Talks on Kashmir by Central Ministers”- (Urdu Daily – Srinagar Times),"Despite several efforts, several efforts failed to overlook it."
01-06-2017,“Talks on Kashmir by Central Ministers”- (Urdu Daily – Srinagar Times),several efforts also give provocative statements in this regard.
01-06-2017,“Talks on Kashmir by Central Ministers”- (Urdu Daily – Srinagar Times),"Defence Minister said that few militants are present in the Valley, who are being aided and abetted by Pakistan but our Army is tackling few militants successfully."
01-06-2017,“Talks on Kashmir by Central Ministers”- (Urdu Daily – Srinagar Times),"Union Home Minister Rajnath Singh says that the disturbance in Valley is continuing since 1947, but when Union Home Minister Rajnath Singh was asked as to why there was only 2 to 7% polling in the recent by-elections, then Union Home Minister Rajnath Singh becomes answerless."
01-06-2017,“Talks on Kashmir by Central Ministers”- (Urdu Daily – Srinagar Times),"In a fresh statement, Union Home Minister Rajnath Singh says that Kashmir, Kashmiri and Kashmiriyat are all Indians."
01-06-2017,“Talks on Kashmir by Central Ministers”- (Urdu Daily – Srinagar Times),When Union Home Minister Rajnath Singh was asked to explain it then Union Home Minister Rajnath Singh remained silent.
01-06-2017,“Talks on Kashmir by Central Ministers”- (Urdu Daily – Srinagar Times),The statement of Central Ministers shows that they are suffering from restlessness and extremely worried for the past one year.
01-06-2017,“Talks on Kashmir by Central Ministers”- (Urdu Daily – Srinagar Times),Central Government is saying that no talks would be held with Hurriyat and Pakistan until the situation becomes normal.
01-06-2017,“Talks on Kashmir by Central Ministers”- (Urdu Daily – Srinagar Times),"The present Government of India should fulfil the promises made with PDP reflected in “Agenda of Alliance” and should find a conducive way for talks, other wise the peace of Indo-Pak sub-continent will be in danger."
01-06-2017,“Kashmir issue: Change in behaviour of Delhi”? (Urdu Daily- Tameel-i-Irshad),"Kashmir issue is lingering for the past 70 years and due to this issue, law & order has been worsened in the Valley for the past 70 years in general and 27 years in particular."
01-06-2017,“Kashmir issue: Change in behaviour of Delhi”? (Urdu Daily- Tameel-i-Irshad),"In this disturbed situation lakhs of people lost this disturbed situation lakhs of people lives, thousands houses were damaged and thousand of people got handicapped physically and mentally."
01-06-2017,“Kashmir issue: Change in behaviour of Delhi”? (Urdu Daily- Tameel-i-Irshad),The relationship between two neighbouring countries India and Pakistan worsened due to Kashmir issue and the alienation increased so much that two neighbouring countries India and Pakistan are ready to wage war against each other.
01-06-2017,“Kashmir issue: Change in behaviour of Delhi”? (Urdu Daily- Tameel-i-Irshad),Many unsuccessful talks were held to solve Kashmir issue.
01-06-2017,“Kashmir issue: Change in behaviour of Delhi”? (Urdu Daily- Tameel-i-Irshad),"After reading history, Kashmir issue was known that Kashmir issue could be solved by tripartite talks and the Hurriyat leadership of the state is advocating for this issue could be solved by tripartite talks and the Hurriyat leadership of the state."
01-06-2017,“Kashmir issue: Change in behaviour of Delhi”? (Urdu Daily- Tameel-i-Irshad),"this issue could be solved by tripartite talks and the Hurriyat leadership of the state are pressing that the basic parties of Kashmir issue are India, Pakistan and Kashmir."
01-06-2017,“Kashmir issue: Change in behaviour of Delhi”? (Urdu Daily- Tameel-i-Irshad),But Kashmiris were not included during Many unsuccessful talks and due to this the matter remained unresolved and Kashmiris also affects the economy and financial condition of India and Pakistan.
01-06-2017,“Kashmir issue: Change in behaviour of Delhi”? (Urdu Daily- Tameel-i-Irshad),"Therefore, Modi led Government of India should take effective steps to solve Kashmir issue Kashmir to avoid war like situation and restore peace in the region."
02-06-2017,Awami Itehaad Party to observe ‘State Flag Day’ on June 7: Engineer Rashid – (Urdu Daily – Srinagar Times),"Describing right to self-determination as only solution for Kashmir issue, MLA/Independent & President of Awami Itehaad Party, Engineer Rashid questioned New Delhi Kashmir is an integral part of India whey Kashmir has separate Constitution and Flag’?"
02-06-2017,Awami Itehaad Party to observe ‘State Flag Day’ on June 7: Engineer Rashid – (Urdu Daily – Srinagar Times),"Addressing a crore group of the party, Engineer Rashid reiterated Engineer Rashid stand that Kashmir is in no way integral part of India."
02-06-2017,Awami Itehaad Party to observe ‘State Flag Day’ on June 7: Engineer Rashid – (Urdu Daily – Srinagar Times),India has not only trampled the sanctity of UN resolutions but has also eroded State’s special position from time to time.
02-06-2017,Awami Itehaad Party to observe ‘State Flag Day’ on June 7: Engineer Rashid – (Urdu Daily – Srinagar Times),"The present leadership of Sangh Parivaar wants to erode the left over individuality of J&K State and make the left over individuality of J&K State a part of Hindu Rashtra, Engineer Rashid alleged."
02-06-2017,BJP responsible for present unfavourable situation: Mustafa Kamaal:  (Urdu Dailies – Srinagar Times/Aftab/Kashmir Uzma),"Addressing a meeting of workers at party headquarters, Srinagar, National Conference Additional General Secretary, Dr. Mustafa Kamaal said that present inefficient rulers of State have been leading State towards ruin."
02-06-2017,BJP responsible for present unfavourable situation: Mustafa Kamaal:  (Urdu Dailies – Srinagar Times/Aftab/Kashmir Uzma),"People’s problems have been increasing day by day, unemployment has crossed all limits, rights of traders are being attacked and conspiracies are being hatched at large scale to mutilate the Muslim majority character of the State, Dr. Mustafa Kamaal alleged."
02-06-2017,BJP responsible for present unfavourable situation: Mustafa Kamaal:  (Urdu Dailies – Srinagar Times/Aftab/Kashmir Uzma),Apprehensions about situation going worse in the State had become clear on the first day when PDP forged alliance with BJP and communal parties started working on BJP and communal parties anti-Kashmir agenda.
02-06-2017,BJP responsible for present unfavourable situation: Mustafa Kamaal:  (Urdu Dailies – Srinagar Times/Aftab/Kashmir Uzma),"History is witness to the fact that PDP has always worked against the interests of Kashmir and Kashmiris, PDP stated."
02-06-2017,Bomb blast in Kabul condemnable: Mahaz-e-Azadi – (Urdu Dailies – Srinagar Times/Aftab),"In a statement, President of J&K Mahaz-e-Azadi, Muhammad Iqbal Mir has condemned the bomb blast in Kabul which killed more than 90 people and injured 400 others and called it as anti-humanity tragedy."
02-06-2017,Bomb blast in Kabul condemnable: Mahaz-e-Azadi – (Urdu Dailies – Srinagar Times/Aftab),"Muhammad Iqbal Mir appealed the UN Secretary General to use Muhammad Iqbal Mir influence and convince important countries of the world about importance of resolution of world issues, particularly the issues of Kashmir, Palestine, Iraq, Somalia, Afghanistan etc, so that terrorists don’t find any logic to continue terrorists inhuman activities."
02-06-2017,Early resolution of Kashmir issue necessary for peace: Tehreek-e-Kashmir – (Urdu Daily – Aftab),"Describing bilateral relations between India and Pakistan as highly destructive, President of Tehreek-e-Kashmir, General Musa has appealed all pro-humanity people of the world to take notice of alleged stubbornness, rigidity and fresh wave of religious hatred of Indian leadership and put pressure on India’s political and militant leadership for finding a solution of Kashmir issue in the wake of Kashmir historical background."
02-06-2017,Early resolution of Kashmir issue necessary for peace: Tehreek-e-Kashmir – (Urdu Daily – Aftab),"Kashmir issue can’t be resolved by bullying, pressure tactics or might, which indicates that resolution of Kashmir issue is necessary for peace of the sub-continent, Kashmir issue said."
02-06-2017,Violence in the region could end by resolving Kashmir issue: Yousuf Naqash – (Urdu Daily – Tameel-i-Irshad),"In a statement, senior Hurriyat leader and Chairman of Islamic Political Party, Muhammad Yousuf Naqash has said that Kashmir issue is a reason for unending wave of violence in the State and until Kashmir issue is resolved, genocide in Kashmir would continue."
02-06-2017,Violence in the region could end by resolving Kashmir issue: Yousuf Naqash – (Urdu Daily – Tameel-i-Irshad),"Muhammad Yousuf Naqash further said that instead of going deep into Kashmir issue, Indian leaders have been issuing provocative statements."
02-06-2017,Violence in the region could end by resolving Kashmir issue: Yousuf Naqash – (Urdu Daily – Tameel-i-Irshad),"India has no other option but to grant right of self-determination to the people of Kashmir which is the only way to resolve Kashmir issue, Muhammad Yousuf Naqash added."
02-06-2017,“Responsibilities of National Conference” – (Urdu Daily – Srinagar Times),Nowadays National Conference headquarters remains active with important or unimportant meeting in which participation of National Conference headquarters leadership is ensured.
02-06-2017,“Responsibilities of National Conference” – (Urdu Daily – Srinagar Times),"With the presence of National Conference headquarters President, Dr. Farooq Abdullah or Working President, Omar Abdullah, all former of sitting MLAs and MLCs can’t dare to remain absent."
02-06-2017,“Responsibilities of National Conference” – (Urdu Daily – Srinagar Times),"In the eyes of National Conference, present Government has failed in all fronts."
02-06-2017,“Responsibilities of National Conference” – (Urdu Daily – Srinagar Times),"Public issues have been increasing on daily basis, unemployment is not being controlled, economic crisis is spreading unemployment tentacles and curfew, crackdown and other restrictions have become a norm."
02-06-2017,“Responsibilities of National Conference” – (Urdu Daily – Srinagar Times),"Nobody can raise objection over these views of Omar Abdullah, because unemployment can never be controlled, prices never come down and ration depots can’t satisfy everybody."
02-06-2017,“Responsibilities of National Conference” – (Urdu Daily – Srinagar Times),This process is very old.
02-06-2017,“Responsibilities of National Conference” – (Urdu Daily – Srinagar Times),Even Sheikh Muhammad Abdullah (former CM/J&K) or any other ruler could not control Even Sheikh Muhammad Abdullah (former CM/J&K) or any other ruler.
02-06-2017,“Responsibilities of National Conference” – (Urdu Daily – Srinagar Times),The truth is that situation of uncertainty and restlessness has spread its net in every era.
02-06-2017,“Responsibilities of National Conference” – (Urdu Daily – Srinagar Times),"According to Omar Abdullah, Kashmir is presently restless and Government has become negligent."
02-06-2017,“Responsibilities of National Conference” – (Urdu Daily – Srinagar Times),"Omar Abdullah has rightly said that if coalition government has failed, responsibilities of National Conference have also increased."
02-06-2017,“Responsibilities of National Conference” – (Urdu Daily – Srinagar Times),"It is the job of NC to awaken present Government for doing present Government duty, Omar Abdullah added."
02-06-2017,“Responsibilities of National Conference” – (Urdu Daily – Srinagar Times),"But, the question is whether opposition is supposed to only criticize government while sitting in locked rooms or gain access to public and play a constructive role."
02-06-2017,“Some courage needed” – (Urdu Daily – Kashmir Uzma),Peoples Democratic Party (PDP) has once again clarified that resolution of Kashmir issue is a part of the party’s main agenda and late Mufti Muhammad Sayeed (former CM/J&K) had agreed to establish coalition government with BJP in the State on the basis of this agenda.
02-06-2017,“Some courage needed” – (Urdu Daily – Kashmir Uzma),"In a policy statement, Peoples Democratic Party (PDP) Vice-President recently gave an account of the achievements of Vice-President , like Peoples Democratic Party (PDP) efforts to establish cooperative atmosphere between India and Pakistan; beginning of trade through LoC and some other similar steps."
02-06-2017,“Some courage needed” – (Urdu Daily – Kashmir Uzma),"There are no two opinions that during first stint of Peoples Democratic Party (PDP) coalition government, situation in the Valley, particularly in Kashmir, had changed to a large extent, particularly with regard to Ikhwan (government gunmen) culture in the area."
02-06-2017,“Some courage needed” – (Urdu Daily – Kashmir Uzma),People had certainly taken a sigh of relief.
02-06-2017,“Some courage needed” – (Urdu Daily – Kashmir Uzma),People were expecting similar steps during its second tenure.
02-06-2017,“Some courage needed” – (Urdu Daily – Kashmir Uzma),But the situation has proved that same is not the case this time.
02-06-2017,“Some courage needed” – (Urdu Daily – Kashmir Uzma),"On the contrary, extremist elements in power at the Centre have been creating hurdles in implementing this policy on ground."
02-06-2017,“Some courage needed” – (Urdu Daily – Kashmir Uzma),"Advocating extreme steps, extremist elements in power at the Centre have further aggravated the situation."
02-06-2017,“Some courage needed” – (Urdu Daily – Kashmir Uzma),"In such a situation, perplexities within PDP camp are but natural and the latest statement reflects the same."
02-06-2017,“Some courage needed” – (Urdu Daily – Kashmir Uzma),"In the latest statement, it has been said that only those people know the reality and can understand pain and grief of the people, who live in such an uncertain and unfavourable situation."
02-06-2017,“Some courage needed” – (Urdu Daily – Kashmir Uzma),"Apparently, it was a hint towards Central leadership who are not only unaware about the delicacies of Kashmir issue and who flare up situation with their provocative statements."
02-06-2017,“Some courage needed” – (Urdu Daily – Kashmir Uzma),"Recently, Union Home Minister, Rajnath Singh has said more than once that the Centre is trying to find out a permanent solution of Kashmir issue."
02-06-2017,“Some courage needed” – (Urdu Daily – Kashmir Uzma),"While welcoming the latest statement, PDP has linked some hopes with this statement, which is not wrong."
02-06-2017,“Some courage needed” – (Urdu Daily – Kashmir Uzma),"Evidently, a statement from a responsible Minister can’t be an irresponsible step."
02-06-2017,“Some courage needed” – (Urdu Daily – Kashmir Uzma),It is different that debates and discussions launched by officers of Army and security forces; BJP leaders and prejudicial media have been affecting the importance of the latest statement.
02-06-2017,“Some courage needed” – (Urdu Daily – Kashmir Uzma),"According to the latest statement, the party is not in favour of people’s disgrace, aggression and violence against aggression and violence, but the party wishes implementation of Agenda of Alliance in letter and spirit."
02-06-2017,“Some courage needed” – (Urdu Daily – Kashmir Uzma),"Such a sentiment of PDP is welcome, but the party will have to confront the circles which advocate anti-people policy."
02-06-2017,“Some courage needed” – (Urdu Daily – Kashmir Uzma),the latest statement has come at an appropriate time and the party should try to implement the party views in right context.
03-06-2017,Kashmir incomplete without Pandits: National Conference – (Urdu Daily – Srinagar Times),"A senior-level delegation of National Conference, led by Provincial President, Nasir Aslam Wani, visited Tulmulla (district Ganderbal) and congratulated Kashmiri Pandits on the occasion ‘Kherbhawani Mela’ on behalf of party leadership."
03-06-2017,Kashmir incomplete without Pandits: National Conference – (Urdu Daily – Srinagar Times),"A senior-level delegation of National Conference, led by Provincial President, Nasir Aslam Wani also met Pandits who came from outside Valley to participate in the annual festival."
03-06-2017,Kashmir incomplete without Pandits: National Conference – (Urdu Daily – Srinagar Times),"While exchanging views with Pandits who came from outside Valley to participate in the annual festival, Nasir Aslam Wani said that Kashmiri people are incomplete without Pandits who came from outside Valley to participate in the annual festival as Kashmiri people are an important part of Kashmiri society."
03-06-2017,Kashmir incomplete without Pandits: National Conference – (Urdu Daily – Srinagar Times),"Expressing sorrow over less number of pilgrims visiting Kherbhawani this year, Nasir Aslam Wani alleged that wrong policies of Central and State Governments have deteriorated situation here conveying negative message across the country."
03-06-2017,Liquor business goes on in the holy month of Ramadhan: Moulana Hami – (Urdu Dailies – Srinagar Times/Aftab/Kashmir Uzma),"Addressing Friday congregation, Chairman of Karvan-e-Islami, Moulana, Ghulam Rasool Hami expressed concern over sale of liquor going on in Kashmir during holy month of Ramadhan."
03-06-2017,Liquor business goes on in the holy month of Ramadhan: Moulana Hami – (Urdu Dailies – Srinagar Times/Aftab/Kashmir Uzma),"Because of some so-called influential people, the State has become target of liquor."
03-06-2017,Liquor business goes on in the holy month of Ramadhan: Moulana Hami – (Urdu Dailies – Srinagar Times/Aftab/Kashmir Uzma),"Expressing satisfaction over the steps being taken by Karvan-e-Islami, he said that every individual should come forward to help the people affected by ongoing violence in the State."
03-06-2017,Liquor business goes on in the holy month of Ramadhan: Moulana Hami – (Urdu Dailies – Srinagar Times/Aftab/Kashmir Uzma),"Unity among Muslims is the need of time so that Ummah could be brought out of difficult situation, he added."
03-06-2017,Kashmir youths have been sacrificing their lives for freedom: J&K Mass Movement – (Urdu Dailies – Srinagar Times/Aftab),"While paying tributes to two youths recently killed in Sopore encounter, J&K Mass Movement has said that Kashmiri youths are being compelled to take up gun."
03-06-2017,Kashmir youths have been sacrificing their lives for freedom: J&K Mass Movement – (Urdu Dailies – Srinagar Times/Aftab),"According to a statement, Chairperson of Mass Movement, Farida Behanji has said that all pro-freedom leadership and people are duty bound to take the mission of ‘martyrs’ to the mission of ‘martyrs’ logical conclusion to prove that all pro-freedom leadership and people are all pro-freedom leadership and people real heirs."
03-06-2017,Kashmir youths have been sacrificing their lives for freedom: J&K Mass Movement – (Urdu Dailies – Srinagar Times/Aftab),Farida Behanji further said that Kashmiri people and ‘resistance’ leadership won’t be cowed down by pressure tactics of India; instead India would further strengthen Kashmiri people and ‘resistance’ leadership won’t be cowed down by pressure tactics of India intentions.
03-06-2017,Sacrifices given for freedom valuable asset: Moulvi Abbas – (Urdu Dailies – Srinagar Times/Aftab),"Patron of J&K Itehaad-ul-Muslimeen and former Chairman of Hurriyat Conference, Moulana Abbas Ansari described sacrifices being given by Kashmiris for freedom movement as valuable asset of freedom movement."
03-06-2017,Sacrifices given for freedom valuable asset: Moulvi Abbas – (Urdu Dailies – Srinagar Times/Aftab),"Therefore, it is necessary that entire Kashmiri nation should express association and steadfastness towards freedom movement to safeguard these sacrifices and to make these sacrifices fruitful, Patron of J&K Itehaad-ul-Muslimeen and former Chairman of Hurriyat Conference, Moulana Abbas Ansari added."
03-06-2017,“Why delay in implementing Agenda of Alliance?” – (Urdu Daily – Srinagar Times),"The statement recently issued by PDP Vice-President, Sartaj Madni with regard PDP Vice-President, Sartaj Madni party’s stand on Kashmir has become a subject of discussion among political circles."
03-06-2017,“Why delay in implementing Agenda of Alliance?” – (Urdu Daily – Srinagar Times),"In this statement, Madni said that resolution of Kashmir issue can’t be delayed further."
03-06-2017,“Why delay in implementing Agenda of Alliance?” – (Urdu Daily – Srinagar Times),"Describing resolution of Kashmir issue as agenda of PDP, Madni said that view points of late Mufti Muhammad Sayeed (former CM/J&K) were received well by people across the border."
03-06-2017,“Why delay in implementing Agenda of Alliance?” – (Urdu Daily – Srinagar Times),"Reacting over the statements of Union Home Minister, Rajnath Singh and other Central leaders, Madni said that only people, who feel grief and pain of people living in unfavourable situation, can understand the reality that resolution of long pending Kashmir issue can’t be delayed further."
03-06-2017,“Why delay in implementing Agenda of Alliance?” – (Urdu Daily – Srinagar Times),"While this statement Madni is appreciable under the given circumstances, the question repeatedly touches the mind that if Agenda of Alliance has been agreed upon by both PDP and BJP, why BJP has been backtracking from BJP."
03-06-2017,“Why delay in implementing Agenda of Alliance?” – (Urdu Daily – Srinagar Times),"Though the recent statement of Union Home Minister is encouraging to some extent, yet the statements coming from other Indian leaders and several BJP leaders have been increasing tension."
03-06-2017,“Why delay in implementing Agenda of Alliance?” – (Urdu Daily – Srinagar Times),"In such a situation, PDP should mount pressure on BJP for implementing Agenda of AllianceAlliance."
03-06-2017,“Why delay in implementing Agenda of Alliance?” – (Urdu Daily – Srinagar Times),"At present, the situation is unfavourable; nobody knows what is going to happen in future."
03-06-2017,“Why delay in implementing Agenda of Alliance?” – (Urdu Daily – Srinagar Times),"So, the situation demands that a process of talks should be initiated immediately with stakeholders."
