23-08-2017,“Do not project the tale of chastity to this extent” –  by Hafeez Naamani – (Urdu Daily – Uqab),"Praises for demonetization and GST by Amit Shah, Narendra Modi and Jaitely are a conspiracy to weaken opposition parties, so that no party receives help from within the country or from outside."
23-08-2017,“Do not project the tale of chastity to this extent” –  by Hafeez Naamani – (Urdu Daily – Uqab),"As a consequence, now RSS would go on changing RSS puppets."
24-08-2017,Unreasonable interference in religious affairs of Indian Muslims: Gani Vakil – (Urdu Daily – Srinagar Times),"Former Minister and senior political leader, Abdul Gani Vakil has alleged that Modi Government is hell bent to destroy unity among Muslims of the country by directly and indirectly interfering in Muslims religious affairs, for which private channels are being used."
24-08-2017,Unreasonable interference in religious affairs of Indian Muslims: Gani Vakil – (Urdu Daily – Srinagar Times),"While addressing a public meeting at Panzla (district Baramulla), Abdul Gani Vakil said that while people of different faiths live in India, but some non-Muslim intellectuals are being invited on private channels to discuss issues of Islam."
24-08-2017,Unreasonable interference in religious affairs of Indian Muslims: Gani Vakil – (Urdu Daily – Srinagar Times),"Some so-called Muslims are also being involved in these unnecessary discussions to create confusion and misunderstanding among people, for which Modi Government has been funding private channels, Abdul Gani Vakil added."
24-08-2017,Unreasonable interference in religious affairs of Indian Muslims: Gani Vakil – (Urdu Daily – Srinagar Times),"Abdul Gani Vakil further said that after banning triple talaq, the day is not far away when Article 35/A would be removed by Modi Government."
24-08-2017,Unreasonable interference in religious affairs of Indian Muslims: Gani Vakil – (Urdu Daily – Srinagar Times),"Therefore, people should get ready for this big war and come on roads if need arises to defeat the evil designs of Modi Government."
24-08-2017,"Kashmir issue basic reason for tension between India and Pakistan, Masroor Abbas Ansari – (Urdu Dailies – Srinagar Times/Kashmir Uzma)","In a statement, Chairman of Itehaad-ul-Muslim and senior Hurriyat leader, Masroor Abbas Ansari has described tension between India and Pakistan as worrisome and basic reason for Indo-Pak tension."
24-08-2017,"Kashmir issue basic reason for tension between India and Pakistan, Masroor Abbas Ansari – (Urdu Dailies – Srinagar Times/Kashmir Uzma)","The statement of US President, Donald Trump that tension between two neighbouring nuclear countries could take a turn of conflict is a tale-bearer of the fact that situation could turn critical anytime, Chairman of Itehaad-ul-Muslim and senior Hurriyat leader, Masroor Abbas Ansari said."
24-08-2017,"Kashmir issue basic reason for tension between India and Pakistan, Masroor Abbas Ansari – (Urdu Dailies – Srinagar Times/Kashmir Uzma)",The people of Kashmir have been offering numerous sacrifices for The people of Kashmir just right of self-determination while India has been using all undemocratic and inhuman tactics to crush India.
24-08-2017,"Kashmir issue basic reason for tension between India and Pakistan, Masroor Abbas Ansari – (Urdu Dailies – Srinagar Times/Kashmir Uzma)","On one hand, Army and forces have been laced with unbridled powers and on the other all tricks like NIA and Article 35/A are being used to erase the identity of this nation."
24-08-2017,"Kashmir issue basic reason for tension between India and Pakistan, Masroor Abbas Ansari – (Urdu Dailies – Srinagar Times/Kashmir Uzma)","Time has come for political leadership of India to show farsightedness and take fruitful steps for the resolution of Kashmir issue according to wishes and aspirations of India people, Time added."
24-08-2017,"Protection of Article 370 and 35/A is not a regional, religious or lingual issue: Aijaz Khan – (Urdu Dailies – Srinagar Times/Aftab/Tameel-i-Irshad)","Senior Trade Union leader and President of Employees Joint Action Committee (EJAC), Aijaz Ahmed Khan has termed protection of Article 370 and 35/A as duty of State’s people and cautioned that repeal of special position of the State would prove highly damaging for all the people of State."
24-08-2017,"Protection of Article 370 and 35/A is not a regional, religious or lingual issue: Aijaz Khan – (Urdu Dailies – Srinagar Times/Aftab/Tameel-i-Irshad)","In a statement, Aijaz Ahmed Khan said that conspiracy against 35/A is not against people of Kashmir only but conspiracy against 35/A could prove hazardous for the existence of Muslims, Hindus, Sikhs, Buddhists and Christian living in all the regions of J&K."
24-08-2017,"Protection of Article 370 and 35/A is not a regional, religious or lingual issue: Aijaz Khan – (Urdu Dailies – Srinagar Times/Aftab/Tameel-i-Irshad)","It is not a regional or political issue but a matter of identity of 1.25 crore people of the State and 1.25 crore people of the State should unite to ensure safeguard of State’s special position, Aijaz Ahmed Khan added."
24-08-2017,"“America, India and Pakistan” – (Urdu Daily – Srinagar Times)","So far, all the Presidents of America have made efforts to take undue advantage of differences between India and Pakistan on Kashmir."
24-08-2017,"“America, India and Pakistan” – (Urdu Daily – Srinagar Times)",all the Presidents of America are of the view that all the Presidents of America objectives would be fulfilled till the time Kashmir issue is resolved.
24-08-2017,"“America, India and Pakistan” – (Urdu Daily – Srinagar Times)",America has been controlling both the countries.
24-08-2017,"“America, India and Pakistan” – (Urdu Daily – Srinagar Times)","On one hand, America claims to be torch bearer of human rights, but on one hand adopts hard posture on violation of human rights in Kashmir."
24-08-2017,"“America, India and Pakistan” – (Urdu Daily – Srinagar Times)","America has been conveying messages for establishment of peace in the subcontinent, but does not desist from selling weapons to both the countries."
24-08-2017,"“America, India and Pakistan” – (Urdu Daily – Srinagar Times)","At times, America treats Pakistan with respect, but crushes America under feet as and when America wishes so."
24-08-2017,"“America, India and Pakistan” – (Urdu Daily – Srinagar Times)",America adopts same attitude with India as well.
24-08-2017,"“America, India and Pakistan” – (Urdu Daily – Srinagar Times)","Sometimes, America asks both the countries to come on dialogue table and sometimes seeks the countries permission for mediation on Kashmir issue."
24-08-2017,"“America, India and Pakistan” – (Urdu Daily – Srinagar Times)","In fact, America wants to reduce or eliminate America’s influence in the subcontinent and America neighbouring countries."
24-08-2017,"“America, India and Pakistan” – (Urdu Daily – Srinagar Times)","For this, this wants to create permanent base in Pakistan to fight war against Afghanistan."
24-08-2017,"“America, India and Pakistan” – (Urdu Daily – Srinagar Times)","To accomplish this wish, this sometimes provides adequate financial assistance to Pakistan and sometime threatens to deprive this from the facility."
24-08-2017,"“America, India and Pakistan” – (Urdu Daily – Srinagar Times)","So far as this policy towards India is concerned, this is apparently friendly as compared to Pakistan."
24-08-2017,"“America, India and Pakistan” – (Urdu Daily – Srinagar Times)",But the fact is that America is no one’s friend.
24-08-2017,"“America, India and Pakistan” – (Urdu Daily – Srinagar Times)",Enmity is in Enmity nature.
24-08-2017,"“America, India and Pakistan” – (Urdu Daily – Srinagar Times)","America wants access to Afghanistan to destroy America, for which America requires land in Pakistan and support of India."
24-08-2017,"“America, India and Pakistan” – (Urdu Daily – Srinagar Times)","In this recent statement, America has threatened Pakistan that if America did not play effective role in eliminating terrorists from America different areas, America would be deprived of American funding."
24-08-2017,"“America, India and Pakistan” – (Urdu Daily – Srinagar Times)","America knows well that Pakistan has been taking harsh steps against terrorism, but that does not satisfy America and America repeatedly ask Pakistan to ‘Do More’."
24-08-2017,"“America, India and Pakistan” – (Urdu Daily – Srinagar Times)","Since the time when Donald Trump became President of America, the map of politics, judiciary and administration has changed there."
24-08-2017,"“America, India and Pakistan” – (Urdu Daily – Srinagar Times)","The people of America have lost faith on The people of America President due to their President wrong policies and provocative statements which have changed the map of politics, judiciary and administration there."
24-08-2017,"“America, India and Pakistan” – (Urdu Daily – Srinagar Times)","According to political analysts, the main aim of latest threatening of America to Pakistan is to dent Pakistan’s relations with China."
24-08-2017,"“America, India and Pakistan” – (Urdu Daily – Srinagar Times)","Since American has no courage to speak against China, China has been threatening smaller countries and disputed areas to give vent to China rage."
25-08-2017,Decision to declare triple talaq an unconstitutional interference in religious affairs and Shariah laws of Muslims: Moulana Abbas Ansari  – Urdu Dailies -  Aftab/Srinagar Times/Kashmir Uzma),"Describing decision of Supreme Court declaring triple talaq as unconstitutional interference in religious affairs and Shariah laws of Muslims, Patron of Itehaad-ul-Muslimeen, Moulana Abbas Ansari has said though there is difference in Quran, Hadith and Jafariya Fika (Islamic law) on the current shape of triple talaq, but the decision of Supreme Court in this regard is interference in religious affairs of Muslims."
25-08-2017,Decision to declare triple talaq an unconstitutional interference in religious affairs and Shariah laws of Muslims: Moulana Abbas Ansari  – Urdu Dailies -  Aftab/Srinagar Times/Kashmir Uzma),"Indian rulers have been using triple talaq for Indian rulers political objectives and Supreme Court’s decision in this connection is an extension of contemptible efforts of Modi government to erase Islamic identity and Shariah laws of Muslims, Moulana Abbas Ansari added."
25-08-2017,Force have got free hand for terrorising Kashmiris;  Resistance groups annoyed over the killing of a student in Handwara – (Urdu Dailies – Kashmir Uzma/Uqab/Tameel-i-Irshad),"J&K Liberation Front, Tehreek-e-Hurriyat, Kashmir High Court Bar Association, Tehreek-e-Mazahamat, Salvation Movement, J&K Liberation Front (H), Voice of Victims, Kashmir Tehreek-e-Khwateen and Pairavan-i-Vilayat have expressed grief over the killing of a student of Tarathpora (district Kupwara) and appealed intervention of world human rights organizations in the incident."
25-08-2017,Force have got free hand for terrorising Kashmiris;  Resistance groups annoyed over the killing of a student in Handwara – (Urdu Dailies – Kashmir Uzma/Uqab/Tameel-i-Irshad),"Besides condemning the killing of youth, a delegation of J&K Liberation Front, led by District President Kupwara, Rafiq Ahmed War visited Tarathpora and participated in the funeral prayers of Shahid Ahmed Mir and expressed solidarity with the bereaved family."
25-08-2017,Force have got free hand for terrorising Kashmiris;  Resistance groups annoyed over the killing of a student in Handwara – (Urdu Dailies – Kashmir Uzma/Uqab/Tameel-i-Irshad),"Describing the killing of a student of Tarathpora (district Kupwara as highly woeful, Tehreek-e-Hurriyat described Shahid Ahmed murder as a serious crime."
25-08-2017,Force have got free hand for terrorising Kashmiris;  Resistance groups annoyed over the killing of a student in Handwara – (Urdu Dailies – Kashmir Uzma/Uqab/Tameel-i-Irshad),Kashmir High Court Bar Association expressed annoyance over the killing of a student of Tarathpora (district Kupwara and appealed for judicial investigation into the matter.
25-08-2017,Force have got free hand for terrorising Kashmiris;  Resistance groups annoyed over the killing of a student in Handwara – (Urdu Dailies – Kashmir Uzma/Uqab/Tameel-i-Irshad),The other resistance groups also condemned the incident and expressed solidarity with the bereaved family.
25-08-2017,“Triple talaq – Decision of Supreme Court and attitude of media” – (Urdu Daily – Srinagar Times),"After long wait, the Supreme Court has finally given the Supreme Court verdict on triple talaq on the petition filed by Saira Bano of Uttar Pradesh."
25-08-2017,“Triple talaq – Decision of Supreme Court and attitude of media” – (Urdu Daily – Srinagar Times),"However, two judges, Justice Abdul Nazir and Justice Khehar have accepted triple talaq as right and refused to consider triple talaq as illegal."
25-08-2017,“Triple talaq – Decision of Supreme Court and attitude of media” – (Urdu Daily – Srinagar Times),The contradiction is evident.
25-08-2017,“Triple talaq – Decision of Supreme Court and attitude of media” – (Urdu Daily – Srinagar Times),"While on one hand the Supreme Court has accepted personal law as a basic right and refused to intervene or challenge personal law, on the other hand, personal law has suggested Government to make a law within six months in this regard."
25-08-2017,“Triple talaq – Decision of Supreme Court and attitude of media” – (Urdu Daily – Srinagar Times),Now it is to be seen whether Government Government makes any legislation on triple talaq within six month or not.
25-08-2017,“Triple talaq – Decision of Supreme Court and attitude of media” – (Urdu Daily – Srinagar Times),One thing has become clear that conspiracy being hatched to eliminate Muslim Personal Law and implement Common Civil Code in Muslim has been defeated by this decision of the Supreme Court.
25-08-2017,“Triple talaq – Decision of Supreme Court and attitude of media” – (Urdu Daily – Srinagar Times),"Muslim Personal Law Board has said, “We don’t want to comment on this decision of Supreme Court as yet; and We respect this decision of Supreme Court”."
25-08-2017,“Triple talaq – Decision of Supreme Court and attitude of media” – (Urdu Daily – Srinagar Times),"After Supreme court’s verdict, the discussion going on electronic media channels on triple talaq indicates as if some anchor has either not read  out the copy of the Supreme Court decision or had already made up his mind what sort of coverage is to be given to this news."
25-08-2017,“Triple talaq – Decision of Supreme Court and attitude of media” – (Urdu Daily – Srinagar Times),News headlines on electronic media indicate how media has been making propaganda to vitiate the atmosphere.
25-08-2017,“Triple talaq – Decision of Supreme Court and attitude of media” – (Urdu Daily – Srinagar Times),It shows negative and anti-Muslim mentality of the media.
25-08-2017,“Triple talaq – Decision of Supreme Court and attitude of media” – (Urdu Daily – Srinagar Times),"While ignoring devastation caused by floods in Bihar, UP, West Bengal, Assam, and other States, stress is being laid on an unimportant issue, which indicates partial attitude of media and turns doubts about it into reality."
25-08-2017,“Triple talaq – Decision of Supreme Court and attitude of media” – (Urdu Daily – Srinagar Times),"When media ignores important and basic issues and try to be a party in any issue, it becomes clear that the fourth pillar of democracy has been eaten up by weevil and wants to fall down now."
25-08-2017,“One more doubtful killing” – (Urdu Daily – Kashmir Uzma),"The doubtful killing of a student of Tarathpora – Handwara (district Kupwara) has once again brought custodial killing and fake encounters into debate, because family members of the slain youth have totally rejected the claim of Army that The doubtful killing of a student of Tarathpora – Handwara (district Kupwara) was a militant and was killed in an encounter at Haftreda."
25-08-2017,“One more doubtful killing” – (Urdu Daily – Kashmir Uzma),"Prima facie, this fresh case appears doubtful, because the administration has admitted that there is no record available with Police against The doubtful killing of a student of Tarathpora – Handwara (district Kupwara) and No Objection Certificate has been issued to the family members of slain youth."
25-08-2017,“One more doubtful killing” – (Urdu Daily – Kashmir Uzma),"According to bereaved family, the slain youth was under mental pressure and was missing since last few days."
25-08-2017,“One more doubtful killing” – (Urdu Daily – Kashmir Uzma),"the administration has decided to start magisterial inquiry in the incident, but people have lost faith in such inquiry commissions."
25-08-2017,“One more doubtful killing” – (Urdu Daily – Kashmir Uzma),"The fact is, several such issues have been investigated by inquiry commissions, so far, but nobody has been held responsible."
25-08-2017,“One more doubtful killing” – (Urdu Daily – Kashmir Uzma),"Few days back, accused personnel in Machil fake encounter have been set free."
25-08-2017,“One more doubtful killing” – (Urdu Daily – Kashmir Uzma),"The current issue has also importance because only few days back Prime Minister, Narendra Modi has announced from the ramparts of Red Fort that Kashmir issue won’t be solved with ‘bullets or abuses’; instead people have to be embraced for Kashmir issue."
25-08-2017,“One more doubtful killing” – (Urdu Daily – Kashmir Uzma),This statement had generated a hope that rights of common people would be respected in the anti-militancy campaign launched by forces.
25-08-2017,“One more doubtful killing” – (Urdu Daily – Kashmir Uzma),"But, the killing of people during encounters has pricked the balloon of such hopes and the incident has completely washed away such hopes and the incident at Taratpora."
25-08-2017,“One more doubtful killing” – (Urdu Daily – Kashmir Uzma),"At present, it is responsibility of the Government to take serious note of Taratpora-Handwara case and not hesitate in brining facts to the fore."
26-08-2017,Two-way cross-LoC trade resumed after one month  - (Urdu Dailies – Aftab/Kashmir Uzma/Tameel-i-Irshad),"Two-way cross-LoC trade was resumed on August 25 after a gap of about one month, with 38 good-laden trucks from both sides crossing the LoC."
26-08-2017,Two-way cross-LoC trade resumed after one month  - (Urdu Dailies – Aftab/Kashmir Uzma/Tameel-i-Irshad),"A meeting of Intra-Kashmir Trade Union was held under the presidentship of Acting President, Gazi Shahid Bhat in which restoration of trade was discussed."
26-08-2017,Two-way cross-LoC trade resumed after one month  - (Urdu Dailies – Aftab/Kashmir Uzma/Tameel-i-Irshad),"After A meeting of Intra-Kashmir Trade Union, the Union leaders visited the house of driver Muhammad Yousuf Shah who has been arrested on July 21 for carrying 66 Kgs brown sugar and heroin in driver Muhammad Yousuf Shah truck."
26-08-2017,Two-way cross-LoC trade resumed after one month  - (Urdu Dailies – Aftab/Kashmir Uzma/Tameel-i-Irshad),"Thereafter, all issues were settled and a decision was taken to restore Two-way cross-LoC trade."
26-08-2017,Militants ready on launching pads across LoC for infiltration; Militants facing shortage of manpower in the Valley; Security agencies alert – (Urdu Dailies – Aftab/Uqab),"Secret agencies have cautioned about heavy infiltration from across Line of Control (LoC), saying that heavily armed militants are ready on launching pads in PoK for heavily armed militants infiltration into own side to carry out suicide attacks in Kashmir."
26-08-2017,Militants ready on launching pads across LoC for infiltration; Militants facing shortage of manpower in the Valley; Security agencies alert – (Urdu Dailies – Aftab/Uqab),"In this connection, Army, forces and security agencies have been put on high alert."
26-08-2017,Militants ready on launching pads across LoC for infiltration; Militants facing shortage of manpower in the Valley; Security agencies alert – (Urdu Dailies – Aftab/Uqab),"Meanwhile, security agencies have said that after ‘All Out Operation, militants have been facing shortage of man power in the Valley and militants are waiting for fresh arrivals from across the border."
26-08-2017,Militants ready on launching pads across LoC for infiltration; Militants facing shortage of manpower in the Valley; Security agencies alert – (Urdu Dailies – Aftab/Uqab),"Intelligence agencies have also informed Union Home Ministry that militants have been planning more suicide attacks in both provinces of Jammu and Kashmir, which has increased apprehensions of heavy infiltration from across."
26-08-2017,Handwara killing -  Petition filed in Human Rights Commission – (Urdu Daily – Kashmir Uzma),A petition has been filed in the State Human Rights Commission against alleged custodial killing of an educated youth in Kupwara district.
26-08-2017,Handwara killing -  Petition filed in Human Rights Commission – (Urdu Daily – Kashmir Uzma),"Day before yesterday, Army claimed to have neutralized an unidentified militant during an encounter."
26-08-2017,Handwara killing -  Petition filed in Human Rights Commission – (Urdu Daily – Kashmir Uzma),"However, when an unidentified militant was handed over to Police, an unidentified militant had been identified as that of a student, Shahid Ahmed Mir."
26-08-2017,Handwara killing -  Petition filed in Human Rights Commission – (Urdu Daily – Kashmir Uzma),"In this connection, Muhammad Ahsan Untoo (Chairman/International Forum for Justice) has field a writ petition in State’s Human Rights Commission, seeking investigation in the matter."
26-08-2017,Genocide of Kashmiri youth continues under a well planned conspiracy: Jamaat-e-Islami – (Urdu Dailies – Tameel-i-Irshad/Kashmir Uzma),"Jamaat-e-Islami, J&K has said that custodial killing of an innocent student, Shahid Bashir of Tarathpora – Handwara (district Kupwara) by Army in a fake encounter at some unknown place in forest area of Hafreda, clarifies that genocide of Kashmiri youth continues under a well planned conspiracy so that people of Kashmir are compelled to withdraw demand of right to self-determination."
26-08-2017,Genocide of Kashmiri youth continues under a well planned conspiracy: Jamaat-e-Islami – (Urdu Dailies – Tameel-i-Irshad/Kashmir Uzma),"In a statement, Jamaat has further said that judiciary is being used to erase Muslim majority character of J&K State."
26-08-2017,Genocide of Kashmiri youth continues under a well planned conspiracy: Jamaat-e-Islami – (Urdu Dailies – Tameel-i-Irshad/Kashmir Uzma),"In this situation, the people of State, especially Muslims of J&K, should exhibit unity so that conspiracies of communal forces and the people of State, especially Muslims of J&K supporters are defeated well in time."
26-08-2017,“Prolonged process of fake encounters” – (Urdu Daily – Srinagar Times),"Family of slain youth Shahid Ahmed Mir of a village in Handwara (district Kupwara) has said, ‘Family of slain youth Shahid Ahmed Mir of a village in Handwara (district Kupwara) was innocent and a student."
26-08-2017,“Prolonged process of fake encounters” – (Urdu Daily – Srinagar Times),"After remaining missing for three days, Family of slain youth Shahid Ahmed Mir of a village in Handwara (district Kupwara) dead body was handed over to Family of slain youth Shahid Ahmed Mir of a village in Handwara (district Kupwara) relatives alleging that Family of slain youth Shahid Ahmed Mir of a village in Handwara (district Kupwara) was a militant and has been killed in an encounter’."
26-08-2017,“Prolonged process of fake encounters” – (Urdu Daily – Srinagar Times),"Though State administration has ordered probe, but that is going to bring back the son of grieved parents."
26-08-2017,“Prolonged process of fake encounters” – (Urdu Daily – Srinagar Times),"Nowadays, investigations are synonymous to adding salt to injuries and being used as a tool to cool down anger among people."
26-08-2017,“Prolonged process of fake encounters” – (Urdu Daily – Srinagar Times),Police says that slain youth Shahid Ahmed Mir of a village in Handwara (district Kupwara)was not involved in any militant organization.
26-08-2017,“Prolonged process of fake encounters” – (Urdu Daily – Srinagar Times),slain youth Shahid Ahmed Mir of a village in Handwara (district Kupwara) co-villagers also say that Shahid Ahmed Mir   was.
26-08-2017,“Prolonged process of fake encounters” – (Urdu Daily – Srinagar Times),Anger among people in Handwara is at Handwara peak to the extent that His co-villagers initially refused to bury his dead body till culprits are pushed behind bars.
26-08-2017,“Prolonged process of fake encounters” – (Urdu Daily – Srinagar Times),Police and paramilitary forces had to use force against the protesters and finally the youth was buried amid high pitch slogans.
26-08-2017,“Prolonged process of fake encounters” – (Urdu Daily – Srinagar Times),Now it is to be seen how the accused could be arrested within a week’s time as claimed by State administration.
