03-08-2018,Article 35/A will be protected in any case for special position of the State: KUTA - (Urdu Daily - Srinagar Times),"Disappointing approach of the Central Government headed by BJP with regard to special position of Jammu and Kashmir Kashmir is condemnable, Disappointing approach of the Central Government headed by BJP with regard to special position of Jammu and Kashmir said."
03-08-2018,Conspiracies being hatched to change Muslim majority character of J&K State into minority; State’s people should unite for protection: Suwat-ul-Haq - (Urdu Dailies - Srinagar Times/Aftab/Kashmir Uzma),"In a statement, Spokesman of Suwat-ul-Haq has said that efforts are being made since decades to end special position of Jammu and Kashmir State guaranteed vide Article 35/A."
03-08-2018,Conspiracies being hatched to change Muslim majority character of J&K State into minority; State’s people should unite for protection: Suwat-ul-Haq - (Urdu Dailies - Srinagar Times/Aftab/Kashmir Uzma),All these plans are aimed at changing Muslim majority character of the State into minority and make temporary accession of J&K with India as permanent and unconditional.
03-08-2018,Conspiracies being hatched to change Muslim majority character of J&K State into minority; State’s people should unite for protection: Suwat-ul-Haq - (Urdu Dailies - Srinagar Times/Aftab/Kashmir Uzma),"Describing tinkering with special position of J&K State as intolerable, Spokesman of Suwat-ul-Haq Spokesman of Suwat-ul-Haq has condemned all those elements that have been using different tricks and tactics to harm this position."
03-08-2018,Conspiracies being hatched to change Muslim majority character of J&K State into minority; State’s people should unite for protection: Suwat-ul-Haq - (Urdu Dailies - Srinagar Times/Aftab/Kashmir Uzma),"Therefore, people should prove people complete awareness in this regard to ensure safety of people rights, Spokesman of Suwat-ul-Haq added."
03-08-2018,Doors of Kashmir closed for foreign journalists; Woman Bureau Chief of Washington Post also not permitted: Omar Abdullah - (Urdu Dailies - Uqab/Tameel-i-Irshad),Media institutions and journalist unions have expressed annoyance over ban imposed by Central Government on the visit of foreign journalists to Jammu and Kashmir without permission.
03-08-2018,Doors of Kashmir closed for foreign journalists; Woman Bureau Chief of Washington Post also not permitted: Omar Abdullah - (Urdu Dailies - Uqab/Tameel-i-Irshad),"Meanwhile, woman Bureau Chief of ‘Washington Post’ for India has revealed that India has not permitted woman Bureau Chief of ‘Washington Post’ for India to accomplish woman Bureau Chief of ‘Washington Post’ for India professional duties in Kashmir."
03-08-2018,Doors of Kashmir closed for foreign journalists; Woman Bureau Chief of Washington Post also not permitted: Omar Abdullah - (Urdu Dailies - Uqab/Tameel-i-Irshad),"Working President of National Conference & former Chief Minister/J&K, Omar Abdullah has said that situation in Kashmir is so bad that we don’t want foreign journalists to see it with foreign journalists own eyes."
03-08-2018,Doors of Kashmir closed for foreign journalists; Woman Bureau Chief of Washington Post also not permitted: Omar Abdullah - (Urdu Dailies - Uqab/Tameel-i-Irshad),"Omar Abdullah questioned on Twitter, “Is situation in Kashmir so bad that we are afraid of foreign journalist’s arrival in the Valley."
03-08-2018,Doors of Kashmir closed for foreign journalists; Woman Bureau Chief of Washington Post also not permitted: Omar Abdullah - (Urdu Dailies - Uqab/Tameel-i-Irshad),This is one more dignified victory of BJP to close doors of Kashmir for foreign journalists”.
03-08-2018,“Article 35/A and National Conference” - (Urdu Daily - Srinagar Times),"National Conference has expressed National Conference determination to defeat all efforts being made to repeal Article 35/A from the Constitution, adding that the party leadership would come in the field for National Conference protection."
03-08-2018,“Article 35/A and National Conference” - (Urdu Daily - Srinagar Times),"In Dr. Farooq Abdullah speeches, party President, Dr. Farooq Abdullah has described any tinkering with Article 370 as dangerous and cautioned Government of India that if any decision in this regard comes against the wishes of Kashmiris restlessness in the State would touch extremes and become a reason for serious consequences."
03-08-2018,“Article 35/A and National Conference” - (Urdu Daily - Srinagar Times),"Working President of National Conference, Dr. Farooq Abdullah has also adopted a hard tone in this regard, saying that if efforts for the removal of 35/A from the Constitution succeed, Article 370 will lose Article 370 value and accession with India will automatically come to end."
03-08-2018,“Article 35/A and National Conference” - (Urdu Daily - Srinagar Times),"But, National Conference could be asked that despite remaining in power for a long time why the party has never put pressure on the Centre for remaining committed at least to ‘conditional accession’."
03-08-2018,“Article 35/A and National Conference” - (Urdu Daily - Srinagar Times),"Neither late Sheikh Muhammad Abdullah nor his successor, Dr. Farooq Abdullah took cudgels with the Centre in this regard."
03-08-2018,“Article 35/A and National Conference” - (Urdu Daily - Srinagar Times),"Later, when Dr. Farooq Abdullah assumed power, Dr. Farooq Abdullah too did not declare any decisive battle for restoration of per-1953 position."
03-08-2018,“Article 35/A and National Conference” - (Urdu Daily - Srinagar Times),"Today, ‘autonomy’ has once become a moment of worry for National Conference."
03-08-2018,“Article 35/A and National Conference” - (Urdu Daily - Srinagar Times),the party should clarify the party position in this matter before jumping in elections.
03-08-2018,“There is difficulty on every step: Walk carefully - (Urdu Daily- Tameel-i-Irshad) ,Human rights violations are at peak in Kashmir and atmosphere of disturbance is found everywhere.
03-08-2018,“There is difficulty on every step: Walk carefully - (Urdu Daily- Tameel-i-Irshad) ,Occurrence of such incidents has become a routine in the Valley; but a new contention has emerged that conspiracies are being hatched to fiddle with this Article.
03-08-2018,“There is difficulty on every step: Walk carefully - (Urdu Daily- Tameel-i-Irshad) ,"Anxiety has gripped the State with regard to hearing on this Article scheduled for August 06, 2018."
03-08-2018,“There is difficulty on every step: Walk carefully - (Urdu Daily- Tameel-i-Irshad) ,"Now separatist leadership, civil society, trade unions and other organisations have given call for agitation and shutdown in defence of Article 35-A and also claimed to sacrifice civil society, trade unions and other organisations blood to maintain and save the special position of the State."
03-08-2018,“There is difficulty on every step: Walk carefully - (Urdu Daily- Tameel-i-Irshad) ,"It is clear that if this Article is tinkered with, the atmosphere in Kashmir will become tense and there will be bloodshed."
03-08-2018,“There is difficulty on every step: Walk carefully - (Urdu Daily- Tameel-i-Irshad) ,So it is important that attention should be paid towards overall situation of the State.
03-08-2018,“There is difficulty on every step: Walk carefully - (Urdu Daily- Tameel-i-Irshad) ,"Instead of hostility, State Government should play role of reconciliation so that the State could be saved from more bloodshed."
04-08-2018,Well known personalities will be present in the Supreme Court during hearing on Article - 35/A: J&K Civil Society - (Urdu Dailies - Srinagar Times/Uqab/Tameel-i-Irshad),"To defend the plans of revocation of J&K State’s special position, the members of  J&K Civil Society Coordination Committee, Muzaffar Ahmed Shah, Advocate Mir Javed, Sardar Jagmohan, Advocate Yasmeen and Deputy Mufti Azam, Nasir-ul-Islam  would be present in the Supreme Court on August 6 during the hearing on Article 35/A."
04-08-2018,Well known personalities will be present in the Supreme Court during hearing on Article - 35/A: J&K Civil Society - (Urdu Dailies - Srinagar Times/Uqab/Tameel-i-Irshad),Civil Society Coordination Committee has appealed all Government employees of the State to remain on protest leave on August 6 and play all Government employees of the State role in this battle.
04-08-2018,Well known personalities will be present in the Supreme Court during hearing on Article - 35/A: J&K Civil Society - (Urdu Dailies - Srinagar Times/Uqab/Tameel-i-Irshad),"Awami National Conference Vice-President, Muzaffar Ahmed Shah has left for Delhi on August 3 to exchange views with Awami National Conference Vice-President, Muzaffar Ahmed Shah lawyer in the Supreme Court with regard to hearing on August 6."
04-08-2018,Well known personalities will be present in the Supreme Court during hearing on Article - 35/A: J&K Civil Society - (Urdu Dailies - Srinagar Times/Uqab/Tameel-i-Irshad),It may be mentioned that the Supreme Court has accepted application of Awani National Conference for being a party to the case.
04-08-2018,Well known personalities will be present in the Supreme Court during hearing on Article - 35/A: J&K Civil Society - (Urdu Dailies - Srinagar Times/Uqab/Tameel-i-Irshad),"Before Awami National Conference Vice-President, Muzaffar Ahmed Shah departure for Delhi, Muzaffar Ahmed Shah has said, “We are not ready to hear any bad news from the Supreme Court."
04-08-2018,Well known personalities will be present in the Supreme Court during hearing on Article - 35/A: J&K Civil Society - (Urdu Dailies - Srinagar Times/Uqab/Tameel-i-Irshad),"Leaders of all political schools of thought, social and trade leaders and every citizen could defend Article 35/A."
04-08-2018,Well known personalities will be present in the Supreme Court during hearing on Article - 35/A: J&K Civil Society - (Urdu Dailies - Srinagar Times/Uqab/Tameel-i-Irshad),"God forbid, in reaction of any unexpected decision of Supreme Court, lakhs of people, including me, would find Supreme Court, lakhs of people in jails”."
04-08-2018,Any kind of fiddling with Article 35/A unacceptable: Salvation Movement - (Urdu Daily -Srinagar Times),"While continuing his contact-people programme, senior resistance leader and Chairman of J&K Salvation Movement, Zaffar Akbar Bhat has said, in a press statement, that people would react on roads against any fiddling with Article 35/A."
04-08-2018,Any kind of fiddling with Article 35/A unacceptable: Salvation Movement - (Urdu Daily -Srinagar Times),Identity of Kashmir could be in danger if Article 35/A.
04-08-2018,Any kind of fiddling with Article 35/A unacceptable: Salvation Movement - (Urdu Daily -Srinagar Times),Weakening of Article 35/A.
04-08-2018,Any kind of fiddling with Article 35/A unacceptable: Salvation Movement - (Urdu Daily -Srinagar Times),"is a plan and conspiracy to change Muslim majority of State into minority, he said."
04-08-2018,Moulana Hami appealed people to defend Article 35/A and State’s integrity - (Urdu Daily - Tameel-i-Irshad),"Talking to media representative, Amir of Karvan-e-Islami, Moulana Ghulam Rasool Hami has said that nobody would be allowed to erode integrity of State by using the Supreme Court and other Government institutions."
04-08-2018,Moulana Hami appealed people to defend Article 35/A and State’s integrity - (Urdu Daily - Tameel-i-Irshad),Different political tactics are being used to remove special position of Jammu and Kashmir which is tantamount to snatching the last right of Kashmiri people.
04-08-2018,Moulana Hami appealed people to defend Article 35/A and State’s integrity - (Urdu Daily - Tameel-i-Irshad),"Need of the hour is to defend Article 35/A, and other Articles in unison."
04-08-2018,Moulana Hami appealed people to defend Article 35/A and State’s integrity - (Urdu Daily - Tameel-i-Irshad),People of the State should unite and raise People of the State voice against possible decision of Supreme Court on this Article.
04-08-2018,Moulana Hami appealed people to defend Article 35/A and State’s integrity - (Urdu Daily - Tameel-i-Irshad),"Addressing judiciary and other institutions, Moulana Ghulam Rasool Hami said that other institutions should deeply review the historical facts of Kashmir and save other institutions institutions from being gifted at the altar of religious extremists."
04-08-2018,“Why special status of Kashmir has become a topic for discussion”? -  (Urdu Daily  - ‘Aftab’) ,People of Kashmir have been agitating in defence of Article 35-A of Indian Constitution.
04-08-2018,“Why special status of Kashmir has become a topic for discussion”? -  (Urdu Daily  - ‘Aftab’) ,"On Thursday, traders, industrialists and civil society took out a procession and staged protest."
04-08-2018,“Why special status of Kashmir has become a topic for discussion”? -  (Urdu Daily  - ‘Aftab’) ,"traders, industrialists and civil society said that people of Kashmir will sacrifice people of Kashmir blood to save Article 35-A of Indian Constitution."
04-08-2018,“Why special status of Kashmir has become a topic for discussion”? -  (Urdu Daily  - ‘Aftab’) ,"traders, industrialists and civil society also warned Government of India not to fiddle with Article 35-A of Indian Constitution; otherwise traders, industrialists and civil society will have to face dire consequences."
04-08-2018,“Why special status of Kashmir has become a topic for discussion”? -  (Urdu Daily  - ‘Aftab’) ,"Next day, Advocates and other people staged protest at different places, while as fruit growers and owners of orchards also staged protest at Fruit Mandi, Srinagar and said that if these Articles were tinkered with, agitation would be started in entire State."
04-08-2018,“Why special status of Kashmir has become a topic for discussion”? -  (Urdu Daily  - ‘Aftab’) ,"People also protested after Friday prayer and declared these Articles as identity and dignity of Kashmir, adding that if these Articles are removed these Articles will eliminate Kashmir and Kashmiriyat."
04-08-2018,“Why special status of Kashmir has become a topic for discussion”? -  (Urdu Daily  - ‘Aftab’) ,"Kashmiri people agree that identity of Jammu and Kashmir has been established under Article 35-A and Article 370 and removal of these Articles will eliminate Kashmiri people existence, culture and civilization."
04-08-2018,“Why special status of Kashmir has become a topic for discussion”? -  (Urdu Daily  - ‘Aftab’) ,"Legal experts are of the view that people of India cannot purchase land in several States, including Gujarat."
04-08-2018,“Why special status of Kashmir has become a topic for discussion”? -  (Urdu Daily  - ‘Aftab’) ,Then why special position and state subject laws of Jammu and Kashmir State have become a topic for discussion?
04-08-2018,“Defence of Article 35/A” - by Dr. Javid Iqbal - (Urdu Daily - Kashmir Uzma),Every political party have come to fore in defence of Article 35/A.
04-08-2018,“Defence of Article 35/A” - by Dr. Javid Iqbal - (Urdu Daily - Kashmir Uzma),"Resistance parties, who have succeeded in establishing a united front through reconciliation, have also come in the fore front in defence of Article 35/A."
04-08-2018,“Defence of Article 35/A” - by Dr. Javid Iqbal - (Urdu Daily - Kashmir Uzma),and called for a complete shutdown on August 5 and 6.
04-08-2018,“Defence of Article 35/A” - by Dr. Javid Iqbal - (Urdu Daily - Kashmir Uzma),"Besides the leadership of resistances parties, State’s Civil Society and Trade Organisations are also in a state of readiness to defend Article 35/A.. Mainstream parties are also raising Mainstream parties voice intermittently in defence of Article 35/A."
04-08-2018,“Defence of Article 35/A” - by Dr. Javid Iqbal - (Urdu Daily - Kashmir Uzma),"The basic reason of hearing on Article 35/A, going to be held on August 6, is that the front-line extremist organisations associated with right wing parties of India have challenged this Act in the Supreme Court."
04-08-2018,“Defence of Article 35/A” - by Dr. Javid Iqbal - (Urdu Daily - Kashmir Uzma),"Right Wing political organisations of India, most of which are associated with RSS, have been maintaining negative view about special position, political and constitutional identity of J&K State."
04-08-2018,“Defence of Article 35/A” - by Dr. Javid Iqbal - (Urdu Daily - Kashmir Uzma),"And, the front-line extremist organisations associated with right wing parties of India being a political arm of right-wing, the view of BJP is also negative which has been proved in previous hearings in the Supreme Court with regard to Article 35/A."
04-08-2018,“Defence of Article 35/A” - by Dr. Javid Iqbal - (Urdu Daily - Kashmir Uzma),Article 35/A in constantly under attack since when BJP government assumed power in Delhi in 2014.
04-08-2018,“Defence of Article 35/A” - by Dr. Javid Iqbal - (Urdu Daily - Kashmir Uzma),Commotion on Article 35/A.
04-08-2018,“Defence of Article 35/A” - by Dr. Javid Iqbal - (Urdu Daily - Kashmir Uzma),"As a Leader of Opposition, BJP, Arun Jaitley has criticised this Act with a logic that this Act is against the rights of Indian citizens."
04-08-2018,“Defence of Article 35/A” - by Dr. Javid Iqbal - (Urdu Daily - Kashmir Uzma),"BJP, Arun Jaitley also said that this Act could be challenged any time in the Supreme Court."
04-08-2018,“Defence of Article 35/A” - by Dr. Javid Iqbal - (Urdu Daily - Kashmir Uzma),"This has happened after 2014 when the front-line organisations of right wing, besides other arguments, stated in the Supreme Court that Article 35/A has no confirmation of Parliament."
04-08-2018,“Defence of Article 35/A” - by Dr. Javid Iqbal - (Urdu Daily - Kashmir Uzma),"According to Article 368 of the Constitution of India, confirmation of Parliament is necessary for any constitutional amendment."
04-08-2018,“Defence of Article 35/A” - by Dr. Javid Iqbal - (Urdu Daily - Kashmir Uzma),"But, Article 370 has been working as a bridge between J&K State and Union of India."
04-08-2018,“Defence of Article 35/A” - by Dr. Javid Iqbal - (Urdu Daily - Kashmir Uzma),Any constitutional amendment could be imposed in the State of J&K under Section (1) of Article 370 and this could be done only on the formal request of State Government.
04-08-2018,“Defence of Article 35/A” - by Dr. Javid Iqbal - (Urdu Daily - Kashmir Uzma),Article 35/A has become a part of Indian Constitution on May 14 1954 vide a Presidential Order.
04-08-2018,“Defence of Article 35/A” - by Dr. Javid Iqbal - (Urdu Daily - Kashmir Uzma),"Owing to this, it is obligatory for Government of India to honour it."
04-08-2018,“Jammu will be affected more by removal of Article 35-A - by Ghulam Hassan Zargar Kulgami - (Urdu Daily - Chattan) ,"Article 35-A and Article 370 are being counted by Constitution of India as a document of accession of Jammu and Kashmir with the Union of India, because this State had a separate and independent position before Independence."
04-08-2018,“Jammu will be affected more by removal of Article 35-A - by Ghulam Hassan Zargar Kulgami - (Urdu Daily - Chattan) ,this State ratio of population had majority of Muslims.
04-08-2018,“Jammu will be affected more by removal of Article 35-A - by Ghulam Hassan Zargar Kulgami - (Urdu Daily - Chattan) ,"But despite this, the then Ruler Maharaja Hari Singh, along with some Muslim leaders, acceded J&K with India and the then Central Government expressed willingness to keep special position of the State in Constitution of India."
04-08-2018,“Jammu will be affected more by removal of Article 35-A - by Ghulam Hassan Zargar Kulgami - (Urdu Daily - Chattan) ,"Otherwise, more options were available at that time."
04-08-2018,“Jammu will be affected more by removal of Article 35-A - by Ghulam Hassan Zargar Kulgami - (Urdu Daily - Chattan) ,"70 years have passed, but today some people are trying to reject the resolutions passed by the ancestors, and Central Government has implemented several laws in this State from time to time."
04-08-2018,“Jammu will be affected more by removal of Article 35-A - by Ghulam Hassan Zargar Kulgami - (Urdu Daily - Chattan) ,"According to Article 35-A, people of other States can not purchase land and properties in J&K and people of other States can not get job in this State."
04-08-2018,“Jammu will be affected more by removal of Article 35-A - by Ghulam Hassan Zargar Kulgami - (Urdu Daily - Chattan) ,After removal of Article 35-A these restrictions would come to end and people of other States can purchase land and properties in J&K and also can do job here.
04-08-2018,“Jammu will be affected more by removal of Article 35-A - by Ghulam Hassan Zargar Kulgami - (Urdu Daily - Chattan) ,Muslims as well as Hindus should think about as well.
04-08-2018,“Jammu will be affected more by removal of Article 35-A - by Ghulam Hassan Zargar Kulgami - (Urdu Daily - Chattan) ,"Therefore, people of Jammu instead of celebrations on removal of Article 35-A should think about removal of Article 35-A."
04-08-2018,“Jammu will be affected more by removal of Article 35-A - by Ghulam Hassan Zargar Kulgami - (Urdu Daily - Chattan) ,people of Jammu instead of celebrations on removal of Article 35-A should come forward to save Article 35-A.
04-08-2018,“Jammu will be affected more by removal of Article 35-A - by Ghulam Hassan Zargar Kulgami - (Urdu Daily - Chattan) ,"Now all people of Valley, irrespective of party affiliations and politics, have come to the front to save Article 35-A and are ready to go to any extent for Article 35-A."
04-08-2018,“Jammu will be affected more by removal of Article 35-A - by Ghulam Hassan Zargar Kulgami - (Urdu Daily - Chattan) ,all people of Valley are commendable who have approached the Supreme Court and tried to save Article 35-A.
04-08-2018,“Jammu will be affected more by removal of Article 35-A - by Ghulam Hassan Zargar Kulgami - (Urdu Daily - Chattan) ,all people of Valley should support all people of Valley.
04-08-2018,“Jammu will be affected more by removal of Article 35-A - by Ghulam Hassan Zargar Kulgami - (Urdu Daily - Chattan) ,"All Muslims as well as Hindus will be affected if Article 35-A is revoked, so unity is needed to save Article 35/A is revoked."
05-08-2018,“Conspiracies being hatched to remove Muslim majority character of Jammu and Kashmir: Tehreek Wahadat-e-Islami - (Urdu Daily - Srinagar Times),"In a statement, Spokesman of Tehreek Wahadat-e-Islami, Khadim Hussain has said that though Government of India with the help of local rulers have already hollowed Article 35/A and Article 370/A, but these Articles still exist in the Constitution of India."
05-08-2018,“Conspiracies being hatched to remove Muslim majority character of Jammu and Kashmir: Tehreek Wahadat-e-Islami - (Urdu Daily - Srinagar Times),Now BJP and RSS are making efforts how demography of the State could be changed and how State Subject law could be revoked to pave way for the end of Muslim majority character of State.
05-08-2018,“Conspiracies being hatched to remove Muslim majority character of Jammu and Kashmir: Tehreek Wahadat-e-Islami - (Urdu Daily - Srinagar Times),"Real struggle of the Muslims of Jammu and Kashmir is against illegal occupation by India, but Real struggle of the Muslims of Jammu and Kashmir will fight tooth and nail any conspiracy against State Subject law, which was implemented by Maharajas in the State, Spokesman of Tehreek Wahadat-e-Islami said."
05-08-2018,“Support to ‘UN chalo’ call by Trade Unions” - (Urdu Daily - Kashmir Uzma) ,Several business platforms have supported the ‘UN Chalo’ call given by Kashmir Economic Alliance for August 6 when petition challenging Article 35/A will come up for hearing in the Supreme Court.
05-08-2018,“Support to ‘UN chalo’ call by Trade Unions” - (Urdu Daily - Kashmir Uzma) ,"‘Kashmir Goods Transport Association’ Parimpora, Srinagar; ‘Kashmir Mutton Dealers Association’, ‘City Traders and Manufacturers Association’; and Common platform of developmental workers, ‘Central Contractors Coordination Committee’ have supported UN Chalo call given Kashmir Economic Alliance for August 6."
05-08-2018,“Pleasing forward movement” - (Urdu Daily - Uqab),"300 lawyers of Jammu have supported Article 35/A, proving the idea wrong that Jammu and Kashmir has fallen into religious and racial discrimination which has put a question mark on the integrity of State."
05-08-2018,“Pleasing forward movement” - (Urdu Daily - Uqab),A hard-line section exists in Jammu which has been looking every matter with an eye of religious prejudice.
05-08-2018,“Pleasing forward movement” - (Urdu Daily - Uqab),A hard-line section has occasionally encouraged communal forces of India and strengthened anti-Kashmir approach which has ended the age old mutual confidence and belief between the people of two provinces.
05-08-2018,“Pleasing forward movement” - (Urdu Daily - Uqab),"Previous day, Jammu Bar had called a meeting on Article 35/A and for deportation of Rohingya and Bangladeshi nationals from Jammu."
05-08-2018,“Pleasing forward movement” - (Urdu Daily - Uqab),"But, about 300 lawyers, who are members of Jammu Bar Association, boycotted a meeting on Article 35/A and convened a separate meeting in J&K High Court complex."
05-08-2018,“Pleasing forward movement” - (Urdu Daily - Uqab),"In a meeting on Article 35/A, Article - 35/A was fully supported with determination to make every effort for Article - 35/A continuation."
