12-06-2017,Search operation continues in three districts of North Kashmir – (Urdu Dailies – Srinagar Times/Tameel-i-Irshad),"Official sources have told UNI that in the wee hours of June 11, search operation has been resumed in Machil and Nowgam sectors of district Kupwara, Uri sector of district Baramulla and Gurez sector of district Bandipora."
12-06-2017,Search operation continues in three districts of North Kashmir – (Urdu Dailies – Srinagar Times/Tameel-i-Irshad),"However, no contact could be established with the fleeing militants as yet."
12-06-2017,Revoking black laws necessary to restore confidence: Zaffar Akbar – (Urdu Daily – Tameel-i-Irshad),"According to a statement, Chairman Salvation Movement, Zaffar Akar Bhat interacted with people at villages Lolpora – Tangmarg (district Baramulla), Soibugh and Lavpora (both in district Budgam) and several other areas and paid tributes to martyrs, besides expressing sympathy with family members of detainees."
12-06-2017,Revoking black laws necessary to restore confidence: Zaffar Akbar – (Urdu Daily – Tameel-i-Irshad),Revocation of black laws and release of detainees is necessary to restore confidence.
12-06-2017,Revoking black laws necessary to restore confidence: Zaffar Akbar – (Urdu Daily – Tameel-i-Irshad),"Kashmiri people and leaders are not against result-oriented and unconditional talks which could resolve Kashmir issue permanently according to the aspiration of Kashmir issue people, the aspiration of its people added."
12-06-2017,“War of words between Indo-Pak Army Chiefs” – (Urdu Daily – Srinagar Times),Exchange of hot words between Army Chiefs of India and Pakistan is not a new thing.
12-06-2017,“War of words between Indo-Pak Army Chiefs” – (Urdu Daily – Srinagar Times),Army Chiefs of India and Pakistan have been issuing statements to show each other down and the process would continue.
12-06-2017,“War of words between Indo-Pak Army Chiefs” – (Urdu Daily – Srinagar Times),Remarks of ‘giving befitting reply’ coming from India and Pakistan Pakistan are common.
12-06-2017,“War of words between Indo-Pak Army Chiefs” – (Urdu Daily – Srinagar Times),The Army Generals of both sides don’t take much time to react over any ordinary incident on border.
12-06-2017,“War of words between Indo-Pak Army Chiefs” – (Urdu Daily – Srinagar Times),The Army Generals of both sides even don’t wait for any hints from The Army Generals of both sides Ministers.
12-06-2017,“War of words between Indo-Pak Army Chiefs” – (Urdu Daily – Srinagar Times),Steps have been taken for meetings between senior officers of both Armies on the border to prevent conflicts and blood shed.
12-06-2017,“War of words between Indo-Pak Army Chiefs” – (Urdu Daily – Srinagar Times),Still bullets are being exchanged and guns roar.
12-06-2017,“War of words between Indo-Pak Army Chiefs” – (Urdu Daily – Srinagar Times),"Even, surgical strikes also take place now."
12-06-2017,“War of words between Indo-Pak Army Chiefs” – (Urdu Daily – Srinagar Times),Both the countries level allegations against each for violating ceasefire agreement.
12-06-2017,“War of words between Indo-Pak Army Chiefs” – (Urdu Daily – Srinagar Times),"Even if exchange of hot words between Indo-Pak Army Chiefs is ignored, tension near borders can’t be prevented."
12-06-2017,“War of words between Indo-Pak Army Chiefs” – (Urdu Daily – Srinagar Times),"In this situation, the Chief of Indo-Pak Armies should avoid hurry and provocation."
12-06-2017,“War of words between Indo-Pak Army Chiefs” – (Urdu Daily – Srinagar Times),"Politicians could mislead people with Politicians wrong statements to save Politicians chair, but The Army Generals of both sides could save the nations by presenting real situation."
12-06-2017,“Deliberate attempt to provoke people” – (Urdu Daily - Uqab),It could be true that militants have planned measure Fidayeen attacks.
12-06-2017,“Deliberate attempt to provoke people” – (Urdu Daily - Uqab),"Quoting reports of secret agencies, it has been said that a group of four ‘fidayeen’ (suicide attackers) have entered Punjab while as apprehensions are being felt about likely entry of ‘fidayeen’ in Kashmir as well."
12-06-2017,“Deliberate attempt to provoke people” – (Urdu Daily - Uqab),Measures are being taken to prevent ‘fidayeen’ attacks and high alert has been issued in Jammu and Kashmir with increased patrolling by forces on National Highway and checking of vehicles.
12-06-2017,“Deliberate attempt to provoke people” – (Urdu Daily - Uqab),"All the measures could be understood, but a sudden cordon and searches in Lal Chowk area of Srinagar city recollect the era of 90s when identification parades were being undertaken in trade centres."
12-06-2017,“Deliberate attempt to provoke people” – (Urdu Daily - Uqab),"This process continued for a long period, but nothing objectionable was found."
12-06-2017,“Deliberate attempt to provoke people” – (Urdu Daily - Uqab),This process is not difficult to understand how disgraceful such actions are for common people.
12-06-2017,“Deliberate attempt to provoke people” – (Urdu Daily - Uqab),"At present when people are always in hurry due to month of Ramadan, such sudden actions of forces are astonishing."
12-06-2017,“Deliberate attempt to provoke people” – (Urdu Daily - Uqab),"Security Forces can understand that ‘fidayeen’ do not roam in market areas and Security Forces won’t come to shopping centre, because Security Forces don’t need shopping."
12-06-2017,“Deliberate attempt to provoke people” – (Urdu Daily - Uqab),The situation of 90s and today is different.
12-06-2017,“Deliberate attempt to provoke people” – (Urdu Daily - Uqab),"In 90s, security forces used to take detained militants with detained militants for identification purposes."
12-06-2017,“Deliberate attempt to provoke people” – (Urdu Daily - Uqab),security forces used to identify militants or security forces supporters in markets or houses.
12-06-2017,“Deliberate attempt to provoke people” – (Urdu Daily - Uqab),Militants mostly remain in forests and in view of likely dangers; it is not possible for security forces to remain in cities.
12-06-2017,“Deliberate attempt to provoke people” – (Urdu Daily - Uqab),"In this situation, if such actions are carried out in a trade centre like Lal Chowk, Srinagar, the purpose appears something different from search of militants."
12-06-2017,“Deliberate attempt to provoke people” – (Urdu Daily - Uqab),Such actions in the month of Ramadan are wrong and an attempt to provoke people which need to be shunned.
13-06-2017,Firing on the house of Congress leader in Shopian – (Urdu Dailies – Srinagar Times/Kashmir Uzma),"Fear gripped Shopian on June 11 evening at about 23 hrs when a group of militants resorted to indiscriminate firing at the house of a local Congress leader and former Minister, Ghulam Hassan Khan."
13-06-2017,Firing on the house of Congress leader in Shopian – (Urdu Dailies – Srinagar Times/Kashmir Uzma),"However, alert security guards deployed there retaliated and defeated the intentions of militants."
13-06-2017,Firing on the house of Congress leader in Shopian – (Urdu Dailies – Srinagar Times/Kashmir Uzma),Exchange of firing between militants and security guards continued for several minutes.
13-06-2017,Firing on the house of Congress leader in Shopian – (Urdu Dailies – Srinagar Times/Kashmir Uzma),"SOG and local Army unit immediately rushed to the spot and started searches in surrounding areas, but without any result."
13-06-2017,People facing financial hardships: Dr. Kamaal – (Urdu Dailies – Aftab/Kashmir Uzma/Uqab),"Describing present coalition Government as a failure on all fronts, Additional General Secretary of National Conference, Dr. Mustafa Kamaal said that the coalition alliance has handed over Kashmir Valley completely to Army and forces."
13-06-2017,People facing financial hardships: Dr. Kamaal – (Urdu Dailies – Aftab/Kashmir Uzma/Uqab),"Interacting with party workers and leaders, Dr. Mustafa Kamaal said that no plausibility has been brought in the supply of water, power and ration in the month of Ramadan."
13-06-2017,People facing financial hardships: Dr. Kamaal – (Urdu Dailies – Aftab/Kashmir Uzma/Uqab),People are facing financial hardships due to wrong policies of present coalition Government.
13-06-2017,People facing financial hardships: Dr. Kamaal – (Urdu Dailies – Aftab/Kashmir Uzma/Uqab),"Now efforts are being made to implement GST with an aim of giving a jolt to the economic autonomy of State, Dr. Mustafa Kamaal added."
13-06-2017,Governor’s rule in the State inevitable for restoration of peace: Bashir Ahmed Khan – (Urdu Daily – Tameel-i-Irshad),"Describing Governor’s rule in the State as inevitable, President of Peoples Political Party, Bashir Ahmed Khan said that after suspending State Assembly, Governor’s rule in the State has become inevitable as this is the only way to restore peace."
13-06-2017,Governor’s rule in the State inevitable for restoration of peace: Bashir Ahmed Khan – (Urdu Daily – Tameel-i-Irshad),"Though the demand of Governor’s rule is not plausible, but in view of prevailing situation restoration of peace could be expected from such an arrangement."
13-06-2017,Governor’s rule in the State inevitable for restoration of peace: Bashir Ahmed Khan – (Urdu Daily – Tameel-i-Irshad),"While talking to media representatives, Bashir Ahmed Khan said that PDP-BJP alliance has no State friendly political agenda and PDP-BJP alliance was forged only to attain power."
13-06-2017,“Accession is conditional” – (Urdu Daily – Srinagar Times),"While speaking on the death anniversaries of two former leaders and Ministers, Mirza Muhammad Afzal Beig and Ghulam Mohi-ud-Din Shah, National Conference Working President, Omar Abdullah spoke less about two former leaders and Ministers, Mirza Muhammad and more on Kashmir issue."
13-06-2017,“Accession is conditional” – (Urdu Daily – Srinagar Times),"Besides paying tributes to two former leaders and Ministers, Mirza Muhammad, Omar Abdullah spoke about some realities which raised several questions because National Conference founders, Sheikh Muhammad Abdullah and Mirza Muhammad Afzal Beig were responsible for the accession of State."
13-06-2017,“Accession is conditional” – (Urdu Daily – Srinagar Times),Omar Abdullah was Prime Minster of J&K and due to political and administrative ups and down Omar Abdullah got the chair of Chief Minister.
13-06-2017,“Accession is conditional” – (Urdu Daily – Srinagar Times),"In this backdrop, Omar Abdullah could be asked ‘was not Omar Abdullah voyage from Prime Minister to Chief Ministership a game play with State’s autonomy’."
13-06-2017,“Accession is conditional” – (Urdu Daily – Srinagar Times),Historians repeatedly say that after assuming power National Conference leadership did not take effective steps to safeguard the instrument of accession in National Conference original shape.
13-06-2017,“Accession is conditional” – (Urdu Daily – Srinagar Times),"Today National Conference can claim that National Conference had passed Autonomy Resolution in the State Assembly, which was ignored and put in dustbin by former Prime Minister, Atal Bihari Vajpayee."
13-06-2017,“Accession is conditional” – (Urdu Daily – Srinagar Times),Did Omar Abdullah Omar Abdullah resign from the Government for such action and disregard by the Centre?
13-06-2017,“Accession is conditional” – (Urdu Daily – Srinagar Times),Omar Abdullah could be asked what steps Omar Abdullah took during Omar Abdullah rule to maintain the historical status of accession and to limit the historical status of accession to affairs of three Departments viz.
13-06-2017,“Accession is conditional” – (Urdu Daily – Srinagar Times),"Defence, Communication and Currency."
13-06-2017,“Accession is conditional” – (Urdu Daily – Srinagar Times),"Now if Omar Abdullah wants to bring State’s autonomy to State’s autonomy original shape, Omar Abdullah should clearly say that Omar Abdullah would not participate in election until Omar Abdullah wish is fulfilled."
13-06-2017,“New Master Plan …. Death for agricultural economics” – (Urdu Daily – Kashmir Uzma),Land is needed for food and fact is that concept of food without land is impossible.
13-06-2017,“New Master Plan …. Death for agricultural economics” – (Urdu Daily – Kashmir Uzma),"Despite this, agricultural land is being used for non-agricultural purposes."
13-06-2017,“New Master Plan …. Death for agricultural economics” – (Urdu Daily – Kashmir Uzma),Lakhs of Kanals of agricultural land has been changed into concrete jungles.
13-06-2017,“New Master Plan …. Death for agricultural economics” – (Urdu Daily – Kashmir Uzma),There was a time when Kashmir used to be almost self-sufficient in food.
13-06-2017,“New Master Plan …. Death for agricultural economics” – (Urdu Daily – Kashmir Uzma),The situation today is that closure of Jawhar Tunnel for few days creates crisis and shortage of food items.
13-06-2017,“New Master Plan …. Death for agricultural economics” – (Urdu Daily – Kashmir Uzma),"Though Government had imposed symbolic ban on using agricultural land for constructions purposes, but several senior officers of agricultural land have constructed palatial houses on agricultural land."
13-06-2017,“New Master Plan …. Death for agricultural economics” – (Urdu Daily – Kashmir Uzma),"Consequently, agricultural land has shrunk and the State has become dependent on Punjab and other States for import of food items."
13-06-2017,“New Master Plan …. Death for agricultural economics” – (Urdu Daily – Kashmir Uzma),"According to new Master Plan, the range of Srinagar city has been expanded by 82%."
13-06-2017,“New Master Plan …. Death for agricultural economics” – (Urdu Daily – Kashmir Uzma),"the range of Srinagar city present area is 416 Sq Kms, while as in 2015-35 Master Plan Its present area is to be expanded up to 766 Sq Kms."
13-06-2017,“New Master Plan …. Death for agricultural economics” – (Urdu Daily – Kashmir Uzma),In view of the increasing population Government should not have shrunk agricultural land to meet people’s residential requirements.
13-06-2017,“New Master Plan …. Death for agricultural economics” – (Urdu Daily – Kashmir Uzma),People should also take in consideration negative effects of this increasing trend.
13-06-2017,“New Master Plan …. Death for agricultural economics” – (Urdu Daily – Kashmir Uzma),"People can construct houses, but that does not mean People should put the fate of coming generations at stake."
13-06-2017,“New Master Plan …. Death for agricultural economics” – (Urdu Daily – Kashmir Uzma),Need of the time is to save agricultural land while constructing buildings.
14-06-2017,"With its military might, India pursuing a policy to suppress ground realities: DPM – (Urdu Daily – Srinagar Times)","General Secretary of Democratic Political Movement, Khwaja Firdous said that while suppressing ground realities in the State with the State military might, India has been pursuing oppressive tactics against Kashmiris."
14-06-2017,"With its military might, India pursuing a policy to suppress ground realities: DPM – (Urdu Daily – Srinagar Times)","Addressing party workers, Khwaja Firdous said that people of Kashmir should not ignore historical background of Kashmir issue."
14-06-2017,"With its military might, India pursuing a policy to suppress ground realities: DPM – (Urdu Daily – Srinagar Times)","Kashmir continues to be a dispute and Kashmir would continue to be in the agenda of UN until Kashmir just solution is found out, Khwaja Firdous said."
14-06-2017,Situation normal in Valley; Three-tire security arrangements for Amarnath Yatra: Deputy CM – (Urdu Dailies – Aftab/Uqab),"While talking to media representative on the sidelines of a function held in Punjab on the completion of three years by Modi Government, Deputy Chief Minister, J&K, Dr. Nirmal Singh has said that situation in Valley is normal; more and more tourists should visit the place for sight seeing."
14-06-2017,Situation normal in Valley; Three-tire security arrangements for Amarnath Yatra: Deputy CM – (Urdu Dailies – Aftab/Uqab),Dr. Nirmal Singh also said that three-tier security arrangements would be made for the safety of Amarnath Yatris.
14-06-2017,Situation normal in Valley; Three-tire security arrangements for Amarnath Yatra: Deputy CM – (Urdu Dailies – Aftab/Uqab),Security would be provided from Jammu base camp up to Yatra base camps at Pahalgam (Anantnag) and Baltal (Ganderbal) in Kashmir.
14-06-2017,Situation normal in Valley; Three-tire security arrangements for Amarnath Yatra: Deputy CM – (Urdu Dailies – Aftab/Uqab),"Steps are being taken by the Central and State governments for restoration of peace in the State, Dr. Nirmal Singh added."
14-06-2017,"Imposition of GST in J&K unacceptable: KTMF;  KEA described GST a conspiracy, pledged to defeat it – (Urdu Dailies – Aftab/Tameel-i-Irshad)","At a meeting held under the chairmanship of a meeting held under the chairmanship of its President, Bashir Ahmed Rather President, Bashir Ahmed Rather convened to discuss implementation of GST in the State, Kashmir Traders and Manufacturers Federation unanimously expressed opinion that implementation of GST is a conspiracy to damage the special constitutional position of J&K."
14-06-2017,"Imposition of GST in J&K unacceptable: KTMF;  KEA described GST a conspiracy, pledged to defeat it – (Urdu Dailies – Aftab/Tameel-i-Irshad)",All members of Manufacturers Federation said that this law would be strongly contested.
14-06-2017,"Imposition of GST in J&K unacceptable: KTMF;  KEA described GST a conspiracy, pledged to defeat it – (Urdu Dailies – Aftab/Tameel-i-Irshad)","All members of the Federation cautioned State Government to shun such steps, keeping in view the apprehensions and reservation of people, especially trader’s community."
14-06-2017,"Imposition of GST in J&K unacceptable: KTMF;  KEA described GST a conspiracy, pledged to defeat it – (Urdu Dailies – Aftab/Tameel-i-Irshad)","Meanwhile, Chairman of Kashmir Economic Alliance, Farooq Ahmed Dar has said, in a statement, that the State and Central governments have been trying to spread appeasing atmosphere by saying that Article 370 won’t be impacted by GST."
14-06-2017,"Imposition of GST in J&K unacceptable: KTMF;  KEA described GST a conspiracy, pledged to defeat it – (Urdu Dailies – Aftab/Tameel-i-Irshad)","In the garb of GST, efforts are being made to erode Article 370 for which the opposition has been apparently working shoulder to shoulder with State Government, Farooq Ahmed Dar said."
14-06-2017,"Imposition of GST in J&K unacceptable: KTMF;  KEA described GST a conspiracy, pledged to defeat it – (Urdu Dailies – Aftab/Tameel-i-Irshad)",Some so-called traders are playing an important role in the secret agenda being prepared by BJP and RSS with regard to Article 370.
14-06-2017,"Imposition of GST in J&K unacceptable: KTMF;  KEA described GST a conspiracy, pledged to defeat it – (Urdu Dailies – Aftab/Tameel-i-Irshad)",Kashmir Economic Alliance won’t allow these intentions to succeed.
14-06-2017,"Imposition of GST in J&K unacceptable: KTMF;  KEA described GST a conspiracy, pledged to defeat it – (Urdu Dailies – Aftab/Tameel-i-Irshad)","Kashmir Economic Alliance would soon make people aware about the dangerous effects of GST law, Farooq Ahmed Dar added."
14-06-2017,"Instead of blind conformity, Police should exhibit pro - people approach: Jamaat-e-Islami – (Urdu Daily – Aftab)","Condemning use of excessive force by Indian forces against people at Turkawangam and Waheel in district Shopian, Jamaat-e-Islami, J&K has appealed world nations and human rights organizations to take serious note of inhuman behaviour being meted out with Kashmiris and take steps to stop it."
14-06-2017,"Instead of blind conformity, Police should exhibit pro - people approach: Jamaat-e-Islami – (Urdu Daily – Aftab)",Kashmir issue can’t be solved by publishing reports and organizing seminars.
14-06-2017,"Instead of blind conformity, Police should exhibit pro - people approach: Jamaat-e-Islami – (Urdu Daily – Aftab)","Instead, there is a need to make Indian forces accountable before world forums."
14-06-2017,"Instead of blind conformity, Police should exhibit pro - people approach: Jamaat-e-Islami – (Urdu Daily – Aftab)","The graph of oppression has been increasing in Kashmir since Indian Army Chief and Government authorities have started justifying violence by forces on civilians in Kashmir, Jamaat added."
14-06-2017,"“Reality about Chinese’ Army stations in Pakistan: -  by Ghulam Alla Kiyani, Muzaffarabad – (Urdu Daily – Kashmir Uzma)",Pak-China friendship and relations are becoming stronger speedily.
14-06-2017,"“Reality about Chinese’ Army stations in Pakistan: -  by Ghulam Alla Kiyani, Muzaffarabad – (Urdu Daily – Kashmir Uzma)","Therefore, enemies of both alliance partners are busy in making propaganda in a new manner."
14-06-2017,"“Reality about Chinese’ Army stations in Pakistan: -  by Ghulam Alla Kiyani, Muzaffarabad – (Urdu Daily – Kashmir Uzma)","India was at the forefront of making wrong propaganda, but America remained silent for a long time."
14-06-2017,"“Reality about Chinese’ Army stations in Pakistan: -  by Ghulam Alla Kiyani, Muzaffarabad – (Urdu Daily – Kashmir Uzma)",Change could be seen in the policy of neighbouring countries of Pakistan viz.
14-06-2017,"“Reality about Chinese’ Army stations in Pakistan: -  by Ghulam Alla Kiyani, Muzaffarabad – (Urdu Daily – Kashmir Uzma)","Bangladesh, Afghanistan and Iran, who earlier used to claim friendship with Pakistan."
14-06-2017,"“Reality about Chinese’ Army stations in Pakistan: -  by Ghulam Alla Kiyani, Muzaffarabad – (Urdu Daily – Kashmir Uzma)","Because of long pending disputes with India, Delhi has been using neighbouring countries of Pakistan viz as a diplomatic tool against Pakistan."
14-06-2017,"“Reality about Chinese’ Army stations in Pakistan: -  by Ghulam Alla Kiyani, Muzaffarabad – (Urdu Daily – Kashmir Uzma)","When America established America Army stations in Afghanistan, India also used America as India Army camp."
14-06-2017,"“Reality about Chinese’ Army stations in Pakistan: -  by Ghulam Alla Kiyani, Muzaffarabad – (Urdu Daily – Kashmir Uzma)","Pakistan had to pay heavy price for Pakistan cooperation with Pakistan, because Afghanis have become captives of India."
14-06-2017,"“Reality about Chinese’ Army stations in Pakistan: -  by Ghulam Alla Kiyani, Muzaffarabad – (Urdu Daily – Kashmir Uzma)",India started imparting training and patronising Afghans in the way India had flared up activities of ‘Muki Bahini’ in Bangladesh against Pakistan.
14-06-2017,"“Reality about Chinese’ Army stations in Pakistan: -  by Ghulam Alla Kiyani, Muzaffarabad – (Urdu Daily – Kashmir Uzma)",the policy of neighbouring countries of Pakistan viz is aimed at creating wedge between Pak-Afghan relations.
14-06-2017,"“Reality about Chinese’ Army stations in Pakistan: -  by Ghulam Alla Kiyani, Muzaffarabad – (Urdu Daily – Kashmir Uzma)",Expressing concern over the policy of neighbouring countries of Pakistan viz is not enough; instead immediate remedy is required to scuttle the policy of neighbouring countries of Pakistan viz.
14-06-2017,"“Reality about Chinese’ Army stations in Pakistan: -  by Ghulam Alla Kiyani, Muzaffarabad – (Urdu Daily – Kashmir Uzma)","Propaganda has been launched as if America is establishing Army stations in Pakistan, besides describing America is as East India Company."
14-06-2017,"“Reality about Chinese’ Army stations in Pakistan: -  by Ghulam Alla Kiyani, Muzaffarabad – (Urdu Daily – Kashmir Uzma)",America has also spread rumours that America is having plans to establish Army stations in Pakistan.
14-06-2017,"“Reality about Chinese’ Army stations in Pakistan: -  by Ghulam Alla Kiyani, Muzaffarabad – (Urdu Daily – Kashmir Uzma)",This all is being done to support Indian stand so that America is prevented from speeding up America plans to flourish Pakistan’s economy and to establish trade relations with the world.
14-06-2017,“Visits of Indian delegations” -  by Muhammad Ashraf Kakroo – (Urdu Daily – Kashmir Uzma),How long Kashmiris would continue to fall in the deceptive trap of Indian politicians?
14-06-2017,“Visits of Indian delegations” -  by Muhammad Ashraf Kakroo – (Urdu Daily – Kashmir Uzma),Kashmiris have come to open enmity with Kashmiris.
14-06-2017,“Visits of Indian delegations” -  by Muhammad Ashraf Kakroo – (Urdu Daily – Kashmir Uzma),But some Kashmiri Muslim politicians have been taking these enemies as some Kashmiri Muslim politicians sympathisers.
14-06-2017,“Visits of Indian delegations” -  by Muhammad Ashraf Kakroo – (Urdu Daily – Kashmir Uzma),"Since years, official and non-official delegations of India have been visiting Kashmir to know the situation."
14-06-2017,“Visits of Indian delegations” -  by Muhammad Ashraf Kakroo – (Urdu Daily – Kashmir Uzma),"Don’t Indian politicians know that Kashmir is a disputed region and Kashmir people want final, peaceful and just solution of the issue?"
