01-08-2017,BJP unleashing oppression on Kashmiris and PDP is silent: Sagar – Urdu Dailies – Srinagar Times/Aftab/Uqab),"Describing current situation as a matter of concern for all sensible people, National Conference General Secretary, Ali Muhammad Sagar has said that ruling parties have been deliberately pushing Kashmir into darkness."
01-08-2017,BJP unleashing oppression on Kashmiris and PDP is silent: Sagar – Urdu Dailies – Srinagar Times/Aftab/Uqab),"While interacting with different delegations at party headquarters, Srinagar, Ali Muhammad Sagar said that reins of power have come in the hands of elements that have been using newer tactics to damage the tradition of justice, equality, brotherhood, religious amenity, prosperity and development nourished by National Conference after getting rid of slavery from one-man rule."
01-08-2017,BJP unleashing oppression on Kashmiris and PDP is silent: Sagar – Urdu Dailies – Srinagar Times/Aftab/Uqab),"By implementing GST, the present regime has trampled whatever else was left, Ali Muhammad Sagar said."
01-08-2017,Sacrifices of youth asset of Kashmir movement: Gulshan Abbas – (Urdu Daily - Srinagar Times),"In a statement, General Secretary of Tehreek Wahdat-i-Islami, Gulshan Abbas has paid tributes to militants killed in Tahab, Pulwama."
01-08-2017,Sacrifices of youth asset of Kashmir movement: Gulshan Abbas – (Urdu Daily - Srinagar Times),"Expressing satisfaction over participation of large number of people in protests, Gulshan Abbas said that this conveys a clear message to India Government and India Government secret agencies that people of Kashmir would be continuing people of Kashmir support to freedom struggle for achieving basic right of self-determination and to get rid from India Government’s slavery."
01-08-2017,Sacrifices of youth asset of Kashmir movement: Gulshan Abbas – (Urdu Daily - Srinagar Times),"Condemning the arrests of Hurriyat leaders by NIA, Gulshan Abbas said that despite India Government’s tyranny, the freedom struggle would continue with full vigour and determination."
01-08-2017,NC and PDP played a role in weakening Article 370 – Vakil – (Urdu Daily – Tameel-i-Irshad),"Alleging mainstream political parties, particularly NC, PDP and Congress, for having weakened Article 370, former Minister and senior political leader, Abdul Gani Vakil has said that while in power mainstream political parties, particularly NC, PDP and Congress have made 46 amendments, which include abolishing posts of Prime Minister and State President, passage of Land Grants Bill and now passage of GST Bill."
01-08-2017,NC and PDP played a role in weakening Article 370 – Vakil – (Urdu Daily – Tameel-i-Irshad),"It is strange that mainstream political parties, particularly NC, PDP and Congress have been talking about saving and safeguarding Article 370, which achieved power in the name of Autonomy and Self-Rule but left no stone unturned in uprooting Article 370."
01-08-2017,NC and PDP played a role in weakening Article 370 – Vakil – (Urdu Daily – Tameel-i-Irshad),"Addressing a convention in Rafiabad (district Baramulla), he urged people to remain cautious about these politicians who raise hue and cry on issues like Autonomy, Self-Rule and Article 370 but while in power these issues have no meaning for these issues."
01-08-2017,NC and PDP played a role in weakening Article 370 – Vakil – (Urdu Daily – Tameel-i-Irshad),"People of the State could People of the State safeguard Article 370, and the forces wanting to further weaken Article 370 would have to face stiff resistance of people, he said."
01-08-2017,“Jamia Masjid locked and  curbs on Friday prayers:  interference in religion” – (Urdu Daily – Srinagar Times),"Restrictions continued to remain in vogue on offering Friday prayers for sixth consecutive Friday (July 28) in Jamia Masjid, Srinagar."
01-08-2017,“Jamia Masjid locked and  curbs on Friday prayers:  interference in religion” – (Urdu Daily – Srinagar Times),Government imposed restriction in the whole area and sealed all roads and streets leading to Jamia Masjid.
01-08-2017,“Jamia Masjid locked and  curbs on Friday prayers:  interference in religion” – (Urdu Daily – Srinagar Times),"According to Islam, Friday is a holy day and offering collective prayers on a holy day have been described as duty of every Muslim."
01-08-2017,“Jamia Masjid locked and  curbs on Friday prayers:  interference in religion” – (Urdu Daily – Srinagar Times),"Before offering Friday prayers, Imams and orators throw light on the history of Islam, besides speaking on current political, social, economic and educational situations so that Muslims become aware about Muslims matters and issues and take collective steps for Muslims settlement."
01-08-2017,“Jamia Masjid locked and  curbs on Friday prayers:  interference in religion” – (Urdu Daily – Srinagar Times),"But, ironically the people at the helm of affairs have locked historical Jamia Masjid, Srinagar since last six weeks for establishment of peace."
01-08-2017,“Jamia Masjid locked and  curbs on Friday prayers:  interference in religion” – (Urdu Daily – Srinagar Times),"People are angry over this action of Government, and religious Ulema describe this action of Government as interference in religious affairs."
01-08-2017,“Jamia Masjid locked and  curbs on Friday prayers:  interference in religion” – (Urdu Daily – Srinagar Times),Perhaps this is for first time in the history of Kashmir that Jamia Masjid remained locked for months.
01-08-2017,“Jamia Masjid locked and  curbs on Friday prayers:  interference in religion” – (Urdu Daily – Srinagar Times),Perhaps this did not happen even during Dogra rule.
01-08-2017,“Jamia Masjid locked and  curbs on Friday prayers:  interference in religion” – (Urdu Daily – Srinagar Times),Locking of mosques and preventing people from offering prayers could further worsen the situation.
01-08-2017,“Jamia Masjid locked and  curbs on Friday prayers:  interference in religion” – (Urdu Daily – Srinagar Times),"Everything could be tolerated by people, except interference in religion."
01-08-2017,“Jamia Masjid locked and  curbs on Friday prayers:  interference in religion” – (Urdu Daily – Srinagar Times),"Therefore, it is the duty of Government to use all the duty of Government resources and abilities to ensure uninterrupted religious congregations, particularly Friday prayers, instead of hushing up the matter by imposing strict restrictions."
01-08-2017,“Jamia Masjid locked and  curbs on Friday prayers:  interference in religion” – (Urdu Daily – Srinagar Times),Government is equally responsible for honouring religious rights of people as Government is responsible for establishment of peace.
01-08-2017,“Jamia Masjid locked and  curbs on Friday prayers:  interference in religion” – (Urdu Daily – Srinagar Times),"Therefore, ensuring Friday prayers in Jamia Masjid, Srinagar is also the responsibility of Government."
01-08-2017,Article 35/A -  In vortex of dangers” – (Urdu Daily – Kashmir Uzma),"In her recent hard hitting statement against any vexation with Article 35-A of Constitution, Chief Minister, Mehbooba cautioned about serious consequences in the Valley if any foul was played with this law, adding that mainstream parties would find it difficult to save the tricolour in the Valley."
01-08-2017,Article 35/A -  In vortex of dangers” – (Urdu Daily – Kashmir Uzma),her said this at a conference titled ‘Understanding Kashmir’ organised by a Social and Economic Consultative Group in New Delhi.
01-08-2017,Article 35/A -  In vortex of dangers” – (Urdu Daily – Kashmir Uzma),"her also said that by interfering in State’s special position, the Centre won’t be targeting separatists whose agenda is separatism, but would weaken those forces which have accepted India and participated in elections."
01-08-2017,Article 35/A -  In vortex of dangers” – (Urdu Daily – Kashmir Uzma),These views of the Chief Minister are based on facts and important under the given situation.
01-08-2017,Article 35/A -  In vortex of dangers” – (Urdu Daily – Kashmir Uzma),"But alliance partner in the State Government - BJP has taken this statement seriously, saying, “Article 35/A is not a sacred cow which can’t be touched’."
01-08-2017,Article 35/A -  In vortex of dangers” – (Urdu Daily – Kashmir Uzma),"In this situation, this statement becomes clear that BJP has no intention to defend this ArticleInstead, it might be desirous of any Supreme Court ruling against this Article so that any Supreme Court ruling against this Article could be abrogated."
01-08-2017,Article 35/A -  In vortex of dangers” – (Urdu Daily – Kashmir Uzma),It is pertinent to mention that an organization has filed a write petition in Supreme Court challenging this Article and a 3-Judge Bench would be hearing a write petition in the Supreme Court challenging Article 35-A and a 3-Judge after six weeks.
01-08-2017,Article 35/A -  In vortex of dangers” – (Urdu Daily – Kashmir Uzma),Concern is being expressed in the Valley on this matter.
01-08-2017,Article 35/A -  In vortex of dangers” – (Urdu Daily – Kashmir Uzma),This restlessness and concern has not spread among resistance circles only but among mainstream too.
01-08-2017,Article 35/A -  In vortex of dangers” – (Urdu Daily – Kashmir Uzma),Article 35-A is very important for State’s special position and any interference or change in Article 35-A could prove a last nail in the coffin of State’s autonomy.
01-08-2017,Article 35/A -  In vortex of dangers” – (Urdu Daily – Kashmir Uzma),"In such a situation, no evasiveness could be expected from the State Government in this regard."
01-08-2017,Article 35/A -  In vortex of dangers” – (Urdu Daily – Kashmir Uzma),the State Government should not rest on verbal statements only; instead the State Government should practically jump in the field and represent the aspirations of people.
01-08-2017,Article 35/A -  In vortex of dangers” – (Urdu Daily – Kashmir Uzma),This is the people’s wish and demand.
02-08-2017,All OGWs involved in attack on Yatra bus arrested: Police – (Urdu Dailies – Srinagar Times/Uqab/Tameel-i-Irshad),"While giving details about the killing of Lashkar-e-Toiba commander, Abu Dujana and Abu Dujana accomplice at Hakripora (district Pulwama), IGP, Kashmir Munir Ahmed Khan revealed that all Over Ground Workers of militants, who played role in the attack on Yatra bus at Botingoo, Anantnag on July 10, have been arrested."
02-08-2017,All OGWs involved in attack on Yatra bus arrested: Police – (Urdu Dailies – Srinagar Times/Uqab/Tameel-i-Irshad),"Vehicle used by militants and Over Ground Workers in this attack has also been seized, giving details about the killing of Lashkar-e-Toiba commander, Abu Dujana and his accomplice at Hakripora (district Pulwama), IGP, Kashmir Munir Ahmed Khan said."
02-08-2017,Hurriyat Conference Jammu and Kashmir paid tributes to Abu Dujana – (Urdu Daily – Srinagar Times),"In a statement, Hurriyat Conference Jammu Kashmir (HCJK) Convenor and Muslims Conference Chairman, Shabir Ahmed Dar, Mahaz-e-Azadi President, Muhammad Iqbal Mir, Chairman of International Forum for Justice, Muhammad Ahsan Untoo, Muslim League Chairman, Imtiyaz Ahmed Reshi and Tehreek-e-Istiqamat Chairman, Ghulam Nabi Dar; and Muslim Khwateen Markaz Chairperson, Yasmeen Raja paid tributes to LeT commander, Abu Dujana killed in an encounter at Hakripora, Pulwama."
02-08-2017,Hurriyat Conference Jammu and Kashmir paid tributes to Abu Dujana – (Urdu Daily – Srinagar Times),The leaders termed killing of innocent Firdous Ahmed in a related incident as unjustified.
02-08-2017,Hurriyat Conference Jammu and Kashmir paid tributes to Abu Dujana – (Urdu Daily – Srinagar Times),"Unbridled security forces have been using resorting to violence against Kashmiris to suppress Unbridled security forces freedom movement, Unbridled security forces said."
02-08-2017,Hurriyat Conference Jammu and Kashmir paid tributes to Abu Dujana – (Urdu Daily – Srinagar Times),Unbridled security forces also asked people to remain associated with the supreme objective for which Kashmiri youth have been offering sacrifices of Kashmiri youth lives.
02-08-2017,Fair-minded people of world are aware of ups and downs on each path : Swat-ul-Haq – (Urdu Daily – Aftab),"While revealing the objective behind arrest of Hurriyat and pro-freedom leaders, Spokesman of Swat-ul-Haq has said that action of authorities was aimed at hiding authorities own perplexities."
02-08-2017,Fair-minded people of world are aware of ups and downs on each path : Swat-ul-Haq – (Urdu Daily – Aftab),This could neither make authorities personality doubtful nor damage the image of movement.
02-08-2017,Fair-minded people of world are aware of ups and downs on each path : Swat-ul-Haq – (Urdu Daily – Aftab),"Without going through its pros and cons, the people of world would never believe in rumours and propaganda launched by national media."
02-08-2017,Fair-minded people of world are aware of ups and downs on each path : Swat-ul-Haq – (Urdu Daily – Aftab),"The world nations are fully aware about the ups and downs on every path, Spokesman has said."
02-08-2017,Genocide of Kashmiris for demanding genuine rights continues: Jamaat-e-Islami – (Urdu Daily – Kashmir Uzma),"Condemning security force personnel for using brute force on peaceful protesters at Kakapora, Pulwama, Jamaat-e-Islami, J&K has said that people in Kashmir are not being allowed to hold peaceful protests, public meetings and express opinion freely, despite tall claims of India for being largest democracy of the world,."
02-08-2017,Genocide of Kashmiris for demanding genuine rights continues: Jamaat-e-Islami – (Urdu Daily – Kashmir Uzma),"While expressing concern over such a serious situation, Jamaat-e-Islami paid tributes to the youth killed during an encounter at Hakripora, Pulwama and appealed world community to play an effective role in ridding people of Kashmir from Indian barbarism and use diplomatic and political influence for right to self-determination of Kashmiris."
02-08-2017,“Irresponsible activities of BJP” – (Urdu Daily – Srinagar Times),"Because of its full majority in Parliament, BJP has become master of BJP own will."
02-08-2017,“Irresponsible activities of BJP” – (Urdu Daily – Srinagar Times),"While maintaining BJP majesty at the centre, BJP has now started a process of illegal means to establish BJP existence in whole country."
02-08-2017,“Irresponsible activities of BJP” – (Urdu Daily – Srinagar Times),The Central leadership of party has become impatient for fulfilling The Central leadership of party secret agenda before next general elections.
02-08-2017,“Irresponsible activities of BJP” – (Urdu Daily – Srinagar Times),"Consequently, a wave of communalism has spread in the country and symptoms of tension among different communities have become visible."
02-08-2017,“Irresponsible activities of BJP” – (Urdu Daily – Srinagar Times),Now the situation has become so serious that former Army officers have handed over a joint statement to the Prime Minister.
02-08-2017,“Irresponsible activities of BJP” – (Urdu Daily – Srinagar Times),"In a joint statement to the Prime Minister, BJP have clearly said that situation in whole country has become serious and Muslims and Dalits are being attacked, thus polluting the atmosphere of communal harmony and brotherhood."
02-08-2017,“Irresponsible activities of BJP” – (Urdu Daily – Srinagar Times),"Meanwhile, the State unit of BJP has been using illegal ways and means to spread the State unit of BJP tentacles in whole J&K; and implementation of GST is a link of this chain."
02-08-2017,“Irresponsible activities of BJP” – (Urdu Daily – Srinagar Times),the State unit of BJP’s another steps is to remove Article/35 A for abrogation of Article 370.
02-08-2017,“Irresponsible activities of BJP” – (Urdu Daily – Srinagar Times),"Recently, Chief Minister, Mehbooba Mufti said that if any damage is caused to Article 370 via Article 35/A, there would be nobody left in the Valley to hoist National flag."
02-08-2017,“Irresponsible activities of BJP” – (Urdu Daily – Srinagar Times),"But, instead of understanding the meaning of the Chief Minister’s views, they (BJP) criticized BJP and some party leaders even demanded BJP resignation."
02-08-2017,“Irresponsible activities of BJP” – (Urdu Daily – Srinagar Times),"Such efforts of BJP clarify that due to power intoxication at the Centre and participation in J&K Government, PDP has gone out of control."
02-08-2017,“Irresponsible activities of BJP” – (Urdu Daily – Srinagar Times),PDP should show courage to bring BJP on right track.
02-08-2017,“Importance and utility of All Party Conference on Kashmir” – (Urdu Daily – Aftab),"According to local news agency – KNS, Peoples Democratic Party (PDP) is contemplating to organize All Party Conference to deliberate on the present and future of Kashmir so that consensus could be established on the issue."
02-08-2017,“Importance and utility of All Party Conference on Kashmir” – (Urdu Daily – Aftab),"According to PDP, at first stage all political parties, including National Conference, Congress and Communist Party etc."
02-08-2017,“Importance and utility of All Party Conference on Kashmir” – (Urdu Daily – Aftab),"would be taken into confidence, because mainstream parties have a role in tackling the present uncertain situation and to find the present uncertain situation solution."
02-08-2017,“Importance and utility of All Party Conference on Kashmir” – (Urdu Daily – Aftab),"Thereafter, National parties like BJP would also be taken confidence; and when a consensus emerges, resistance leadership would also be involved in consultations."
02-08-2017,“Importance and utility of All Party Conference on Kashmir” – (Urdu Daily – Aftab),This possible step to be taken by ruling PDP is being appreciated because at least some new idea could emerge.
02-08-2017,“Importance and utility of All Party Conference on Kashmir” – (Urdu Daily – Aftab),Political circles are of the view that political parties have to play a positive role in changing the fate of nations.
02-08-2017,“Importance and utility of All Party Conference on Kashmir” – (Urdu Daily – Aftab),"Now when Chief Minister, Mehbooba Mufti has said that Chief Minister, Mehbooba Mufti would try to convene All Party Conference, she would try to convene All Party Conference role would have to be seen."
02-08-2017,“Importance and utility of All Party Conference on Kashmir” – (Urdu Daily – Aftab),"Chief Minister, Mehbooba Mufti has also said that resistance leadership would be involved after arriving at a consensus."
02-08-2017,“Importance and utility of All Party Conference on Kashmir” – (Urdu Daily – Aftab),But it would be premature to say anything because it is not known whether resistance leadership would join the process started by a mainstream party.
02-08-2017,“Importance and utility of All Party Conference on Kashmir” – (Urdu Daily – Aftab),"Anyhow, it is an established fact that a political process and dialogue is the only way to bring situation under control and to find solution of issues."
02-08-2017,“Importance and utility of All Party Conference on Kashmir” – (Urdu Daily – Aftab),"There is no other option for it, provided the process started by a mainstream party is based on sincerity."
03-08-2017,Kashmir issue can’t be weighed against trade: Mustafa Kamaal - (Urdu Dailies – Srinagar Times/Aftab/Kashmir Uzma),National Conference has urged Central Government to accept ground realities and take effective steps for political solution of Kashmir issue so that durable peace is established in the State.
03-08-2017,Kashmir issue can’t be weighed against trade: Mustafa Kamaal - (Urdu Dailies – Srinagar Times/Aftab/Kashmir Uzma),"While addressing a meeting at party headquarters, Srinagar, Additional Secretary of National Conference, Dr. Mustafa Kamaal has said that Kashmir is neither a law & order nor economic issue; it is a political issue which needs to be resolved politically."
03-08-2017,Kashmir issue can’t be weighed against trade: Mustafa Kamaal - (Urdu Dailies – Srinagar Times/Aftab/Kashmir Uzma),it is woeful that implementation of the Prime Minister’s package is being preferred over the blood flowing in Kashmir.
03-08-2017,Kashmir issue can’t be weighed against trade: Mustafa Kamaal - (Urdu Dailies – Srinagar Times/Aftab/Kashmir Uzma),"Commenting on the Kashmir visit of high level officials from Delhi to take review of centrally sponsored projects, Dr. Mustafa Kamaal said that the real issue faced by Kashmiri is being ignored."
03-08-2017,Half of the wanted 12 commanders killed: Army – (Urdu Dailies – Srinagar Times/Aftab),"After killing Sabzar Ahmed, successor of HM commander Burhan Wani, Army had earlier issued a list of most wanted 12 commanders of Hizbul Mujahideen (HM) and Lashkar-e-Toiba (LeT), out of which half a dozen has been killed along with most wanted 12 commanders of Hizbul Mujahideen (HM) and Lashkar-e-Toiba (LeT), out of which half a dozen associates in different encounters."
03-08-2017,Half of the wanted 12 commanders killed: Army – (Urdu Dailies – Srinagar Times/Aftab),"a list of most wanted 12 commanders of Hizbul Mujahideen (HM) and Lashkar-e-Toiba (LeT), out of which half a dozen included, Junaid Ahmed Matoo @ Kandroo (LeT commander) r/o Khudwani, Kulgam; HM commander Burhan Wani Bashir Lashkari (LeT commander); r/o Sopshali, Kokernag (Anantnag); Zeenat-ul-Islam Alkama (LeT commander); r/o Sugan-Zainapora (Shopian); Waseem Ahmed @ Osama (LeT commander) r/o Haf Shirmal (Shopian);  Abu Dujana @ Hafiz (LeT commander) r/o Gilgit-Baltistan; Abu Hamas (JeM commander) r/o Pakistan; Sadam Paddar @ Zaid (HM commander) r/o Shopian; Shoukat Ahmed Tak @ Huzaifa (LeT commander); r/o Panzgam-Awantipora (Pulwama); Riyaz Ahmed Naikoo @ Zuber (HM commander) r/o Tokan-Awantipora (Pulwama); Muhammad Yasin Itoo @ Mansoon (HM commander) r/o Chadoora (Budgam); Zakir Rashid Bhat @ Moosa (HM commander) r/o Noorpora-Awantipora (Pulwama); and Altaf Ahmed Dar (HM commander) @ Kachru r/o Hawra (Kulgam)."
03-08-2017,Half of the wanted 12 commanders killed: Army – (Urdu Dailies – Srinagar Times/Aftab),"Out of these senior commanders, half a dozen have been killed during encounters at different places."
03-08-2017,Half of the wanted 12 commanders killed: Army – (Urdu Dailies – Srinagar Times/Aftab),"After the killing of LeT commander Abu Dujana at Hakripora, Pulwama, the security forces have now issued a list of 6 commanders which include, Zakir Rashid Bhat @ Moosa, Riyaz Ahmed Naikoo @ Zuber, Zeent-ul-Islam @ Alkama, Waseem Ahmed @ Osama, Abu Hamas and Showkat Ahmed Tak @ Huzaifa."
03-08-2017,Half of the wanted 12 commanders killed: Army – (Urdu Dailies – Srinagar Times/Aftab),"According to sources, Zakir Moosa who is active since 2013 has been put in A++ category."
03-08-2017,"Curbs in down town, Srinagar and restrictions on Friday prayers:  Valley traders to start agitation – (Urdu Daily – Aftab)","While protesting against imposition of restrictions on Friday prayers in downtown and depriving traders from going business, the traders have said that the traders won’t hesitate to come on roads for restoration of the traders genuine rights."
03-08-2017,"Curbs in down town, Srinagar and restrictions on Friday prayers:  Valley traders to start agitation – (Urdu Daily – Aftab)","At a meeting, which was attended by several Bazaar Committees of downtown, Srinagar, the traders exchanged views on restrictions being imposed by Government on every Friday in Jamia Masjid area and depriving restrictions being imposed by Government on every Friday in Jamia Masjid area from doing business."
03-08-2017,"Curbs in down town, Srinagar and restrictions on Friday prayers:  Valley traders to start agitation – (Urdu Daily – Aftab)","President of Kashmir Traders and Manufacturers Federation, Muhammad Yasin Khan warned Government that if the process of restrictions continues the traders won’t hesitate from coming on roads."
03-08-2017,"Curbs in down town, Srinagar and restrictions on Friday prayers:  Valley traders to start agitation – (Urdu Daily – Aftab)","Muhammad Yasin Khan further said, “We can tolerate anything except interference in religious affairs."
03-08-2017,"Curbs in down town, Srinagar and restrictions on Friday prayers:  Valley traders to start agitation – (Urdu Daily – Aftab)","If the process of restrictions is repeated next week, the traders would start agitation against it for which Government would be responsible”."
03-08-2017,Police foiled Naseem Geelani’s press conference – (Urdu Daily –Kashmir Uzma),"Thwarting press conference of Naseem Geelani (son of Hurriyat Chairman, S.A.S. Geelani), Police prevented Naseem Geelani (son of Hurriyat Chairman, S.A.S. Geelani) from coming before media."
03-08-2017,Police foiled Naseem Geelani’s press conference – (Urdu Daily –Kashmir Uzma),"Nayeem Geelani was called by NIA for questioning, but Nayeem Geelani suffered a heart attack and was admitted in hospital."
03-08-2017,Police foiled Naseem Geelani’s press conference – (Urdu Daily –Kashmir Uzma),"Nayeem Geelani has now called Naseem Geelani, the younger son of S.A.S.  Geelani, to Delhi for questioning."
