20-06-2017,Arwani encounter:  Resistance groups paid tributes to slain youth – (Urdu Daily – Kashmir Uzma),"A delegation of Freedom Party, led by Secretary General, Moulana Abdullah Tari, visited Khudwani, Kulgam and paid tributes to Junaid Mattoo killed in Arwani encounter."
20-06-2017,Arwani encounter:  Resistance groups paid tributes to slain youth – (Urdu Daily – Kashmir Uzma),"A delegation of Freedom Party, led by Secretary General, Moulana Abdullah Tari also visited Frastbal-Pampore (district Pulwama) and paid tributes to Adil Ahmed Mir."
20-06-2017,Arwani encounter:  Resistance groups paid tributes to slain youth – (Urdu Daily – Kashmir Uzma),"On the occasion, Shabir Ahmed Shah (Chairman) spoke to the bereaved family members over phone and expressed sympathy with the bereaved family members."
20-06-2017,Arwani encounter:  Resistance groups paid tributes to slain youth – (Urdu Daily – Kashmir Uzma),"President of a faction of Mahaz-e-Azad,i Syed Altaf Andrabi paid tributes to the martyrs and said that blood would definitely bring freedom for Kashmir."
20-06-2017,Resolution of Kashmir issue not possible without aspirations of Kashmiris: Khan Sopori – (Urdu Daily – Tameel-i-Irshad),"Chief of Public Relation Wing of Hurriyat Conference (G) & incarcerated Chairman of J&K Peoples League, Ghulam Muhammad Khan Sopori has welcomed the statements given by Pakistani leadership with regard to Kashmir and expressed the hope that Pakistan would continue Pakistan political, moral, and diplomatic support in future for right to self-determination of Kashmiris."
20-06-2017,Resolution of Kashmir issue not possible without aspirations of Kashmiris: Khan Sopori – (Urdu Daily – Tameel-i-Irshad),"In a statement received from Kot Balwal jial, Jammu, Ghulam Muhammad Khan Sopori has said that Pakistan is the basic and important party to Kashmir issue and Kashmir issue has to play an important role in Kashmir issue resolution."
20-06-2017,Resolution of Kashmir issue not possible without aspirations of Kashmiris: Khan Sopori – (Urdu Daily – Tameel-i-Irshad),On diplomatic level Pakistan should stress upon India to stop oppression on people in J&K and get ready to resolve Kashmir issue either according to resolutions adopted by UN or through tripartite talks.
20-06-2017,“Amarnath Yatra …. Need to be cautious about mischievous elements” – (Urdu Daily – Kashmir Uzma),"Expression of concern and worry by Hurriyat (G) Chairman, S.A.S. Geelani about negative propaganda being made by a section of outside media on Amarnath Yatra is not only proper and timely but praiseworthy as well."
20-06-2017,“Amarnath Yatra …. Need to be cautious about mischievous elements” – (Urdu Daily – Kashmir Uzma),"It is a fact that with approaching date of Amarnath Yatra this year, a section of print and electronic media has been continuously creating an impression that Yatris would be facing dangers in Kashmir because of prevailing uncertainty."
20-06-2017,“Amarnath Yatra …. Need to be cautious about mischievous elements” – (Urdu Daily – Kashmir Uzma),"Moreover, false propaganda has also been launched on social media to create fear and apprehension among Yatris."
20-06-2017,“Amarnath Yatra …. Need to be cautious about mischievous elements” – (Urdu Daily – Kashmir Uzma),Amarnath Yatra is a religious matter which continues since long.
20-06-2017,“Amarnath Yatra …. Need to be cautious about mischievous elements” – (Urdu Daily – Kashmir Uzma),Nobody can deny the historical reality that Kashmiri Muslims have always welcomed Yatris and tried to provide all facilities to Kashmiri Muslims.
20-06-2017,“Amarnath Yatra …. Need to be cautious about mischievous elements” – (Urdu Daily – Kashmir Uzma),"It is not a matter of regret that some extremists and vested interests have been running a campaign to defame Kashmir and Kashmiris, but rulers and decision makers of New Delhi have neither countered such deliberate attempts nor gave proper place to the expression of brotherhood and co-existence by Kashmiris during Yatra."
20-06-2017,“Amarnath Yatra …. Need to be cautious about mischievous elements” – (Urdu Daily – Kashmir Uzma),"People of Kashmir don’t need praises from any one for this, because it is in People of Kashmir temperament; and respect for human and humanity is People of Kashmir valuable asset."
20-06-2017,“Amarnath Yatra …. Need to be cautious about mischievous elements” – (Urdu Daily – Kashmir Uzma),It is the responsibility of Government to welcome statements coming from Hurriyat leaders and counter the negative propaganda.
20-06-2017,“Amarnath Yatra …. Need to be cautious about mischievous elements” – (Urdu Daily – Kashmir Uzma),"At the same time, Government should make Government coalition partner, BJP understand the negative effects of this deliberate mischief because several workers of this party and BJP close quarters have become a part of this campaign."
20-06-2017,“Lest doomsday may come” – (Urdu Daily- Uqab),"On June 15, 2017, local commander of Lashkar-e-Toiba and two of his accomplices got killed in an encounter at Arwani, besides killing of two civilians due to direct firing by forces."
20-06-2017,“Lest doomsday may come” – (Urdu Daily- Uqab),This incident created tense situation in South Kashmir.
20-06-2017,“Lest doomsday may come” – (Urdu Daily- Uqab),"After This incident, militants stopped a Police vehicle at Achhabal (Anantnag) in which six Police personnel, including SHO were travelling."
20-06-2017,“Lest doomsday may come” – (Urdu Daily- Uqab),"militants resorted to indiscriminate firing inside a Police vehicle at Achhabal (Anantnag) in which six Police personnel, including SHO were travelling killing all Police personnel on the spot."
20-06-2017,“Lest doomsday may come” – (Urdu Daily- Uqab),"This incident has shaken the Government, forces and agencies."
20-06-2017,“Lest doomsday may come” – (Urdu Daily- Uqab),"While forces described Arwani encounter as biggest achievement, militants also termed Achhabal incident as militants big achievement."
20-06-2017,“Lest doomsday may come” – (Urdu Daily- Uqab),"But, in both these separate incidents, one thing was common that people killed at Arwani were Kashmiris and those killed in Achhabal incident were also Kashmiris."
20-06-2017,“Lest doomsday may come” – (Urdu Daily- Uqab),It is true that militants have militants own thinking and strategy and militants consider Police forces as militants enemy.
20-06-2017,“Lest doomsday may come” – (Urdu Daily- Uqab),"But, Police personnel have also taken pledge to be loyal towards the force."
20-06-2017,“Lest doomsday may come” – (Urdu Daily- Uqab),Police personnel earn salary to feed Police personnel families.
20-06-2017,“Lest doomsday may come” – (Urdu Daily- Uqab),It is not possible for Police personnel to keep away for Police personnel duties.
20-06-2017,“Lest doomsday may come” – (Urdu Daily- Uqab),Militants always remain ready to take extreme step for those who pose threat to Militants.
20-06-2017,“Lest doomsday may come” – (Urdu Daily- Uqab),Achhabal incident is the best example of Achhabal incident.
20-06-2017,“Lest doomsday may come” – (Urdu Daily- Uqab),This was a big and only incident of this nature in which a number of Police personnel were killed.
20-06-2017,“Lest doomsday may come” – (Urdu Daily- Uqab),It is worth consideration that number of local Policemen and their family members constitute a sizeable part of population.
20-06-2017,“Lest doomsday may come” – (Urdu Daily- Uqab),"If every aspect of Achhabal incident is viewed seriously, apprehensions about such incidents turning into a civil war in Kashmir can’t be ruled out."
20-06-2017,“Lest doomsday may come” – (Urdu Daily- Uqab),Reasonable and wise men are highly worried over such apprehensions.
20-06-2017,“Lest doomsday may come” – (Urdu Daily- Uqab),"Therefore, there is a need to avert any situation which could create a civil war like situation in Kashmir."
21-06-2017,Sacrifices asset of movement: Mass Movement – (Urdu Dailies – Srinagar Times/Aftab/Tameel-i-Irshsad),"While paying tributes to militants recently killed in an encounter with security forces at Arwani - Bijbehara (district Anantnag), leaders of J&K Mass Movement said that people have decorated people ongoing freedom movement of Kashmir with people sacrifices which are asset of J&K Mass Movement."
21-06-2017,Sacrifices asset of movement: Mass Movement – (Urdu Dailies – Srinagar Times/Aftab/Tameel-i-Irshsad),Complete association of people with J&K Mass Movement and people with this movement steadfastness is the demand of J&K Mass Movement success.
21-06-2017,Sacrifices asset of movement: Mass Movement – (Urdu Dailies – Srinagar Times/Aftab/Tameel-i-Irshsad),"Several leaders of J&K Mass Movement visited different places in Kashmir to express sympathy and solidarity with the bereaved families of commander, Junaid Mattoo, and Adil of Pampore, Pulwama."
21-06-2017,Sacrifices asset of movement: Mass Movement – (Urdu Dailies – Srinagar Times/Aftab/Tameel-i-Irshsad),"Shrinking space for political activities and pushing people of Kashmir to the wall are the reasons for innocent youths taking up arms in their hands, their said."
21-06-2017,Inhuman attitude of Kathua jail authorities towards Kashmiri detainees: Jamaat-e-Islami – (Urdu Daily – Aftab),"Expressing concern over inhuman and immoral behaviour being meted out to Kashmiris detainees in Kathua jail Jammu, Jamaat-e-Islami, J&K has said that 50 Kashmiri detainees in the said jail have been facing inhuman behaviour at the hands of jail authorities and 50 Kashmiri detainees in the said jail lives have been made hell."
21-06-2017,Inhuman attitude of Kathua jail authorities towards Kashmiri detainees: Jamaat-e-Islami – (Urdu Daily – Aftab),50 Kashmiri detainees in the said jail are being kept in barracks for 23 hours and allowed to come out only for one hour in a day.
21-06-2017,Inhuman attitude of Kathua jail authorities towards Kashmiri detainees: Jamaat-e-Islami – (Urdu Daily – Aftab),Family members are not allowed to meet 50 Kashmiri detainees in the said jail on weekly basis but on fortnightly basis.
21-06-2017,"Encounter at Pazalpora, Sopore – (Urdu Daily – Kashmir Uzma)","After crackdown, encounter between militants and security forces started as Pazalpora – Sopore (district Baramulla) where militants have been besieged."
21-06-2017,"Encounter at Pazalpora, Sopore – (Urdu Daily – Kashmir Uzma)","Police has said that on a tip off about the presence of two militants, Army and Police surrounded Pazalpora village in Sopore area."
21-06-2017,"Encounter at Pazalpora, Sopore – (Urdu Daily – Kashmir Uzma)","As soon as forces started searches, encounter between militants and security forces started and exchange of firing continued till late in the night."
21-06-2017,"Encounter at Pazalpora, Sopore – (Urdu Daily – Kashmir Uzma)","According to Police, two militants are hiding in Pazalpora village and siege around two militants has been narrowed."
21-06-2017,Release of detainees on Eid;  Non-stop process of arrests continues: Nasir Aslam Wani – (Urdu Daily – Kashmir Uzma),"Condemning continuous raids and arrests, Provincial President of National Conference, Nasir Aslam Wani has said that while prisoners were being released in the past on the occasion of Eid, but the State Government has started a new process of arrests and raids to hide the State Government failures."
21-06-2017,Release of detainees on Eid;  Non-stop process of arrests continues: Nasir Aslam Wani – (Urdu Daily – Kashmir Uzma),"Instead of settling issues at administrative and political levels, the State Government has been using force against the people, Nasir Aslam Wani said."
21-06-2017,“Disturbing situation ------- Precaution necessary” – (Urdu Daily – Kashmir Uzma),Reports have been regularly pouring in about beating of civilians and destroying civilians properties by Security Forces in South Kashmir.
21-06-2017,“Disturbing situation ------- Precaution necessary” – (Urdu Daily – Kashmir Uzma),"It seems that forces personnel don’t miss any chance to show forces personnel authority, whether it is a rally, meeting or latest Cricket match between and Pakistan."
21-06-2017,“Disturbing situation ------- Precaution necessary” – (Urdu Daily – Kashmir Uzma),"Despite Government’s denial, the fact is that situation is worsening with each passing day."
21-06-2017,“Disturbing situation ------- Precaution necessary” – (Urdu Daily – Kashmir Uzma),"Meaningful silence maintained by Government and elected representatives on nocturnal raids and searches being carried out by forces in residential areas show Meaningful silence maintained by Government and elected representatives on nocturnal raids and searches being carried out by forces in residential areas helplessness and ineffectiveness, but Meaningful silence maintained by Government and elected representatives on nocturnal raids and searches being carried out by forces in residential areas silence is an indirect support of this process."
21-06-2017,“Disturbing situation ------- Precaution necessary” – (Urdu Daily – Kashmir Uzma),"On the other hand, anti-Kashmir campaign launched by electronic media in India continues in a planned way."
21-06-2017,“Disturbing situation ------- Precaution necessary” – (Urdu Daily – Kashmir Uzma),But Government is not opening Government mouth on Government.
21-06-2017,“Disturbing situation ------- Precaution necessary” – (Urdu Daily – Kashmir Uzma),Perhaps views of experts are not wrong that anti-Kashmir campaign flourishing at country level and hard line strategy inside Kashmir might be a political compulsion for BJP because the party has to face people after two years to seek votes again.
21-06-2017,“Disturbing situation ------- Precaution necessary” – (Urdu Daily – Kashmir Uzma),But PDP has come to power with people’s vote and safety of their life and property is PDP constitutional and moral duty.
21-06-2017,“Disturbing situation ------- Precaution necessary” – (Urdu Daily – Kashmir Uzma),"Being a Chairperson of United Command Council, Chief Minister Mehbooba Mufti should use Chief Minister Mehbooba Mufti influence to stop beating of people and destroying people properties by forces."
21-06-2017,“Disturbing situation ------- Precaution necessary” – (Urdu Daily – Kashmir Uzma),It is an accepted reality that collision and conflict become reason for worsening the situation instead of improving it.
21-06-2017,“Disturbing situation ------- Precaution necessary” – (Urdu Daily – Kashmir Uzma),"Therefore, all political parties, including resistance camp, should not evade all political parties, including resistance camp positive role in this regard."
21-06-2017,“Alas! Kashmiri detainees”  - by Abdul Rafiya Rasool – (Urdu Daily – Kashmir Uzma),"While continuing their barbarism and cruelty, the uniformed men have been spilling blood in Kashmir during the holy month of Ramadhan from Kashmir very first day."
21-06-2017,“Alas! Kashmiri detainees”  - by Abdul Rafiya Rasool – (Urdu Daily – Kashmir Uzma),"On the other hand, security forces are in search of excuses to implicate Kashmiri youth in false cases and arrest false cases, besides destroying properties of people during nocturnal raids."
21-06-2017,“Alas! Kashmiri detainees”  - by Abdul Rafiya Rasool – (Urdu Daily – Kashmir Uzma),The only aim of mean tactics and excesses is to harass Kashmiri people psychologically so that Kashmiri people lose courage and accept the occupation of strangers.
21-06-2017,“Alas! Kashmiri detainees”  - by Abdul Rafiya Rasool – (Urdu Daily – Kashmir Uzma),Recently a large number of Kashmiri youth have been put behind bars and are being made targets of vengeance in jails.
21-06-2017,“Alas! Kashmiri detainees”  - by Abdul Rafiya Rasool – (Urdu Daily – Kashmir Uzma),"In fact, Kashmiri detainees in jails are like dead bodies."
21-06-2017,“Alas! Kashmiri detainees”  - by Abdul Rafiya Rasool – (Urdu Daily – Kashmir Uzma),"Recently, the ailing Asiya Indrabi and Fehmeeda Sofi were arrested in Srinagar and lodged in Amphala jail, Jammu."
21-06-2017,“Alas! Kashmiri detainees”  - by Abdul Rafiya Rasool – (Urdu Daily – Kashmir Uzma),"Besides Asiya Indrabi, thousands of Kashmiris have been imprisoned under black laws and most of thousands of Kashmiris have been kept in Jammu jails."
21-06-2017,“Alas! Kashmiri detainees”  - by Abdul Rafiya Rasool – (Urdu Daily – Kashmir Uzma),"Courts have already quashed the ill famed Act slapped against some of thousands of Kashmiris, but thousands of Kashmiris have been re-arrested and put in jails again."
21-06-2017,“Alas! Kashmiri detainees”  - by Abdul Rafiya Rasool – (Urdu Daily – Kashmir Uzma),Some of thousands of Kashmiris have been bailed out by Courts; still Some of them are not being released.
21-06-2017,“Alas! Kashmiri detainees”  - by Abdul Rafiya Rasool – (Urdu Daily – Kashmir Uzma),"Some of Kashmiri detainees in jails are old, while some others are not more than 30 years of age."
21-06-2017,“Alas! Kashmiri detainees”  - by Abdul Rafiya Rasool – (Urdu Daily – Kashmir Uzma),Food provided to detainees in jailsis is sub-standard.
21-06-2017,“Alas! Kashmiri detainees”  - by Abdul Rafiya Rasool – (Urdu Daily – Kashmir Uzma),"Moreover, there is no proper medical facility available in jails and medicines provided to sick inmates are also sub-standard."
21-06-2017,“Alas! Kashmiri detainees”  - by Abdul Rafiya Rasool – (Urdu Daily – Kashmir Uzma),It is no more a hidden fact that condition of jails demands reformation.
21-06-2017,“Alas! Kashmiri detainees”  - by Abdul Rafiya Rasool – (Urdu Daily – Kashmir Uzma),Kashmiri detainees in jails are being tortured and harassed under the garb of different excuses.
21-06-2017,“Alas! Kashmiri detainees”  - by Abdul Rafiya Rasool – (Urdu Daily – Kashmir Uzma),This needs to be stopped forthwith.
22-06-2017,Centre’s pressure on State Government for GST law: Gani Vakil – (Urdu Daily – Srinagar Times),"Former Minister and senior political leader, Abdul Gani Vakil has said that if Central Government mounts pressure on State Government for implementing GST law in the State in a hurry, it would become a serious issue and would be last nail by Mehbooba Government to hollow Article 370."
22-06-2017,Centre’s pressure on State Government for GST law: Gani Vakil – (Urdu Daily – Srinagar Times),"Taking a dig at National Conference and Congress for leaving no stone unturned in causing erosions in Article 370, Abdul Gani Vakil described apprehensions of traders with regard to GST as genuine."
22-06-2017,Arrest of youth and restrictions on prayers in the month of Ramadhan condemnable: Save Party – (Urdu Daily – Srinagar Times),"At an Iftar party organised by J&K Save Party at Hotel Jehangir in Srinagar on June 20, party President, Ghulam Hassan Dar expressed concerned on the arrest/killing of youth, inhuman behaviour of jail authorities with detainees and restrictions on prayers in the month of Ramadhan."
22-06-2017,Arrest of youth and restrictions on prayers in the month of Ramadhan condemnable: Save Party – (Urdu Daily – Srinagar Times),"party President, Ghulam Hassan Dar further said that people of the State are unsafe in war like situation and stressed on peaceful talks to get rid of this situation and for the resolution of Kashmir issue."
22-06-2017,Arrest of youth and restrictions on prayers in the month of Ramadhan condemnable: Save Party – (Urdu Daily – Srinagar Times),"party President, Ghulam Hassan Dar also appealed to Government to release detainees before Eid-ul-Fitr."
22-06-2017,India should shun its rigidity and stubbornness: Zaffar Akbar Bhat– (Urdu Daily – Tameel-i-Irshad),"While speaking at an Iftar party organized by him for families of martyrs, detainees and pellet victims, Chairman of J&K Salvation Movement, Zaffar Akbar Bhat said, “We are indebted to sacrifices given by martyrs."
22-06-2017,India should shun its rigidity and stubbornness: Zaffar Akbar Bhat– (Urdu Daily – Tameel-i-Irshad),We promise to the families of martyrs that We won’t show slackness in taking mission of martyrs forward”.
22-06-2017,India should shun its rigidity and stubbornness: Zaffar Akbar Bhat– (Urdu Daily – Tameel-i-Irshad),"On the occasion, people raised slogans and reiterated people pledge to take forward the freedom movement."
22-06-2017,“Border inhabitants in difficult circumstances” – (Urdu Daily – Kashmir Uzma),"Though border inhabitants always spend border inhabitants life in difficult circumstances, but for the last few months, life has been made hell for border inhabitants."
22-06-2017,“Border inhabitants in difficult circumstances” – (Urdu Daily – Kashmir Uzma),border inhabitants have faced lots of problems and difficulties due to border skirmishes between Indo-Pak troops.
22-06-2017,“Border inhabitants in difficult circumstances” – (Urdu Daily – Kashmir Uzma),border inhabitants difficulties had not ended as yet that Army made border inhabitants life more difficult by imposing restrictions on people’s movement in Balakote sector of Poonch district.
22-06-2017,“Border inhabitants in difficult circumstances” – (Urdu Daily – Kashmir Uzma),People are not allowed to go to People agricultural fields situated in the area under wire fencing.
22-06-2017,“Border inhabitants in difficult circumstances” – (Urdu Daily – Kashmir Uzma),"Earlier People used to go to People fields along with cattle with the permission of Army, but now this process has been stopped."
22-06-2017,“Border inhabitants in difficult circumstances” – (Urdu Daily – Kashmir Uzma),Reason for this is that some days ago a youth carrying drugs was caught within the wire fencing.
22-06-2017,“Border inhabitants in difficult circumstances” – (Urdu Daily – Kashmir Uzma),"Since then, Army Army has imposed new restrictions which have caused anxiety among people."
22-06-2017,“Border inhabitants in difficult circumstances” – (Urdu Daily – Kashmir Uzma),"Though the matter has been taken up with civil authorities, but no step has been taken so far in this regard."
22-06-2017,“Border inhabitants in difficult circumstances” – (Urdu Daily – Kashmir Uzma),Blockade of border inhabitants by Army is a matter of concern and State Government should take up a matter of concern and State Government with Army authorities.
22-06-2017,“Border inhabitants in difficult circumstances” – (Urdu Daily – Kashmir Uzma),"If these people are residents of State Government, these people should have right to live freely."
22-06-2017,“Border inhabitants in difficult circumstances” – (Urdu Daily – Kashmir Uzma),these people should have permission to go to these people fields for cultivation purposes to make booth ends meet.
22-06-2017,“Return to the past” – (Urdu Daily – Uqab),The biggest misfortune of Kashmir is that the graph of crime has been increasing with each passing day.
22-06-2017,“Return to the past” – (Urdu Daily – Uqab),"New generation, in particular, has been sinking in the marsh of crime and drugs."
22-06-2017,“Return to the past” – (Urdu Daily – Uqab),"It is also true that Kashmiri candidates have shown exemplary performance in national level examinations, besides showing mettle in other sectors."
22-06-2017,“Return to the past” – (Urdu Daily – Uqab),But the feeling about Kashmir becoming shelter for crime is heart piercing.
22-06-2017,“Return to the past” – (Urdu Daily – Uqab),Only two decades ago Kashmir used to be cleanest amongst all states of the sub-continent in the matter of crime.
22-06-2017,“Return to the past” – (Urdu Daily – Uqab),"Whenever any crime used to occur, Kashmir society used to be ashamed of as if whole society has committed the crime."
22-06-2017,“Return to the past” – (Urdu Daily – Uqab),"For weeks and months, learned men used to try to find out reasons of the crime."
22-06-2017,“Return to the past” – (Urdu Daily – Uqab),Discussions used to take place in every get-together or meeting in this regard.
22-06-2017,“Return to the past” – (Urdu Daily – Uqab),"But, social situation of Kashmir took a sudden turn in which people with criminal mindset started flourishing people with criminal mindset crime world."
22-06-2017,“Return to the past” – (Urdu Daily – Uqab),"Today newspapers are full of sensational news about murders, thefts, loot, deception etc."
22-06-2017,“Return to the past” – (Urdu Daily – Uqab),"On the other hand, children are getting involved in drug addiction and debauchery."
22-06-2017,“Return to the past” – (Urdu Daily – Uqab),The drug addiction has also reached to renowned schools of the Valley.
22-06-2017,“Return to the past” – (Urdu Daily – Uqab),Even girl students are also crossing limits.
22-06-2017,“Return to the past” – (Urdu Daily – Uqab),"If situation did not change immediately, it would be difficult to say anything about the future shape of Kashmir society."
22-06-2017,“Return to the past” – (Urdu Daily – Uqab),Some leaders say that Indian Government is responsible for debauchery in Kashmir.
22-06-2017,“Return to the past” – (Urdu Daily – Uqab),"When we hold someone else responsible for we mistakes, it means we support our mistakes."
