01-01-2018,"On the eve New Year, Dr. Farooq Abdullah prayed for restoration of Autonomy and urged India and Pakistan to forget past bitterness – (Urdu Dailies – Srinagar Times/Aftab/Uqab)","Welcoming New Year (2018), National Conference President, Dr. Farooq Abdullah has expressed hope that efforts towards political resolution of Kashmir issue would bear fruit and State’s autonomy would be restored."
01-01-2018,"On the eve New Year, Dr. Farooq Abdullah prayed for restoration of Autonomy and urged India and Pakistan to forget past bitterness – (Urdu Dailies – Srinagar Times/Aftab/Uqab)","Both India and Pakistan would forget past bitterness and differences and make a new beginning for the resolution of all mutual issues to usher the subcontinent into durable peace, Dr. Farooq Abdullah added."
01-01-2018,"On the eve New Year, Dr. Farooq Abdullah prayed for restoration of Autonomy and urged India and Pakistan to forget past bitterness – (Urdu Dailies – Srinagar Times/Aftab/Uqab)","Appreciating initiatives taken by former Pakistan President, General Parvez Musharaf, former Pak Prime Minister, Nawaz Sharif and former Prime Minister, Atal Bihari Vajpayee for the resolution of Kashmir issue through peaceful dialogue, Dr. Farooq Abdullah appealed Indo-Pak Prime Ministers to take steps for improving mutual relations."
01-01-2018,"On the eve New Year, Dr. Farooq Abdullah prayed for restoration of Autonomy and urged India and Pakistan to forget past bitterness – (Urdu Dailies – Srinagar Times/Aftab/Uqab)","Kashmir issue is a reality which needs to be resolved politically, Dr. Farooq Abdullah added."
01-01-2018,Javed Ahmed Mir (JKLF-H) and Zaffar Akbar Bhat (Salvation Movement) met Mushtaq-ul-Islam – (Urdu Dailies – Aftab/Kashmir Uzma),"Salvation Movement Chairman, Zaffar Akbar Bhat and J&K Liberation Front (H) Chairman, Javed Ahmed Mir met Mushaq-ul-Islam (Chairman/Muslim League) at his home in Batmaloo, Srinagar and welcomed his release from detention."
01-01-2018,Javed Ahmed Mir (JKLF-H) and Zaffar Akbar Bhat (Salvation Movement) met Mushtaq-ul-Islam – (Urdu Dailies – Aftab/Kashmir Uzma),The leaders also discussed present political situation in Kashmir and reiterated resolve to take forward Salvation Movement in an organized and principled manner.
01-01-2018,Javed Ahmed Mir (JKLF-H) and Zaffar Akbar Bhat (Salvation Movement) met Mushtaq-ul-Islam – (Urdu Dailies – Aftab/Kashmir Uzma),"Later, The leaders visited the houses of victims of Salvation Movement, expressed solidarity with The leaders and assured solidarity with them that Kashmiri people would continue Kashmiri people  struggle till the goal is achieved."
01-01-2018,"At a meeting, Peoples’ Political Front (PPF) commended patience of Kashmiris against oppression – (Urdu Daily – Tameel-i-Irshad)","According to a statement, Chairman of Peoples’ Political Front, Mussadiq Adil convened a meeting of party members at Soura, Srinagar."
01-01-2018,"At a meeting, Peoples’ Political Front (PPF) commended patience of Kashmiris against oppression – (Urdu Daily – Tameel-i-Irshad)","Addressing a meeting of party members, Mussadiq Adil said that like previous 30 years, the year 2017 has also proved full of miseries and difficulties for the people of Kashmir with lot of bloodshed."
01-01-2018,"At a meeting, Peoples’ Political Front (PPF) commended patience of Kashmiris against oppression – (Urdu Daily – Tameel-i-Irshad)","The patience exhibited by Kashmiris against cruelty during the year is commendable, Mussadiq Adil said."
01-01-2018,"At a meeting, Peoples’ Political Front (PPF) commended patience of Kashmiris against oppression – (Urdu Daily – Tameel-i-Irshad)","While condemning brutalities perpetrated by government agencies in Kashmir during the year 2017, Mussadiq Adil said that this is being done only to suppress the movement against India’s forcible occupation of Kashmir, in which they have once again failed as in the past."
01-01-2018,“How the New Year would be” – (Urdu Daily – Aftab),"The year 2017 has passed, leaving behind both sweet and bitter memories."
01-01-2018,“How the New Year would be” – (Urdu Daily – Aftab),Previous year was full of bitterness and confusion with large scale killings and topsy-turvy politics.
01-01-2018,“How the New Year would be” – (Urdu Daily – Aftab),No worthwhile improvement was witnessed in Indo-Pak relations during Previous year.
01-01-2018,“How the New Year would be” – (Urdu Daily – Aftab),"Thought only time would tell what Previous year is going to bring for the people of Kashmir, yet signs and symptoms indicate that the year 2018 is not going to be full of joy and happiness for the people of KashmirKashmir."
01-01-2018,“New Year ………….New Hopes” – (Urdu Daily – Kashmir Uzma) ,"The year 2017 has come to end with tension between India and Pakistan, Operation All Out, NIA actions, appointment of interlocutor, bloody Parliament by-polls, GST implementation, and regularization of 60,000 casual employees; general amnesty for stone-pelters, student agitations and strong statements of Dr. Farooq Abdullah against the Centre."
01-01-2018,“New Year ………….New Hopes” – (Urdu Daily – Kashmir Uzma) ,"Now, 2018 begins today with people expressing joy, but bitter memories of The year 2017 increasing people apprehensions."
01-01-2018,“New Year ………….New Hopes” – (Urdu Daily – Kashmir Uzma) ,"No doubt that the Central Government has appointed former Intelligence Bureau chief, Dineshwar Sharma  as interlocutor on Kashmir, but in view of past experiences, expectations of people with his visits have started becoming extinct."
01-01-2018,“New Year ………….New Hopes” – (Urdu Daily – Kashmir Uzma) ,"Appointment of the interlocutor at its place, but there has been no march forward on political resolution of Kashmir issue."
01-01-2018,“New Year ………….New Hopes” – (Urdu Daily – Kashmir Uzma) ,"Except general amnesty to 4500 first time stone pelters, no other confidence building measure was taken during 2017 which could have restored confidence among people."
01-01-2018,“New Year ………….New Hopes” – (Urdu Daily – Kashmir Uzma) ,"While looking at this non-serious atmosphere, several quarters, whether mainstream or separatist, have been terming the appointment of interlocutor as a time buying tactic, because results of reports submitted by previous interlocutors and Working Groups are before Working Groups."
01-01-2018,“New Year ………….New Hopes” – (Urdu Daily – Kashmir Uzma) ,"If the Central Government does not make serious efforts for political solution of Kashmir issue and remains contended with the Central GovernmentOperation All Out’ and NIA actions, no worthwhile change could be expected in 2018."
01-01-2018,“New Year ………….New Hopes” – (Urdu Daily – Kashmir Uzma) ,Expecting any change in the internal situation of Kashmir is also difficult.
01-01-2018,“New Year ………….New Hopes” – (Urdu Daily – Kashmir Uzma) ,"In view of political, economic and social issues of the people of State, it could be said that there is enough to be done."
01-01-2018,“New Year ………….New Hopes” – (Urdu Daily – Kashmir Uzma) ,"However, it depends on the Central Government how the Central Government is going to utilize 365 days of 2018 and how the Central Government would face the challenges which have fastened State’s people under their claws."
01-01-2018,“Palestine and Kashmir” – by S. Ahmed Peerzada – (Urdu Daily – Kashmir Uzma),There are lots of similarities in the issues of Palestine and Kashmir.
01-01-2018,“Palestine and Kashmir” – by S. Ahmed Peerzada – (Urdu Daily – Kashmir Uzma),Muslims of Palestine have been fighting for Muslims of Palestine rights; and hapless Muslims of Kashmir also are struggling for last seven decades for hapless Muslims of Kashmir political rights.
01-01-2018,“Palestine and Kashmir” – by S. Ahmed Peerzada – (Urdu Daily – Kashmir Uzma),Muslims of Palestine are being killed in Palestine and the lives of innocent people of Kashmir are also being snatched every day.
01-01-2018,“Palestine and Kashmir” – by S. Ahmed Peerzada – (Urdu Daily – Kashmir Uzma),"The killing of two innocent women in Shopian and Yunsoo – Handwara   (district Kupwara) and a Sumo driver of Kralpora, Kupwara are latest examples of Kupwara, who were killed by uniformed men in their homes."
01-01-2018,“Palestine and Kashmir” – by S. Ahmed Peerzada – (Urdu Daily – Kashmir Uzma),"Though issues of the people of Palestine and Kashmir Kashmir are similar, but approach of world nations towards both the issues is different."
01-01-2018,“Palestine and Kashmir” – by S. Ahmed Peerzada – (Urdu Daily – Kashmir Uzma),"Recently, US President Donald Trump announced decision accepting Jerusalem as the capital of Israel."
01-01-2018,“Palestine and Kashmir” – by S. Ahmed Peerzada – (Urdu Daily – Kashmir Uzma),Most world nations openly opposed and condemned decision accepting Jerusalem as the capital of Israel.
01-01-2018,“Palestine and Kashmir” – by S. Ahmed Peerzada – (Urdu Daily – Kashmir Uzma),OIC and UN General Assembly also rejected the announcement of the US President.
01-01-2018,“Palestine and Kashmir” – by S. Ahmed Peerzada – (Urdu Daily – Kashmir Uzma),"On the contrary, most of Most world nations appear unconcerned or unaware with regard to Kashmir issue."
01-01-2018,“Palestine and Kashmir” – by S. Ahmed Peerzada – (Urdu Daily – Kashmir Uzma),Why the world has been adopting two standards for two similar issues is an important question.
01-01-2018,“Palestine and Kashmir” – by S. Ahmed Peerzada – (Urdu Daily – Kashmir Uzma),"Two important parties of the issue, Kashmiris and Pakistan, need to find out answer of this question and review this question stimulant factors."
01-01-2018,“Palestine and Kashmir” – by S. Ahmed Peerzada – (Urdu Daily – Kashmir Uzma),"On Palestine issue, world Muslims are united which world Muslims have shown on the platform of UN."
01-01-2018,“Palestine and Kashmir” – by S. Ahmed Peerzada – (Urdu Daily – Kashmir Uzma),But this does not happen with regard to Kashmir issue.
01-01-2018,“Palestine and Kashmir” – by S. Ahmed Peerzada – (Urdu Daily – Kashmir Uzma),"Every Muslims has made Palestine as Every Muslims own issue, while as the issue is the pain and grief of Kashmiris only."
01-01-2018,“Palestine and Kashmir” – by S. Ahmed Peerzada – (Urdu Daily – Kashmir Uzma),Pakistan is a party of Kashmir issue and has been playing a key role in highlighting Kashmir issue at international level for the last seven decades.
01-01-2018,“Palestine and Kashmir” – by S. Ahmed Peerzada – (Urdu Daily – Kashmir Uzma),"Still then, we can say that desired efforts are not being made which are required to publicise the issue and human rights violations taking place in Kashmir."
01-01-2018,“Palestine and Kashmir” – by S. Ahmed Peerzada – (Urdu Daily – Kashmir Uzma),"Kashmir issue needs to be highlighted as the pain of world Muslims and entire Ummah, as a single body, have to take concrete steps to highlight the reality of Kashmir issue."
01-01-2018,“Palestine and Kashmir” – by S. Ahmed Peerzada – (Urdu Daily – Kashmir Uzma),"For this, Kashmiri leadership also has to chalk out a new strategy to take forward the struggle."
01-01-2018,“Palestine and Kashmir” – by S. Ahmed Peerzada – (Urdu Daily – Kashmir Uzma),"First priority should be given to stoppage of human rights violations taking place in Kashmir, including killing of innocent people."
01-01-2018,“Palestine and Kashmir” – by S. Ahmed Peerzada – (Urdu Daily – Kashmir Uzma),"If killings would be solving issues, Kashmir issue would have been solved in 90s because dozens of people were being killed in a single day then; and Kashmir issue would not have existed after the massacre of Muslims in Jammu in 1947."
01-01-2018,“Palestine and Kashmir” – by S. Ahmed Peerzada – (Urdu Daily – Kashmir Uzma),"The issues are not solved by killings and wars; instead killings and wars are solved by fulfilling demands of principles, justice and honesty."
01-01-2018,“Palestine and Kashmir” – by S. Ahmed Peerzada – (Urdu Daily – Kashmir Uzma),"As a nation, we (Kashmiris) have to join heads and find out why world does not accord importance to Kashmir issue."
01-01-2018,“Palestine and Kashmir” – by S. Ahmed Peerzada – (Urdu Daily – Kashmir Uzma),There is need to know and understand reasons for this and nock the conscience of world humanity by clarifying our strategy.
02-01-2018,National electronic media responsible for causing damage to tourism: Director Tourism – (Urdu Dailies – Srinagar Times/Uqab/Tameel-i-Irshad),"Director Tourism Kashmir, Mehmood Ahmed Shah has said that National electronic media has been projecting negative image of the situation in Valley due to which Tourism sector has suffered heavy loss."
02-01-2018,National electronic media responsible for causing damage to tourism: Director Tourism – (Urdu Dailies – Srinagar Times/Uqab/Tameel-i-Irshad),"While talking to UNI on the sidelines of a function organized at the Club/Convention Centre, Pahalgam (district Anantnag), Director Tourism Kashmir, Mehmood Ahmed Shah said that South India is the best market for Kashmir tourism because Kashmir tourism regional media has been playing impartial role with regard to Kashmir."
02-01-2018,Mischief of rulers can’t change Quran or Islamic Shariah: Jamaat-e-Islami – (Urdu Dailies - Srinagar Times/Aftab/Kashmir Uzma),"Jamaat-e-Islami, J&K has said that the announcement of Prime Minister, Narendra Modi has perplexed Indian Muslims, in which Narendra Modi stated that 1300 seats have been reserved for Muslim women wishing to perform Hajj without Mahram (male companion)."
02-01-2018,Mischief of rulers can’t change Quran or Islamic Shariah: Jamaat-e-Islami – (Urdu Dailies - Srinagar Times/Aftab/Kashmir Uzma),"Jamaat-e-Islami clarifies that BJP Government at the Centre, controlled by RSS, wants to terminate association of Muslims with Muslims religion in a planned manner so that an irreligious Ummah could be brought up  for making Muslims ‘Ghar Wapsi’ possible."
02-01-2018,Mischief of rulers can’t change Quran or Islamic Shariah: Jamaat-e-Islami – (Urdu Dailies - Srinagar Times/Aftab/Kashmir Uzma),"Though such mischief could neither change Quran or Islamic Shariah, but Quran or Islamic Shariah could shake the faith of Muslims, Jamaat added."
02-01-2018,Mischief of rulers can’t change Quran or Islamic Shariah: Jamaat-e-Islami – (Urdu Dailies - Srinagar Times/Aftab/Kashmir Uzma),The organization further said that by criminalizing tripe-talaq the Central Government wants to create a tug of war atmosphere between men and women to disturb strong family system among Muslims.
02-01-2018,Two more local youth of Pulwama returned to their homes – (Urdu Dailies  – Aftab/Tameel-i-Irshad),"Two local youths of Kangan (district Pulwama), who were intending to join militant ranks, have suddenly returned to Two local youths of Kangan (district Pulwama), who were intending to join militant ranks homes."
02-01-2018,Two more local youth of Pulwama returned to their homes – (Urdu Dailies  – Aftab/Tameel-i-Irshad),"Confirming the report, Defence sources said that 10 days back, two youth of Kareemabad and Kangan (both in district Pulwama), who were intending to join militant ranks, have returned to two youth of Kareemabad and Kangan (both in district Pulwama), who were intending to join militant ranks today (January 1)."
02-01-2018,Two more local youth of Pulwama returned to their homes – (Urdu Dailies  – Aftab/Tameel-i-Irshad),"According to news agency - UNI, following appeals from 10 days back, two youth of Kareemabad and Kangan (both in district Pulwama), who were intending to join militant ranks, have returned to their homes today (January 1) parents, both the youths surrendered before Army at a function."
02-01-2018,Two more local youth of Pulwama returned to their homes – (Urdu Dailies  – Aftab/Tameel-i-Irshad),Later the youths were handed over to the youths families.
02-01-2018,"Cordon and Search Operation started in Pakherpora, Mohanpora and Futlipora – (Urdu Dailies – Uqab/Aftab/)","Forces have been alerted in Pakherpora, Mohanpora and Fultipora (all in district Budgam) and security forces have started frisking of passengers travelling in vehicles."
02-01-2018,"Cordon and Search Operation started in Pakherpora, Mohanpora and Futlipora – (Urdu Dailies – Uqab/Aftab/)","Following a trip off about presence of militants, Army has increased night patrolling, besides starting house-to-house search in Pakherpora, Mohanpora, Futlipora and nearby villages."
02-01-2018,"Cordon and Search Operation started in Pakherpora, Mohanpora and Futlipora – (Urdu Dailies – Uqab/Aftab/)","(B)	Article"
02-01-2018,“Issues of Indian Muslims and present Government” -  by Feroz Ahmed – (Urdu Daily – Srinagar Times),"While hurting the sentiments of Indian Muslims, Modi government, intoxicated by power, has passed Triple Talaq Bill in the Parliament."
02-01-2018,“Issues of Indian Muslims and present Government” -  by Feroz Ahmed – (Urdu Daily – Srinagar Times),There is every possibility that Rajya Sabha would also pass Triple Talaq Bill in the Parliament.
02-01-2018,“Issues of Indian Muslims and present Government” -  by Feroz Ahmed – (Urdu Daily – Srinagar Times),"Soft approach of Congress has played important role in the passage of this Triple Talaq Bill in the Parliament in Lok Sabha, which indicates that Congress is going to adopt similar approach in the Rajya Sabha."
02-01-2018,“Issues of Indian Muslims and present Government” -  by Feroz Ahmed – (Urdu Daily – Srinagar Times),"In fact, Congress has stopping paying attention towards Muslims and Congress leaves no stone unturned in adopting soft Hindutva agenda to strengthen Congress vote bank among non-Muslims."
02-01-2018,“Issues of Indian Muslims and present Government” -  by Feroz Ahmed – (Urdu Daily – Srinagar Times),Most shameful aspect of this issue came to the fore when Muslim members in the Parliament did not support Assaddudin Owaisi.
02-01-2018,“Issues of Indian Muslims and present Government” -  by Feroz Ahmed – (Urdu Daily – Srinagar Times),The voice of Assaddudin Owaisi evaporated in the air due to lack of attention and conscience shown by Muslim Parliament members.
02-01-2018,“Issues of Indian Muslims and present Government” -  by Feroz Ahmed – (Urdu Daily – Srinagar Times),Muslims in India have been suffering losses of men and material since BJP came to power at the Centre.
02-01-2018,“Issues of Indian Muslims and present Government” -  by Feroz Ahmed – (Urdu Daily – Srinagar Times),"With the passage of Triple Taalq Bill, Congress has started attacking Islam and Shariah."
02-01-2018,“Issues of Indian Muslims and present Government” -  by Feroz Ahmed – (Urdu Daily – Srinagar Times),"Only yesterday, Prime Minister, Narendra Modi said, in a statement, that Muslim women could visit Mecca for Hajj pilgrimage without Mahram (male associate)."
02-01-2018,“Issues of Indian Muslims and present Government” -  by Feroz Ahmed – (Urdu Daily – Srinagar Times),Muslims will have to unite to face all these issues and prove Muslim women political maturity.
02-01-2018,“Issues of Indian Muslims and present Government” -  by Feroz Ahmed – (Urdu Daily – Srinagar Times),"In case Muslim women continue to say that Muslims should not intervene in political matters, the day is not far away when Muslims won’t be allowed to follow Shariah."
02-01-2018,“Issues of Indian Muslims and present Government” -  by Feroz Ahmed – (Urdu Daily – Srinagar Times),"Otherwise also, the agenda of RSS is that all rights of Muslims would be snatched if all rights of Muslims want to live in India; and if all rights of Muslims want to live in India, all rights of Muslims have to live like Hindus."
02-01-2018,“Issues of Indian Muslims and present Government” -  by Feroz Ahmed – (Urdu Daily – Srinagar Times),"Therefore, need of the time is that we should become strong politically, forge unity and support the party which is willing to protect we faith, Shariah and honour."
02-01-2018,“Issues of Indian Muslims and present Government” -  by Feroz Ahmed – (Urdu Daily – Srinagar Times),we should also adopt all means by which number of Muslims members in the Parliament could be increased so that Muslim don’t see such a black day again.
02-01-2018,“Bleeding journey of fortune making” – by Manzoor Anjum – (Urdu Daily – Kashmir Uzma),The year 2017 has come to end; and world has been welcoming the New Year 2018.
02-01-2018,“Bleeding journey of fortune making” – by Manzoor Anjum – (Urdu Daily – Kashmir Uzma),"On the beginning of New Year, there is jubilation everywhere in world, in which new generation, which has to shoulder responsibilities of coming days, is in the forefront."
02-01-2018,“Bleeding journey of fortune making” – by Manzoor Anjum – (Urdu Daily – Kashmir Uzma),"But, children of our land, unconcerned about all pleasures, must be pelting stones on forces; busy in encounters, taking dead bodies out of debris or getting injured by pellets and bullets."
02-01-2018,“Bleeding journey of fortune making” – by Manzoor Anjum – (Urdu Daily – Kashmir Uzma),Who has written this fate of our children and why?
02-01-2018,“Bleeding journey of fortune making” – by Manzoor Anjum – (Urdu Daily – Kashmir Uzma),We don’t have any feeling of changing and passing times.
02-01-2018,“Bleeding journey of fortune making” – by Manzoor Anjum – (Urdu Daily – Kashmir Uzma),"At the end of year, We don’t want to introspect about We gain or loss."
02-01-2018,“Bleeding journey of fortune making” – by Manzoor Anjum – (Urdu Daily – Kashmir Uzma),Can’t We intellectuals and leaders feel so?
02-01-2018,“Bleeding journey of fortune making” – by Manzoor Anjum – (Urdu Daily – Kashmir Uzma),All We leaders are worried about the future of We new generation with claims to streamline All our leaders future.
02-01-2018,“Bleeding journey of fortune making” – by Manzoor Anjum – (Urdu Daily – Kashmir Uzma),But We new generation along with their fate is being buried under the depths of earth and We leaders fulfil our leaders right of leadership by holding India or Pakistan responsible for all this.
02-01-2018,“Bleeding journey of fortune making” – by Manzoor Anjum – (Urdu Daily – Kashmir Uzma),"In this game of several decades, all political forces, decision makers and leaders have given it a name of ‘holy struggle’ to brighten the dark future of our new generation."
02-01-2018,“Bleeding journey of fortune making” – by Manzoor Anjum – (Urdu Daily – Kashmir Uzma),"Resistance leadership, religious organizations and separatists take pride in the death of every militant, saying that religious organizations and separatists have laid down religious organizations and separatists lives for eminence of Islam."
02-01-2018,“Bleeding journey of fortune making” – by Manzoor Anjum – (Urdu Daily – Kashmir Uzma),"At the same time, religious organizations and separatists also say that if this process of sacrifices stops, all sacrifices given so far, would go in vain."
02-01-2018,“Bleeding journey of fortune making” – by Manzoor Anjum – (Urdu Daily – Kashmir Uzma),"So, this process of sacrifices should continue."
02-01-2018,“Bleeding journey of fortune making” – by Manzoor Anjum – (Urdu Daily – Kashmir Uzma),All leaders in pro-India camp have also made youth centre of All leaders in pro-India camp politics.
02-01-2018,“Bleeding journey of fortune making” – by Manzoor Anjum – (Urdu Daily – Kashmir Uzma),Everybody claims to be busy in streamlining the future.
02-01-2018,“Bleeding journey of fortune making” – by Manzoor Anjum – (Urdu Daily – Kashmir Uzma),"In this way, new generation is being eliminated for streamlining the future of new generation."
02-01-2018,“Bleeding journey of fortune making” – by Manzoor Anjum – (Urdu Daily – Kashmir Uzma),Ideas of new generation have been caged within the limits of killing or getting killed; and death has been fixed as new generation goal.
02-01-2018,“Bleeding journey of fortune making” – by Manzoor Anjum – (Urdu Daily – Kashmir Uzma),Nobody is allowed to speak whether deaths of Kashmiris is necessary for the resolution of Kashmir issue?
02-01-2018,“Bleeding journey of fortune making” – by Manzoor Anjum – (Urdu Daily – Kashmir Uzma),Why the blood of Kashmiris is being sought for the resolution of Kashmir issueKashmir ?
02-01-2018,“Bleeding journey of fortune making” – by Manzoor Anjum – (Urdu Daily – Kashmir Uzma),Can India establish peace by pellets or bullets?
02-01-2018,“Bleeding journey of fortune making” – by Manzoor Anjum – (Urdu Daily – Kashmir Uzma),Can Mehbooba Mufti build fate of Kashmiri youth on their dead bodies?
02-01-2018,“Bleeding journey of fortune making” – by Manzoor Anjum – (Urdu Daily – Kashmir Uzma),No leader has answer to these questions.
02-01-2018,“Bleeding journey of fortune making” – by Manzoor Anjum – (Urdu Daily – Kashmir Uzma),"We can’t go far away in the obsession of streamlining future, where future itself has been facing worst end."
