14-08-2017,“Article 370 and accession with India”  - (Urdu Daily – Aftab),"At present, Kashmir affects won’t be felt, but no sign of Kashmir, Kashmiriyat and identity of Kashmir would be visible in future anywhere, because rights of the original residents of Kashmir won’t be having any security."
14-08-2017,“Article 370 and accession with India”  - (Urdu Daily – Aftab),Every institution would be occupied by non-State subjects and the laws and rules would be trampled under feet which were promulgated by a presidential order in 1954.
14-08-2017,“Article 370 and accession with India”  - (Urdu Daily – Aftab),"According to Article 370, the Supreme Court and Election Commission of India have no jurisdiction in the State."
14-08-2017,“Article 370 and accession with India”  - (Urdu Daily – Aftab),"But some tricks were played, bringing both these institutions in the State, thus Article 370 was weakened instead of strengthening Article 370."
14-08-2017,“Article 370 and accession with India”  - (Urdu Daily – Aftab),"Whatever is left in Article 370, that too is being attacked and right-wing parties are in the forefront for the same."
14-08-2017,“Article 370 and accession with India”  - (Urdu Daily – Aftab),"RSS ad BJP, in particular, seems busy in RSS ad BJP efforts to bring special position of the State to an end."
14-08-2017,“Article 370 and accession with India”  - (Urdu Daily – Aftab),"But, now mainstream parties of Kashmir have decided to unite to counter the conspiracies being hatched to abrogate this Article, which is satisfying."
14-08-2017,“Article 370 and accession with India”  - (Urdu Daily – Aftab),"As said above, Article 370 is linked with accession to India and any fiddling with Article 370 would put a question mark on accession to India."
14-08-2017,“Article 370 and accession with India”  - (Urdu Daily – Aftab),"Therefore, the Central Government should think hundred times about the Central Government consequences."
16-08-2017,Right to self-determination for nations an accepted affair: Barrister Tramboo – (Urdu Daily – Srinagar Times),"While expressing grief over the recent killing of three HM militants at Awneera (district Shopian), Patron of J&K Liberation Front (R), Barrister Abdul Majid Tramboo has said that commitment of slain militant, Muhammad Yaseen Itoo @ Ghaznavi towards freedom movement would be written in golden letters in history."
16-08-2017,Right to self-determination for nations an accepted affair: Barrister Tramboo – (Urdu Daily – Srinagar Times),"Right to self-determination for any nation is an accepted affair which has the guarantee of international community, Barrister Abdul Majid Tramboo said."
16-08-2017,Right to self-determination for nations an accepted affair: Barrister Tramboo – (Urdu Daily – Srinagar Times),"Expressing objection to Independence Day celebrations in J&K State, Barrister Abdul Majid Tramboo said that no occupying country has right to celebrate Independence Day in the occupied region."
16-08-2017,"Hurriyat Conference Jammu Kashmir, Muslim Conference Tehreek-i-Istiqamaat appealed for observing complete haltal and black day on August 15 – (Urdu Dailies – Srinagar Times/Kashmir Uzma)","In a joint statement, Convener of Hurriyat Conference Jammu Kashmir & Chairman of Muslim Conference, Shabir Ahmed Dar, President of Mahaz-e-Azadi, Muhammad Iqbal Mir, Chairman of International Forum for Justice, Muhammad Ahsan Untoo, Young Men’s League Chairman, Imtiyaz Ahmed Reshi, Chairman of Tehree-i-Istiqamat, Ghulam Nabi War and Chairperson of Muslim Khwateen Markaz, Yasmeen Raja have appealed to the people to observe complete hartal and black day on August 15."
16-08-2017,"Hurriyat Conference Jammu Kashmir, Muslim Conference Tehreek-i-Istiqamaat appealed for observing complete haltal and black day on August 15 – (Urdu Dailies – Srinagar Times/Kashmir Uzma)","India has no justification to observe Independence Day, because those who snatch freedom of other nations and enslave people on the basis of might have no right to celebrate people Independence Day."
16-08-2017,"Hurriyat Conference Jammu Kashmir, Muslim Conference Tehreek-i-Istiqamaat appealed for observing complete haltal and black day on August 15 – (Urdu Dailies – Srinagar Times/Kashmir Uzma)","Meanwhile, Hurriyat JK leader, Muhammad Ahsan Untoo, participated in the funeral procession of militant commander, Yaseen Itoo @ Ghaznabi."
16-08-2017,"Hurriyat Conference Jammu Kashmir, Muslim Conference Tehreek-i-Istiqamaat appealed for observing complete haltal and black day on August 15 – (Urdu Dailies – Srinagar Times/Kashmir Uzma)","After paying tributes to the slain militant commander, Untoo visited the house of bereaved family members to pay condolence."
16-08-2017,Sending National Front Chairman to judicial custody condemnable:  National Front – (Urdu Dailies – Srinagar Times/Aftab/Kashmir Uzma),"Calling sending of National Front Chairman, Nayeem Ahmed Khan and other arrested resistance leaders in judicial custody as political vendetta and anti-democracy act, National Front Spokesman has said, in a statement, India has been adopting cruel attitude towards Kashmiri resistance leadership, including Nayeem Ahmed Khan, and common people."
16-08-2017,Sending National Front Chairman to judicial custody condemnable:  National Front – (Urdu Dailies – Srinagar Times/Aftab/Kashmir Uzma),"National Front Spokesman National Front Spokesman also paid tributes to slain HM commander, Yaseen Itoo @ Ghaznavi and his associated at Awneera (district Shopian)."
16-08-2017,Article 6 of J&K Constitution also challenged – (Urdu Dailies – Kashmir Uzma/Tameel-i-Irshad),"After challenging Article 35/A of Indian Constitution, the Article-6 of Jammu and Kashmir Constitution has also been challenged in the Supreme Court."
16-08-2017,Article 6 of J&K Constitution also challenged – (Urdu Dailies – Kashmir Uzma/Tameel-i-Irshad),"While a process of questioning the special position of J&K State continues, fresh cases are being registered in the Courts of New Delhi."
16-08-2017,Article 6 of J&K Constitution also challenged – (Urdu Dailies – Kashmir Uzma/Tameel-i-Irshad),"In this connection, a writ petition has been filed against Article 6 of J&K Constitution which is related with permanent residence in J&K State."
16-08-2017,Article 6 of J&K Constitution also challenged – (Urdu Dailies – Kashmir Uzma/Tameel-i-Irshad),"a writ petition says, “Article 6 of J&K Constitution prevents a woman from marrying as per a woman wish."
16-08-2017,Article 6 of J&K Constitution also challenged – (Urdu Dailies – Kashmir Uzma/Tameel-i-Irshad),"If a woman marries a man who doesn’t possess State Subject Certificate, a woman children can’t acquire property in J&K State”."
16-08-2017,Article 370 and Article 35/A are signs of J&K State’s identity: Mufti Azam  – (Urdu Daily – Uqab),"After holding threadbare discussion on Article 370 and Article 35/A at a meeting of J&K Muslim Personal Law Board, held under the presidentship of Mufti Azam (Grand Mufti), a resolution was passed which states: “J&K is a State consisting on three provinces Jammu, Kashmir and Ladakh."
16-08-2017,Article 370 and Article 35/A are signs of J&K State’s identity: Mufti Azam  – (Urdu Daily – Uqab),a resolution also includes the area under the occupation of Pakistan which is being called Azad Kashmir.
16-08-2017,Article 370 and Article 35/A are signs of J&K State’s identity: Mufti Azam  – (Urdu Daily – Uqab),This State has remained under the occupation of different Kings and rulers.
16-08-2017,Article 370 and Article 35/A are signs of J&K State’s identity: Mufti Azam  – (Urdu Daily – Uqab),"During English rule, “J&K was called as Princely State."
16-08-2017,Article 370 and Article 35/A are signs of J&K State’s identity: Mufti Azam  – (Urdu Daily – Uqab),"During English rule, This State attained a special status which continues till date."
16-08-2017,Article 370 and Article 35/A are signs of J&K State’s identity: Mufti Azam  – (Urdu Daily – Uqab),Article 370 and Article 35/A of Indian Constitution are guarantee for State’s special position.
16-08-2017,Article 370 and Article 35/A are signs of J&K State’s identity: Mufti Azam  – (Urdu Daily – Uqab),Abrogation of these Articles is aimed at vanishing Muslim majority character of This State.
16-08-2017,Article 370 and Article 35/A are signs of J&K State’s identity: Mufti Azam  – (Urdu Daily – Uqab),The petition filed in the Supreme Court is an unsuccessful attempt in this regard.
16-08-2017,Article 370 and Article 35/A are signs of J&K State’s identity: Mufti Azam  – (Urdu Daily – Uqab),The Centre has been served a notice to file The Centre reply.
16-08-2017,Article 370 and Article 35/A are signs of J&K State’s identity: Mufti Azam  – (Urdu Daily – Uqab),"It is really a challenge for the people of State, particularly Muslims."
16-08-2017,Article 370 and Article 35/A are signs of J&K State’s identity: Mufti Azam  – (Urdu Daily – Uqab),"If the Supreme Court gives the Supreme Court verdict which hurts these Articles, all relations would either become weak or vanish."
16-08-2017,Article 370 and Article 35/A are signs of J&K State’s identity: Mufti Azam  – (Urdu Daily – Uqab),"A destructive situation would erupt in the country, particularly in J&K State, which can’t be controlled by State or Central governments."
16-08-2017,Article 370 and Article 35/A are signs of J&K State’s identity: Mufti Azam  – (Urdu Daily – Uqab),It is a matter of life and death.
16-08-2017,Article 370 and Article 35/A are signs of J&K State’s identity: Mufti Azam  – (Urdu Daily – Uqab),"In case pro-India parties failed to defend It, case pro-India parties existence would also come to end."
16-08-2017,Article 370 and Article 35/A are signs of J&K State’s identity: Mufti Azam  – (Urdu Daily – Uqab),"Therefore, the people of nation need to think and understand this."
16-08-2017,Article 370 and Article 35/A are signs of J&K State’s identity: Mufti Azam  – (Urdu Daily – Uqab),the people of nation need to stand up in defence of Article 370 and Article 35/A.
16-08-2017,Article 370 and Article 35/A are signs of J&K State’s identity: Mufti Azam  – (Urdu Daily – Uqab),This is an opportunity to prove the people of nation unity and defeat this conspiracy with one voice.
16-08-2017,Article 370 and Article 35/A are signs of J&K State’s identity: Mufti Azam  – (Urdu Daily – Uqab),It is a challenge to our honour and also an important time to unite”.
16-08-2017,Article 370 and Article 35/A are signs of J&K State’s identity: Mufti Azam  – (Urdu Daily – Uqab),"“Efforts to protect Article 35/A” – (Urdu Daily – Srinagar Times)
Apparently, PDP has been making efforts to defeat attempts being made for abrogation of Article 370 and Article 35/A of Indian Constitution."
16-08-2017,Article 370 and Article 35/A are signs of J&K State’s identity: Mufti Azam  – (Urdu Daily – Uqab),"In this connection, endeavours of Chief Minister, Mehbooba Mufti could be seen with open eyes."
16-08-2017,Article 370 and Article 35/A are signs of J&K State’s identity: Mufti Azam  – (Urdu Daily – Uqab),"Though opposition has been describing claims of the Chief Minister as unsatisfactory with regard to assurance given to her by the Prime Minister, but PDP is optimistic that activities to abrogate Article 370 and Article 35/A would come to an end."
16-08-2017,Article 370 and Article 35/A are signs of J&K State’s identity: Mufti Azam  – (Urdu Daily – Uqab),Things in this regard would be clear within coming weeks.
16-08-2017,Article 370 and Article 35/A are signs of J&K State’s identity: Mufti Azam  – (Urdu Daily – Uqab),The matter is in the Court.
16-08-2017,Article 370 and Article 35/A are signs of J&K State’s identity: Mufti Azam  – (Urdu Daily – Uqab),Some people call delay of cases in Courts as a triumph; but lava could burst anytime.
16-08-2017,Article 370 and Article 35/A are signs of J&K State’s identity: Mufti Azam  – (Urdu Daily – Uqab),Court decisions are no less than a time bomb.
16-08-2017,Article 370 and Article 35/A are signs of J&K State’s identity: Mufti Azam  – (Urdu Daily – Uqab),"Therefore, it is the duty of State Government to hold decisive talks with the Centre, because until the case is withdrawn from the Court the issue will continue to be at the issue place."
16-08-2017,Article 370 and Article 35/A are signs of J&K State’s identity: Mufti Azam  – (Urdu Daily – Uqab),PDP can’t raise objection on legal activities.
16-08-2017,Article 370 and Article 35/A are signs of J&K State’s identity: Mufti Azam  – (Urdu Daily – Uqab),"Decision of Courts could be objected, but PDP implementation can’t be denied."
16-08-2017,Article 370 and Article 35/A are signs of J&K State’s identity: Mufti Azam  – (Urdu Daily – Uqab),The writ petition has been filed by a private party in the Court.
16-08-2017,Article 370 and Article 35/A are signs of J&K State’s identity: Mufti Azam  – (Urdu Daily – Uqab),"But, Civil Society and analysts are of the view that hand of Centre is behind hand of Centre at the behest of RSS."
16-08-2017,Article 370 and Article 35/A are signs of J&K State’s identity: Mufti Azam  – (Urdu Daily – Uqab),"That is the reason why coalition partner in the State Government, BJP, has not been making any effort to protect this law."
16-08-2017,Article 370 and Article 35/A are signs of J&K State’s identity: Mufti Azam  – (Urdu Daily – Uqab),"In the meantime, State Law Minister, Abdul Haq Khan has said that services of legal experts and lawyers were being utilised to defend Article 370 and Article 35/A."
16-08-2017,Article 370 and Article 35/A are signs of J&K State’s identity: Mufti Azam  – (Urdu Daily – Uqab),That doesn’t mean the case would be won.
16-08-2017,Article 370 and Article 35/A are signs of J&K State’s identity: Mufti Azam  – (Urdu Daily – Uqab),"In case PDP wants to win case, PDP will have to seek guarantee from Central Government for withdrawal of the case from the Court."
16-08-2017,Article 370 and Article 35/A are signs of J&K State’s identity: Mufti Azam  – (Urdu Daily – Uqab),"Recently, Roads and Building Minister, Naeem Akhtar has described hue and cry of opposition as futile and said there won’t be fiddling with any Article."
16-08-2017,Article 370 and Article 35/A are signs of J&K State’s identity: Mufti Azam  – (Urdu Daily – Uqab),"If Naeem Akhtar believes that opposition has been making noise even after a successful meeting between the Prime Minister and Chief Minister, Naeem Akhtar should try to stop BJP from taking forward the Court activities."
16-08-2017,Shortage of audience in Bakshi Stadium; Police contingent of Uttar Pradesh disappointed – (Urdu Dailies – Srinagar Times/Uqab/Tameel-i-Irshad),"Police contingent of Uttar Pradesh, which participated in the Independence function at Bakshi Stadium, Srinagar, has expressed disappointment over presence of small audience in the function."
16-08-2017,Shortage of audience in Bakshi Stadium; Police contingent of Uttar Pradesh disappointed – (Urdu Dailies – Srinagar Times/Uqab/Tameel-i-Irshad),"While talking to news reporters, Deputy Superintendent of UP Police said that it is very disappointing that very less number of people have come to participate in the Independence Day function."
16-08-2017,Shortage of audience in Bakshi Stadium; Police contingent of Uttar Pradesh disappointed – (Urdu Dailies – Srinagar Times/Uqab/Tameel-i-Irshad),"However, Deputy Superintendent of UP Police expressed the hope that people would come out of people homes in coming times to participate in the function."
16-08-2017,Shutdown and protest on the occasion of August 15 a referendum: Freedom Party – (Urdu Daily – Aftab),the Spokesman described ‘hartal’ and public protest on the occasion of India’s Independence Day as a referendum of people.
16-08-2017,Shutdown and protest on the occasion of August 15 a referendum: Freedom Party – (Urdu Daily – Aftab),"By ignoring such realities Indian rulers and Indian local agents could deceive Indian rulers and its local agents but couldn’t mislead international community for long, the Spokesman said."
16-08-2017,Shutdown and protest on the occasion of August 15 a referendum: Freedom Party – (Urdu Daily – Aftab),"Describing Independence Day celebrations under the shadow of forces and after turning Valley into an Army cantonment as a joke, the Spokesman said that people remaining away for these functions reflects that Independence Day celebrations on disputed land has no justification."
16-08-2017,“Goli aur Boli” ---- Familiarity  with realities needed” – (Urdu Daily – Kashmir Uzma),"While addressing the nation from Red Fort on the occasion of 71st Independence Day, Prime Minister, Narendra Modi, for the first time, tried to reach out to the people of Kashmir saying that Kashmir issue could be solved by embracing Kashmiris but not by ‘goli’ or ‘gaali’."
16-08-2017,“Goli aur Boli” ---- Familiarity  with realities needed” – (Urdu Daily – Kashmir Uzma),"While speaking about several issues confronting the nation, Prime Minister, Narendra Modi also openly expressed Prime Minister, Narendra Modi changing view about Kashmir."
16-08-2017,“Goli aur Boli” ---- Familiarity  with realities needed” – (Urdu Daily – Kashmir Uzma),"Prime Minister, Narendra Modi view of embracing Kashmiris instead of ‘goli’ and gaali’ is beyond traditional stand of BJP’s extreme ideology."
16-08-2017,“Goli aur Boli” ---- Familiarity  with realities needed” – (Urdu Daily – Kashmir Uzma),"Prime Minister, Narendra Modi also talked about violence and also made a mention of separatists."
16-08-2017,“Goli aur Boli” ---- Familiarity  with realities needed” – (Urdu Daily – Kashmir Uzma),"While Prime Minister, Narendra Modi stand was clear with regard to violence that no softness would be adopted in this regard, but  Prime Minister, Narendra Modi also held separatists responsible for the happenings in Kashmir, saying that a handful of separatists have been hatching new conspiracies always."
16-08-2017,“Goli aur Boli” ---- Familiarity  with realities needed” – (Urdu Daily – Kashmir Uzma),"Prime Minister, Narendra Modi has tried to address three quarters with regard to Kashmir issue."
16-08-2017,“Goli aur Boli” ---- Familiarity  with realities needed” – (Urdu Daily – Kashmir Uzma),"At external level, there were enough hints towards China and Pakistan."
16-08-2017,“Goli aur Boli” ---- Familiarity  with realities needed” – (Urdu Daily – Kashmir Uzma),"Without going for a deep analysis, some parts of Prime Minister, Narendra Modi address clarified that there were separate messages for people, separatists and militancy."
16-08-2017,“Goli aur Boli” ---- Familiarity  with realities needed” – (Urdu Daily – Kashmir Uzma),"So far as embracing Kashmiris is concerned, embracing Kashmiris is related to people and this way Prime Minister, Narendra Modi has tried to reach out to the people of Kashmir so that people hearts could be won over; and simultaneously a message goes to the countrymen not to nourish hatred against Kashmiris in the countrymen mind."
16-08-2017,“Goli aur Boli” ---- Familiarity  with realities needed” – (Urdu Daily – Kashmir Uzma),"Prime Minister, Narendra Modi view that the issue can’t be solved by ‘goli’ and ‘gaali’, was a hint that Kashmiris can’t be subdued through might; instead Kashmiris could be brought into mainstream through affection and love."
16-08-2017,“Goli aur Boli” ---- Familiarity  with realities needed” – (Urdu Daily – Kashmir Uzma),"If this is the thought of the Prime Minister, this is the thought of the Prime Minister should be welcomed."
16-08-2017,“Goli aur Boli” ---- Familiarity  with realities needed” – (Urdu Daily – Kashmir Uzma),"However, time will tell whether it is only a verbal account or would be implemented on the ground."
16-08-2017,“Goli aur Boli” ---- Familiarity  with realities needed” – (Urdu Daily – Kashmir Uzma),It can be implemented when the process of abuses and taunts is stopped and use of bullets and pellets against Kashmiris comes to end.
16-08-2017,“Goli aur Boli” ---- Familiarity  with realities needed” – (Urdu Daily – Kashmir Uzma),"If the Centre is really serious in resolving Kashmir issue, one has to go to the root cause of Kashmir issue."
16-08-2017,“Goli aur Boli” ---- Familiarity  with realities needed” – (Urdu Daily – Kashmir Uzma),"All the three quarters have to be addressed simultaneously; and it is to be understood that people, separatist and militants are not separate but an inherent political sentiment joins people, separatist and militants with each other."
16-08-2017,“Goli aur Boli” ---- Familiarity  with realities needed” – (Urdu Daily – Kashmir Uzma),"Therefore, it would be wise to address this sentiment which makes separatists and militants relevant here."
16-08-2017,“Goli aur Boli” ---- Familiarity  with realities needed” – (Urdu Daily – Kashmir Uzma),"If success is achieved in addressing this sentiment, other matters would automatically settle down."
16-08-2017,“Goli aur Boli” ---- Familiarity  with realities needed” – (Urdu Daily – Kashmir Uzma),"However, it doesn’t seem that Delhi would be doing so."
16-08-2017,“Goli aur Boli” ---- Familiarity  with realities needed” – (Urdu Daily – Kashmir Uzma),"In every case, speech of the Prime Minister should be welcomed with a hope that a spirit about the resolution of Kashmir issue is generated in Indo-Pak Governments so that some way is found out to take the people of J&K State out of the burning furnace."
16-08-2017,“Mehbooba’s announcement” – (Urdu Daily – Srinagar Times),"After unfurling National flag on the occasion of Independence Day at Bakshi Stadium, Srinagar, Chief Minister, Mehbooba Mufti in Mehbooba Mufti address described Kashmir as crown of India."
16-08-2017,“Mehbooba’s announcement” – (Urdu Daily – Srinagar Times),"More importantly, Mehbooba Mufti said that all parties are ready to exhibit unity to ensure protection of State’s special position."
16-08-2017,“Mehbooba’s announcement” – (Urdu Daily – Srinagar Times),"Mehbooba Mufti said this with reference to Mehbooba Mufti recent meeting with National Conference President, Dr. Farooq Abdullah and described National Conference President, Dr. Farooq Abdullah as a senior and experienced leader."
16-08-2017,“Mehbooba’s announcement” – (Urdu Daily – Srinagar Times),"In Mehbooba Mufti speech, National Conference President, Dr. Farooq Abdullah laid stress on talks and expressed sorrow for seeing Kalashnikovs in the hands of Kashmiri youth instead of pen."
16-08-2017,“Mehbooba’s announcement” – (Urdu Daily – Srinagar Times),"However, Mehbooba Mufti admitted that situation worsened in Kashmir due to some mistakes of the Centre."
16-08-2017,“Mehbooba’s announcement” – (Urdu Daily – Srinagar Times),"With reference to Agenda of Alliance with BJP, Mehbooba Mufti again said that settling mutual and national issues has been promised in BJP."
16-08-2017,“Mehbooba’s announcement” – (Urdu Daily – Srinagar Times),"In her speech, Mehbooba Mufti tried to convey a message to the Centre that if efforts are not made to prevent abrogation of State’s special position, consequences won’t be good."
16-08-2017,“Mehbooba’s announcement” – (Urdu Daily – Srinagar Times),In this backdrop Mehbooba Mufti gave an impression that Mehbooba Mufti is well prepared to defend the identity of J&K State and wants to work with like-minded parties.
16-08-2017,“Mehbooba’s announcement” – (Urdu Daily – Srinagar Times),On the conclusion of her speech Mehbooba Mufti raised slogan ‘Hindustan Zindabad’ but did not forget raising slogan ‘Jammu and Kashmir Payindabad’ (Long live Jammu & Kashmir).
16-08-2017,“Mehbooba’s announcement” – (Urdu Daily – Srinagar Times),Mehbooba Mufti statements contained a message for the Centre which must have been noticed.
16-08-2017,“Mehbooba’s announcement” – (Urdu Daily – Srinagar Times),"Mehbooba Mufti statement, “If any attempt was to tinker with special position of State, we all (Kashmiris) are one” is not ordinary or any election stunt."
16-08-2017,“Mehbooba’s announcement” – (Urdu Daily – Srinagar Times),Mehbooba Mufti admission about Mehbooba Mufti meeting with Dr. Farooq Abdullah must have certainly made the Centre anxious.
16-08-2017,“Mehbooba’s announcement” – (Urdu Daily – Srinagar Times),"Perhaps, the Centre was not expecting that after meeting with Mehbooba Mufti arch rival National Conference leader, Mehbooba Mufti would highlight special position of the State in Mehbooba Mufti address on Independence Day function."
16-08-2017,“Mehbooba’s announcement” – (Urdu Daily – Srinagar Times),"With Mehbooba Mufti speech on Independence day, it is now clear that Mehbooba Mufti wants to take cudgels with BJP on the issue of Article 35/A."
16-08-2017,“Mehbooba’s announcement” – (Urdu Daily – Srinagar Times),"Mehbooba Mufti has felt that though the Centre has not refused to fulfil promises made in the Agenda of Alliance, but it has been making efforts to make it ineffective by wasting time."
